"Let’s stop calling this the Sixth Great Extinction. Let’s start calling it what it is: the “first great extermination”. A recent essay by the environmental historian Justin McBrien argues that describing the current eradication of living systems (including human societies) as an extinction event makes this catastrophe sound like a passive accident. While we are all participants in the first great extermination, our responsibility is not evenly shared. The impacts of most of the world’s people are minimal. Even middle-class people in the rich world, whose effects are significant, are guided by a system of thought and action that is shaped in large part by corporations. We are guided by an ideology so familiar and pervasive that we do not even recognise it as an ideology. It is called consumerism The Guardian’s polluters series reports that just 20 fossil fuel companies, some owned by states, some by shareholders, have produced 35% of the carbon dioxide and methane released by human activities since 1965. This was the year in which the president of the American Petroleum Institute told his members that the carbon dioxide they produced could cause “marked changes in climate” by the year 2000. They knew what they were doing. Even as their own scientists warned that the continued extraction of fossil fuels could cause “catastrophic” consequences, the oil companies pumped billions of dollars into thwarting government action. They funded thinktanks and paid retired scientists and fake grassroots organisations to pour doubt and scorn on climate science. They sponsored politicians, particularly in the US Congress, to block international attempts to curtail greenhouse gas emissions. They invested heavily in greenwashing their public image. These efforts continue today, with advertisements by Shell and Exxon that create the misleading impression that they’re switching from fossil fuels to renewable energy. In reality, Shell’s annual report reveals that it invested $25bn in oil and gas last year. But it provides no figure for its much-trumpeted investments in low-carbon technologies. Nor was the company able to do so when I challenged it. A paper published in Nature shows that we have little chance of preventing more than 1.5C of global heating unless existing fossil fuel infrastructure is retired. Instead the industry intends to accelerate production, spending nearly $5tn in the next 10 years on developing new reserves. It is committed to ecocide. But the biggest and most successful lie it tells is this: that the first great extermination is a matter of consumer choice. In response to the Guardian’s questions, some of the oil companies argued that they are not responsible for our decisions to use their products. But we are embedded in a system of their creation – a political, economic and physical infrastructure that creates an illusion of choice while, in reality, closing it down. We are guided by an ideology so familiar and pervasive that we do not even recognise it as an ideology. It is called consumerism. It has been crafted with the help of skilful advertisers and marketers, by corporate celebrity culture, and by a media that casts us as the recipients of goods and services rather than the creators of political reality. It is locked in by transport, town planning and energy systems that make good choices all but impossible. It spreads like a stain through political systems, which have been systematically captured by lobbying and campaign finance, until political leaders cease to represent us, and work instead for the pollutocrats who fund them. In such a system, individual choices are lost in the noise. Attempts to organise boycotts are notoriously difficult, and tend to work only when there is a narrow and immediate aim. The ideology of consumerism is highly effective at shifting blame: witness the current ranting in the billionaire press about the alleged hypocrisy of environmental activists. Everywhere I see rich westerners blaming planetary destruction on the birth rates of much poorer people, or on “the Chinese”. This individuation of responsibility, intrinsic to consumerism, blinds us to the real drivers of destruction. The power of consumerism is that it renders us powerless. It traps us within a narrow circle of decision-making, in which we mistake insignificant choices between different varieties of destruction for effective change. It is, we must admit, a brilliant con. It’s the system we need to change, rather than the products of the system. It is as citizens that we must act, rather than as consumers. But how? Part of the answer is provided in a short book published by one of the founders of Extinction Rebellion, Roger Hallam, called Common Sense for the 21st Century. I don’t agree with everything it says, but the rigour and sweep of its analysis will, I think, ensure that it becomes a classic of political theory. It begins with the premise that gradualist campaigns making small demands cannot prevent the gathering catastrophes of climate and ecological breakdown. Only mass political disruption, out of which can be built new and more responsive democratic structures, can deliver the necessary transformation. By studying successful mobilisations, such as the Children’s March in Birmingham, Alabama in 1963 (which played a critical role in ending racial segregation in the US), the Monday Demonstrations in Leipzig in 1989 (which snowballed until they helped bring down the East German regime), and the Jana Andolan movement in Nepal in 2006 (which brought down the absolute power of the monarchy and helped end the armed insurgency), Hallam has developed a formula for effective “dilemma actions”. A dilemma action is one that puts the authorities in an awkward position. Either the police allow civil disobedience to continue, thereby encouraging more people to join, or they attack the protesters, creating a powerful “symbolism of fearless sacrifice”, thereby encouraging more people to join. If you get it right, the authorities can’t win. Among the crucial common elements, he found, are assembling thousands of people in the centre of the capital city, maintaining a strictly nonviolent discipline, focusing on the government and continuing for days or weeks at a time. Radical change, his research reveals, “is primarily a numbers game. Ten thousand people breaking the law has historically had more impact than small-scale, high-risk activism.” The key challenge is to organise actions that encourage as many people as possible to join. This means they should be openly planned, inclusive, entertaining, peaceful and actively respectful. You can join such an action today, convened by Extinction Rebellion in central London. Hallam’s research suggests that this approach offers at least a possibility of breaking the infrastructure of lies the fossil fuel companies have created, and developing a politics matched to the scale of the challenges we face. It is difficult and uncertain of success. But, he points out, the chances that politics as usual will meet our massive predicament with effective action are zero. Mass dilemma actions could be our last, best chance of preventing the great extermination. • George Monbiot is a Guardian columnist"
"Alexandria Ocasio-Cortez said she was ‘inspired’ by the Global Green New Deal, a bold proposal to fight climate change announced today by the C40 group of global mayors. To kick off their major summit this week the group, which represents more than 90 of the world’s biggest cities, voiced their backing for the plan and said it reaffirmed their “commitment to protecting the environment, strengthening our economy, and building a more equitable future by cutting emissions”.  New York congresswoman Ocasio-Cortez applauded the move, adding: “If we work to join forces globally, we will be able to defeat our greatest threat and realise our greatest opportunity.” China produces the most heat-trapping pollution, followed by the US. But historically, the US has contributed more carbon dioxide to the atmosphere than any other nation. The US also has high emissions per capita, compared to other developed countries. And Americans buy products made in China, therefore supporting China's carbon footprint.  Ocasio-Cortez arrived in Copenhagen on Wednesday morning ahead of the seventh World Mayors’ Summit held by the C40 group of leading global cities, where she is scheduled to make a speech on Friday. She immediately started posting videos of the city to her 4m Instagram followers. Eric Garcetti, the Los Angeles mayor who is now taking over as chair of C40, told a press conference after the announcement that delivering the Global Green New Deal would be his priority. “This will be my priority as the new chair, to deliver a Green New Deal in the face of the climate emergency and to make the 2020s the decade of human action,” he said.  “This will be the defining decade not only of our lives, but of life itself for human beings on this planet. I have no doubt that we can and will get it right, because human beings have this stubborn desire to survive.” Jamie Margolin, Seattle-based high school senior who founded the US green pressure group Zero-Hour, called on the cities to raise their ambitions.  “The Green New Deal is not just about a specific piece of legislation or about a promise a politician makes. It’s about finally ending the fairy tale. With the Green New Deal we are calling to an end the sacrificing of everything to protect that fairytale of eternal economic growth.”The mayors group, representing more than 90 of the world’s biggest cities, also launched a blistering attack on the failure to agree strong measures to fight the climate crisis at last month’s UN Climate Action Summit, blaming “a small number of powerful governments serving the interests of the fossil fuel industry”. “World leaders met in New York just last month and once again failed to agree anything close to the level of action necessary to stop the climate crisis,” the group’s chair, Anne Hidalgo, the mayor of Paris, said in a statement. “Their ineptitude directly threatens all people around the globe as time keeps running against us.”Mark Watts, the C40 executive director, told the Guardian that the leaders of the US, Brazil, Australia, Russia and Turkey were now “essentially representatives of the fossil fuel industry”, so it was important for “the next most powerful group of politicians”, the mayors of the biggest cities, to step up.“It makes what we do even more important, because in the context of those really powerful nations not only holding back their own actions but blocking the whole of the United Nations, we’ve got to have momentum coming from somewhere else,” Watts said. The conference gathers leaders from cities around the world for three days to share ideas on green urban development and how to pressure national leaders to act on the climate crisis. The conference covers themes such as affordable housing, waste and climate migration. The city of Copenhagen, which has an ambitious plan to become carbon-neutral by 2025, is showcasing efforts such as apartments built with recycled materials and energy-efficient systems. As they arrive at the summit’s opening ceremony on Wednesday evening, the mayors and their staff will nonetheless have to pass a “green illusions scanner” erected by the local green pressure group Klima Aktion DK. Protesters will also carry binoculars to show that city leaders are being watched. “The entire framework around the C40 has the wrong approach,” said Kirsten Kværnø, one of the organisers. “They’re taking the wrong starting point: that technology and green growth is going to save us from this crisis.” Hidalgo said ahead of the conference that she supported the disruptive protests launched this week in London, Berlin and elsewhere by the protest group Extinction Rebellion. “We are facing a climate emergency, and a growing number of people around the world, particularly young people, are treating it as such,” she said. “We share their concern for the future of humanity, and we must push forward with courage and ambition to change the status quo that has generated this crisis.”As well as mayors, Watts said this year’s summit would bring together “more of the genuine national leaders of youth climate strikes than ever before”, with youth activists from 30 different countries. Follow Guardian Cities on Twitter, Facebook and Instagram to join the discussion, catch up on our best stories or sign up for our weekly newsletter"
"The Queensland government has announced it will rush consultation on controversial proposed laws to crack down on acts of civil disobedience by climate change protesters. The announcement comes amid rolling acts of disruption in Brisbane by members of Extinction Rebellion and has been met with concern from legal and environmental groups, who say the proposals infringe on people’s basic civil liberties.  The proposed laws give police search and seizure powers where they reasonably suspect people are carrying locking devices, which are designed to prevent or delay the removal of protesters from public spaces. They also introduce new fines for the use of such devices. When the laws were announced in August, the state government made claims – but has offered no evidence to support them – that activists were using devices “laced with booby traps” and “designed to harm”. The Queensland premier, Annastacia Palaszczuk, and the police minister, Mark Ryan, on Wednesday cited two recent actions by Extinction Rebellion protesters they believed were dangerous and put people in harm’s way. The include a man who chained himself to a railway on Wednesday morning and a man who dangled for several hours from the Story Bridge over the Brisbane River on Tuesday. The man who hung suspended from the bridge reportedly said afterwards that it would be “dangerous for the police to come and rescue me”. Ryan could not tell reporters whether the unique apparatus used by the protesters in each case would be covered by the new laws. Palaszczuk said the state was seeing “major disruption” from the civil disobedience of climate activists. “The use of these dangerous devices is not acceptable,” she said. “My government will be asking (for) the hearings on these laws to take place as soon as possible. I want these laws in place by the end of this month. “I don’t think the people who are protesting at the moment are endearing themselves to families, to motorists, to people going about their ordinary duties or getting to and from work, and it has become unacceptable to use these dangerous devices. “It’s just getting beyond a joke now.” She also sought to defend her government’s record on climate, citing a 50% renewable target as evidence of action. The state’s approach is under heavy scrutiny because of its position on new thermal coal mines and its pivot in support of the coal industry after the federal election. Public submissions to the state parliament’s legal affairs committee on the new laws closed at midday on Tuesday and hearings had been scheduled for later this month. It is likely the hearings will now take place quickly next week, alongside a sitting of parliament, and passed before 24 October. The committee has not yet published public submissions, but several groups have released theirs. The Caxton Legal Centre said the state had not properly explained why the laws were needed. “Until clear and compelling evidence of the justification for these new laws ismade public we believe that the proposed amendments should not proceed,” saidBridget Burton, the director of the Caxton Legal Centre’s human rights and civil law practice. “The proposed laws will extend police search powers and increase the penalties for breaches of the peace to up to two years imprisonment if introduced. “By privileging powerful institutional interests over the human rights ofindividuals (the proposal does not achieve) the right balance in a society ostensibly based on freedom, democracy and respect for the dignity of all people.” The Human Rights Law Centre said the laws infringe on Queenslanders’ human rights. Alice Drury, a lawyer at the Human Rights Law Centre, said criminal laws must be based on evidence. “The public is entitled to have all the facts when a government proposes a new law that undermines their democratic rights,” Drury said. “Politicians should resist the knee-jerk response of criminalising conduct because it’s frustrating, and recommit to facilitating peaceful protest for the health of our democracy.” The Queensland Greens MP, Michael Berkman, said the short-cutting of the committee process was a “disgusting betrayal of our democracy”. “(Major political parties) keep taking massive donations from big fossil fuel. That’s why they’re shutting down dissent, that’s why these laws have really been introduced to squash peaceful protest.”"
"Fresh from another internet pile-on over his views on the climate emergency, Jonathan Franzen has warned that hate speech on social media is dividing humanity and preventing the cooperation needed to tackle the environmental crisis. The American novelist was speaking to the Extinction Rebellion podcast, to be released on Wednesday, about the aggressive online response to his recent New Yorker article about the climate catastrophe. He is not on social media, he said, “so I don’t experience the Twitter rage except through the accounts of a couple of friends who have not learned that they shouldn’t tell me about these things”.  Franzen said that he found it “surprising, if not disheartening, to learn that the messenger was being attacked even if the facts of the message were not being challenged … In the context of a threatened social order, the kind of polarisation and hysteria and real hate speech that is occurring primarily on the internet, much less often face to face, is part of the problem.” In his September New Yorker article, Franzen shared his belief that a climate apocalypse is unavoidable and so it is “important to fight smaller, more local battles that you have some realistic hope of winning”. Among his critics were scientists, who particularly objected to his statement that “consensus among scientists and policymakers is that we’ll pass this point of no return if the global mean temperature rises by more than two degrees Celsius”. Franzen admitted that his claim about warming could have been expressed more clearly. “That remark about things spiralling out of control past the two degree point was in the context of saying we should have as substantial and immediate reductions in carbon emissions as we possibly can – not only because it’s the right thing to do, but because it will at least, if nothing else, somewhat slow the pace of change and give us time to prepare and adapt and become more resilient. Obviously, a world of two degrees is better than a world of seven degrees,” he said. In the New Yorker, he urged readers to “save what you love specifically – a community, an institution, a wild place, a species that’s in trouble – and take heart in your small successes”. Franzen is on the board of American Bird Conservancy, and has written extensively about the need to protect birds. “I feel like all I do is fail, but every once in a while we have some little success and that was really the ultimate message of my New Yorker piece,” he said. “You’re not going to probably save anything permanently but, to save something for a while, to watch a formerly wrecked place recover ecologically, to see a species that you care about whose population was declining rebounding – I have hope for those places, and I have hope for those species. In the context of the larger failure, that is not nothing.” Franzen supports Extinction Rebellion, which is in the middle of two weeks of protests in London. “It’s different from some of the earlier climate activist organisations over here. I appreciate that and I’m all for it,” he told the activists’ podcast."
"You probably don’t think clams are the most exciting animals on the planet. But anyone who dismisses these marine bivalve molluscs surely cannot be aware of just how important they actually are. Without knowing it, they have taught us so much about the world we live in – and how it used to be.  Our research team has spent the past two decades examining the chemical composition of the longest-lived animal that doesn’t live in a colony known to science – the ocean quahog clam – to find out how the climate of the North Atlantic ocean has changed in relation to the atmosphere. This quahog can live for more than 500 years – and, as it does, it lays down growth rings in its shell. As with trees, the growth rings are at wider increments when conditions are more favourable and narrower when less so. By comparing these shell rings we were able to date each of them and find out what the temperature and salinity (or density) of the seawater was at the time of its growth. Any clams that lived at the same time had the same pattern of lines on their shells. So by comparing many of them together, we managed to extend the record backwards beyond the lifespan of just one individual, to around 1,000 years. Using this information, we have discovered how the ocean environment that these clams live in has changed. And we now have the first precisely dated, annually resolved, record of North Atlantic ocean variability covering the entire last millennium, allowing scientists to examine the timing of past changes in the marine environment relative to those in the atmosphere.  Perhaps one of the most profound aspects of our research is the finding that human-driven climate change, resulting in an overall warming of surface air temperatures, has led to a reversal in the long-term natural coupling of the marine and atmospheric climate systems. Evidence from the shells shows that over the modern industrial period (AD 1800-2000) changes in marine climate lagged behind the atmosphere. Surface air temperatures responded much faster to human-induced climate changes than the North Atlantic did. Though we cannot speculate on what this will mean for the future, this new information will play an important role in reducing uncertainty in predictions of future climate variability. Though the shells of quahogs typically only grow up to 13cm in length, this finding from the study of the chemistry in their rings is astounding. Until now, there has been no direct evidence that variability in the North Atlantic during the past 1,000 years drove changes in the atmospheric climate, or if the oceans were merely responding to changes in the atmosphere. Our understanding of ocean variability timing in the North Atlantic, and the mechanisms behind it, were relatively poorly known until this study – and direct observations were limited to the 20th century. Looking further back in time, the oxygen isotopes record developed from the clam shells shows marked changes in the climate over the past 1,000 or so years. During the last millennium, volcanic eruptions, the power of the sun (solar irradiance) and human industrial activity all played a significant role in driving the conditions in the North Atlantic. In addition, our research found that the North Atlantic probably played an important role in the switch from the relatively warm conditions of the medieval climate anomaly (from about AD 1000 to 1400) into the cooler conditions of the “Little Ice Age” from about AD 1450 to 1850).  The most intriguing result from this period came from comparing the clam shell rings with ice cores and tree rings. While the shells allowed us to uncover marine variability, the ice and tree trunks have previously shown scientists what the atmospheric surface air temperature was like during different time periods in the northern hemisphere and Greenland. By comparing the shells with ice and trees, we found that over the pre-industrial portion of the last millennium (between the years 1000 and 1800) changes in marine climate preceded changes in northern hemisphere surface air temperatures.  Between 1000 and 1800, changes in the North Atlantic – brought about by solar irradiance, gases being expelled into the atmosphere from volcanoes and changes in air circulation – were fed back into the atmosphere. This influenced the temperature of the atmosphere then, and means that the North Atlantic ocean was playing an active role in influencing atmospheric air temperatures.  This continues to play a pivotal role in future climate variability, albeit now with a backdrop of long-term warming driven by greenhouse gases.  This clam may indeed be small fry, but what we have learned about the ocean climate from quahog clam shells has drastically changed our view of the world’s atmosphere."
