"Rising temperatures are linked to increasing rates of suicide, according to a large new study. The researchers warn that the impact of climate change on suicides may be as significant as economic recessions, which are known to increase rates of self-harm. The links between mental health and global warming have not been widely researched but the new work analysed temperature and suicides across the US and Mexico in recent decades. It found that the rate of suicide rose by 0.7% in the US and by 2.1% in Mexico when the average monthly temperature rose by 1C.  The analysis was done at county level and took into account seasonal variation, levels of poverty and even the news of celebrity suicides that can lead to more deaths. The scientists found that hotter periods resulted in more suicides irrespective of wealth and the usual climate of the area. “Determining whether or not the rate of suicide responds to climatic conditions is important, as suicide alone causes more deaths globally than all forms of violence combined and is among the top 10–15 causes of death globally,” said Prof Marshall Burke, at Stanford University in the US, and his colleagues, who published their research in the journal Nature Climate Change. “Even modest changes in suicide rates due to climate change could [lead to] large changes in the associated global health burden, particularly in wealthier countries where current suicide rates are relatively high,” the researchers said. Record high temperatures have been recorded around the world in recent weeks and are likely to have been driven by climate change. This kind of study cannot prove a causal link between rising temperature and more suicides. But the results show “remarkable consistency” over time and in many different places, according to the scientists. It is also supported by recent research that linked climate change to 60,000 suicides in India in the last three decades.  The researchers also analysed more than 600m messages on Twitter and found that the use of depressive words, such as alone, bleak, lonely and trapped, increased as temperatures rose. “This further suggests that mental wellbeing deteriorates during warmer periods,” said the scientists. One possible way in which this might happen is that when the body cools itself during warmer conditions, the blood flow to the brain is altered. If current carbon emissions are not curbed, the scientists estimated that between 9,000 and 40,000 additional suicides could be expected by 2050 in the US and Canada due to climate change. That number of deaths is significantly more than would be expected from a 1% rise in unemployment due to an economic recession, the researchers said. Other research has already clearly shown that rising heat increases violence between people. • In the UK, the Samaritans can be contacted on 116 123. In the US, the National Suicide Prevention Hotline is 1-800-273-8255. In Australia, the crisis support service Lifeline is on 13 11 14. Hotlines in other countries can be found here."
"Blaming China for climate change is a clearcut case of “yellow peril” hysteria (Letters, 12 July). On average, a person in China consumes less than half of the emissions of a person in the US (7.2 tonnes per capita annually compared with 16.5 tonnes). So why all the finger-wagging at China? There’s a blatant mistake recurring in carbon politics. Yes, as a nation, China emits the most carbon dioxide, but an astronomical volume of these emissions are to manufacture our goods in the west. Is it fair to maintain a voracious level of consumption in the US and UK while blaming China for producing the goods that we’re consuming? Don’t look at emissions in isolation. Look at them in tandem with consumption, and then we’ll see where to place the burden of blame. Also, China’s investments in renewables have caused the costs to plummet, from which the entire world can now benefit. China invests more than $100bn in domestic renewables every year – more than twice the level of the US, and more than the US and the EU combined.Marcus NieldClimate Change Adaptation Unit, UN Environment, Nairobi, Kenya • Your article (23 July) accurately sums up the excellent work done by the Global Footprint Network regarding our depletion of the planet’s ability to support us. What, unlike GFN themselves, the article did not acknowledge is that the number of people consuming those resources is a critical, if not the critical, driver of the unfolding crisis. In 1970, our global population was less than half of the 7.6 billion we have presently. In 1970, Earth Overshoot Day fell on the 29 December: in 2018, on 1 August. Can anyone credibly claim that those two changes are not linked?  Population is a solvable problem – family planning, lifting people out of poverty, education, empowering women and challenging cultural norms opposing small family size are vital, positive mechanisms to bring our human footprint back in line with with what our only home can sustainably provide. Robin MaynardDirector, Population Matters • Would you like to submit a photograph to be printed in the Guardian’s letters spread? If so, you can do so here • Join the debate – email guardian.letters@theguardian.com • Read more Guardian letters – click here to visit gu.com/letters"
"A British professional football club that is powered by renewable energy and serves vegan food to players, staff and fans has received a prestigious United Nations certification. Forest Green Rovers, which plays in League Two, announced on Monday that it has become the world’s first UN certified carbon-neutral football club.  Based in the Gloucestershire town of Nailsworth, the club has signed up for a United Nations Framework Convention on Climate Change (UNFCCC) initiative called Climate Neutral Now for the 2018-19 season. FGR’s green credentials have been attracting attention around the world for several years. It claims to be the first vegan football club in the world after receiving the vegan trademark from the Vegan Society. The club says it became vegan because of the “huge environmental and animal welfare impacts of livestock farming”, as well as to improve player performance and give fans healthier, tastier food on match days. FGR is powered by 100% green energy from Ecotricity – the company founded by the club’s chairman, Dale Vince – some of which is generated by the solar panels on the stadium roof. The team plays on an organic pitch, which is cut by a solar-powered robot lawnmower, and all rainwater that falls on the stands or on the pitch is recycled to minimise the club’s use of mains water. FGR has electric car charging facilities at the stadium, to encourage fans to travel to games sustainably. FGR was promoted to the Football League for the first time in the club’s 129-year history last year and will start its second season in League Two – the fourth tier of professional football in England – next month."
"It was just another moment in this long, increasingly strange summer. I was on a train home from Paddington station, and the carriage’s air-conditioning was just about fighting off the heat outside. Most people seemed to be staring at their phones – in many cases, they were trying to stream a World Cup match, as the 4G signal came and went, and Great Western Railway’s onboard wifi proved to be maddeningly erratic. The trebly chatter of headphone leakage was constant. And thousands of miles and a few time zones away in Loudoun County, Virginia, one of the world’s largest concentrations of computing power was playing its part in keeping everything I saw ticking over, as data from around the world passed back and forth from its vast buildings. Most of us communicate with this small and wealthy corner of the US every day. Thanks to a combination of factors – its proximity to Washington DC, competitive electricity prices, and its low susceptibility to natural disasters – the county is the home of data centres used by about 3,000 tech companies: huge agglomerations of circuitry, cables and cooling systems that sit in corners of the world most of us rarely see, but that are now at the core of how we live. About 70% of the world’s online traffic is reckoned to pass through Loudoun County.  But there is a big problem, centred on a power company called Dominion, which supplies the vast majority of Loudoun County’s electricity. According to a 2017 Greenpeace report, only 1% of Dominion’s total electricity comes from credibly renewable sources: 2% originates in hydroelectric plants, and the rest is split evenly between coal, gas and nuclear power. Dominion is also in the middle of a huge regional controversy about a proposed pipeline that will carry fracked gas to its power plants, which it says is partly driven by data centres’ insatiable appetite for electricity. Clearly, then, the video streams, digital photographs and messaging that pour out of all those servers come with a price. I was reminded of all this by the recently published book New Dark Age, by the British writer James Bridle. He cites a study in Japan that suggests that by 2030, the power requirements of digital services will outstrip the nation’s entire current generation capacity. He quotes an American report from 2013 – ironically enough, commissioned by coal industry lobbyists – that pointed out that using either a tablet or smartphone to wirelessly watch an hour of video a week used roughly the same amount of electricity (largely consumed at the data-centre end of the process) as two new domestic fridges. If you worry about climate change and a cause celebre such as the expansion of Heathrow airport, it is worth considering that data centres are set to soon have a bigger carbon footprint than the entire aviation industry. Yet as Bridle points out, even that statistic doesn’t quite do justice to some huge potential problems. He mentions the vast amounts of electricity consumed by the operations of the online currency Bitcoin – which, at the height of the speculative frenzies earlier this year, was set to produce an annual amount of carbon dioxide equivalent to 1m transatlantic flights. And he’s anxious about what will happen next: “In response to vast increases in data storage and computational capacity in the last decade, the amount of energy used by data centres has doubled every four years, and is expected to triple in the next 10 years.” These changes are partly being driven by the so-called internet of things: the increasing array of everyday devices – from TVs, through domestic security devices, to lighting systems, and countless modes of transport – that constantly emit and receive data. If driverless cars ever arrive in our lives, those same flows will increase hugely. At the same time, the accelerating rollout of the internet and its associated technologies in the developing world will add to the load.  About a decade ago, we were being told to fight climate change by switching off our TVs and stereos. If the battle is now even more urgent, how does it fit with a world in which router lights constantly flicker, and all the devices we own will be in constant, energy-intensive communication with distant mega-computers? But some good news. Whatever its other ethical contortions, Silicon Valley has an environmental conscience. Facebook has pledged to, sooner or later, power its operations using “100% clean and renewable energy”. Google says it has already achieved that goal. So does Apple. Yet even if you factor in efficiency improvements, beneath many of these claims lies a reality in which the vast and constant demand for power means such companies inevitably use energy generated by fossil fuels, and then atone for it using the often questionable practice of carbon offsetting. And among the big tech corporations, there is one big focus of worry: Amazon, whose ever-expanding cloud computing wing, Amazon Web Services, offers “the on-demand delivery of computer power, database storage … and other IT resources” and provides most of the computing power behind Netflix. This sits at the heart of data centres’ relentless expansion. Green campaigners bemoan the fact that the details of AWS’s electricity consumption and its carbon footprint remain under wraps; on its corporate website, the story of its use of renewable energy suddenly stops in 2016. Besides, for all their power, even the most enlightened US giants obviously command only part of a global industry. To quote from that Greenpeace report: “Among emerging Chinese internet giants such as Baidu, Tencent and Alibaba, the silence on energy performance still remains. Neither the public nor customers are able to obtain any information about their electricity use and CO2 target.” Irrespective of the good work carried out by some tech giants, and whether or not you take seriously projections that the entire communication technology industry could account for up to 14% of carbon emissions by 2040, one stark fact remains: the vast majority of electricity used in the world’s data centres comes from non-renewable sources, and as their numbers rapidly increase, there are no guarantees that this will change. On the fringes of the industry, a few voices have been heard describing the kind of future at which most of us – expecting everything streamed as a right – would balk. They talk about eventually rationing internet use, insisting that people send black and white images, or forcibly pushing them away from binge-streaming videos. Their basic point, it seems, chimes with those occasions when the smartphone in your pocket starts to suddenly heat up: a metaphor for our warming planet, and the fact that even the most well-intentioned corporations may yet find that their supposedly unlimited digital delights are, in the dictionary definition of the term, unsustainable. • John Harris is a Guardian columnist"
nan
"The UK’s historic churches are at serious risk from the impact of climate change, including higher levels of rainfall and invasive pests such as termites, according to the National Churches Trust. Roofs, towers and spires are threatened by strong winds and more frequent storms. The trust saw a 26% year-on-year increase in applications for grants for urgent repairs, maintenance and development projects in 2017, its annual review says.  A total of 480 churches and chapels around the country sought financial help from the trust, which awarded 230 grants worth £1.7m – an increase of £300,000 compared with 2016. Claire Walker, the trust’s chief executive, said many church buildings had reached a tipping point due to the combined impact of climate change, cuts to Heritage Lottery Fund grants and the end of the government-funded roof repair scheme for listed places of worship. “The intensity of extreme weather patterns, including heavier rainfalls and storms, is putting church gutters and drains under strain, and systems designed in the past cannot cope,” she said. “Looking to the future, the impact of climate change could have a serious impact on the UK’s historic churches. Higher levels of rainfall in the UK, such as the 20% increase seen in Scotland since the 1960s, with more cycles of wetting and drying, will cause damage to timber and stonework. Stronger winds and more frequent storms will threaten roofs, towers and spires. “Climate change is also making the UK ever more vulnerable to invasive pests. The biggest danger for church buildings would be from termites, which are now widespread in France, with infestations being found close to the Channel coast.” Termites can cause extensive damage to structural timber. The pests excavate it from the inside, leaving a thin skin of unharmed wood which can conceal the damage being caused. The only colony of termites known to have become established in the UK was found in south Devon in the 1990s. It was eliminated after years of action by government agencies. Among the churches awarded grants by the trust last year were St Botolph’s in Boston, Lincolnshire, a Grade I-listed building and the UK’s largest parish church, which received £40,000 for roof repairs. The Grade II-listed St David’s Old Church in Llanwrtyd, Wales, which has a recorded history spanning more than 1,000 years, received £20,000 from the trust for urgent repairs to stonework and gutters."
"The extreme heatwaves and wildfires wreaking havoc around the globe are “the face of climate change,” one of the world’s leading climate scientists has declared, with the impacts of global warming now “playing out in real time.” Climate change has long been predicted to increase extreme weather incidents, and scientists are now confident these predictions are coming true. Scientists say the global warming has contributed to the scorching temperatures that have baked the UK and northern Europe for weeks. The hot spell was made more than twice as likely by climate change, a new analysis found, demonstrating an “unambiguous” link.  Extreme weather has struck across Europe, from the Arctic Circle to Greece, and across the world, from North America to Japan. “This is the face of climate change,” said Prof Michael Mann, at Penn State University, and one the world’s most eminent climate scientists. “We literally would not have seen these extremes in the absence of climate change.” “The impacts of climate change are no longer subtle,” he told the Guardian. “We are seeing them play out in real time and what is happening this summer is a perfect example of that.” “We are seeing our predictions come true,” he said. “As a scientist that is reassuring, but as a citizen of planet Earth, it is very distressing to see that as it means we have not taken the necessary action.” The rapid scientific assessment of the northern European heatwave was done by Geert Jan van Oldenborgh, at the Royal Netherlands Meteorological Institute and also colleagues in the World Weather Attribution (WWA) consortium. “We can see the fingerprints of climate change on local extremes,” he said. The current heatwave has been caused by an extraordinary stalling of the jet stream wind, which usually funnels cool Atlantic weather over the continent. This has left hot, dry air in place for two months – far longer than usual. The stalling of the northern hemisphere jet stream is being increasingly firmly linked to global warming, in particular to the rapid heating of the Arctic and resulting loss of sea ice. Prof Mann said that asking if climate change “causes” specific events is the wrong question: “The relevant question is: ‘Is climate change impacting these events and making them more extreme?’, and we can say with great confidence that it is.” Mann points out that the link between smoking tobacco and lung cancer is a statistical one, which does not prove every cancer was caused by smoking, but epidemiologists know that smoking greatly increases the risk. “That is enough to say that, for all practical purposes, there is a causal connection between smoking cigarettes and lung cancer and it is the same with climate change,” Mann said. Other senior scientists agree the link is clear. Serious climate change is “unfolding before our eyes”, said Prof Rowan Sutton, at the University of Reading. “No one should be in the slightest surprised that we are seeing very serious heatwaves and associated impacts in many parts of the world.” It is not too late to make the significant cuts needed in greenhouse gas emissions, said Mann, because the impacts progressively worsen as global warming increases.  “It is not going off a cliff, it is like walking out into a minefield,” he said. “So the argument it is too late to do something would be like saying: ‘I’m just going to keep walking’. That would be absurd – you reverse course and get off that minefield as quick as you can. It is really a question of how bad it is going to get.”"
