"This Friday, Extinction Rebellion will hold a peaceful demonstration to call upon the BBC to convey the severity of the climate and ecological emergency we are experiencing, and the urgent action needed to address this. The BBC, as a respected media voice in the UK, needs to play a key role in enabling the transformative change needed. We are requesting: 1. The director general, Tony Hall, agree to a meeting with a delegation from Extinction Rebellion to discuss how the BBC can tell the full truth on the climate and ecological emergency.  2. The BBC declares a climate and ecological emergency. 3. The BBC places the climate emergency as its top editorial and corporate priority by adoption of a climate emergency strategic plan, at the level of urgency placed on informing the public about the second world war. 4. The BBC to divest all pension funds, investments and bank accounts from fossil fuel corporations and their bankers. 5. The BBC, its subsidiaries and its supply chain to agree to be zero-carbon by 2025. 6. The BBC to publish an annual eco-audit of all BBC operations, including summary of key ecological and carbon data. 7. The BBC to take a lead on encouraging other national and global media corporations to join the global efforts to save humanity/nature from existential crises. 8. The BBC to only allow thinktank spokespersons on air to discuss the climate emergency whose funding is fully transparent.Clare FarrellExtinction Rebellion • Join the debate – email guardian.letters@theguardian.com • Read more Guardian letters – click here to visit gu.com/letters • Do you have a photo you’d like to share with Guardian readers? Click here to upload it and we’ll publish the best submissions in the letters spread of our print edition"
"Riots in Paris, turmoil in Westminster, death in Strasbourg, stasis in Katowice at climate talks: some weeks, optimism can seem thin and remote, like the atmosphere on Neptune. Happily, there are thinkers such as Thomas Piketty to tell us how it could all be so different. A new plan for the EU, devised by the French economist and dozens of other Europeans, takes aim at some of these perennial problems – and offers some tentative solutions.  It seems particularly relevant, at a time when France’s gilets jaunes are tearing up Paris because of grinding austerity, that here is a plan that would raise money from big multinationals, not struggling families. It also seems apposite that, with few concrete plans to deliver the cuts in carbon emissions required to keep the planet from overheating, here is a plan that would set a firm carbon price. It feels urgent that, at a time when immigration and asylum have upended European politics, here at last is a proposal for funding a response. And any plan to make the EU more lovable is surely overdue: the British predicament is a testament to that. Prospects for enacting the Piketty plan may be slim, given Europe’s perennial difficulty in finding consensus: not even everyone on the left will agree, as Yanis Varoufakis makes clear in this piece about his own plan to revive the EU.  But at least it’s a plan. Elsewhere, one of our abiding themes in 2018 has been homelessness, an issue that always comes to the fore at this time of year. With rates climbing in many wealthy countries, it was good to hear of the remarkable work by a Dublin doctor to try to make a difference. Finally: the Russian robot that turned out to be a man in a suit, the Santa who lost his cool and started swearing, and the Londoners who replied with typically dry humour to a New York Times request for victims of petty crime to come forward. This article, published by Ensia, delved into the mistakes Japan made in reforesting landscapes after the second world war, and the lessons it holds for other countries aiming to plant millions of trees in coming years to sequester carbon. Also, as the COP climate talks concluded in Poland, we salute our colleagues at Le Monde for their series on measures to fight global warming, including the Swedish neighbourhood powered entirely by renewables (this article is in French). Thanks very much for all you’ve been doing to report in those remotes areas. You’re bringing the light to the world. Samah Brice, by email In Haiti, where 4,000 people finally gained redress after having their land appropriated for an industrial park seven years ago. “After my land was taken from me, we women have been in a difficult situation. We’ve had no income for crops we used to sell. We didn’t see any future. With the agreement we signed yesterday, we hope our lives will be changed.” Seliana Marcelus, one of the farmers and lead negotiators Also, with our fellow travellers at The Correspondent, which promises a fresh stream of constructive journalism in 2019, having crowdfunded $2.5m (nearly £2m) for a new, ad-free platform. “We don’t just cover the problem, but also what can be done about it,” they say. Festive message: this week, we are not asking Upsiders to join the Guardian as members, but would instead invite you to consider donating to our Christmas charity appeal. Our journalists, including the Upside editor, Mark Rice-Oxley, will be taking your phone donations this Saturday on +44(0)20 3353 4368. This email will not self-destruct, but will not appear for the next three weeks, while we – and you – take a well-earned break. We’ll be back with you on 11 January with an optimistic look at 2019 and all that it holds. Happy Christmas, and wishing you all a prosperous, peaceful new year."
"Those attending the COP24 climate negotiations in Katowice, Poland, this week have been greeted by a bizarre sight: an artistic celebration of one of the main fuels responsible for destroying the global climate. Katowice is the centre of Poland’s coal industry, and despite hosting a conference that represents the last chance saloon when it comes to taking meaningful action on climate change, local politicians pride themselves on the black stuff. Perhaps we could have expected no different when the Intergovernmental Panel on Climate Change decided on such an inappropriate venue and to allow coal companies to sponsor the talks. If we do make it through climate change with some form of civilisation intact, we will look back at some of the things we are doing now with the moral repugnance we feel towards slavery. There are legitimate parallels here. Climate change will most hurt those yet to be born. Our failure to make the dramatic changes needed to our economy and society means we are behaving as if we own the lives of future generations and have a right to steal their lives from them.  Art plays a key role in recording contemporary life, but because it is exploratory and imaginative it also invites us to challenge the assumptions we live by. In Katowice there is a counter-exhibition on coal by art students, drawing attention to the “dark side of coal”. Meanwhile the campaign movement Art Not Oil, which has been pushing for an end to oil sponsorship of the arts, ran a parallel protest exhibition alongside the British Museum’s I Object show in opposition to financial backing from BP – a company that proudly boasts it is one of the most significant corporate investors in UK arts and culture. Performers acted as “rebel curators”, presenting objects to the public that represent BP’s complicity in climate breakdown. Just as in Bristol, where the Green lord mayor, Cleo Lake, has banished paintings related to the slave trade from her office, so galleries should shun BP funding. Musicians are also challenging corporate sponsorship. Neil Young is due to play a large concert in Hyde Park next summer. Recently he criticised the event’s sponsor, Barclays, declaring the bank a “fossil-fuel-funding entity”. Young said such sponsorship was incompatible with his beliefs about the climate, and that he was seeking to rectify the situation. Yesterday he claimed victory, saying the concert was now proceeding without Barclays as a sponsor. Others need to follow his lead. And perhaps Young and other musicians concerned about climate change will also need to think carefully about the carbon footprint of performing concerts around the globe. There’s also a strong case against continued fossil fuel sponsorship from an economic perspective. The financial sector is rapidly divesting from fossil fuels, realising the smart money is in renewables and the green economy. Since the Paris agreement was adopted in November 2015, the sustainable finance agenda has moved rapidly. In the European parliament I’ve worked on legislation that requires all financial market players to give full information about how customers’ money is invested. Since the EU has committed to phasing out fossil fuels by 2050, any pensions for people aged under 40 that contain assets based on fossil fuels could be claimed to have been mis-sold. So decisions not to throw money at fossil fuels are increasingly looking hard-headed and rational rather than purely moral. There’s also a growing divestment movement, and universities and colleges have been at the forefront. Almost half of UK universities have made divestment commitments. Students and academics of the arts can play a vital role in pushing this agenda, again using their talents to do this in creative ways. No matter how much they are struggling for cash, galleries and arts promoters should be made to feel too ashamed to take money from the industries that are leading us to climate breakdown. In the same way we now look back on the slave trade, those who took the filthy fossil fuel lucre will be condemned by future historians. But the arts sector must go further than simply seeking clean sources of funding. Artistic creation invites us to imagine alternative worlds and to subvert the power of the old. Envisioning a future where fossil fuels have no place in our economy or society could provide a rich creative vein for artists and musicians, allowing them to play a vital role in generating ideas about how we are to live in the post-fossil fuel era. • Molly Scott Cato is Green party MEP for South West England"
"It was a blazing hot day in La Quinta, California, and Irving Berlin was inspired to write a song. Not just any old tune: having completed the lyric, the composer told his secretary he “just wrote the best song that anybody’s ever written”. Though not everyone would agree with his boast, White Christmas went on to become a commercial and cultural success. Made famous by Bing Crosby, who sang it in the film Holiday Inn, it is thought to be the bestselling single of all time, shifting at least 150m copies worldwide.  White Christmas was not a hit initially. But in 1942, two years after it was written, the song topped the US charts, thanks in part to its popularity with American soldiers stationed overseas during the second world war. It was a hit in Britain, too, perhaps helped by the fact that, unlike swathes of the southern US, we actually experience white Christmases – or at least we used to. The last “proper” white Christmas – at least in southern Britain – with snow settling on the ground, was in 2010, though in the Highlands snow falls every winter. However, as global warming takes hold, soon the only link with white Christmases may be the famous song."
nan
"Scientists have laid down the gauntlet for political leaders as the UN climate summit in Katowice, Poland, wrestles with the challenge of cutting emissions without sparking social tensions like those seen recently in France. The UN climate talks – known as COP24 and the most important since the Paris agreement was signed in 2015 – aim to set a new rulebook for governments to reduce greenhouse gases and to raise ambitions, after warnings of dire consequences if global warming rises more than 1.5C above pre-industrial levels.  The climate crisis is already here and the risks are growing, said Hoesung Lee, chair of the UN Intergovernmental Panel on Climate Change, who led a study by thousands of scientists on ways to avoid 1.5C of warming via accelerated transition from fossil fuels. “The IPCC made a tremendous collective effort to bring you the best scientific knowledge on the subject. We tell you limiting warming to 1.5C is possible but the window is narrowing,” Lee told a plenary on Tuesday. “The scientific community has delivered, now it is up to governments to take action.” There has been fierce debate about what to do with the study. All but four of the world’s governments want to formally welcome the 1.5C report to spur a more ambitious shift towards renewable energy. However, four oil producing nations – the US, Russia, Saudi Arabia and Kuwait – said the study should merely be “noted”. This issue has overshadowed the past few days of the talks in Poland. Saudi Arabia has claimed there are “gaps and uncertainties” in the study. The US held a long-planned event promoting coal, gas, oil and nuclear power. In a thinly veiled criticism of such tactics, Laurent Fabius, a former prime minister of France and president of the 2015 Paris climate talks, told the plenary that political leaders would play a negative role if they were “not only somnambulists but spoilers”. He noted that global emissions rose by 2% this year, when they need to decline if warming is to be kept to a less dangerous level. “Let us be clear, the real world is not on track. We need to do more and to do it faster,” Fabius said. “The IPCC 1.5C report shows the tremendous importance of every half degree and the disastrous consequences of missing that boundary.” But many delegates said more attention should be focused on the social challenges of rapid change, as workers in old industries, such as coal, lose their jobs and the price of fossil fuels is pushed higher to stimulate the transition to alternative energies. Without greater consideration of how the costs and benefits could be equally shared there could be a violent backlash, as France has experienced with the gilets jaunes protests that were initially about a planned rise in an eco-tax on petrol. Jonathan Pershing, a former US climate envoy, said technology and the markets would drive change, and it was already cheaper to build a new renewable power plant than a new coal or gas plant. “But you have to think about how to manage it. What happens to people who no longer have jobs from the old economy in the new economy? How do you think about new opportunities and the training you give young people? If you close down old facilities, how do you do it in a manner that keeps the communities alive and helps maintain the traditions and cultural structures?” Pershing said. “We don’t do it very often so we don’t have much experience. No report tells us how to manage the political difficulties. We need to manage the transitions. They’re hard.” This was echoed by Andrew Steer, president of the World Resources Institute, who said it was important for governments to separate raising tax revenue from addressing climate change. “The yellow vest implications are huge and show the danger if we take wrong moves,” he said. “We haven’t paid enough attention on the short-term impacts [of putting a price on carbon]. The environment movement needs to look at itself in the mirror.”"
nan
"The EU and scores of developing countries have pledged to toughen their existing commitments to reduce greenhouse gas emissions to enable the world to stay within a 1.5C rise in global warming. The promise, which follows increasingly dire scientific warnings, was the most positive message yet to come from the ongoing talks in Poland. The announcement came at the end of a day in which the UN secretary general made an impassioned intervention to rescue the talks, which have been distracted by US, Russian and Saudi moves to downgrade scientific advice. “We’re running out of time,” António Guterres told the plenary. “To waste this opportunity would compromise our last best chance to stop runaway climate change. It would not only be immoral, it would be suicidal.” The talks have centred on devising a rulebook for implementing the 2015 Paris agreement and raising countries’ level of ambition to counter climate change, but progress has been slow on several key issues and divisions have emerged between four fossil fuel powers – the US, Russia, Saudi Arabia and Kuwait – and the rest of the world. The UN believes China could play a stronger role in the absence of leadership from the US. Sources said Guterres would make a telephone call to Xi to ask for his help in nudging talks forward. The EU also wants China, which is a key member of the block of 77 developing countries, to step up to ensure that countries all follow the same rules in being transparent over their greenhouse gas emissions. Campaigners praised the decision by the High Ambition Coalition group of countries, made up of the EU and four other developed countries, including Canada and New Zealand, as well as the large grouping of least developed countries and several other developing nations, to scale up their emissions-cutting efforts in line with a 1.5C temperature rise limit. Wendel Trio, director of the Climate Action Network Europe, said: “The spirit of Paris is back. The statement will boost greater ambition at the crunch time of these so far underwhelming talks. For the EU this must mean a commitment to significantly increase its 2030 target by 2020, even beyond the 55% reduction some member states and the European parliament are calling for. We call upon the countries that have not signed the statement so far to stop ignoring the science.”  Guterres, in a pointed criticism aimed at the four countries that have been refusing to “welcome” the Intergovernmental Panel on Climate Change’s special report on 1.5-degree warming, said rejecting climate science was indefensible. He added: “The IPCC special report is a stark acknowledgment of what the consequences of global warming beyond 1.5 degrees will mean for billions of people around the world, especially those who call small island states home. This is not good news, but we cannot afford to ignore it.” Frank Bainimarama, the prime minister of Fiji and the outgoing chair of COP23, amplified Guterres’ message. He told delegates they risked going down in history as “the generation that blew it – that sacrificed the health of our world and ultimately betrayed humanity because we didn’t have the courage and foresight to go beyond our short-term individual concerns: craven, irresponsible and selfish”. The former US vice-president Al Gore told delegates they faced “the single most important moral choice in history of humanity”. Behind the scenes, delegates said there had been strong progress on finance thanks to a doubling of commitments by Germany and Norway to help poorer nations adapt to climate change and build institutions capable of monitoring emissions. Nicholas Stern, the author of a landmark review on the economics of climate change, praised “the level of ideas and cooperation”. But others said there were still many disputed brackets in the negotiating text on transparency and other elements of the rulebook. “There has been some progress, but it’s a very worrying time. There is still a lot more on the table than we hoped for at this stage,” said Helen Mountford, vice-president of the World Resources Institute. “The secretary general is coming in to make sure this COP can land in a good place. He will hold a summit next year to raise ambitions. If he wants success there, then here we need a robust rulebook and clear signals on ambition and finance.” Janos Pasztor, the former climate adviser to Ban Ki-moon, told the Guardian that Guterres was doing the right thing by intervening at a crucial stage. “He needs to make clear what the IPCC has described as a major challenge, and that we have to deliver on that,” he said. Pasztor added: “We are talking about the need for massive emissions reductions, that have to happen now, not in the future. It is very daunting. The secretary general has reminded the world of what is at stake, and the political significance of that.” The contrasts with the Paris climate summit, in terms of the political atmosphere, were striking. David Levaï, who was part of the French government team that helped to broker the successful 2015 conference, said the geopolitical winds were far less favourable today. Globally, the rise of nationalists such as Donald Trump in the US and Jair Bolsonaro in Brazil has tilted power towards fossil fuel and agribusiness interests. He said: “In the year before Paris, all countries made clear that they wanted an agreement. Now, there are repeated attacks on multilateralism, and this has empowered groups that take negative actions.” Levaï, who is at the Institute for Sustainable Development and International Relations, expressed hope that the secretary general might make a difference. “The fact that he has come back shows he feels a need to whip countries into order,” he said. There has been some criticism of the pro-coal government of Poland for failing to press governments to raise their ambitions. But it joined Fiji as co-chair of the Talanoa phase of the negotiations to issue a call for action that recognised the importance of the 1.5C report as the basis for more urgency and ambition. “The window for action is closing fast. We need to do more and we need to do it now,” said the document, which would form part of the official statement from this conference."
nan
