"“Global heating” is a more accurate term than “global warming” to describe the changes taking place to the world’s climate, according to a key scientist at the UK Met Office. Prof Richard Betts, who leads the climate research arm of Britain’s meteorological monitoring organisation, made the comments amid growing evidence that rising temperatures have passed the comfort zone and are now bringing increased threats to humanity.  “Global heating is technically more correct because we are talking about changes in the energy balance of the planet,” the scientist said at the UN climate summit in Katowice, Poland. “We should be talking about risk rather than uncertainty.” Earlier this month, the Met Office produced a new report that showed the searing heatwave that hit the UK this summer – along with other parts of the northern hemisphere – was made 30 times more likely by human-caused climate change. Betts said the shifting climate was pushing some natural processes – such as the blossoming of trees and laying of eggs – out of sync. “That’s already happening. We are also seeing higher temperatures of heatwaves. The kind of thing we saw this year will happen more often. “The risks are compounding all the time. It stands to reason that the sooner we can take action, the quicker we can rein them in.” His views were echoed by Hans Joachim Schellnhuber, a professor of theoretical physics and founder of the Potsdam Institute for Climate Impact Research in Germany. He said his recent Hothouse Earth report , which was one of the most widely quoted and downloaded studies of this year, had helped to change the language used to describe the climate crisis. “Global warming doesn’t capture the scale of destruction. Speaking of hothouse Earth is legitimate,” he said. The scientists expressed frustration at the slow pace of action by political leaders. In signing the 2015 Paris agreement, governments around the world aimed to keep global warming to within 1.5C to 2C above pre-industrial levels. But current commitments are far off track. The Met Office upgraded its forecasts this week to show the planet is on track to warm by between 2.5C and 4.5C. “We have broadened out the range of possibilities,” said Betts, who is conducting a risk assessment based on the new projections. In the UK, he said the trend was towards wetter winters with more floods, hotter summers with more droughts interspersed with increasingly intense rain. At 3C of change, Schellnhuber said southern Spain would become part of the Sahara. Even 2C, he said, could not be guaranteed as safe. The Paris pact was a firewall, he said. “It’s not helping us to keep the world as it is now. We’ve lost this opportunity already. It’s a firewall against climate chaos.” Johan Rockström, executive director of the Stockholm Resilience Centre, said “cracks” were starting to appear in the climate system that were pushing nature from being a friend that absorbs carbon dioxide to an enemy that releases carbon dioxide. These concerns are fuelled by the growing intensity of forest fires, the effect of melting ice-sheets on the jet stream, and the rising risk of permafrost thaw, which would release trapped methane. Although he stressed it might not yet have passed a tipping point, he said the warnings were getting louder. “This shift from friend to foe is no doubt a scientific nightmare. That is the biggest worry that we have,” he said. “It does terrify me. The only reason we sit here without being completely depressed is that we see we have policy measures and technology to move in the right direction. “We need to have a diagnosis just like a patient who comes to a doctor and gets a really bad diagnosis. But if the science is right, the technology is right, and the policy is right you can cure that very dire situation. There is no scientific suggestion that the door is shut.” This week’s climate talks have crept forward with only small progress towards a new global rulebook, but emissions continue to rise and the planet continues to heat. “Things are obviously proceeding very slowly,” said Betts. “As a scientist, it’s frustrating to see we’re still at the point when temperatures are going up and emissions are going up. I’ve been in this for 25 years. I hoped we’d be beyond here by now.” Schellnhuber concurred. “I’ve worked on this for 30 years and I’ve never been as worried as I am today.”"
nan
"They lacked the drama, excitement and eventual breakthrough that marked the Paris agreement of 2015, but this year’s UN climate talks produced important steps forward in putting the landmark accord into practice. After last-minute wrangling over wording, late on Saturday night delegates in Poland finally agreed a text that contains most of the “rulebook” needed to guide countries’ implementation of the Paris goals.  These include complex technical issues such as how countries should measure and report on their greenhouse gas emissions, and account for progress on meeting their commitments on curbing carbon, with an agreement to work on setting new targets for financial assistance to poor countries. Resolving these should mean countries can move ahead with meeting their targets. “This is a good agreement,” the European commissioner Miguel Cañete told the Guardian. “We have more to do but we can move forward now.” Nicholas Stern, author of the seminal review of the economics of climate change, said: “This has been another summit of tough negotiations, but it has ultimately succeeded in its crucial primary task of agreeing the so-called rulebook for the Paris agreement.” One important issue that could not be resolved was over carbon markets, and how countries can gain credits for their efforts to cut emissions and their carbon sinks, such as forests, which absorb carbon dioxide. After Brazil, which hopes to benefit from its huge rainforest cover, insisted on wording that critics said would allow for double counting of credits and undermine the integrity of the system, this issue was postponed until next year. While the conference broadly succeeded within its narrow technical remit, however, key questions on tackling climate change were ignored or put off. Foremost among these is the inadequacy of countries’ current national targets for curbing greenhouse gases. With current targets, the world is likely to face 3C or more of warming, which scientists warn would bring disaster. Paul Bledsoe, a former climate adviser to President Bill Clinton, said: “Gaining a strong regime of accounting for emissions is an essential step on getting a handle on global emissions, and a major achievement. But the biggest breakthroughs on emissions cuts must be done at the head of state level over the next several years, not in a few days by ministerial negotiators.” The conference also failed to take account of the warnings by the Intergovernmental Panel on Climate Change, the global body of the world’s leading climate scientists, which only two months ago presented a bleak picture of the damage that would be done if global temperature rises reached or exceeded 1.5C above pre-industrial levels. The panel said that the result would be heatwaves, droughts, floods, the die-off of coral reefs, and the decline of agricultural productivity in large swathes of the world. The Paris agreement binds countries to avoid a 2C temperature rise, with an aspiration to limit warming to no more than 1.5C. Time is running out: the IPCC’s findings imply that there is about a decade left to set the world on a new track. This year was the fourth hottest on record, according to the World Meteorological Organization, and extreme weather – such as the heatwave in the UK, wildfires in Europe and the US, floods in India and storms in south-east Asia – affected every continent. Jennifer Morgan, the executive director of Greenpeace, said: “A year of climate disasters and a dire warning from the world’s top scientists should have led to so much more. Instead, governments let the people down again as they ignored the science and the plight of the vulnerable. Adopting a set of rules for climate action is not nearly enough; without immediate action, even the strongest rules will not get us anywhere.” The two-week conference, known as COP24, in Poland’s coal-fuelled heartland started with Sir David Attenborough warning of the collapse of civilisation if untrammelled climate change were allowed to take hold. “Right now, we are facing a manmade disaster of global scale, our greatest threat in thousands of years: climate change,” the veteran broadcaster and naturalist told delegates. “If we don’t take action, the collapse of our civilisations and the extinction of much of the natural world is on the horizon.” The secretary general of the UN, António Guterres, also stepped up his rhetoric, warning it would be “immoral and suicidal” to fail to take strong action. The 15-year-old Swedish schoolgirl Greta Thunberg, whose strike to raise awareness of the issue drew global attention, was scathing in her speech to the conference: “You’re not mature enough to tell it like it is. Even that burden you leave to your children.” There were encouraging signs of shifting geopolitics at the talks. China and the EU were able to settle differences on how to account for and verify greenhouse gas emissions, and the EU and a handful of other rich countries joined with scores of developing nations in promising to focus on the 1.5C limit in setting their future emissions-cutting targets. But while the conference ended in a show of unity, with the Polish minister in charge leaping from the podium table into the audience in glee as it finally closed 30 hours after the deadline, the talks also displayed new rift lines. Brazil, under its incoming president, Jair Bolsonaro, who is hostile to the Paris agreement and sceptical of climate science, held up agreement for nearly a day by insisting on a change to the rules on carbon credits that critics say would undermine the system. That decision has been put off to next year, but the stance of Brazil under Bolsonaro – he also withdrew Brazil’s offer to host next year’s conference – troubles many other countries. Brazil previously acted as a powerbroker between developed and developing nations, and without that role future talks may be more acrimonious. The US also showed how Donald Trump’s presidency is changing its role, when it joined with Russia, Saudi Arabia and Kuwait to prevent the conference from fully embracing the IPCC’s findings. In previous years, while Saudi Arabia has played an obstructive and delaying role behind closed doors, it has rarely been willing to take a public stance against agreement, and Russia has remained largely quiet since allowing for the adoption of the Kyoto protocol in 2004. Australia, which has played a shifting role in the talks under successive governments, also joined with US supporters in a celebration of coal. It seems that Trump’s hostility to climate science is emboldening other countries to take a more aggressive role in fighting progress. David Waskow, of the World Resources Institute, told the Guardian: “[The US’s new stance] is giving these countries more space for what they want to do.” Despite the progress made at this year’s talks, some believe that the UN process will always be too slow to measure up to the scale and urgency of the problems, and new ways should be found to take action independently. Durwood Zaelke, president of the Institute for Governance and Sustainable Development, said: “In the climate emergency we’re now in, slow success is no success. [The rulebook] is decades too late. It should be clear that the UN consensus process can never produce the muscular agreement we need to meet the emergency.” He advocates sectoral agreements for heavy industries such as steel, aluminium and cement that would require companies in those industries to reduce their emissions, removing any competitive disadvantage to businesses in being first-movers in cutting carbon."
"The UN met on Saturday in Poland to discuss a draft agreement on climate change, which sources said was likely to pass, as exhausted delegates made compromises on some key issues but left other contentious problems to be resolved next year. The result will not be the breakthrough campaigners and some countries were hoping for, but will keep discussions alive on formulating key aspects of the implementation rules for the 2015 Paris accord.  Delegates have been thrashing out a text on the complex mechanisms required to put the Paris goals into effect for the past two weeks, and appeared partly successful as the talks overran their Friday deadline and looked likely to continue into late afternoon on Saturday at least. The text will give countries clarity on key points such as accounting for their greenhouse gas emissions and recording their carbon reductions. They will also go some way to encourage the stepping up of each country’s climate change efforts. Among the issues holding up progress is the highly technical question of what should happen to the market for carbon credits, held by some countries in recognition of their emissions-cutting efforts and their carbon sinks, such as forests. These credits count toward countries’ emissions-cutting targets. Brazil introduced wording that would benefit the country for its huge rainforest cover, but critics said contained loopholes that allowed for double counting of carbon credits would severely undermine the integrity of the system. That question is unlikely to be resolved in the time remaining, but gave an indication of Brazil’s likely stance in future talks. Next year’s conference was supposed to be held in Brazil, but will take place in Chile because Brazil’s incoming president, Jair Bolsonaro, withdrew the offer to host. Brazil has been a reliable supporter of the annual talks in the past and has worked to broker deals between the developed and developing world. Without that support in future, the talks are only likely to grow more fractious. The US, Russia, Saudi Arabia and Kuwait have also played a disruptive role, watering down a resolution that would have welcomed the recent IPCC report that a temperature rise of 1.5C would have dire consequences. The compromise in the redrafted text would have all countries “welcome the timely completion” of the IPCC report, but campaigners pointed out that this was weak because it refers merely to the timing of the report rather than its content. The EU, by contrast, and several other developed countries joined with scores of developing nations in announcing they would focus on preventing a 1.5C rise in their carbon-cutting efforts. There were few new offers from the rich world of financing for developing countries to help them cut emissions and adapt to the effects of climate change, another issue that has been pushed to future talks. As the last-minute negotiations wore on, delegates were saddened to hear of the death overnight of the veteran Philippine negotiator, Bernaditas de Castro Muller, who was a notable presence at the talks for nearly three decades. Tributes came from many who admired her forthright style."
"Australia appears likely be allowed to exploit a controversial climate loophole, using carryover carbon credits from the Kyoto protocol to meet its Paris agreement targets. New Zealand has already ruled out using the carryover credits, saying it would discourage other countries from the practice.  Australia’s environment minister, Melissa Price, said Australia would meet its Paris commitment of a 26% to 28% carbon emissions reduction – “equivalent to a halving of emissions per person” – but would not comment on whether the government would use carryover credits from Kyoto to reach that target. New Zealand’s climate change minister, James Shaw, said this week the practice of claiming credits was not in the spirit of the Paris agreement, and “we would discourage any country from using [it]”. He has previously described the practice as “dodgy accounting” and like “trying to have two meals for the price of one”. The use of carryover credits is one of dozens of technical elements being negotiated at the UN climate talks in Katowice, Poland where 193 countries have gathered to negotiate the “rulebook” for each meeting the emissions reductions targets made three years ago in Paris. The practice of carryover credits allows countries to count carbon credits from exceeding their targets under the soon-to-be-obsolete Kyoto protocol periods against their Paris commitment for 2030. Australia’s environment department projects its surplus at 294m tonnes of carbon dioxide equivalent, but independent climate analysts suggest that figure could be as high as 333m tonnes, or up to 400m tonnes if tree-planting and other land use changes are counted in Australia’s favour. Most of these additional carbon credits have been won through Australia’s unique deal under Kyoto to count land-clearing changes towards emissions reductions. Having those credits already “banked” against Australia’s emissions reduction target would make meeting its 2030 Paris goal of a 26% to 28% emissions reduction significantly easier: closer to 15% in actual reductions, Climate Analytics has said. Government figures show the Australia’s carbon emissions continue to rise. Emissions from fossil fuels and industry have been increasing by about 2% a year since 2014. At the UN climate change talks in Poland this week, the Marshall Islands has raised objections to the use of carryover credits in informal negotiations, but with little support. Preliminary documentation from inside the talks, seen by Guardian Australia, suggest that using carryover credits is not going to be prohibited under the “rulebook” for the Paris agreement, meaning countries will be able – and some likely – to do it. The chief executive of Climate Analytics and a lead author on former IPCC assessment reports Bill Hare said it appeared almost inevitable Australia would be allowed to – and would – use carryover credits. A change of government would not change the policy, he said. “Every indication is that both the government, and the Labor party, have every intention of trying to carry over surplus credits from the Kyoto protocol into Paris. “The [Australian government] delegation has made statements at negotiations over a period of time that are consistent with that.” Hare said Australia, based on its current climate policies, could not meet its Paris agreement target without using surplus credits. He described the use of carryover credits as “fake climate action”. “About half of the cumulative abatement task from 2021 to 2030 could be met by the projected Kyoto second commitment period surplus … in other words, the overall mitigation effort to reach the already inadequate target would be halved.” Along with New Zealand refusing to use its credits, other countries have previously declined to use theirs. In 2015, Denmark, Germany, the UK, Sweden, and the Netherlands cancelled 635m tonnes of carbon credits. In Katowice, Price told Guardian Australia that the government was committed to the Paris Agreement and its targets. “Our priority at COP 24 is to secure agreement on a comprehensive rulebook to guide the implementation of the agreement. “Our 2030 target is to reduce emissions by 26 to 28% below 2005 levels, which is equivalent to a halving of emissions per person. The government is confident of meeting this target, based on our track record of meeting and beating our first and second Kyoto protocol targets.” Australia, however, has consistently won specific exemptions to the calculation of its carbon reductions targets over decades of climate negotiations. During negotiations over the Kyoto protocol, the Howard government negotiated a special deal, allowing it to actually increase emissions by 8% between 2008 and 2012. An additional article negotiated in the dying hours of the conference – known as the “Australia clause” and condemned at the time by a European environment spokesman as “wrong and immoral... a disgrace” – allowed Australia to include land use changes in its emissions calculations which meant the target could be reached with only minor changes to land-clearing laws. When Australia met – and exceeded – its first Kyoto target, it was able to bank those extra carbon credits, carrying them over to meet its second target for 2020. That excess appears now likely to be calculated in assessing its Paris commitment."
"ExxonMobil’s alleged role in spreading misinformation about climate change will be scrutinised by the European Union for the first time, in a move welcomed by campaigners. The world’s biggest international oil company has been investigated in the US over allegations that it knew about the dangers of global warming for decades but deceived the public over the risks, a charge the firm has rejected.  EU politicians will now turn their attention to the role the company has played in Europe, where it has a sizeable presence from the huge Groningen gas field in the Netherlands to oil and gas fields in the North Sea. MEPs on the environment, public health and food safety committee will quiz a series of speakers on misinformation campaigns on climate change, which could include representatives of the company. The hearing on 21 March, jointly held by the petitions committee, comes after a petition by fossil fuel campaigners calling for a closer look at the information the company “wants to withhold from us now”. “ExxonMobil has misled the public on climate change for over 40 years. Now it’s time to correct the record and hold them accountable,” said Wenonah Hauter, the executive director of Food & Water Europe, which organised the petition. She called on the the new US Congress to follow the European parliament’s lead. “The weak outcome of the climate negotiations in Poland show that we can’t wait – leaders everywhere must take climate denial and climate action seriously,” she said, in reference to the UN climate talks which concluded on Saturday. The group would like to see lobbyists for the company barred from Brussels because of the firm’s alleged past behaviour. Molly Scott Cato, the Green MEP for South West England and Gibraltar, agreed that lobbying of EU institutions by companies that had been linked to climate denial should not be permitted. She said: “Exxon has a shameful history of funding climate change denial – paying for fake science and dangerous lies that have prevented us from taking timely action on climate change and forcing the world into the current climate crisis.” An ExxonMobil spokesperson said: “We unequivocally reject allegations that ExxonMobil suppressed climate change research contained in media reports that are inaccurate distortions of ExxonMobil’s nearly 40-year history of climate research. We understand that climate risks are real.” In recent years the company has softened its stance on climate change, urging the US to stay in the Paris climate agreement and agreeing to join an industry alliance on climate change. The company has recently been targeted by shareholders calling on it to set carbon targets at ExxonMobil’s AGM next year."
