"Protesters standing in floodwaters hold a sign that reads: “Can we talk about climate change now?” Scant media coverage of the link between increasing weather extremes and a warming world suggests it’s a conversation still seriously waiting to begin.  Several voices were quick however to exploit underspending on flood defences to attack overseas aid commitments. Ironically, estimates of £5-£6bn flood damage costs are more than covered by UK subsidies to fossil fuels – providing a more obvious candidate to switch resources.  Problematically, many clung to the idea that extreme events would trigger a change of mind on climate change. Yet policy seems untouched. Unrelenting, bleak and disconnected is no way to start a new year. But what if there was a seasonal subject that could tell the climate story, explain how we might change and adapt and, at least if you live in the UK, provide a little pleasure too?  Don’t put your glasses raised to new year down yet, the day of the champagne environmentalist may have arrived, in a good way. The world of wine, and especially the sparkling kind, can seem frivolous. But shifting patterns of global production are becoming a bellwether for climate change. Rising temperatures and shifting rainfall patterns pose particular problems to an industry which is so sensitive to weather that even mild seasonal variations can be tasted in every glass of the final product. Some grapes, like pinot noir, prosper only in a temperature range of 14C-16C. Increasing extreme weather events like the damaging European heatwave of 2003, revealed an acute vulnerability, for example, of traditional champagne-growing areas. Winemaking literally dried up. Last summer saw fears of a repeat. Wine reveals how a warming world challenges us to find new, more benign production methods and also to rethink our consumption habits. The UK’s changing climate, with warmer summers and milder winters, has presided over a boom in the production of high-quality sparkling wines and a flourishing of small-scale producers, especially in the southwest, a part of the country hit badly by floods in 2014. Breaky Bottom vineyard is one example, operating since 1974 at the end of a rough farm track near the town of Lewes and charming wine critics. That counts as well-established compared to its near neighbour the Bluebell vineyard which only began production in 2007 and started winning awards by 2011.  Though still modest internationally, they are part of a surge of production which has seen the area under production in England double in seven years. A good year in 2014 saw the equivalent of 6.3m bottles produced, nearly 50% more than the previous year, and exports to 14 countries. The high-quality, but small scale, non-industrial operation typical of wine making in the UK provides a lesson in sustainability according to Julia Stafford, founder of the Wine Pantry, a business set up to sell exclusively English wine. With a background in shipping, she saw the problems of industrial-scale production which is obsessed with cheapness, and the potential for a different approach in the emerging English market. “People laughed at first. But long summers are good for us. We don’t have the problem of extreme heat. It’s a young industry in the UK, with small areas and experimental,” explains Stafford. At Sharpham in Devon, award-winning wines are grown by the River Dart near Totnes. A study on whether the town could feed itself found that even with its current small-scale, high-quality production, the Sharpham vineyard produced enough to provide a bottle of wine each month to every one of the area’s 22,000 inhabitants.  Internationally, says Stafford, “You have all this wine mass produced, an energy intensive industry. But here we tend to do hand picking, and use sheep and cows to graze instead of using herbicides. It’s a lighter footprint.” To get a more sustainable wine industry, she says: “Have one good bottle (that might be more expensive), not two (cheap) bad bottles.” The UK has, for the moment, won the climate lottery for producing some wines. But success could be short-lived. As temperatures continue to rise, one projection suggests that by 2080 the south-west will only be good for growing raisins. In the US, the wine industry already faces major challenges. California, for example has been hit by both protracted drought and extremes of rainfall. After a period of denial, growers there say climate change is becoming too obvious to ignore. “I think that as human beings, until we experience something like real pain, we can generally find a way to rationalise things and pretty much defer tough decisions,” says Randall Grahm of the Bonny Doon Vineyard, a wine maker near Santa Cruz, celebrated for championing terroir and biodynamic growing techniques. “But, wells are running dry. The 2015 vintage is possibly the earliest harvest on record in California, and wild-fire flames are licking at the edge of Napa Valley.” Rising temperatures are changing the characteristics of the grapes and the wine they produce, he says, and not in a good way. Alcohol content is going up and natural acidities are declining, eroding the wines’ finesse and elegance. In response, makers are trying to find new grape varieties or rootstocks, avoid local regulatory obstacles to planting new vineyards, and respond creatively to climate change. “We are trying to plant a new vineyard in San Juan Bautista in such a way that will allow, at least for the red grapes, the possibility of dry-farming,” says Grahm, “We’re using more drought-tolerant rootstocks, wider plant spacing, smaller, head-trained vines, and most significantly, using biochar as a means of enhancing the water-holding capacity of the soil.” Their ploughing technique is designed to avoid rain draining away. As well as adapting to climate change, Grahm is pioneering techniques to reduce the industry’s impact by reducing its more energy intensive infrastructure. He opts for a lower-impact plantation, progressively eschewing wires, end-posts, stakes, irrigation, in favour of a mixed plantation, ecological balance that might make spraying unnecessary and the use of biochar mixed with compost as a way to sequestering carbon in the soil.  If you want to explain something, they say you should talk to people about what they care about.  As public spending cuts were voted through in the last UK Coalition government, annual spending on champagne rose in the bars of Westminster to £35,000. Wine could be the ultimately safe subject to communicate climate change where even great deluges fail.  As some in the industry point to ways in which we can both adapt to and minimise warming, in the UK at least you can become a “champagne environmentalist” without it necessarily being an insult, as long as you don’t drink too much."
"Overstated profits, secretive lobbying, the dirty side of industries laid bare – 2015 saw yet another clutch of corporate scandals. Sustainability and corporate responsibility may have become watchwords for global companies, but this doesn’t seem to have stemmed the bad behaviour of some businesses.  Here we round up some of the most significant corporate scandals of the year.  Volkswagen may well have won the prize for corporate villain of the year in 2015 following revelations that the German car manufacturer had installed software designed to cheat nitrous oxide (NOx) emissions tests in up to 11m of its diesel cars. The scandal widened in November when it emerged the company may also have been reporting its CO2 emissions incorrectly. As is so often the case with corporate scandals, establishing responsibility proves a slippery task. Then-CEO Martin Winterkorn took five days to resign, accepting responsibility only with the caveat “I am not aware of any wrongdoing on my part”. Under the new leadership of Matthias Müller, VW says it has made progress in its search to understand what went on. A “chain of errors” is the unsatisfying conclusion so far, with blame pinned on weak processes, “misconduct and shortcomings”, and some overly-tolerant “mindsets”.  VW’s dodgy emissions tests speak to a broader problem of people’s trust in businesses. When businesses abuse their position and indulge in dangerous greenwashing they undermine any company’s attempts to advocate for climate change action and responsible business. Consistently pitching itself as a champion of corporate responsibility, VW topped the Dow Jones Sustainability Index as the most sustainable car maker just before the scandal broke, with Winterkorn saying “the Volkswagen Group is well on the way to establishing itself long term as the world’s most sustainable automaker”. It now faces multiple investigations, including from the European parliament, and potentially tens of billions of euros in fines. If VW was villain of the year, some are suggesting that oil and gas behemoth ExxonMobil is the villain of our lifetime. An Inside Climate News investigation in September into internal Exxon documents revealed that the company’s own research had warned of the dangers of man-made climate change as early as 1981. Rather than start a debate about how to transition to a low carbon economy, the company chose instead to plough more than $30m (£20.3m) into climate denial, according to Greenpeace figures. For a long time it ran a campaign of misinformation, insisting that climate science remained uncertain, and even now it dismisses the possibility of a low-carbon future any time soon. The scandal is so significant because it is now clear that the richest company in America’s history had a choice. It could have engaged with its own research, opened up a public debate about the implications of climate change and looked at how to adapt its business model to meet the oncoming crisis. Or, as it chose to do, it could bury its head in the sand, invest in denial, minimise the potential of renewables and claim the future lies in oil and gas.  According to Bill McKibben: “Businesses misbehave all the time, but VW is the flea to Exxon’s elephant. No corporation has ever done anything this big and this bad.” In a year that saw the Paris climate talks and negotiations on two global trade agreements – the Trans Pacific Partnership Agreement (TTP) and the Transatlantic Trade and Investment Partnership (TTIP) – it’s perhaps not surprising that climate lobbying was such a big feature of 2015. According to data from the environmental non-profit CDP, 77% of the largest 500 companies in the world say they use trade associations to lobby on climate policy.  A Policy Studies Institute (PSI) investigation in March found that multinational companies eager to tout their sustainability credentials were also members of influential trade associations lobbying against EU climate policy. PSI looked at groups such as BusinessEurope, which has argued climate policies will undermine competitiveness, and the European Chemical Council, which argued that strengthening the EU Emissions Trading System would lead to businesses moving overseas for lower energy costs. Armed with this research, NGO ShareAction launched its “clean words, dirty lobby” campaign aiming to force companies to stand up to their rhetoric on climate change and stop funding trade associations working to weaken climate policy. In September, ShareAction organised a group of 25 investors with more than €61bn (£45bn) in assets to write to multinationals including BP, Glencore and Proctor & Gamble asking them to justify their membership of big EU trade associations. There is movement from companies. Shell announced in August that it was cutting ties with the rightwing American Legislative Exchange Council (Alec) because of its denial of climate change and last year Unilever split from BusinessEurope, reportedly for similar reasons.  Multinational companies have enormous power and influence and will have a key role in shaping climate policy. While many made bold pledges in 2015 in the run up to the Paris talks (Ikea, for example, promised €1bn to fight climate change), the continued existence of cosy, secretive lobbying threatens to undermine action we need to avoid catastrophic climate change. Brazil’s government called it the “worst environmental disaster in Brazil’s history”. In November, a tailings dam in the Brazilian mining state of Minas Gerais burst causing a huge and devastating mudflow. The 60m cubic meters of mine waste (equivalent to 25,000 Olympic swimming pools) killed at least 13 people and left hundreds homeless as it swept through villages and polluted the 800km River Doce, depriving local people of their water source and killing thousands of fish. The dam belonged to Samarco, a joint venture between mining giants Vale and BHP Billiton. All three companies, along with the Brazilian government, have been slammed by the UN for their “insufficient” response to the crisis. Vale, the world’s biggest iron ore specialist, has tried to wriggle out of liability by arguing Samarco is an independent company and wholly responsible for the tragedy. A federal judge has disagreed, freezing the assets of BHP Billiton and Vale after finding that Samarco would not have the funds to pay for the scale of the damage caused by the dam. The ruling found that both companies could be held responsible for the dam collapse, for which the government is demanding at least 20bn reals (£3.5bn). Both companies can appeal. As the country begins to collect itself after the tragedy, the spotlight has fallen on the Brazilian authorities, with allegations of lax safety regulations for the mining industry. The state of Minas Gerais has suffered five dam breaks in the last ten years, yet the pace of change is slow; a new mining code has been working it way through Congress for years.  Japanese computers-to-nuclear company Toshiba came undone in July 2015 after it was revealed to have inflated net profits by £780m over several years.  A report filed to the Tokyo Stock Exchange by the company spoke of a broken corporate culture: “Within Toshiba, there was a corporate culture in which one could not go against the wishes of superiors”. According to regulators, the company set unrealistic targets and employees were discouraged from questioning the actions of their bosses. Independent investigators found that both the president and chief executive of the 140-year old company were aware of the overstatement.  Financial regulators have recommended fines of £40m for Toshiba. The company’s share price has slumped by 40% since the beginning of 2015 and it’s laying off nearly 7,000 consumer electronics jobs as part of a post-scandal restructuring process.  For many the Toshiba scandal is reminiscent of the fall from grace of another of Japan’s huge corporations, Olympus. In 2011 the company was revealed to have hidden $1.7bn of losses over 13 years. The Japanese government is under fire for not doing more to prevent corporate wrongdoing. Japan’s prime minister Shinzo Abe has championed corporate responsibility as part of his growth strategy and the Toshiba scandal hit just weeks after the unveiling of a new corporate governance code in Japan, intended to instil a new culture of openness between shareholders and companies. There is clearly much more work to be done to achieve corporate transparency. Toshiba was a company lauded for its corporate governance structures yet these could not stand up to a culture of secrecy, a failure to properly monitor and a relentless quest for profits."
"Leonardo DiCaprio has launched a ferocious attack on the greed of the world’s energy industry at the World Economic Forum in Davos. DiCaprio used an awards ceremony to demand more action on climate change, decrying those who deny it is a problem. And he insisted fossil fuels must be kept in the ground – backing a campaign launched by the Guardian last year. After picking up a crystal award for his work on environmentalism, the actor explained he had seen the devastation caused by climate change firsthand, from melting glaciers in the Arctic to farmers whose crops had been washed away. DiCaprio is tipped for Oscar success this year for his role in the bleak and gritty drama The Revenant. And he gave energy bosses a similar savaging. In front of world leaders, business chiefs and campaigners, DiCaprio said: We simply cannot afford to allow the corporate greed of the coal, oil and gas industries to determine the future of humanity. Those entities with a financial interest in preserving this destructive system have denied, and even covered up the evidence of our changing climate. Enough is enough. You know better. The world knows better. History will place the blame for this devastation squarely at their feet.” The solution to limiting global warming, he added, is to leave oil, gas and coal reserves alone: Our planet cannot be saved unless we leave fossil fuels in the ground where they belong. Twenty years ago, we described this problem as an addiction. Today, we possess the means to end this reliance.” DiCaprio also announced that his foundation was making $15m of fresh grants to support environmental protection. That includes funding to protect 6.5 million acres of rainforest on Sumatra from the “invasive and destructive practices” of the palm oil industry. DiCaprio was one of four winners of a Crystal award at WEF this year. The fund also recognised Chinese actor Yao Chen for her work raising public awareness of the refugee, artist Olafur Eliasson, and musician will.i.am for his i.am angel Foundation, which tries to keep young underprivileged young people in education, and out of trouble. Accepting his award, will.i.am joked he had grown up near gangs, but had kept out of them as he was more scared of his mother than the gang leaders. His dream is that a child in one of America’s poorest regions could become the next tech pioneer."
"Satellites don’t measure the Earth’s temperature. Senator Ted Cruz (R-TX) and his fellow climate contrarians love the satellite data, but as Carl Mears of the Remote Sensing Systems (RSS) satellite dataset and Ben Santer recently wrote,  they are not thermometers in space. The satellite [temperature] data ... were obtained from so-called Microwave Sounding Units (MSUs), which measure the microwave emissions of oxygen molecules from broad atmospheric layers. Converting this information to estimates of temperature trends has substantial uncertainties.  Scientists process the raw microwave data, applying a model to make numerous adjustments in order to come up with a synthetic estimate of the atmospheric temperature. Climate scientists have identified many errors in the model, and so it’s undergone several major revisions. It’s a complicated process for many reasons discussed in greater detail in this new Skeptical Science myth rebuttal, and by Mears and Santer.  For example, satellites have a limited lifetime and are replaced (so far there have been 10 different satellites with MSUs); the MSU instruments change - they now use advanced MSUs (AMSUs); their orbits drift and decay due to friction; clouds get in the way; they have to isolate the data from the different layers of the atmosphere, etc. In a recent Senate hearing, Ted Cruz and one of his witnesses, Judith Curry, claimed “the satellite data are the best data we have.” Most experts disagree. At first blush the claim sounds plausible. After all, satellites are high tech! But how do we decide which data are “the best”? That’s a subjective question, but we can apply some objective criteria to answer it. For example, as humans, we might consider the temperature where we live (at the Earth’s surface) the most important. Satellites estimate the temperature of the atmosphere, most of which is above us. In fact, as John Christy, who runs the University of Alabama at Huntsville (UAH) satellite dataset recently said,  the main product we use now for greenhouse model validation is the temperature of the Mid-Troposphere The mid-troposphere is the atmospheric layer from about 25,000–50,000 feet, or about 8–15km in altitude. For perspective, the highest point on the Earth’s surface is on Mount Everest at 29,000 feet (8.8km), and the highest elevation city in the world is La Rinconada, Peru at 16,700 feet (5.1km). So, by this criterion, surface temperature data would be “the best;” better than satellite data because they’re more relevant to people. Maybe we value the data with the least uncertainty. Because of all the processing, adjustments, and modeling involved in creating the synthetic temperature data, satellite trends have far greater uncertainty than the surface temperature datasets. By this criterion, surface temperature data would again be “the best;” about five times better than satellite data. Or perhaps we think it’s important that different groups processing the same raw data in different ways arrive at consistent final temperature estimates. This is true for surface temperature data, which are analyzed by NASA, NOAA, the Met Office, Berkeley Earth, Cowtan & Way, the Japan Meteorological Agency, and others. These groups all arrive at consistent end results. On the other hand, different groups processing the same raw satellite data arrive at very different estimates of the warming trend in the atmosphere. By this criterion, again, surface temperatures beat satellites. As Carl Mears has said, I consider [surface temperature datasets] to be more reliable than satellite datasets (they certainly agree with each other better than the various satellite datasets do!).  Maybe we consider it important to measure how much humans are warming the entire planet. Only about 2% of the heat trapped by increased greenhouse effect goes into warming the atmosphere; over 90% goes into warming the oceans. By that criterion, ocean heat content data would be “the best;” far better than satellite data. One benefit noted by proponents of the satellite data is that it’s validated by weather balloons directly measuring the temperature of the atmosphere. The problem is, the weather balloons indicate that the lower atmosphere has continued to warm in recent years, diverging from the satellite synthetic temperature estimates. That’s not much of an argument in favor of the satellite data.  In fact, the weather balloon data debunks the “no significant warming since 1998” myth that motivates contrarians like Cruz to cherry pick the satellite data in the first place. It’s also worth noting this myth is based on über cherry picking. So, the surface temperature data are “best” if you value the least uncertain temperature measurements, of the part of the planet where people live, with consistent results among different groups. The ocean heat data content are “best” if you want the most comprehensive measurement of the warming of the Earth. The satellite data are best … if you want the data that show the least warming. As Carl Mears notes starting at the 7:35 mark in the above video,  Look at all the different datasets. You don’t want to trust only the satellite temperatures, you want to look at the surface temperatures and that sort of thing. Every other data source paints a consistent picture of global warming – surface thermometers, weather balloons, ocean buoys, and even natural thermometers like rising sea levels, melting land and sea ice, and shifting seasons and species habitats. Even the satellites show a long-term warming trend in the atmosphere. There is a great irony here. Climate contrarians decry necessary adjustments to raw surface temperature data (even though the adjustments reduce the warming trend), and have even launched inquiries, accusing scientists of conspiring to manipulate the surface temperature data. Yet they have no qualms with the more numerous and complex adjustments made the satellite data. Contrarians claim that models are worthless, and yet unwaveringly trust the models used to turn microwave detections into synthetic temperature estimates.  There’s excessive “skepticism” applied to the surface temperature data and a serious lack of skepticism of the satellite data. There’s a term that describes this behavior: ‘confirmation bias.’ The data that conflict with contrarian worldviews are rejected, while those that conform to their preconceived biases are accepted.  In the end, Ted Cruz’s claim is rated false by every objective measure."
