"The recent coordinated push for new coal-powered electricity generators in Australia comes as the industry is on its last legs. The intensified push for government handouts can be seen as a last-ditch attempt for the coal industry to squeeze some money out of the unwise investments it made at the end of the mining boom. Here are the facts and figures that point towards that conclusion. Australia joined 174 countries and the European Union in 2015, signing the Paris agreement. In doing so, Australia agreed to do its part in keeping the global temperature rise “well below” 2C. It also commits countries to achieving net-zero emissions “in the second half of this century”. That agreement, designed to stop runaway climate change, requires that all of Australia’s coal-fired generators close. According to the International Energy Agency, OECD countries such as Australia need to shut down almost all of their coal-fired power stations by about 2035. And the rest of the world will need to phase out coal power by 2050, it says. With coal-fired power stations taking up to a decade to build, and designed to last 30 or 40 years, building new ones now is obviously inconsistent with those commitments. In particular, Australia has committed to reducing its emissions by 26% below 2005 levels by 2030 – a commitment that is not strong enough to limit global warming at 2C and will need to be “ratcheted up”. But the Australian government recently released projections of the country’s carbon emissions showing that current policies are going to cause emissions to rise to 2030, not drop, leaving Australia overshooting that commitment by a long way. In producing those projections, the Department of Environment and Energy assumed that 2,000MW of coal capacity would retire between 2020 and 2030, and that the generation would be taken up by existing coal and some gas. (That’s equivalent to about two large power stations.) If, instead, even more coal is built, the already rising emissions would get even worse. Meanwhile, even before coal generators begin to close, the demand for their power has been dropping as renewables enter the mix. According to data from the Office of the Chief Economist, the demand for coal-generated electricity has dropped by more than 15% in the past eight years. Moreover, New South Wales budget papers show that the state government has recently downgraded its projections for domestic consumption by a whopping 20%. Last year it estimated domestic consumption would be 30m tonnes a year for the next five years. This year it changed that estimate to just 24m tonnes each year. In response to the new figures, the NSW Greens’ energy spokesman, Jeremy Buckingham, said: “Coal power has been in decline for nearly a decade and it is clear that no one is going to build a new coal-fired power station anywhere in Australia. “Coal is the whale oil of the 21st century and should be phased out as rapidly as possible for the sake of the climate.” While the proponents of coal talk about coal power being “cheap and reliable”, they are wrong on both fronts. Coal is now the most expensive form of new power. According to Bloomberg New Energy Finance, the cost of energy from a new coal power plant would be $134-$203/MWh. That’s more expensive than wind, solar or highly efficient combined-cycle gas (costing $61-$118/MWh, $78-$140/MWh and $74-$90/MWh, respectively). Whether or not an energy source is “reliable” depends on what you’re relying on it for. The only people who still think we need the old-fashioned sort of “baseload power” that coal provides – power that is always running regardless of whether you need it – are those in the coal industry. Coal power stations are slow to start up and so can’t respond efficiently to fluctuations in supply and demand. Old energy systems were built assuming coal would always be running. It was the “baseload” energy and other forms of energy such as gas would switch on to satisfy the peaks in demand. In a world where wind and solar energy can produce a lot of energy, but not constantly, baseload needs to be replaced with flexible power that can smooth out the spiky energy supply created by variable sources of renewable energy. In the short term, that can be gas. But, in the longer term, to stop runaway climate change, that service will need to be supplied by renewable sources such as battery storage, hydro, solar thermal with storage or geothermal. When competing with renewables, coal generators end up burning costly fuel, even when they are giving the electricity away for free. Leonard Quong from Bloomberg New Energy Finance said when releasing a recent report: “In the grid of the not-too-distant future coal’s baseload operation becomes a curse, not a blessing.” And Steven Holliday, the chief executive of the UK’s National Grid, recently said: “The idea of baseload power is already outdated.” According to the Office of the Chief Economist’s most recent Resources and Energy Major Projects Report, there are 37 major coalmining projects that are currently in the works. However, that number has dropped since the last report a year ago and, in that time, no new projects have moved from along the pipeline from being “committed” to “completed”. If all the projects still listed as being actively pursued were to reach completion, they would produce almost 300m tonnes of coal each year. Adam Walters from Energy & Resource Insights said that list is a “salient reminder, if one is needed, that vast amounts of proposed new coal capacity, much with most approvals in place, remains waiting for a favourable market”. He said most of those projects were begun during the mining boom, when commodity prices were high. With prices depressed, they’ve stayed on the books but are not progressing. The push for rejuvenating the coal industry with government subsidies is the sort of thing that could help the industry get some of these projects back on track, Walters said. The global coal industry recently saw its biggest player, Peabody, go bankrupt in the US. If companies are forced to take write-downs for these projects by admitting they will never go ahead, it could mean the end for some of the companies. At his National Press Club address last week, Malcolm Turnbull appeared to point to this as the reason he is now looking to subsidise the most expensive and dirtiest form of energy, saying that it could help our mining industry. He said: “As the world’s largest coal exporter, we have a vested interest in showing that we can provide both lower emissions and reliable baseload power with state-of-the-art, clean, coal-fired technology.”"
"It’s fitting that as Donald Trump continues to flirt with anti-vaccine conspiracy theories, inoculation may provide the key to effectively debunking this sort of misinformation. That’s the finding of a new study published in Global Challenges by Sander van der Linden, Anthony Leiserowitz, Seth Rosenthal, and Edward Maibach. The paper tested what’s known as “inoculation theory,” explained in the video below by John Cook, who’s also published research on the subject. The video is a lecture from the Denial101x free online course, which itself is structured based on inoculation theory:  According to inoculation theory, facts are important but by themselves aren’t sufficient to convince people as long as misinformation is also present. People also have to be inoculated against the misinformation, for example through an explanation of the logical fallacy underpinning the myth. To test the theory, the study authors ran an experiment using a fact that’s been subjected to a tremendous misinformation campaign: the 97% expert consensus on human-caused global warming. There’s been some debate among social scientists about consensus messaging, with most research suggesting it’s effective and important at convincing people about the importance of climate change.  However, Dan Kahan has argued that given science communicators’ efforts over the past decade to inform the public about the expert consensus, the fact that so few people are aware of it suggests that consensus messaging is a dud. If it were going to work, it should have worked by now, the argument goes. This new study guts that argument. In their experiment, the scientists first asked their representative American subjects “To the best of your knowledge, what percentage of climate scientists have concluded that human-caused climate change is happening?”. The average answer was between 70% and 73%. Each group was then presented with evidence of the 97% expert consensus. That raised the average answer to about 90%. As you would expect, facts were effective when presented by themselves. The authors ran three more tests. First, after showing the 97% consensus evidence in pie chart form, they then presented a group with a piece of misinformation – the infamous Oregon Petition, which is often used to argue there is no climate consensus. This misinformation completely offset the influence of the facts – the subjects’ answers in this group fell all the way back down to a 73% perceived consensus. In the next tests, after showing the evidence of 97% consensus, the scientists “inoculated” the groups against the misinformation. In one test, they informed the group “Some politically-motivated groups use misleading tactics to try to convince the public that there is a lot of disagreement among scientists.” In the final test, they provided much more detail about the specific flaws in the Oregon Petition, and how it misinforms people.  After then showing these groups the Oregon Petition misinformation, the average perceived consensus rose to 80% in the first test, and 84% in the second test. The inoculation offset about half to two-thirds of the effect of the misinformation, and participants’ perception moved closer to the truth.  As lead author Sander van der Linden explained, the effectiveness of the inoculation across the political spectrum was particularly encouraging: We found that inoculation messages were equally effective in shifting the opinions of Republicans, Independents and Democrats in a direction consistent with the conclusions of climate science. What’s striking is that, on average, we found no backfire effect to inoculation messages among groups predisposed to reject climate science, they didn’t seem to retreat into conspiracy theories. There will always be people completely resistant to change, but we tend to find there is room for most people to change their minds, even just a little. As John Cook put it: The intriguing result was the inoculation worked across the political spectrum - even among conservatives - which tells me that nobody likes to be deceived. These results suggest that consensus messaging hasn’t been terribly effective at changing peoples’ minds about climate change because there’s been a simultaneous misinformation counter-campaign, articulated by Republican strategist Frank Luntz in his infamous leaked memo: Voters believe that there is no consensus about global warming within the scientific community. Should the public come to believe that the scientific issues are settled, their views about global warming will change accordingly. Therefore, you need to continue to make the lack of scientific certainty a primary issue in the debate. Those who oppose taking action to curb climate change have heeded Luntz’s call. “There is no consensus” is the fourth most popular myth in the Skeptical Science database. An analysis of climate editorials published by conservative columnists between 2007 and 2010 found that “no consensus” was far and away the most popular myth, made in a whopping 64% of their climate editorials. The climate consensus misinformation campaign has been robust, and as in van der Linden’s study, canceled out much the effect of the 97% consensus fact. The challenge then is in delivering the facts and inoculation to the individuals who are being exposed to the misinformation. Conservative media outlets are the primary climate misinformation delivery system, but are unlikely to also publish facts and explanations about why their misinformation is wrong. However, while individuals who rely solely upon biased media outlets may be incurable, the majority of the public could potentially be inoculated against misinformation. The study thus provides a key message for those fighting against the growing post-truth, “alternative facts” culture: facts by themselves are insufficient, but explaining the flaws underpinning associated misinformation can help weaken its effect and increase public acceptance of the facts. The fact-myth-fallacy debunking structure explained and implemented in the Denial101x free online course is thus a valuable tool for scientists, science communicators, and anyone struggling to break through ideological barriers to facts."
"The Clean Energy Regulator has castigated a major electricity company for choosing to pay a $123m penalty rather than build or contract new wind or solar power. It said the move was “hugely disappointing” and customers would rightly be outraged to know the company wasn’t using money collected for investing in renewables in the proper way.  ERM Power has announced it will pay the regulator rather than buy certificates of green power generation to meet its renewable energy target obligations for 2016, citing tax reasons. “We view the intentional failure to surrender certificates as a failure to comply with the spirit of the law and an undermining of the objectives of the scheme,” the regulator’s chair, Chloe Munro, said. “It’s our view that an investment in a growing industry is money better spent than a financial penalty that has no return.” ERM customers were charged prices that included a component to pay for extra renewable energy generation, she said. “We believe many customers would be disappointed to know that this money has not been used for the intended purpose.” The renewable energy target works by allowing generators of renewable energy – both large-scale and small systems such as household solar panels – to create certificates for the electricity they generate. Electricity retailers buy those certificates and have to surrender a certain number of them to the regulator each year as a way of ensuring they use an amount of renewable energy. In a statement to the stock exchange, ERM said the price for the large-scale generation certificates had more than doubled to nearly $90 each, while the penalty to the regulator was valued at $65 per certificate. The company said it continued to meet other green power obligations and supported the principles of the renewable energy target. Munro said that on the whole, the energy sector took a responsible approach to its obligations and there had been a recent uptick in new projects supported by large electricity retailers. The head of the Clean Energy Council, Kane Thornton, said he thought ERM Power customers would be disappointed by the decision. “Failure to meet obligations under the RET is like deciding to demolish a heritage-listed building and then paying the resulting fine,” Thornton said. He said ERM Power was a major energy retailer that held contracts to supply power to the New South Wales and Queensland governments.  “These governments and other customers should be asking why ERM has made a decision not to meet their obligations or support renewable energy projects which will deliver major economic benefits to regional parts of Queensland and NSW,” he said. "
"The evacuation of nearly 200,000 people near Oroville Dam is the kind of event that makes climate change personal. A co-worker of mine was forced out of his home for several days by the emergency evacuation, and another friend was visiting Lake Oroville and happened to leave 15 minutes before the evacuation order was issued. Like many extreme events, the Oroville emergency is a combination of natural weather likely intensified by climate change. California regularly sees “atmospheric rivers” that deluge the state with rainfall, but in a hotter world, scientists anticipate that they’ll be amplified by an increase in the amount of water vapor in the atmosphere.  Northern California is in the midst of its wettest rainy season on record – twice as wet as the 20th century average, and 35% wetter than the previous record year. It proved to be almost too much for America’s tallest dam to handle. Water managers were forced to use Oroville Dam’s emergency spillway for the first time ever, which then began to erode, posing the threat of a failure and catastrophic flooding of nearby towns. While studies haven’t yet connected this extreme wetness to climate change (there are still several months remaining in California’s rainy season), what we’re seeing is consistent with climate scientists’ expectations of a hotter world. Dams in the United States were built 50 years ago, on average. Since then, the Earth’s surface temperature has warmed about 0.75°C, and there’s now more than 5% more water vapor in the atmosphere as a result, which intensifies storms. With hotter temperatures, more precipitation falls as rain and less as snow, and California’s Sierra snowpack also melts earlier in the year. Climate change stresses California’s water infrastructure through all of these mechanisms.  Peter Gleick of the Pacific Institute has been researching the impact of climate change on the water cycle since the 1986, when his dissertation was the first research to conclude that the Sierra snowpack would be at risk due to rising temperatures from global warming. He also found that this would lead to increased winter runoff and flood risks, which is exactly what we’re now seeing. As Gleick told me: Our infrastructure was designed for yesterday’s climate, not today’s or tomorrow’s. We know the climate is changing and we need to be prepared. Gleick warned 30 years ago that this increased runoff would add stress to California’s water infrastructure, also noting that in a hotter world, more precipitation would fall as rain and less as snow. California will get the worst of all possible worlds – more flooding in the winter, less available water in the summer. Gleick’s words now seem prescient. Research has shown that conditions that create both wet years and hot dry years in California are becoming more frequent. California’s intensely wet 2017 is a prime example of weather whiplash, as the state is just now emerging from a 5-year drought that was its most intense in more than 1200 years.  Studies have found that global warming intensified that drought by about 15–35% through factors like increased evaporation and water demand, pushing it into the realm of record-shattering intensity. As Gleick recently wrote, extreme weather is battering California: We already see fundamental changes in storm frequency and intensity, increases in the size and duration of droughts and rainfall events, disappearing snow packs, growing agricultural water demands with rising temperatures, and more. We cannot afford the luxury of pretending climate change isn’t real, and we cannot afford to ignore the risks to our water infrastructure posed by these changes. Any investment in infrastructure must take climate change into account through smart flexible design, integration of better weather-forecasting and modeling tools, and adoption of new standards for facility construction and operation. Environmental groups warned the state about Oroville Dam in 2005, noting that in an intensely wet year like we’ve seen in 2017, its emergency spillway could erode, and thus should be coated with concrete. State agencies concluded that the cost of this project couldn’t be justified given the low probability of such a wet season, but climate change increases the likelihood and intensity of extreme precipitation events. The environmental groups were proven right. These are some of the many hidden costs of climate change. Intense droughts and floods exert extra stress on aging water management systems, farms, and other infrastructure. Lives are put in danger, as my friends’ were. On the other side of the world, Australia is in the midst of a record-breaking heatwave, with temperatures reaching 44°C (111°F), 12°C (22°F) above normal. Such dangerous heatwaves are now twice as likely to occur because of human-caused global warming. It’s becoming more and more difficult to deny the reality and dangerous consequences of human-caused climate change, and more costly to do so."
