"The high ambition of the Paris Agreement, to limit global warming to “well below 2°C”, was driven by concern over long-term sea level rise. A warmer climate inevitably means melting ice – you don’t need a computer model to predict this, it is simple common sense. As temperatures rise, sooner or later much of the world’s glaciers will become water, which will end up in the ocean. With enough warming, ice sheets could also begin to melt irreversibly. Also, water expands as it warms. Although the full impact will take a long time – centuries or more – the implications of even only 2°C warming for low-lying coastal areas and island states are profound. This is why, in Paris, the world agreed to “pursue efforts” to go further, and limit warming to 1.5°C above pre-industrial levels. “Pre-industrial” is not always well-defined, but is often taken as 1850-1900 since that is when accurate measurements became widespread enough to estimate global temperature change. By the 1980s, when scientists first warned about the risks of climate change, the world had already warmed by around 0.4°C. Things have accelerated since, and while year-to-year changes show downs as well as ups, the general ongoing trend is upwards. Latest data from the Met Office shows 2016 is expected to be 1.2°C above pre-industrial levels – the hottest year ever recorded. So given this, what will a world above 1.5°C look like? Depending on climate sensitivity and natural variability, we could conceivably see the first year above 1.5°C as early as the late 2020s – but it is more likely to be later. In any case, the first year above 1.5°C above pre-industrial temperatures will not represent what a world that warm looks like in the longer term.  During that year we’d expect some extreme weather events somewhere in the world, as happens every year. Some of these heatwaves, heavy downpours or droughts may well have become more likely as part of the changing climate. Others, however, may not have changed in likelihood. Teasing out the signal of climate change from the noise of natural variability is hard work.  But there will be some places which do not yet see major impacts in that first year, that nevertheless will have become more likely to be affected. The “loaded dice” analogy is rather clichéd, but nevertheless useful – even a pair of loaded dice will not roll a double six every time, just more often than normal dice. So while the chances of an extreme heatwave, for instance, may have increased by the time we exceed 1.5°C, it may not necessarily occur in that year. Furthermore, some impacts such as sea level rise or species extinctions will lag behind the change in climate, simply because the processes involved can be slow. It takes decades or more to melt glaciers, so the input of extra water to the oceans will take time.  None of this should lull us into a false sense of security, however. While rising seas or biodiversity losses may not be obvious in the first year above 1.5°C, some of these changes will probably be already locked in and unavoidable. The impacts of increased carbon dioxide do not just come from its effects as a greenhouse gas. It also affects plant growth directly by enhancing photosynthesis (“CO₂ fertilisation”), and makes the sea less alkaline and more acidic. “Ocean acidification” is unhealthy for organisms which make calcium in their bodies, like corals and some forms of plankton. All other things being equal, CO₂ fertilisation could be viewed to some extent as “good news” as it could help improve crop yields, but even so, the implications for biodiversity may not all be positive – research has already shown that higher CO₂ benefits faster-growing species such as lianas, which compete with trees, so the makeup of ecosystems can change. The extent to which a 1.5°C world will see these other impacts depends on the still-uncertain level of “climate sensitivity” – how much warming occurs for a given increase in carbon dioxide. Higher sensitivity would mean even a small rise in CO₂ would lead to 1.5°C, so fertilisation and acidification would be relatively less important, and vice versa. There is a huge debate about whether limiting warming to 1.5°C is even possible or not. But even if it is, limiting global warming will itself have consequences. I’m not talking here about potential economic impacts (whether positive or negative). I’m talking about impacts on the kind of thing we are trying to protect by minimising climate change itself, things like biodiversity and food production. In scenarios that limit warming at 1.5°C, net CO₂ emissions would have to become negative well before the end of the century. This would mean not only stopping the emission of CO₂ into the atmosphere, but also taking huge quantities of it out. Large areas of new forest and/or large plantations of bioenergy crops would have to be grown, coupled with carbon capture and storage. This will require land. But we also need land for food, and also value biodiverse wilderness. There is only so much land to go round, so difficult choices may be ahead. So while the Paris Agreement ramped up the ambition and committed the world to trying to limit warming to 1.5°C, we should remember that there is much more than a single number that is important here. It would be naive to look at the climate in the first 1.5°C year and say “Okay, that’s not so bad, maybe we can relax and let the warming continue”. It’s vital to remember that at any given level of global warming, we have not yet seen the full impacts of it.  But nor have we seen the impacts of holding back warming at low levels. One way or another, ultimately the world is going to be a very different place."
"“Ford takes its responsibilities for the environment and communities around the globe very seriously. That was evident again recently, when Ford was one of only four automakers reaching agreement with California on higher gas-mileage standards to reduce emissions. We have said multiple times that Ford does not support a rollback of federal emission standards. Additionally, Ford supports CO2 reductions consistent with the Paris climate accord, as we’ve shared publicly.” A spokesperson said the company endorsed the UN’s sustainable development goals, citing its heavy investment in vehicle electrification, “which we believe will facilitate long-term reductions in CO2 emissions”. The Guardian has collaborated with leading scientists and NGOs to expose, with exclusive data, investigations and analysis, the fossil fuel companies that are perpetuating the climate crisis – some of which have accelerated their extraction of coal, oil and gas even as the devastating impact on the planet and humanity was becoming clear. The investigation has involved more than 20 Guardian journalists working across the world for the past six months. The project focuses on what the companies have extracted from the ground, and the subsequent emissions they are responsible for, since 1965. The analysis, undertaken by Richard Heede at the Climate Accountability Institute, calculates how much carbon is emitted throughout the supply chain, from extraction to use by consumers. Heede said: ""The fact that consumers combust the fuels to carbon dioxide, water, heat and pollutants does not absolve the fossil fuel companies from responsibility for knowingly perpetuating the carbon era and accelerating the climate crisis toward the existential threat it has now become."" One aim of the project is to move the focus of debate from individual responsibilities to power structures – so our reporters also examined the financial and lobbying structures that let fossil fuel firms keep growing, and discovered which elected politicians were voting for change.  Another aim of the project is to press governments and corporations to close the gap between ambitious long-term promises and lacklustre short-term action. The UN says the coming decade is crucial if the world is to avoid the most catastrophic consequences of global heating. Reining in our dependence on fossil fuels and dramatically accelerating the transition to renewable energy has never been more urgent. The company cited the fact it was spending $11bn (£9bn) on electrified vehicles globally from 2017 through 2022 and has invested a further $500m to produce a new electric vehicle. It said in Europe it had announced plans for 17 electrified vehicles by 2023 that “will provide customer choice and deliver CO2 performance”. “We are supportive of increasingly challenging targets to reduce vehicle greenhouse gas emissions while taking into account supportive or impeding factors such as technology capability, infrastructure development, consumer preference, fuel prices and other factors that can affect the take-up of ever cleaner technologies in the market ... “In regards to our membership in the Alliance of Automobile Manufacturers in the United States, we believe it is important to take action as an industry as well as an individual manufacturer. Toyota continues to support year-over-year increases in standards but we believe adjustments are warranted to address changes in the assumptions used to establish those standards. “We will keep pushing for a sustainable agreement that sets progressive improvements in fuel economy, promotes advanced and diverse technologies and aligns with market realities and customer choice. “In Europe, thanks to our manufacturing presence in several EU countries, we are a member of the European Automobile Manufacturers’ Association (ACEA) ... At ACEA, Toyota has specifically advocated for technology neutrality. We don’t believe the setting of specific sales quotas for certain types of zero-emission vehicles is the best mechanism to achieve the desired CO2 reduction targets. Instead … we believe the massive electrification of fleets using a variety of technologies adapted to a variety of consumer needs will be more successful.” “Sustainability is one of the essential elements of Daimler’s corporate strategy and at the same time, it is critical to our business success. As a global company, we have a responsibility to play our part in managing the transformation of our industry to one that is increasingly focused on sustainability by keeping the balance on several, complex dimensions: evaluating economic, ecological and social aspects, for customers and investors as well as for employees, business partners and society as a whole … “Regarding your question on matching the individual, worldwide CO2 regulations: it is our goal and intent to incorporate as many aspects as possible of Daimler’s goals and beliefs in the positions of associations both in the US and the EU. The conditionality principle which has been advocated for by the EU auto industry in the discussion on post-2020 CO2 targets in the EU can serve as an example for this.” “The BMW Group welcomed the 2C goal of the Paris climate agreement and is committed to it. This was reinforced by CEO Oliver Zipse at the Frankfurt motor show in September. By 2020, we will have reduced the CO2 emissions of our European vehicle fleet by 50% in comparison with the 1995 base year. The BMW Group is currently working on new targets as part of a new sustainability strategy from 2020. “Our aim is to find a sustainable approach that meets all three requirements of sustainability (ecological, social, economic) in a balanced and appropriate manner. The BMW Group ultimately bears responsibility for more than 130,000 employees and their families. “The BMW Group has long been a champion of sustainability technology, encouraging its own industry and others to play their part in emissions reduction. We have been contributing ideas to decarbonise transport at multiple climate conferences worldwide since 2008 (since COP14) and through the company’s membership of various national and international associations. Within these associations, members naturally hold different positions on the climate debate. BMW plays its role in promoting electric mobility as a means to meeting the 2C goal of the Paris climate agreement. In our experience, constructive dialogue is the best way to bring about positive long-term changes.” “Our global commitment to improving fuel economy, reducing emissions and pursuing an all-electric zero-emissions future is unwavering, regardless of any modifications to existing emissions standards currently under review in the United States. In the US, we remain interested in working with all parties to advance American automotive technological leadership. Regardless of the standards, we are committed to a future of zero crashes, zero emissions, and zero congestion. The pathway to that vision includes continually improving fuel economy and our commitment to an all-electric future. This is why we’ve called for a US national zero-emissions vehicle programme. “Our zero-emissions vision extends beyond products to our manufacturing operations, where we have committed to use 100% renewable energy by 2050.  “We set a new goal to reduce emissions by 31% by 2030 compared to a 2010 baseline, consistent with the level of decarbonisation required by science-based methodology. We have consistently reaffirmed these points with our global employees and other stakeholders, including policymakers, regulators and shareholders.” “FCA supports the policy choice in favour of ongoing fuel economy improvements in the fleet, but that policy needs to be based on market realities as they have evolved since 2012. In business and in government, we have to make decisions based on the best information available to us at the time, but we also must be nimble enough to adjust our plans when the facts on the ground change.”"
"
Share this...FacebookTwitter Best-selling authors Prof. Fritz Vahrenholt and geologist Dr. Sebastian Lüning comment on Shakun’s recent “Nature” paper at their kaltesonne.de site.
One of the most hotly disputed points in the climate debate is CO2 climate sensitivity. The warmists would like to have everyone believe that CO2 is the primary climate driver in the climate system.
However, climate and geological data show it aint so. More than 10 years ago a Swiss-French team published  the results of an Antarctic ice core study in Science. The scientists, among them Thomas Stocker, were able to show that atmospheric CO2 concentrations lagged behind temperature by about 800 years. This has become a painful thorn in the side of the global warmists. Clearly it showed that CO2 reacted to temperature, and not vice versa.
Rather than admitting that the CO2 global warming hypothesis is broken, the warmists have chosen instead to try to get rid of inconvenient 800-year lag.

Figure 1: CO2 lags temperature by 800 years. Timescale from 22,000 to 10,000 years before present. Source: Monnin et al. 2001.
With the IPCC 5th assessment report due to come out soon, the IPCC activists are scrambling to get their hands on a study that eliminates this 800-year lag and puts CO2 back in command.
Jeremy Shakun refabricates Earth’s history
Die kalte Sonne site writes how the IPCC is attempting to pull another Michael Mann-type history rewrite. In 2001, Man’s now bogus hockey stick was the graph celebre that re-invigorated the global warming movement. But with Michael Mann fading, the IPCC needs a new, young star, fresh with a PhD. They found him in Jeremy Shakun, lead author of a new study that claims to do away with the inconvenient 800-year lag and shows CO2 once again is the real driver.
Shakun claims that the Antarctic climate shown by the ice core reconstruction was a local artifact, and not global. Shakun and his team took temperature reconstructions from numerous locations scattered about the globe and averaged them out and suddenly, lo and behold, temperature lagged CO2. Science now settled!
Shakun an his colleagues claimed that during the last ice age CO2 concentrations surged 40%, which led to a temperature increase of about 3.5°C – precisely what the IPCC wanted to see. The media and warmist science community all breathed a sigh of relief – the climate catastrophe is coming after all. And without checking up, the mainstream media unleashed the news, e.g. Spiegel Online, web.de, Stern.
But then came Willis Eschenbach, who quickly exposed the shortcomings of Shakun’s paper. Die kalte Sonne describes how he went about with his analysis at WUWT. Lüning and Vahrenholt write:
It is a true mystery how anyone is able to discern temperature is lagging behind CO2 from such a massive scatter of data, as the title of Shakun’s paper (Global warming preceded by increasing carbon dioxide concentrations during the last deglaciation“) claims.


<!--
google_ad_client = ""ca-pub-3545577860068042"";
/* neu test */
google_ad_slot = ""6412247007"";
google_ad_width = 200;
google_ad_height = 200;
//-->





Figure 2: Source: Willis Eschenbach, Anthony Watts, WUWT.
Parallels to Michael Mann
With the Shakun story, Vahrenholt and Lüning see parallels to the Michael Mann saga:
One can’t help but get the impression that all this is a renewed desperate attempt to salvage the beloved CO2-catastrophe model. Already in the case of the Hockey Stick curve statistical tricks as ad absurdum were used. When that failed, scientists very close to the IPCC tried to blame the Little Ice Age solely on volcanic activity. The Shakun paper is simply the latest sequel. It plainly shows once again that the judges (IPCC report authors) should not judge their own deeds (scientific literature). What is taken as a given in the legal system is not even questioned in the politically sensitive climate sciences. All we can do is scratch our heads in amazement.”
Vahrenholt and Lüning add:
And there are other interesting parallels to the Hockey Stick saga. Michael Mann was awarded his doctorate degree for his Hockey-Stick research, and then was put on the accelerated fast-track to professor and promoted to the IPCC top brass. Also Jeremey Shakun carried out his work, now published in Nature, as part of his doctoral thesis which he submitted in 2010 (see p. 64 in the doctoral thesist and p. 80 of the pdf). Originally the paper had been intended to be published by Science. Had it been submitted there, rejected, and then had more luck at Nature? And what is going to happen to Jeremey Shakun? Is he going to have an similarly rapid career climb like Mann did?”
The IPCC process is broken
Vahrenholt and Lüning write:
Finally, it is interesting to note that Shakun’s co-author is Peter Clark, his PhD advisor who happens to be a coordinating lead author of the new IPCC report. Also co-author Bette Otto-Bliesner is also a lead author of the new report of the IPCC.”
and add:
The stated task of the IPCC is neutral viewing and assessment of the scientific literature. How can neutrality be assured when IPCC members ultimately peer-review their own work?”
Looks like the IPCC is more broken and corrupt than ever.
 
Share this...FacebookTwitter "
"
Share this...FacebookTwitterAt their Die kalte Sonne website, Professor Fritz Vahrenholt and Dr. Sebastian Lüning present a guest post by Prof. Jan-Erik Solheim, who comments on the huge divergence between Hansen’s 1988 forecast and actual observations. I’ve translated his guest post in English:
===================================================
What ever became of James Hansen’s 1988 temperature forecast? Time for an evaluation
by Prof. Jan-Erik Solheim
One of the most important publications on “dangerous man-made climate change” is one by James Hansen and his colleagues in the year 1988 which appeared in the Journal of Geophysical Research. The title of the publication: Global Climate Changes as Forecast by Goddard Institute for Space Studies Three-Dimensional Model.

Figure 1: Temperature prognosis by the Hansen Group from 1988. The different scenarios assume 1.5% CO2 increase (blue), fixed CO2 emissions (green) and stopped CO2 emissions (red). In reality CO2 emissions have increased about 2.5% per year, which would be more than depicted the the blue curve scenario. The black curve is the actual temperature (smoothed 5-year mean). The Hansen-Model overestimated the temperature by 1,9°C and is thus a full 150% off. Graph supplemented as to Hansen et al. (1988).
In this publication Hansen and his colleagues present the GISS Model II, which simulates climate changes resulting from concentration changes in atmospheric trace gases and airborne aerosols. Here the scientists illustrate three scenarios:
–A: Increase of CO2 emissions of 1.5% per year
–B: fixed increase CO2 emissions after the year 2000
–C: No increase in CO2 emissions after the year 2000


<!--
google_ad_client = ""ca-pub-3545577860068042"";
/* neu test */
google_ad_slot = ""6412247007"";
google_ad_width = 200;
google_ad_height = 200;
//-->




CO2 emissions have increased at rate of about 2.5% since the year 2000 and so according to Hansen’s paper, we would expect a temperature increase greater than the Model A scenario. Figure 1 shows all three of Hansen’s scenarios as well as the real measured global temperature.
The arrow extending beyond Scenario A shows the temperature value that should have been predicted by the Hansen Team based a CO2 increase of 2.5%. According to Hansen’s projection, the temperature should have increased 1.5°C when compared to the 1970s level. In truth the temperature rose only 0.6°C.
It is clearly visible that the temperature forecast modelled by the Hansen Group is off by about 150%. It is truly regrettable that precisely this modelling is still being viewed as a reliable forecast by our politicians.
=====================================================
Jan-Erik Solheim is professor emeritus University of Oslo Institute of Theoretical Astrophysics, an active member of the International Astronomical Union, and authored a number papers on climate change.
UPDATE: Steve Goddard adds some background info at his site
 
Share this...FacebookTwitter "
"
Share this...FacebookTwitterSlowly it seems that some greens are starting to wake up from their zombie condition and are showing signs that they may one day realize the disaster they’ve unleashed.
German public television, the ZDF of all networks, has a clip on how the building of windmills has completely run amok in Germany. Hat-tip: www.kaltesonne.de/.


Now mountain and hill tops are being deforested to clear the way for 200 meter tall monster industrial wind turbines. As the ZDF shows, greens are aghast.
The clip shows how forests in Rhineland Palatinate are being cleared, along with the habitats of 13 different types of bats and other types of biodiversity, all to make way for wind parks. The people at the start of the clip are visibly in a state of shock. This is the last thing they ever expected of their once beloved movement.
Margrit Stroh says:
I’m amazed that once we were all in favour of wind energy, and now we are demonstrating against it.”
As for Isa Mann (later in the clip) save your tears, lady. You were warned. Worse, the clearing of land is being done without even obtaining a permit. That formality can be skipped when it comes windparks – so decrees the Greens.
With wind parks, all due process gets thrown to the wind. Bats, beetles or trees, which can otherwise stop any billion-euro project in Germany, simply get trampled when it comes to wind parks.


<!--
google_ad_client = ""ca-pub-3545577860068042"";
/* neu test */
google_ad_slot = ""6412247007"";
google_ad_width = 200;
google_ad_height = 200;
//-->




Part of the reason for all this is because the German government finds itself in a jam. It concocted a nice story on why it needs to be done, and now it has to save its face quickly – even if it means destroying Germany’s once famous forests and landscape.
Magdelene Becker, on the verge of being speechless, says:
Now, even before anything is permitted! I can’t believe that they are allowed to do such a thing. I don’t understand it.”
Follow the Vorreiter (Führer)!
If you don’t understand it, then let Green Party propagandist, one bordering on climate madness, Eveline Lemke explain it:
If we don’t succeed in transforming our supply of energy soon and if we don’t show the world how to fight climate change, then nobody will look at us. Germany is the leader. We want the world to witness how one goes about protecting the climate. Without climate protection, there won’t be any species diversity left to protect. This is why this is a priority.”
Rarely does one see that level of arrogance and dominance-with-a-mission as that displayed by Lemke. Now if that doesn’t convince you how out to lunch these people are…
Welcome to Germany – a country run by Green infallible Führers – and soon to be covered by windmills, corn for biogas…and possibly lots of angry citizens.
Note: The video clip is called: Der “GRÜNE Wahnsinn”, which means: The “GREEN Madness”. I call it “Green Führerism”, which is the same.
 
Share this...FacebookTwitter "
