"Stumbling on submerged roots, attacked by bees and wading waist-deep through leech-infested water, the three researchers and their Pygmy guides progress at just 100 metres an hour through the largest and least-explored tropical bog in the world. The group halt and unpack what looks like a spear, which is plunged over and over again into the waterlogged forest floor. Each time it brings up a metre-long core of rich, black peat made up of partly decomposed leaves and ancient plantlife. The deepest the steel blade reaches before meeting the underlying clay is 3.7 metres.  Leeds University forest ecologists Simon Lewis and Greta Dargie cheer. The peat bed below the tangle of trees and water in the geographical heart of Africa is much deeper than they expected; and because peat stores carbon and slows global warming, their new research conducted last week in the Democratic Republic of the Congo (DRC)will be welcome news for the 194 countries meeting in Bonn for the annual UN climate conference. Lewis and Dargie surprised the world earlier this year when they showed that the peatlands on either side of the Congo river contained one third of all the world’s tropical peat and were five times more extensive than anyone had thought, stretching over 145,500 sq km (56,000 sq miles), an area larger than England. Since 2012, the two researchers have spent months at a time wading through bogs and sleeping on makeshift platforms built above the crocodile-infested swamp forests in the Cuvette central region of the neighbouring Republic of the Congo. “We would see elephant feet and gorilla hands imprinted in the peat. We were increasingly in awe that a remote, almost unknown, wilderness such as this could still be found on Earth today,” said Lewis. Working mainly in the dry season, they took more than 500 peat samples, and calculated that the central African peatlands hold 30.6 billion tonnes of carbon accumulated over 10,000 years – the equivalent to three years of the world’s fossil fuel emissions. This would make them one of the world’s most important carbon “sinks”, they said. But their new exploratory research, conducted with the Congolese botanist Corneille Ewango, 50km from Mbandaka in DRC, suggests that central Africa’s inaccessible forest swamps could be even more important as a global carbon storehouse than they thought, and could need a global initiative to research and protect them. “While the extent of the peat is known, its depth is not. There is just no data. We are a long way from really knowing how much is there and need to do more research,” said Dargie. “Maintaining these large stores of carbon must be a global priority. Only with strong scientific data on the peatland, and how it behaves or might react to future changes, can governments establish baselines and protections in international agreements to ensure it is preserved,” said Greenpeace forest campaigner Matt Daggett. There is growing understanding that the fate of carbon sinks like the Congo basin peatlands will determine future climate change. If left alone, they are vital collectors of CO2; but if the forests above them are felled and the land is converted to farming, as has been widely practised for the past 30 years in south-east Asia, then the dried-out peat emits vast quantities of CO2 and intensifies climate change. Tropical peatland stores around 2,000 tonnes of carbon per hectare but this has been barely recognised by governments which have continued to promote intensive farming on peatlands. The draining of south-east Asia’s peat swamps and the felling of its trees has been a climate disaster, say scientists. Two months of intense peat fires started in August 2015 to clear land for palm oil and pulp and paper plantations in Indonesia released an estimated 884m tonnes of carbon dioxide, more than the European Union in its entirety emitted that year. The Congo basin forest, the second largest in the world after the Amazon, has been relatively protected by its inaccessibility, but environmentalists say it is highly vulnerable and its peat could easily be destroyed. Pressure is building, they say, from logging companies and European governments to lift a 15-year-old moratorium on the allocation of new industrial logging concessions. Logging on swamplands is prohibited in the DRC but, says the Rainforest Foundation UK (RFUK), Congolese legislation does not precisely define what constitutes a swamp. Its analysis suggests 3.4bn tonnes of carbon could be emitted if the concessions become active. According to Greenpeace, nearly half of the DRC’s current logging concessions are in breach of the law because their permissions have run out and they do not have approved management plans. These concessions overlap around 10,000 sq km of peat swampland. “If this forest is cut, there will be decomposition of the peat and vast quantities of CO2 will be released into the atmosphere, said Dagett. The Congolese government, which has welcomed the scientists, is cautious about further protection. “There must be a balance between the forests and development. It comes down to money,” said Joseph Katenga, forest adviser to Amy Ambatobe, the minister for the environment and sustainable development. But communities living close to the carbon-rich swamps near Lokolama have welcomed the discovery of peat, hoping it would attract money to better protect their forests which they traditionally use for fishing and hunting. “As indigenous people, peatlands are part of our heritage and their discovery for the world to see represents a great hope for future generations,” said Valentin Egobo, who speaks for the Lokolama community. “We hope our government will support us in our role as guardians of this ancient forest and provide us with the needed support to safeguard peatlands for our children and for the world. “We did not know the peat was there. This is very important for us but we also need development. Our schools are dilapidated. We are marginalised and impoverished,” Egobo added. The future of the DRC rainforest may be determined next month when the Norwegian government is expected to decide whether to fund a French Development Agency plan to expand “sustainable” industrial logging in the region. This would allow local communities to benefit from their resources, according to the agency. But Greenpeace, RFUK and a petition signed by 135,000 people in Norway and the UK have condemned the plan. “Norway risks putting globally significant stores of carbon at risk through misguided support for so-called sustainable forest management in DRC. Instead of expanding large-scale timber-felling, Norway should work with the Congolese government to shut down the half of the country’s logging areas which the law requires to be closed and returned to the state,”, said Simon Counsell, the director of the RFUK. The need to protect the forests above the peatlands was emphasised last week by a major report showing that there is 40% more carbon stored in forested lands than in known fossil-fuel deposits worldwide. “Releasing this carbon into the atmosphere through continuing deforestation not only commits us to the worst impacts of climate change, but also results in the loss of a globally important carbon sink. “Protecting the carbon stored in forests is no different than taking action to ensure fossil deposits like coal stay underground,” said the report’s lead author, Martin Herold of Wageningen University in the Netherlands."
"“Climate change is an issue determining our destiny as mankind – it will determine the wellbeing of all of us,” the German chancellor, Angela Merkel, has told the world’s nations gathered at a climate summit. The delegates heard a series of strong political messages on Wednesday, urging them to use the final two days of the summit to complete important work on putting the landmark 2015 Paris deal into action. Without this, the world faces a devastating 3C or more of global warming.  The UN secretary general, António Guterres, told the conference in Bonn of his visit to the Caribbean after this year’s hurricanes.  “The catastrophic damage of climate change is upon us and when the frontline is devastated, the whole army is lost” he said, railing against the $825bn invested in fossil fuels in 2016. “We must stop making bets on an unsustainable future.” The French president, Emmanuel Macron, who has been among the most vocal critics of Donald Trump’s decision to pull the US out of the Paris deal, got the loudest applause when he committed France and European partners to filling the funding gap for the UN’s climate science panel, left by the US withdrawal. “They will not miss a single euro,” he said. Macron also emphasised the global importance of tackling global warming, saying: “The fight against climate change is by far the most significant struggle of our times.” He also addressed the issue that underpins most disputes at the global negotiations: the responsibility of rich nations that caused climate change to pay for the solution and compensate for the damage: “Climate change adds further injustice to an already unfair world.” President Ali Bongo Ondimba of Gabon, representing African nations, said the need for faster action was urgent: “The fire is right under our feet. That is why I am expressing the extreme concern of Africa in light of the increase of disasters related to climate change. Africa suffers the loss and damage on a daily basis.”  “It is now time for the developed countries to live up to their responsibilities,” said Baron Waqa, president of Nauru and representing small island states. “Lack of resources is the problem.” The talks in Bonn have progressed reasonably smoothly, without the drama and walkouts of previous summits. But one issue has flared up – whether rich nations are doing enough before 2020 to cut their emissions and to help poorer nations cope with the impacts of global warming.  It has been forced to the top of the agenda by the devastating floods and hurricanes seen around the world this year – as well as the meeting being run by the vulnerable island nation of Fiji. Negotiators agreed a deal on this on Wednesday, involving new stock takes of action in 2018 and 2019 and on progress towards the $100bn a year in climate funding that rich nations have promised to deliver by 2020.  The divisive issue of “loss and damage” – compensation for poor nations for the climate change damage – has been defused for now, with an expert meeting to address concerns next year. Progress has been made in drawing up the draft rules for implementing the Paris agreement, an essential step ahead of agreeing them in 2018. Merkel, Guterres and Macron were almost upstaged by the first speech of the high-level session, given by 12-year-old Timoci Naulusala from Fiji, without any hint of nerves. Referring to the impact of Cyclone Winston in 2016, he said: “My home, my school, sources of food, money, water, were totally destroyed. My once beautiful village, which I called home, is a barren waste. Climate change is real, not a dream.”  Frank Bainimarama, Fiji’s prime minister and president of the summit, said: “We are not simply negotiating words on a page, but we are representing all our people and the places they call home.” Merkel, who as an environment minister chaired the first climate summit 23 years ago, has been under pressure this week to phase out Germany’s large coal-fired power stations, which are likely to bust Germany’s climate targets.  “We still use a lot of coal, particularly lignite,” she said, acknowledging the issue is controversial, but she said jobs had to be taken into account too. She added that progress was expected in the next few days as she settles the terms of a new governing coalition with the Green and Liberal parties. However, Prof John Schellnhuber, at the Potsdam Institute for Climate Impact Research in Germany, and who has advised both Merkel and the pope, said the 20,000 German jobs in coal would be lost to mechanisation in any case, and were a small number compared to the 600,000 created in the wider economy each year. Macron set out unusual detail for a head of state in his speech, saying France would close all its coal power plants by 2021 and would ban all new exploration for fossil fuel in its territories. He also said France would fund interconnectors and energy storage technology to spread renewable energy around Europe and work to push the cost of CO2 emissions to €30 a tonne, which would end the viability coal and drive out gas. "
"Al Gore has accused Donald Trump of surrounding himself “with the absolute worst of climate deniers” and said he has given up attempting to persuade the president to reverse his dismantling of policies combatting global warming. However, both Gore, the former US vice-president, and Jerry Brown, governor of California, told the Guardian they were confident the US will regain its leadership position on climate change if Trump is defeated in the next presidential election.  Gore, Brown and Michael Bloomberg, the billionaire former mayor of New York, are heading a broad coalition of climate change hawks from US states, cities and businesses in Bonn, where UN climate talks are being held. This alliance is in sharp contrast to the official US delegation, which is representing the only national government in the world that doesn’t want to be part of the Paris climate accords. “I haven’t had any conversations with [Trump] since his speech to withdraw from Paris. I tried my best and thought he’d come to his senses but I’ve been proven wrong,” Gore, who met with Trump during the transition to try to influence his thinking, told the Guardian. “I don’t feel I have the ability to change his mind. He’s surrounded himself with the absolute worst of climate deniers who seem to have captured his mind on the issue.” Trump has aligned with Scott Pruitt, the head of the US Environmental Protection Agency who is a vocal critic of the Paris deal. Pruitt has cast doubt on whether carbon dioxide drives global warming, and claimed there is “tremendous disagreement” among scientists over climate change.  Several former and current members of the administration, including Stephen Bannon and Mick Mulvaney, have also previously dismissed evidence for climate science.  Gore, who is now one of the world’s leading voices on climate change, said other countries are “aghast” at Trump’s retreat from climate policy but said the backlash both within the US and abroad is encouraging. “The US cities and states have made a tremendous difference and I think the reaction of the rest of the world has minimized the damage done by Donald Trump,” he said. “The reaction to Trump is if anything stronger than the actions Trump is taking. “This experiment with Trump is less than a year old and in science, experiments are sometimes cut short early. I’m not saying this will happen this time, but this feels like a movie I’ve seen before. “We went off the rails a bit in the last election. I think the rest of the world understands that the Trump period is an unfortunate departure from what the US is known for when we are at our best. Those who have appreciated US leadership grieve its loss and hope it’s temporary.”  Brown also said he sees little point attempting to sway the Trump administration. “The official policy of the US is that climate change is a total and complete hoax conceived by Chinese conspirators,” the California governor told the Guardian. “That is so preposterous that engagement on that basis is just useless.” However, the California governor said mid-term elections in the US next year may pressure Trump to change position. “He’s an action orientated person, not a politician, so who knows,” he said. “Ultimately we won’t have a denier in the White House forever. We are engaged in a great political struggle between the deniers who want to turn the world over to fossil fuel interests and scientists and concerned activists who want to see decarbonization. “Donald Trump is a very small point in the overall climate factor. We are facing a moment of truth over whether we can decarbonize or see civilization itself decline over the next 100 years.  “We have a political sidebar we can tweet about but the existential problem is that species are being destroyed, ecologies are being degraded and mankind is on the chopping block. This isn’t the time for politics, it’s the time for courageous action.” Brown has attempted to step into the vacuum created by US withdrawal by holding dozens of events and meetings with national leaders, UN officials and NGOs across Europe ahead of the Bonn talks.  The Democratic governor has taken on a role highlighting the impact of sub-national entities such as California, which would have the sixth largest economy in the world if it were a country and has implemented a ‘cap and trade’ emissions trading system that may soon be linked to a similar mechanism used by European Union countries. “I want to strengthen the coalition of states and provinces in order to do everything possible to reduce carbon emissions,” Brown said.  “The great threat to the world is the radically changing climate and the level of indifference and inertia is so powerful that I find it incumbent to build a counterforce of mayors and governments to work together to protect our climate and get us off the carbon addiction.” The Bonn talks, which will run until 17 November, are largely a technical exercize in helping countries implementing the goals of the Paris agreement, where nearly 200 nations agreed to limit global warming to 2C above the pre-industrial era.  Trump has vowed to pull the US from the agreement but under the pact’s rules he will be unable to do so until 2020. In Bonn, the US delegation is expected to follow the lead of the president, a vocal supporter of fossil fuels, by extolling the benefits of “efficient” coal, nuclear energy and natural gas."
"Al Gore’s new movie ‘An Inconvenient Sequel’ is, in some ways, similar to his groundbreaking Inconvenient Truth project, but different in other ways. Those key differences are why I recommend you watch it.  This movie successfully accomplishes a number of interweaving tasks. First, it gives some of the science of climate change. Gore gets his science right. I remember his first movie, which I thought was more steeped in science and data than this one, so based on my recollection this new picture is somewhat abbreviated. That’s a good thing because the science is settled on climate change. That is, the science is settled that humans are causing current climatic changes and the science is settled that we are observing these changes throughout the natural world.   Readers of this column who venture into the comments below will likely find people claiming, “science is never settled.” But the people making those comments are not scientists. They don’t work in this field every day, they don’t see the data, and they don’t know what they’re talking about. The opening of the new film shows a sample of the misguided attacks on Al Gore, exclusively from conservatives in the United States. It was so clear to me, when watching and listening, that these attacks are the same ones that we climate scientists constantly have to endure. Most scientists have not been attacked as consistently or for such a long duration as Mr. Gore, but the types of attacks he has had to handle are close cousins to what my colleagues and I experience on a regular basis.  Many conservatives, and some progressives too, claim that Al Gore made climate change political. But I now realize he didn’t. Al Gore was simply the first major political figure that took a stand on climate change. He would have loved to have been joined by anyone of any political persuasion. I firmly believe that the denialism we see from conservatives in the USA is partly because they cannot bring themselves to admit he was right.  In many people’s subconscious, it is better to deny the science and damn the world than admit a liberal former vice president was correct. And that failure is on them. Better people would rise above gut emotions and follow facts faithfully to where they lead. Instead, most US conservatives have tied their legacy to a climate denial movement that is causing and will cause irreparable harm to the planet, its biology, and human societies.  A party that calls itself “conservative” has acted out of accord with its stated values. And this fact should anger true conservatives. How could they allow an entire party to be tarred with this damning legacy? It isn’t Mr. Gore’s fault that conservatives have made climate denial a litmus test for their party. It isn’t Gore’s fault that conservative politicians have been bought by fossil fuel industries who have attacked climate science and climate scientists. It isn’t Al Gore’s fault that the Republican Party has stood in the way of the development of clean renewable fuels in the US. That is on them. It isn’t Mr. Gore’s fault that the very few conservatives who have taken a principled stand have been cast out from their party. The politicization of science is their scar. With respect to the science, this new movie focuses on actual implications of climate change. Whether Mr. Gore is discussing Greenland’s crumbling ice sheet with scientists Eric Rignot or Konrad Steffen, or conversing with Miami city planners on ways to handle rising waters, the movie brings the implications of a changing climate home. Mr. Gore reminds us of projections for the future. For instance, South Florida may see 7 feet of sea level rise by 2100. City planners are considering ways to raise parts of the city to deal with this. Oh by the way, yes the best evidence shows we really may get 7 feet by 2100. Later, Gore meets with people who have suffered through terrible and super-charged storms, such as recent typhoons in the Pacific. He lays clear the science that climate change is warming our oceans, providing extra fuel to make storms like Irma, Harvey, Sandy, and Maria more powerful. In these spots, his science is dead on. This may make you wonder why I recommend people watch this movie. Isn’t it just more doom and gloom? Well, this is the exciting part. While the politics of climate change, at least in the USA (with a President and Congress in full denial mode, not only rolling back progress but sabotaging the science), what reason is there to be hopeful?  First, other countries are taking the lead from the US. I see this in my own work. Not only in basic science but in deployment of renewable energy. This is one area of great potential. Even though, as shown in the movie, fossil fuel companies and some conservative politicians are trying to sabotage clean energy markets, they cannot deny the economics. It just makes sense to use clean and renewable energy.  Do you remember that iconic scene from his first movie, where he followed greenhouse gas data upward using a lift? The gas levels were literally off the screen? Well, that gloomy image is replaced in the new movie by an equally iconic but optimistic animation of how countries are installing clean energy.  A large part of the story does deal with Al Gore’s personal journey. In many ways, this is mirrored in the journeys of climate scientists and people who care about the Earth’s environment. We have all experienced the ups and downs of this crisis; in fact, we’ve experienced them together whether we knew it or not. Interestingly, I have come around to a cautious optimism that is identical to Al Gore’s.  The election in the US was a climate disaster and it is turning out to be worse than we could have feared. The US President and Congress are doing everything they can to ensure more rapid and devastating climate change. They are doing everything they can to ensure more California wildfires, more Marias, more Harveys, and more Irmas. They are doing everything they can to bring us more California droughts and wildfires and Texas floods. They are doing everything they can to cut funding from climate science so we won’t know how bad it is. They are doing everything they can to make the USA a pariah nation. In fact, on the day I write this, the US has become the only country to reject the Paris Climate Accord. That is a stunning fact. What kind of country does this? What they are doing is so un-American; so un-conservative.  But what these forces cannot do is turn back the tide of the economics. People are investing in clean energy because it makes economic sense. And this is the inflection point that makes the clean energy revolution unstoppable. That’s why I am optimistic. That’s why Al Gore is optimistic. That’s the threaded message in his movie. And it’s why you should be optimistic too."
