"Warmer winters are linked to increased crime rates in parts of the United States, a new study has found. Researchers found that violent crime is almost always more prevalent when temperatures are warmer in the winter months. The trend was especially strong when winters were mild in regions that usually have fierce winters, like the north-east and midwest.  The study has implications for how America reacts to climate change as the promise of a warming climate could therefore lead to rising crime levels. Researchers compared crime and climate data from the FBI’s Uniform Crime Reporting program and the National Oceanic Atmospheric Administration, covering 16,000 cities across the north-east, south-east, south central, west and midwest regions for the study published in GeoHealth. The crime data covered the years 1979 to 2016. “The relationship between climate, human interaction and crime that we’ve unveiled is something that will have an impact on people’s wellbeing,” said Ryan Harp, the lead author of the study and a doctoral candidate in the department of atmospheric and oceanic sciences at the University of Colorado Boulder. The explanation is simple enough: warmer temperatures mean more people are out and about, creating the opportunity for crime. In technical terms, three elements needed for a crime to occur – a motivated offender, a suitable target and the absence of a guardian such as a police officer – are more likely to come together when the weather is decent. The link between warmer temperatures and crime all but disappears during the summer months, the study found. That finding cast doubt on an alternative theory, known as the temperature aggression hypothesis, which holds that heat causes stress which makes people more likely to commit crimes."
"On Wednesday I will join hundreds of others in Parliament Square to assert that we will not stand idly by in the face of climate breakdown and ecological crisis. We will affirm a commitment to engage in non-violent but illegal activities to try and force urgent action. Collectively we have signed a declaration to this effect; an Extinction Rebellion against the British government for criminal inaction. Over decades we have all operated in our different spheres of life – whether as journalists, academics, politicians, campaigners and educators – to ring the alarm about the way planetary life support systems are being destroyed. But a powerful alliance of wealthy individuals and multinational corporations, backed by complicit politicians, has subverted the political process and blocked action. This is why, whoever we are and whatever we do, we are coming together now to say we are prepared to engage in civil disobedience to force urgent climate action.  We are prepared to halt lorries entering fracking sites; to stand in the way of bulldozers building roads and block traffic along heavily congested and polluted streets. Direct actions like these have a long and proud history; it’s time to carry them through in a systematic way to protect the climate, and to be willing to be arrested for doing so. So how have we have reached a situation where a law maker like me feels there is no alternative but to become a law breaker? Here my Quaker heritage is helpful. Our thin pamphlet of theological guidance ncludes the useful advice: “Respect the laws of the state but let your first loyalty be to God’s purposes.” As a Quaker, I don’t believe that spiritual wisdom resides in books or rituals but in the still, small voice that tells you when something must change. When the inward light, that I believe we all have within us, prompts you to stand up to a fascist bully or to engage in civil disobedience to halt climate breakdown, you have no choice but to follow. I represent some 5 million people in the European parliament. But who represents the generations as yet unborn that will have no chance of a decent and civilised life unless we act on climate change? Who represents the thousands of species that are becoming extinct during the modern era? A mass extinction that is entirely the result of human actions, and which we are living through almost without noticing? I am proud of the way 50 Green MEPs, of 750 elected across Europe, have achieved policy breakthroughs. Just last week we won a vote on banning plastics and limiting the use of antibiotics on farms. And my work on sustainable finance has a real chance of creating financial incentives to shift investment away from fossil fuels and towards projects that will protect wild habitats. But it isn’t enough. Green voters in the UK are grossly underrepresented because of our unfair electoral system. So British policy on energy and transport is stuck in the past, while other European countries with a strong green contingent in their parliaments are far more advanced in the transition towards a green economy. A spur towards direct action against this government and in defence of our planet conveniently appeared this week. As finance speaker for the Green party, I had called for an emergency budget for the climate, and the party issued a challenge: if the budget offers a single pound to climate-wrecking projects it will have failed. Well, the chancellor didn’t mention climate change once in his statement, and, rather than action to avert climate breakdown, we saw the chancellor accelerate it. He threw £30bn at road building while freezing fuel duty for the ninth year running, meaning this now amounts to a £9bn tax giveaway a year. There was also a sneaky £3bn tax break for oil and gas companies in the North Sea, through the removal of “tax barriers” to investment. This was just the enticement we needed to take the government on. The latest IPCC report and Tuesday’s Living Planet report by WWF, which reveals that wildlife populations have declined by more than half in less than 50 years, show how urgently change is needed. It is no exaggeration to say that our survival as a species is at risk. Enough. Enough of words; of hypocrisy and broken promises. It’s time to act. • Molly Scott Cato is Green party MEP for South West England"
"How is it possible to live with despair? If, in the wake of last month’s horrifying UN report on global warming, you’ve been asking yourself this question, take some solace (or at least solidarity) from the knowledge that you’re not alone. Jonathan Franzen has been grappling with it for years, and as the final-countdown title of his new volume of essays suggests, his despair at the state of the planet and our absolute inability (“political, psychological, ethical, economic”) to save it is, if anything, deepening. “I don’t have any hope that we can stop the change from coming,” he says bluntly at the conclusion of his opening essay, and nothing in the following pages suggests he is anywhere close to changing his mind. But by refusing to hope for the impossible, Franzen, improbably, manages to produce a volume that feels, if not hopeful, then at least not hopeless. There’s nothing he can do – there’s probably nothing any of us can do – to avert or even alleviate the coming catastrophe. But for now, he’s here and he’s alive, and over the course of these essays he offers us a series of partial, tentative answers to the question he poses himself at the beginning: “How do we find meaning in our actions when the world seems to be coming to an end?” This is not a collection that wastes time attempting to persuade us of the reality of the climate crisis; frankly, we’re way past that. “Drastic planetary overheating,” Franzen assures us, “is a done deal” – and by the way, we need to revise significantly upward our definition of what “drastic” means. The notional two-degree figure widely cited by politicians as the upper limit of what we, and the planet, could possibly accommodate is a line we’re on course to gallop past in just a few years’ time. By 2100, we may well be looking at a five or six-degree temperature rise, and even then there’s a possibility we’re being lowballed. “The scientist who confidently predicts a five-degree warming by the end of the century,” Franzen suggests, towards the end of the collection, “might tell you in private, over beers, that she really expects it to be nine.” It’s a body blow moment in a book that declines to pull its punches, and Franzen acknowledges that many of his readers – “the people for whom the prospect of a hot, calamity-filled future is unbearably sad and frightening” – might be “forgiven for not wanting to think about it”. But over the course of these essays, he succeeds in demonstrating that resignation brings with it a curious intellectual freedom. His acknowledgment that the macro problem is beyond him allows him to start thinking more creatively about micro solutions: what can be achieved here, now, today. Naturally, there’s another way to read his position. Viewed through the other end of the telescope, Franzen’s acceptance of the coming crisis could be seen as an abdication of responsibility: resignation in terms of action, rather than comprehension; a ducking of the issue that’s just a left-liberal version of the US president’s fatuous claim that the climate will “change back”. It’s an accusation to which Franzen is acutely sensitive, not least because it has been levelled at him before. In the collection’s opening piece, “The Essay in Dark Times”, published as “Is it too Late to Save the World?”, what begins as a fascinating consideration of the role of the essay at a moment of objective peril evolves, via a circuitous route that takes in quitting smoking, birdwatching in Ghana and Trump’s election, into a critical rereading of another essay (“Save What You Love”, also collected here) that he wrote for the New Yorker, some two-and-a-half years earlier. That one was triggered by his fury at the actions of the National Audubon Society, the US’s foremost organisation for bird conservation. Franzen’s passion for birdwatching is almost as well known as his novels, so to say the Audubon Society was an unlikely target is an understatement. But it was precisely “as a bird-lover” that it attracted his ire. In 2014, the Society had, “with much fanfare”, thrown all its resources into the climate change fight, declaring that global warming was “the number-one threat to the birds of North America”. There’s no question that climate change poses an existential threat in the medium-term, however, “in 2014, the most serious threats to American birds were habitat loss and outdoor cats”. In Franzen’s view, the society’s position was both “narrowly dishonest” and potentially harmful, in that it might discourage people “from tackling solvable environmental problems in the here and now”. He said as much in his essay, was duly denounced as a “climate-change denier”, and retreated in a mixture of shame and regret on the one hand, and injured self-justification on the other. The irony, of course, was that he wasn’t attempting to deny climate change at all: “In fact, I’m such a climate-science accepter that I don’t even bother having hope for the ice caps.” Rather, he was denying that our current piecemeal, unserious attempts to mitigate it will have any consequential effect, and arguing that therefore we might better expend our efforts on conservation projects whose benefits “are immediate and tangible”. Where Franzen perfectly strikes the balance between form, content and voice you know you’re in the presence of a master It’s a complex position, both to articulate and to accept. But it is not, in the years since he first set it out, one that he has backed away from, because it represents the only hope he has left, and the central hope of this collection: that facing the future “honestly, however painful this may be, is better than denying it”. Rather, as these essays show, the conclusion he has come to is that it’s not his position that’s lacking, but his ability to put it across in a way that readers can accept. It’s a challenge to him as a writer: to think harder; to write more clearly and with more sympathy. It’s a question of what the essay, as a form and specifically in his hands, can do. And it’s a challenge to which he rises. This isn’t a flawless collection: there are uneven moments, and occasional longueurs. There are also – and I say this as a bird-lover – a whole lot of birds. They are the animating spirits of the collection, flitting and rustling through the essays, and Franzen ably makes the case both for their hold over him and their symbolic significance (“If you could see every bird in the world, you’d see the whole world”). But as the pages turn and the feathers pile up, it becomes harder and harder to keep the murres, taikos and storm petrels straight in your head – or, finally, to invest too deeply in the differences. Yet there are essays in which the balance between form, content and voice is perfectly struck, and when you reach one of those, it’s clear that you’re in the presence of a master. The opening essay, in which the idea of the essay itself is held up to the light, is a thing of supple, compelling intelligence, and by placing “Save What You Love”, his piece on the Audubon Society, after his retrospective analysis of its weaknesses, he effectively contextualises it, and allows us to read it for what it is: a teasing-out of complex arguments that refuses to reach for satisfying but reductive conclusions. Then there’s the title essay, which comes fittingly at the collection’s close, brings together all of its strands (climate change, humanity, thinking, writing, birds), and is simply a delight. In it, Franzen weaves together, lightly but tightly, two narrative threads: his expedition on a cruise ship to Antarctica, and the life of his uncle Walt, whose unlooked-for bequest paid for the trip. The timelines diverge wildly (the trip takes a couple of weeks; Walt lived to a ripe old age) but by combining them, Franzen expertly shows how they speak to each other. They’re both stories about death: Walt, we learn, “lost his daughter” (in a car crash in her 20s), “his war buddies, his wife, and my mother” before mortality caught up with him; the Antarctic is both a death zone, the literal and metaphorical end of the world, and, thanks to climate change, dying itself. But read on, and we find that the real resonance between the two tales is the urgent case they make for the worth and beauty of life. Walt survived his tragedies, kept faith with the world, and “never stopped improvising”; in Antarctica, Franzen comes face to face with a king penguin in the wild, and finds that it “seemed to me, in itself, sufficient reason not only to have made the journey; it seemed reason enough to have been born on this planet”. It’s the work of a writer at the top of his game – limber and lovely, delivering deep insights with delicacy and grace – and it poignantly makes the only case for climate action that has any chance of succeeding: that there is so much worth living for. “Even in a world of dying,” Franzen concludes, “new loves continue to be born.” • The End of the End of the Earth by Jonathan Franzen (4th Estate, £16.99). To order a copy for £12.99, go to guardianbookshop.com or call 0330 333 6846. Free UK p&p over £15, online orders only. Phone orders min. p&p of £1.99."
"Twenty-two people have been arrested after protesters daubed the windows of the Department for Business, Energy and Industrial Strategy in London and blocked passing traffic in an effort to provoke society into action over climate change. One protester climbed above the revolving doors of the main entrance of the building in Westminster and wrote “frack off” in black spray paint, and another sprayed the extinction symbol in red on windows facing traffic on Victoria Street. A spokesperson for Extinction Rebellion, the group that coordinated the demonstration, said their members used spray chalk, which washes off. During the day, protesters superglued themselves to card-entry gates inside the staff entrance to the building, and lay down outside in Victoria Street blocking westbound traffic.  The protest is intended to be the first in a series continuing throughout the week and culminating with a mass civil disobedience action on Saturday, which activists are calling “rebellion day”. ""Frack off"" #extinctionrebellion protester spray paints department for business energy and industrial strategy as they escalate the #ClimateBreakdown demonstration pic.twitter.com/K2FsFDNXPU Dozens of protesters had locked themselves together outside the doors of the BEIS building and others glued themselves to glass. At another entrance, protesters from the group Christian Climate Action could be seen through windows to have entered the lobby of the building and locked themselves to fittings. Bell Selkie, 48, from Wales, sitting glued by her left hand to the door of BEIS, said the effects of climate change were becoming obvious. Bell Selkie, 48, centre, farmer from Wales, locked on and glued to the doors of the department of business, environment and industrial strategy: ""I live on a farm and the harvests are failing and it's very obvious to me that climate change is hitting now.""#extinctionrebellion pic.twitter.com/P0MWndqsLx “The IPCC report in October gave us six to 12 years, and this is known to be a conservative report. If we don’t respond with a war-style effort now we are all fucked, all of us. My heart is breaking and I’ve got to do something, and I’m putting my life on hold,” she said. Some protesters wore high-visibility vests and patches with the words “conscientious protector”. Asked what that meant, one demonstrator, who preferred not to be named, said: “I have a conscience and I’ve never done anything like this before; I have to do something. We have to protect the environment because if we don’t, all the other problems, all the other causes that exist, are pointless. Everything else is pointless.” The Green party peer Jenny Jones came to witness the demonstration after seeing news of it on social media from her office in the House of Lords. She said she backed non-violent direct action. “If we’re not bold then we won’t have a usable planet in the next few decades,” she said. “The fact is we need action, we need it fast. This government has dragged its feet long enough. Whether it’s solar subsidies, making windfarms difficult or even actually supporting things like fracking, this government has actually gone in the wrong direction almost every time. So let’s hope they listen.” Contacts from inside the building said announcements had been made over the internal public address system that entrances and exits were blocked and no one was able to enter or leave the department. In a statement, Extinction Rebellion said: “The UK government, specifically BEIS, is promoting fracking – meeting with fracking companies more than 30 times in the last three years, compared to zero times with anti-fracking groups – despite massive local opposition. “From Preston New Road (665 days now and counting) in Lancashire, to Kirby Misperton in North Yorkshire, to Horse Hill in Surrey, communities are coming together to fight against fracking.” "
"Veganism, once widely seen as an alternative, if not an extreme, lifestyle, is now in the mainstream. Exactly how many people in the UK have eliminated animal products including dairy and honey from their diets is uncertain. One recent survey suggested there could be as many as 3.5 million vegans in the UK. The Vegan Society offers the much lower figure of 600,000 vegans, which still represents a fourfold increase in four years. But either way, and combined with a big increase in vegetarians and occasional meat-eaters (otherwise known as “flexitarians”), a huge shift in eating habits is under way. This week’s annual food and drink report by the supermarket Waitrose says around a third of people have either cut down on or stopped eating meat altogether. There is more than one explanation for this change in behaviour. More than half of those surveyed by Waitrose said animal welfare was their motivation for changing their diet. The intensive farming and slaughter of livestock has long aroused feelings of regret and distaste in many people who do not object on principle to eating meat. Such feelings, along with concerns around health and sustainability, have led to rising demand for organic and free-range products among those who can afford them. The growing trend towards giving up meat altogether suggests either that the moral objections have spread, that other factors than animal welfare are in play – or, most likely, some combination of both.  These other factors are health and the environment. Expert advice on diet has long focused on a balanced intake of nutrients, and eating more fruit and vegetables and less sugar and fat. There is no simple answer to the question of whether it is healthier to be a carnivore or not. But over the past few years what was once suspected has become official: cured and processed meats can cause bowel cancer, and are classified by the World Health Organization as a group-one carcinogen, alongside tobacco and asbestos. Little wonder, then, that health-conscious people are giving up BLTs. While the health case for vegetarian and vegan diets is inward-looking, the environmental arguments point urgently outwards and forwards in time. Last month a major international study concluded that huge reductions in meat-eating are essential, especially in the western countries that eat most of it, since food production is a big contributor to global warming as well as deforestation, water shortages and pollution from fertilisers. This was one of the main arguments for veganism made by the freelance journalist Selene Nelson in an article this week, after her exchange of emails with Waitrose Food magazine editor William Sitwell led to his resignation. Mr Sitwell had responded to her pitch for a vegan series featuring recipes and tips with a reply that joked he might instead commission a series about “killing vegans” to “expose their hypocrisy”. Since Waitrose is currently promoting new vegan lines, it was unimpressed when these comments ended up in the press. What might have been laughed off in a note to a colleague was poorly judged as a response to a freelancer’s pitch for paid work. Had he thought better of his rudeness and sent a follow-up email, the story might have had a different ending. Vegans, as has been pointed out by Mr Sitwell’s defenders, are not a minority it is a crime to insult. What they are, to those who would rather ignore the peril of rising carbon emissions, is an irritation. To others who share their concerns, they offer a challenge – even an inspiration."
nan
