"Last week, authorities in Sweden took an unusual step. They issued an appeal for international aid to help them tackle an epidemic of wildfires that has spread across the nation over the past few days. After months without rain, followed by weeks of soaring temperatures, the nation’s forests had become tinderboxes.  The result was inevitable. Wildfires broke out and, by the end of last week, more than 50 forest blazes – a dozen inside the Arctic circle – had spread across Sweden. A nation famous for its cold and snow found itself unable to cope with the conflagrations taking place within its border and so made its appeal for international help, a request that has already been answered by Norway and Italy who have both sent airborne firefighting teams to help battle Sweden’s blazes. Nor is the nation’s fiery fate particularly unusual at present. Across much of the northern hemisphere, intense and prolonged heatwaves have triggered disruption and devastation as North America, the Arctic, northern Europe and Africa have sweltered in record-breaking temperatures. In Africa, a weather station at Ouargla, Algeria, in the Sahara desert, recorded a temperature of 51.3C, the highest reliable temperature ever recorded in Africa. In Japan, where temperatures have reached more than 40C, people were last week urged to take precautions after the death toll reached 30 with thousands more having sought hospital treatment for heat-related conditions. And in California increased use of air conditioning units, switched on to counter the scorching conditions there, has led to power shortages. But perhaps the strangest impact of the intense heat has been felt in Canada. It too has been gripped by ferocious heat, with Toronto recording temperatures that have exceeded 30C on 18 days so far this year. This figure compares with only nine such days all last summer. Dozens have died in the withering heat – with startling and grim consequences. Montreal’s morgue has been swamped with the bodies of those who have died because of the heat, and many corpses have had to be stored elsewhere in the city. Montreal coroner Jean Brochu said it was first time the city’s morgue had been overwhelmed this way. Britain’s scorching weather – which has melted the roof of Glasgow’s Science Centre and parched the lawns of the nation’s historic homes – may have made regular UK headlines. However, it has been relatively mild in impact compared to those experienced in many other parts of the world. Far from being a parochial problem, the current heatwave is clearly an issue that affects vast stretches of our planet: a global concern not a local one. But why is so much of our world currently being afflicted with blisteringly hot weather? What is driving the wildfires, the soaring temperatures and those melting rooftops? These are tricky questions to answer, such is the complex nature of the planet’s weather systems. Most scientists point to a number of factors with global warming being the most obvious candidate. Others warn that it would be wrong to overstate its role in the current heatwaves, however. “Yes, it is hard not to believe that climate change has to be playing a part in what is going on round the globe at present,” said Dann Mitchell of Bristol University. “There have been some remarkable extremes recorded in the past few weeks, after all. However, we should take care about overstating climate change’s influence for it is equally clear there are also other influences at work.” One of those other factors is the jet stream – a core of strong winds around five to seven miles above the Earth’s surface that blow from west to east and which steer weather around the globe. Sometimes, when they are intense, they bring storms. On other occasions, when they are weak, they bring very calm and settled days. And that is what is occurring at present. “The jet stream we are currently experiencing is extremely weak and, as a result, areas of atmospheric high pressure are lingering for long periods over the same place,” added Mitchell. Other factors involved in creating the meteorological conditions that have brought such heat to the northern hemisphere include substantial changes to sea surface temperatures in the North Atlantic. “These are part of a phenomenon known as the Atlantic multidecadal oscillation,” said Professor Adam Scaife, of the Met Office. “In fact, the situation is very like the one we had in 1976, when we had similar ocean temperatures in the Atlantic and an unchanging jet stream that left great areas of high pressure over many areas for long periods,” said Scaife. “And of course, that year we had one of the driest, sunniest and warmest summers in the UK in the 20th century.” However, there is one crucial difference between 1976 and today, added Professor Tim Osborn, director of research at the Climatic Research Unit, University of East Anglia. “The baseline on which these effects operated is very different today. Since 1976 we have had several decades of global warming – caused by rising carbon emissions – which has raised baseline global temperatures significantly.” As a result, any phenomenon such as the weakening of the jet stream is going to have a more pronounced effect than it did 40 years ago. And as global carbon emissions continue to rise and predictions suggest the world will be unable to hold global temperature rises this century to below 2C above pre-industrial levels, widespread heatwaves are very likely to get worse and become more frequent, scientists warn. Nor is the problem of increasingly severe heatwaves confined to the land. “We have marine heatwaves as well – all over the globe,” said Michael Burrows, of the Scottish Marine Institute, Oban. “For example, there was a major marine heatwave that struck the coast of Australia last year. It devastated vast swathes of the Great Barrier Reef. More to the point, marine heatwaves are also becoming more and more frequent and intense, like those on land, and that is something else that we should be very worried about.” Additional reporting: Ashifa Kassam, Toronto"
"In March this year I started to care about the planet. Like, in a big way. Before that, I fretted about it and treated it like an extremely beautiful but very sick creature I was afraid to get too attached to. If you want to know how my change of heart started, I’ll tell you the same thing I told the poor old Texan man sitting beside me on a flight out of JFK. “I’m going for a chemistry test with the first woman president of Ireland so I could potentially be her co-host for this climate justice podcast she’s about to make.” He stayed quiet after that. The following morning, jet-lagged and disoriented on a winding London street, I couldn’t find the restaurant where I was supposed to meet Mary Robinson. When I eventually did find it, I couldn’t find the door, so her first impression of me was of a tardy wild-eyed woman knocking on a window mouthing “so sorry” and “just an omelette please”. My first impression of her was way back when I was eight years old, and she became the president of Ireland. Back then, she came across as powerful and good and clever, certainly not someone to mess with. Those were the instincts of a child and three decades later I’m glad to have been proven correct. After the Irish presidency Mary Robinson became the UN high commissioner for human rights, and it was during this time she began to see the link between climate change and human rights. She focused in on this and 15 years ago set up the Mary Robinson Foundation for Climate Justice. Climate justice means a people-centered solution to climate change. It pushes for restorative justice and recognizes the integrity of the planet and every creature on it. And I’ve come to understand that climate justice is a way out of the capitalist and paternalist way of living that’s gotten us into this climate change mess in the first place. I’m a comedian and a podcaster, as I explained to the Texan on the airplane who was now pretending to be asleep. My job as co-host, should I get it, would be to help navigate the world of podcasting and, I whispered as I patted his hand, I’d add in my own sense of curiosity and hopefully some levity too.  The following morning, after hurriedly eating my omelette, we headed to a studio where we had some classic podcast banter, which went as follows: Me: “On you and your husband’s first date, who paid for dinner?” Mary, narrowing her eyes: “This is a little frivolous. Shall we begin the divestment discussion?”  That’s how it started; that’s how I learned more about climate justice in the past six months than in the whole rest of my life. I count myself lucky, because climate justice is fascinating, uplifting, and intersectional in a way that’s still too large for me to comprehend but could change the course of the world.  Over the course of five months, Mary and I spoke to and heard from amazing women all over the world. There are scientists in Africa, farmers in Asia, politicians in Brussels, and indigenous community leaders in America, all working to solve climate problems every single day. People I didn’t realize were helping turn out to be the heroes of this story – like lawyers and children and midwives. People like Tara Houska, an attorney who advocates on behalf of tribal nations at the local and federal levels, who spent six months on the frontlines in North Dakota fighting the Dakota Access pipeline.  She is also heavily engaged in the movement to defund fossil fuels, and she travels the world challenging major banks and institutions about this. I got so fired up after listening to that I called my bank to see what they were doing with my savings: $3,200 at the time (less now that I had to buy a new sofa). Turns out I needed to move it (my money, not my sofa) because Chase Bank is … not a good choice if you care about divestment from fossil fuels. Two youngsters stick in my mind, Victoria Barrett and Ridhima Pandey. They are just a couple out of dozens of kids worldwide using the law to force their governments to take climate change more seriously. Victoria is a 19-year-old New Yorker. Her school was flooded by Superstorm Sandy and she’s a plaintiff in a groundbreaking constitutional climate lawsuit against the US government, arguing the administration’s climate-changing actions violate young people’s constitutional rights to life, liberty and property. The trial starts in October. Ridhima, from Uttarakhand, India, filed a petition against her government in 2017 when she was just nine years old. She argued that the Indian government had failed to fulfill its duties to her and the Indian people to protect them from climate impacts – a hearing on the case is expected soon. When I was nine, all I wanted was one of those pens with lots of different colors to click between.  While all of us have contributed to climate change to some extent, its results are not gender neutral I also learned that while all of us have contributed to climate change to some extent, its results are not gender neutral. It affects women first and worst: women are more likely to die in a climate disaster, and day to day they are the ones cooking on solid fuel stoves that can ultimately poison them. Climate justice offers a feminist solution, one that sees women as equally valuable as men. I learned too that the countries that do the worst damage to the planet don’t actually feel its effects, at least not fully and not yet.  Which brings me to what I unlearned. I’m sorry to say that in the past I’ve seen people in countries and communities hit worst by climate change as unfortunate victims, and failed to see that precisely because of this suffering, they are often the ones leading the fight against it. Climate justice heroes come from Bangladesh, Rwanda and Puerto Rico, to name a few, and also from indigenous communities worldwide. It took repeated conversations and actual listening on my part to break down my colonial mindset, my internalized “the west knows best” attitude, one I wasn’t aware I had.  Within the US, people of color and poor people breathe dirtier air than whiter, wealthier people. In LA, you’re almost twice as likely to die in a heatwave if you’re black, because of the urban heat island effect and less access to air conditioning and cars than other Angelenos. Isn’t that just disgusting? But again, leadership is coming from within the communities at risk. We had a conversation with Sarra Tekola. She’s a climate justice and Black Lives Matter activist working on a PhD in climate science in Seattle. It was thrilling to sit in a studio and be part of a discussion between Mary, someone accustomed to and comfortable moving through the halls of power, and Sarra, someone who is 40 years younger and usually found protesting outside those very halls.  As you would expect, there was more in common than not, and what I found moving was the women’s shared sense of urgency and fighting spirit, and the unspoken kinship that comes with it. Anyone can be a part of this, you just have to join in. Until now, I’ve felt a pervasive sense of doom that’s kept me stuck when it comes to climate change. But today, there are new elements I’ve learned about that bolster me and give me hope: namely the ethics, the politics and the spiritual dimension in our relationship to the planet and the people who live on it. "
"Marc Morano is the real-world fossil fuel industry version of Nick Naylor. His career began working for Rush Limbaugh, followed by a job at Cybercast News Service where he launched the ‘Swift Boat’ attacks on 2004 Democratic presidential candidate John Kerry. In 2006, Morano became the director of communications for Senator Jim Inhofe (R-OK), who is perhaps best known for throwing a snowball on the Senate floor and calling human-caused global warming “the greatest hoax ever perpetrated on the American people.” Thus it’s unsurprising that in 2009, Morano began directing fossil fuel-funded think tanks designed to cast doubt on the reality of and dangers associated with human-caused global warming. As he admitted in Merchants of Doubt, Morano frequently embodies the strategy of climate denial known as ‘fake experts’:  Most recently, Morano created a short video that centers on three common climate myths and has garnered over 5m views on Facebook.  Morano begins his video by denying the 97% expert consensus on human-caused global warming. Consensus denial is one of the most popular climate myths, and was the subject of the most widely-shared climate story of 2016. Morano’s strategy is to critique two of the studies that found a 97% expert consensus. One, published in 2009 by Peter Doran and Maggie Zimmerman surveyed 3,146 Earth scientists, but fewer than 80 of the participants were actively publishing climate science research (and hence experts on the subject). Basically, the critique is that the study sample size was too small to make a conclusive determination about the level of expert consensus.  That’s a valid point, except this was just one among many such climate consensus studies. In fact, the authors of seven separate consensus studies using a variety of approaches (some with very large sample sizes) teamed up in 2016 to publish a paper concluding that the expert consensus on human-caused global warming is between 90 and 100%. So, this critique is invalid when considering all the available consensus research. Morano also critiques the consensus study that my colleagues and I published in 2013. He does so simply by quoting economist Richard Tol saying our 97% figure “was pulled from thin air.” Tol argued that the methodology in our study was flawed, but when we applied his critiques in a follow-up paper published in 2014, we found that the consensus was still 97 ± 1%.  Moreover, Tol himself has said, “The consensus is of course in the high nineties” and “There is no doubt in my mind that the literature on climate change overwhelmingly supports the hypothesis that climate change is caused by humans. I have very little reason to doubt that the consensus is indeed correct.” In short, Morano’s only evidence to dispute the expert consensus on human-caused global warming is to quote an economist who agrees the consensus is 90–100%, and that the experts are correct that humans are responsible for global warming. Next in the video, Morano claims that we’re not actually in the midst of the hottest period on record, and that ‘hottest year’ claims are “merely political statements” because for example, he claims, scientists can’t say with 100% certainty that 2016 was hotter than 2015 due to the margin of uncertainty in the data. This claim is similar to one made on Fox News that earned a ‘Pants on Fire’ rating from Politifact based on consultation with climate scientists. 2014 through 2017 are indeed the four hottest years on record, outside the range of uncertainty. Morano concludes the video by claiming “the most outrageous myth of all is that carbon dioxide is somehow the control knob of the climate.” Ironically, Nasa climate scientists published a paper in 2010 titled, “Atmospheric CO2: Principal Control Knob Governing Earth’s Temperature.” Morano argues that the experts are wrong because there are hundreds of factors influencing Earth’s climate, and that carbon dioxide “is one of these factors that gets essentially drowned out, and you can’t distinguish its effect from natural variability.” That claim is entirely false, as elegantly illustrated in this graphic created by Bloomberg. Human-caused global warming now far outside the range of natural variability. In fact, we’re now warming global temperatures more than 20 times faster than Earth’s fastest natural climate changes. And of course, climate scientists have observed human fingerprints all over climate change, most recently in the atmosphere. It would be absurd to take Marc Morano’s word over the evidence published in peer-reviewed studies by climate scientists at Nasa and other scientific institutions around the world. Lately, Facebook has struggled mightily in trying to figure out how to combat the epidemic of fake news propagated via its platform. Mark Zuckerberg made headlines last week when he defended fake news from Holocaust deniers, saying he didn’t “think that they’re intentionally getting it wrong.” It’s virtually impossible to discern an individual’s intent, but if that person is spreading misinformation, intent is irrelevant. If Facebook wants to stop misinforming millions of its users, it needs to tackle the problem of fake news regardless of intent. So far, Facebook seems more concerned about the appearance of ‘bias’ than about making sure the content shared on its site is factually correct. Fortunately, the exposure to Morano’s misinformation video is not as bad as it seems at first blush. Although Facebook implies the video has been viewed over 5m times, a “view” is counted after just three seconds, and videos on the site play automatically.  Nevertheless, the video has been shared over 75,000 times, so it has certainly reached a wide audience. Facebook needs to come to terms with the fact that there is an objective reality. Even if Marc Morano sincerely believes humans aren’t causing global warming, that belief is false, and by continuing to host his myth-filled video, Facebook is misinforming tens of thousands, perhaps even millions of its users."
nan
"Environmental campaigners have lost their high court challenge against the government over its policy for tackling climate change. The charity Plan B Earth brought legal action against the government’s stance on the 2050 carbon target, set out under the Climate Change Act 2008.  The charity and 11 UK citizens aged nine to 79 – including the publisher Dame Carmen Callil – wanted to bring a judicial review against the business secretary, Greg Clark. But Mr Justice Supperstone rejected Plan B Earth’s case on Friday, saying it was “unarguable”. Lawyers for the charity previously argued the government should have, in light of the current scientific consensus, gone further than its original target of reducing carbon levels by 2050 to 80% of that present in 1990. They said the decision not to amend the 2050 target put the UK in breach of its international obligations under the Paris agreement on climate change and was influenced by the government’s belief that a “more ambitious target was not feasible”. At a hearing on 4 July, Jonathan Crow QC told the court: “The secretary of state’s belief that he needs to have regard to what is feasible, rather than what is necessary, betrays a fundamental misunderstanding of the scheme of the 2008 act and must be quashed. “All of the individual claimants are deeply concerned about climate change.” The barrister argued the business secretary’s “continuing refusal” to amend the 2050 target means the UK is playing “Russian roulette with two bullets, instead of one”. But, refusing permission for a full hearing, Mr Justice Supperstone said Plan B Earth’s arguments were based on an “incorrect interpretation” of the Paris agreement. He said: “In my view the secretary of state was plainly entitled ... to refuse to change the 2050 target at the present time. “I do not consider it arguable that the secretary of state’s refusal to amend the 2050 target is an unlawful exercise of his discretion.” Tim Crosland, director of Plan B Earth, said the charity was “surprised and disappointed” by the ruling and plans to appeal. He said: “We consider it clear and widely accepted that the current carbon target is not compatible with the Paris agreement. “Neither the government nor the committee on climate change suggested during our correspondence with them prior to the claim that the target was compatible. “Indeed, it was only in January of this year that the committee published a report accepting that the Paris agreement was ‘likely to require’ a more ambitious 2050 target. “Moreover the government acknowledged in these proceedings that it was uncontroversial that the 2050 target was insufficient to meet the 1.5C target, one of the key aspects of the Paris commitment. “In these circumstances, Plan B and the other 11 claimants continue to consider that a full hearing on an issue of such urgent and vital importance is necessary. “As with other legal campaigns confronting powerful vested interests it takes time to break through, and time is not on our side. “We’ll be doing everything possible to accelerate the process. Wildfires raging in the Arctic Circle must surely be a wake-up call.” "
