"When Jeremy Corbyn won the leadership of the Labour party in September he celebrated in a pub up the road from the Houses of Parliament with a thank you to supporters and a rousing rendition of the Red Flag. On the edge of the impromptu stage that day, beside Len McCluskey of Unite and John McDonnell the future shadow chancellor, was a singular figure singing with particular pride: Piers Corbyn, the new leader’s elder brother, who has, you could say, led a parallel career of stubborn principle to his younger sibling. I was in the euphoric crowd that day, and since then I’ve wondered a bit about the relationship between the brothers, what they have learned from each other. With some of this in mind I called Piers recently and asked if he might like to talk about some of that. He agreed, but typically on the basis that he would happily talk about any subject under the sun – apart from his relationship with Jeremy and the vexed question of how his leadership is going. He shares much of his brother’s mistrust of the press; recently, he suggests, the Independent published an account of an exchange that had taken place over a family Christmas dinner. That wasn’t on. What he will talk about, though, is the thing he has talked about for just about as long as he can remember: the weather. On this very British basis we met last week in a cafe over the road from his office on Borough High Street in south London. You don’t have to speak to Piers for very long to realise that at least a couple of Corbyn family traits are indelible: the first is that intransigent rasp of a voice with faint traces of west country burr; the second is the sense that life, like politics, is best played as a long game.  Piers Corbyn has a faith, even at 68, that if he states his beliefs often enough – though it might seem no one is listening – his day will surely come. He takes comfort in this not only from the recent elevation of his brother, but also from the example of Galileo, and of John Harrison and his measurement of longitude. “It is unfortunately not the case that the truth always prevails in the short term,” he tells me, with some conspiratorial conviction, “there are often vested interests to prevent it.” The particular “truth” that Corbyn has in mind is perhaps the least fashionable proposal currently available in enlightened debate: it is the belief that changes in the Earth’s climate and its weather are dictated primarily by cyclical activity on the surface of the sun (and not, pointedly, by the effects of carbon dioxide in the atmosphere). It is a cause even more thankless than the return of 1980s socialism to British parliamentary politics seemed (until very recently). Corbyns have little fear of pariah status, though. What of the “settled opinion” of climate scientists and governments around the world, sealed in the recent Paris accord? “For one thing science doesn’t do settled opinions,” Corbyn says. “And for another they are all wrong.” This contrarian spirit began in Piers Corbyn at the age of five when his father, an electrical engineer, encouraged him to investigate the efficacy of a Victorian dew pond (he found it to be limited); it continued with his construction of all manner of meteorological equipment in the family garden in Shropshire; then through the study of tiny anomalies in the true orbit of the Earth (based, aged 17, on weekly measurements of the elevation of the sun, with findings published in the journal of the Royal Geographical Society) and into academic degrees in solid state physics and astrophysics at Imperial College London. The culmination of this obsession was a personal epiphany: “I was thinking of using the weather to discover what the sun had been doing in the past,” Corbyn says. “But then I thought, that’s just stupid: why not use the sun to predict what the weather will do in the future?” In his mind, the only thing that has got in the way of him making his fortune from that ambition, is politics. To begin with, he says, his solar-based forecasts and calculations were way off, and he had as good as given up, but in 1984 a singular event changed the course of his working life. At the time, Corbyn says, of the year after his brother had first been elected a Labour MP, his own political loyalties were in a certain state of flux. He had been a radical student union president in London and sometime revolutionary socialist (a past that he believes would have prevented him working at the Met Office, still part of the Ministry of Defence, even had he wanted to). In the early 1980s he had been affiliated to the International Marxist Group, after a brief flirtation with the “quasi-Trotsky anarchist group, The Big Flame, for the 11 days it existed”. At the beginning of 1984, knowing his meteorological background, the IMG asked him to forecast what the winter was going to be like at the end of that year. The miners were planning a strike and “they wanted to know whether it was going to be cold enough for the strike to be effective, to bring Britain to its knees,” Corbyn recalls. He said no, but under pressure from his comrades he went back to the data, “looked at a lot of new relationships and correlations” and came to the conclusion that, yes, it was going to be a very cold winter. He presented his evidence to the Miners’ Educational Support Committee (“I think it was called that. We had a lot of committees…”) And it was passed on up to the NUM. As the strike unfolded Corbyn’s prediction proved correct, the winter of 1984-85 was unusually cold. Was the NUM grateful? “Very,” he says. He had phone calls from head office, “not [Arthur] Scargill personally but one of his senior assistants”, asking how long the cold weather would last. He told him he thought it could possibly last long enough to bring down the Thatcher government, but by March the strike had collapsed and he never got the chance to be proved right. All the while Corbyn was assessing the proximity of revolution by monitoring the electricity output at Goldsmith’s college where he was a lecturer in the physics department. “The voltages were below the legal minimum all that winter,” he says. “It is supposed to be 240v, it was below 210v and for safety they are legally bound to turn it off. The government were desperately doing everything they could to conserve power. I called to say I had measured the voltages at the University of London and they were below that minimum. They said, ‘Well, Mr Corbyn you must have faulty equipment,’ and put down the phone.” It was in those weeks and months, Corbyn suggests, that Margaret Thatcher came up with her most devious plan to deindustrialise Britain and defeat the miners once and for all: she would popularise and endorse the science of man-made climate change, as a way of converting Britain from coal to nuclear power. The Hadley Centre, the world’s first dedicated research institution became her pet project. Thatcher, who later recanted her doom-mongering, “probably knew climate change was nonsense,” Corbyn suggests, “she was a scientist. But she was also a politician. The rest is history.” Corbyn sees that moment as the one in which politicians first saw the political capital to be made from prophesying the coming apocalypse. Worse though, in his mind, the most vehement expression of that prophesy was not on the right but on the left. Climate change became a progressive cause. For Corbyn, it answered the crisis on the left created by the fall of the Berlin Wall. “The left needed a new totem pole. Something for the young to dance around and feel good about,” he says, somewhat bitterly. “Revolutions had failed. Russia had failed. Socialism wasn’t dead but it needed a cause. The Red-Green alliance became that cause. It needed massive state spending, which they equated with socialism. In my view the left stopped thinking in 1989. It is only my brother who has started to change the agenda of privatisation and so on.” It is hard to imagine that Piers has not bent his brother’s ear with elements of this analysis at family gatherings for about 25 years. Does he show signs of wavering? “I don’t speak for my brother on any of this,” he says. “I don’t give advice to him where it is not appropriate.” Did Jeremy share his obsession with the weather as a kid? “Not really,” he says. “We were all different. Our eldest brother was into cars. He became a flight test engineer for Concorde. The next brother is a mining engineer, went to Imperial college. Then there is me, scientist. Then Jeremy, who was always politics. I think we all took after different aspects of our dad; while my mother encouraged us to make things all the time. The house was rundown and we boys had to do repairs. Jeremy and I learned how to repoint brickwork and so on. We became pretty good builders.” Piers has had perhaps less convincing success with the construction project that has occupied most of his adult life. After the relative triumph of his forecast for the miners he worked pretty much full-time on his long-range models. By 1989, the first year he heard of the idea of man-made climate change, he was ready to sell his formula to the world. Ignoring the traditional model of publication and peer review, ostensibly to prevent others stealing his ideas, he engaged the bookmaker William Hill to construct some weather bets for him with the help of the Met Office. “That went on for 12 years,” he says. “I had 30 bets at £20 each on long-range aspects of the weather each month; betting the average temperature would be below normal, that kind of thing. We made a lot of money that way.” How much is a lot of money? “I made about 40% profits on stake, overall,” he claims. “I would bet £600; I would get an extra £200 back. It would pay the rent basically.” He and his girlfriend at the time no doubt spent a lot of time looking anxiously at the sky. After this marginal success, a little better than putting a wet finger in the wind, some commercial clients came calling. For a while, Corbyn exclusively told the clothes store Etam the optimum time to sell its T-shirts or its hats and scarves. Some farmers were seduced by his predictions of storm and drought. And then the scientific consensus around carbon dioxide as principal climate-changer hardened, and Corbyn’s company, WeatherAction, which floated on the stock exchange in 1997, went back into private ownership after two years. Adversity has only stiffened Corbyn’s resolve, however. Despite his marginal status he is fighting global opinion on all fronts. These days he does the odd presentation for Texan oil companies, or Russian climate sceptics. And he has not given up on a shift of opinion closer to home. “Whatever you think of it all, the net result of these beliefs has been a deindustrialising of the west and the shift of carbon dioxide production from Britain to India and China,” he says. “Labour under Jeremy are now saying we have got to make a special case for steel and various industries that have to pay all these significant taxations on energy costs, which is the reason a lot of them are closing down.” Piers is whispering in the ear of any MP who will listen: “Graham Stringer, of Labour, is sympathetic,” he says, “Sammy Wilson DUP, a number of Tories, Boris is very sympathetic [Johnson tends to use Corbyn, in an unlikely alliance, as his climate guru]. Now I think we have George Galloway which is significant, because he can be very persuasive…” Inevitably, Corbyn has arrived for coffee armed with graphs and charts; so before I go I try to get him to explain how his calculations work. He talks 10 to the dozen about solar magnetic fields and lunar modulation and stratospheric winds. He outlines his database of 200-year-old German weather maps and solar observation from American satellites. “The principle is that all weather that happens has happened before, all storm systems, the question is finding the closest match…” If the results are as good as he claims, I suggest, why haven’t other people picked up on his system? “We haven’t told them how it’s done!” he says. “We had the Solar Weather Technique, ‘SWT zero’. We now have now got the Solar Lunar Action Technique, ‘SLAT’, and we are on version 12CS – s is for special. We have gone through 20 improvements and understandings on this…” As he talks I have the impression of an army of researchers tracking and calculating, poring over maps in order to compete with the Met Office’s supercomputer. When you say “we…” I ask. “I mean me,” he says. “OK” I say. “And what does the system suggest we can look forward to? “It will get much, much colder,” Corbyn asserts (he has lately suggested that in the longer term we are on the verge of a great cooling cycle, which will vindicate him once and for all). “Next month we have a displaced polar vortex situation. Plenty of snow coming.” We both glance out at the spring-like day on Borough High Street. “It’s got a chance, I guess,” I say. Corbyn grins. As he knows only too well, stranger things have happened."
"The strange sight of dead seabirds black against the white snows of winter far from their natural habitat has become an all too common occurrence these days along a wilderness snowmobile trail that runs for hundreds of miles into the wild north of Alaska’s largest city. Worse than the dead birds, though, are the birds seen swimming in the rare pockets of open water along the fast-flowing Susitna and Yentna rivers. These are starving animals still struggling to live, and yet doomed to die prematurely.  Wildlife scientists say the dead and dying birds – 18in tall common murres – are only a few among what might be as many as 100,000 or more of their species losing the battle to survive in the storm-pounded North Pacific Ocean. Since late summer, thousands of murres have washed up dead on beaches along the Gulf of Alaska after apparently dying at sea. Others were strong enough to get airborne in fall or winter only to be swept inland as seasonal storms roiled the offshore waters. An estimated 8,000 dead murres showed up on the beaches near Whittier, an isolated community of only about 220 people 60 miles south-east of here. Thousands more were found dead near Homer, a popular summer tourist destination 125 miles to the south that is home to about 5,000 year-round residents. As yet, no has any clue as to exactly how many carcasses litter the remote and little visited beaches along the hundreds of miles of undeveloped coast that rims the Alaska gulf, according to John Piatt at the Alaska Science Center of the US Geological Survey. The full death count might never be known. Piatt has spent almost 30 years studying Alaska murres and other seabirds. He has seen big die-offs before. He and other researchers estimated 120,000 murres died of starvation in the winter of 1993. About 185,000 were calculated to have perished after being smeared with a mousse-like emulsion of water and oil that spewed out of Prince William Sound and rampaged north across the gulf after the Exxon Valdez oil tanker spilled 11m gallons of crude oil in1989. What has been different this time is the number of dying murres pushed inland by an oscillating jet stream that has played havoc with Alaska weather for the past two winters. Some blame climate change, but climate experts say it is hard determine whether Alaska is witnessing a long-term shift or only a strange, short-term anomaly in a region where the weather is notoriously unpredictable. Whichever the case, winds that normally blow west to east across the Pacific have been eddying into a south to north pattern as the atmosphere swirls like a whirlpool in a river. Starving murres still strong enough to get airborne have found themselves caught in warm, moist winds of up to 100mph roaring north out of the gulf into the heart of the 49th state. Thousands, possibly tens of thousands, of the birds rode these winds until they faded only to find themselves stranded and awaiting death far from their natural habitat. Some birds were pushed over the towering Alaska Range mountains into the bitterly cold Alaska interior hundreds of miles from the sea. Most, however, came to earth near this city or just to the north in the Matanuska-Susitna Valley. Urban Alaskans rallied to save those found on or adjacent to the state’s few roadways.  The Bird Treatment and Learning Center here has taken in 411 murres since October, said director Guy Runco. In a normal year, the center handles 600 to 700 birds of all species. One or two of them might be murres. “It’s really strange,’’ Runco said. Rehabilitating malnourished murres has taxed the center’s finance and its staff of volunteers, and there’s no telling if saving the murres has had any environmental value. Released back into the wild fat and well fed, they could just end up starving again. Murres need to eat about a fiftieth of their body weight in small fish per day to survive. Piatt and other scientists said the birds are obviously having problems finding enough food. The causes could be a decline in forage fish or simply a shift in where the forage fish feed. Some have pondered climate change there, too. The forage fish thrive in cold water, and the water in the gulf has been unusually warm this year. It could be the fish declined because of this – or that they moved away from the normal feeding grounds of the murre as they sought cooler waters. The murre die-off, though dramatic, is not thought to be any threat to the species as a whole given that there are an estimated 2.8 million breeding murres in 230 nesting colonies in Alaska. There are also animals that have benefited from the tragedy of the murres. “The eagles are eating well,’’ Runco said. Alaska’s bald eagles are notoriously efficient scavengers. So, too, the state’s ravens, magpies, coyotes, foxes, mink, weasels and other animals. Jean Gabryszak, whose family runs the remote Yentna Station Roadhouse, said: “The ravens are all fat and happy.’’"
"Demand for electric and plug-in hybrid vehicles is soaring, according to new figures released today by the UK’s Society of Motor Manufacturers and Traders (SMMT). The data shows the number of new cars eligible for the government Plug-in Car Grant scheme rose from 14,532 in to 28,188 last year, an increase of 94 per cent. Zero and low emission vehicles still make up only a fraction of an overall market, with total new vehicle registrations reaching a record 2.6 million. However, demand for alternative fuelled and low emission vehicles is outperforming the wider market across all categories. The auto market as a whole grew 6.3 per cent, but demand for pure electric vehicles rose 48 per cent to nearly 10,000 vehicles and demand for plug-in hybrids soared 133 per cent year-on-year to over 18,000 vehicles. Since the Plug-in Car Grant scheme was launched with its promise of up to £5,000 off the cost of electric vehicles, 47,690 eligible cars have been registered. Conventional hybrids enjoyed a similar strong performance last year with annual demand for petrol hybrids growing 18 per cent to 40,707 registrations and demand for diesel hybrids climbing 36 per cent to over 3,800. Overall, the market for alternative fuelled vehicles rose 40 per cent to 72,775 units, increasing the sector’s market share from 2.1 per cent in 2014 to 2.8 per cent last year. In contrast, demand for diesel vehicles rose just three per cent, as the fall-out from the VW scandal no doubt contributed to the technology’s market share slipping to 48.5 per cent."
"California governor Jerry Brown declared an emergency on Wednesday in a Los Angeles neighborhood where a blown-out natural gas well has been spewing record amounts of global warming pollution. Ten weeks after the 23 October breach was detected, Brown ordered state agencies to make sure Southern California Gas Company, which owns the stricken natural gas storage facility, plugs the leak. “All necessary and viable actions will be taken to ensure Southern California Gas Company: maximizes daily withdrawals of natural gas from the Aliso Canyon Storage Facility for use or storage elsewhere; captures leaking gas and odorants while relief wells are being completed; and identifies how it will stop the gas leak if relief wells fail to seal the leaking well, or if the existing leak worsens,” the order said. The breach had released “major amounts of methane, a powerful greenhouse gas” and caused widespread disruption to local people in the Porter Ranch area, the statement from Brown noted. Experts said the break at the natural gas storage reservoir is the largest known occurrence of its kind.  Methane is dozens of times more warming than carbon dioxide, and the storage facility, which draws on about 100 other wells, is one of the largest in the state. Campaign groups say the broken well has been pumping out the equivalent in carbon dioxide emissions of 7m cars a day. Thousands of people, including schoolchildren, have been evacuated from Porter Ranch to escape the rotten egg smell of the chemicals added to the gas. The declaration follows Brown’s visit to Porter Ranch earlier this week, during which he met residents who have suffered nose bleeds, headaches and nausea from the smells. Such chemicals are commonly used to aid in leak detection. Brown directed his administration to take “all necessary and viable actions” to make sure SoCalGas captures leaking natural gas and odorants. He also asked the company to spell out how it planned to plug the well if its current effort failed. The order bans SoCalGas from injecting more natural gas into the storage site, and it calls for independent monitoring of air quality. Brown also ordered daily inspections and regular testing of natural gas storage wells in the state for leaks. Brown has come under intense criticism from campaign groups for his slow response to the leak. On Wednesday, some of those groups now expressed relief.  “This is a hard-fought win for the residents of Porter Ranch and beyond affected by this noxious blowout,” Alexandra Nagy, an organiser for Food and Water Watch, said in an emailed statement. She called on Brown to shutter the storage facility for good."
"A “modest” uniform carbon tax of £20 a tonne would have a negligible impact on consumer prices, according to a new study that attempts to make the case for wider adoption of carbon pricing policies. The study from the Grantham Research Institute on Climate Change and the Environment and the ESRC Centre for Climate Change Economics and Policy at London School of Economics and Political Science argues that applying the tax to all fuels would increase UK consumer prices by up to just 0.9 per cent, assuming all costs were passed along supply chains fully.  However, the report, which was authored by David Grover, Ganga Shreedhar and Dimitri Zenghelis, argues that the true cost impact on consumers is likely to be even lower, given the manner in which the carbon tax would incentivise green behaviour change, drive business innovation, and provide the Treasury with revenues that it could recycle back into the economy. “In reality [the] impact would likely be still smaller than these estimates suggest because our analysis has not allowed for any of the input substitution, innovation, production method change, or new investment behaviour that industries would exhibit to avoid the cost of carbon pricing,” the paper stated. Opponents of carbon taxes argue they would impose costs on consumers and undermine the competitiveness of carbon intensive industries. Last year the government moved to ease these concerns, exempting a raft of energy intensive industries such as steel and concrete manufacturing from existing carbon taxes and ‘green levies’. However, the new paper argues only a handful of industries that together account for around two per cent of UK GDP would face production cost increases that could result in their international competitive position being compromised. “Carbon policies will provide incentives to increase energy efficiency and resource productivity which could afford UK producers a competitive advantage in the long term, in a world where fossil fuel prices could rise and carbon reduction policies are likely to become more widespread and ambitious,” the paper said. It added that industries that are disproportionately impacted by carbon taxes should be provided with policy support to help them adapt to carbon pricing measures. “The correct policy response is not to resist this change but to identify vulnerable sectors and buffer labour market participants against its sharpest effects,” the paper said. “Countries and firms that resist enduring change and innovation may not be acting in their long-term interests.”"
nan
