"The UK is “woefully unprepared” for deadly heatwaves, according to a cross-party committee of MPs, with the government ignoring warnings from its official climate change adviser. One in five homes dangerously overheats during heatwaves today, the MPs found, while on the hottest day of 2016 alone there were almost 400 heat-related deaths. But climate change has doubled the risk of heatwaves and events even worse than the heat currently baking the nation could occur every other year by the 2040s, the MPs report said, with a tripling of heat deaths to 7,000 a year as a result. Buildings, particularly hospitals and care homes, must be prepared for heatwaves, the MPs said, with sick and elderly people especially vulnerable to heart and breathing problems. But currently the NHS is only required to prepare plans for severe cold weather and there are no building regulations to prevent overheating with ventilation and shading.  The MPs also called for other measures, including formal guidance from Public Health England to relax office dress codes and allow home working during heatwaves, and to head teachers about relaxing school uniform policy. The MPs said a public information campaign on the serious dangers of heatwaves was needed and health minister Steve Brine, giving evidence to the MPs in June, acknowledged this: “Heat alerts tend to be seen as barbecue alerts, as opposed to there being a risk.” Mary Creagh MP, chair of the environmental audit committee, said: “The government has sat on its hands, ignored the warnings of the Committee on Climate Change (CCC) and left the UK woefully unprepared.” As far back as 2003, a severe heatwave saw temperatures reach 38.5C and more than 2,000 heat-related deaths in 10 days, she said: “But the government has continued to allow homes, hospitals and schools to be built that are not resilient to heatwaves.” Kathryn Brown, head of adaptation at the CCC said: “We have recommended to government every year since 2014 that a new standard or regulation is needed to address the risk from overheating in new homes.” Ministers have rejected the advice, citing a commitment to “reduce net regulation on homebuilders”. The government published its updated National Adaptation Strategy on 19 July but Brown said it made no commitment to deal with the issue. “Action is needed now to redouble efforts to tackle overheating – one of the key risks facing the UK from climate change.” Heatwaves are known killers in the UK and the number of hot days is rising. “It is likely that more than 1,000 people have died in the UK as a result of the extended heatwave conditions this summer,” said Bob Ward, policy director at the Grantham Research Institute on Climate Change at the London School of Economics. “There would justifiably be an outcry if more than 1,000 people had died in a flood.”  “The government’s apparent lack of concern about the growing risks of deadly heatwaves is absolutely woeful,” he said. “The lack of communication by government departments and agencies about the risks of heatwaves is contributing to the death toll every year.” The EAC report found that homes in densely populated urban areas, which can be 10C hotter than the countryside, are already at significant risk of overheating, as are certain other buildings, including houses built in the 1960s and 1970s. “The current lack of regulation to prevent overheating, means that new developments, including hospitals and care homes, which will be around for the next 70 years will add to the number of buildings that overheat,” it said. Excess deaths in nursing homes increased more than 40% in some parts of the UK during the 2003 heatwave, the MPs reported, but the homes are still not required to report their readiness to cope under NHS emergency preparedness rules. Heatwaves are also economically costly, the EAC reported, particularly due to lost working days as a result of transport problems. “Only 50% of the UK’s motorways and major roads are surfaced with material that is the most resilient to the kind of summer temperatures the UK is beginning to experience regularly,” the MPs said, while in June, railway tracks buckled in the heat and caused significant delays. Research cited in the report found that in 2010, 5m staff days were lost due to overheating above 26C, resulting in an economic loss of about £770m. The Department for Environment, Food and Rural Affairs did not respond to a request for comment."
"Farmers across northern and central Europe are facing crop failure and bankruptcy as one of the most intense regional droughts in recent memory strengthens its grip. States of emergency have been declared in Latvia and Lithuania, while the sun continues to bake Swedish fields that have received only 12% of their normal rainfall.   The abnormally hot temperatures – which have topped 30C in the Arctic Circle – are in line with climate change trends, according to the World Meteorological Organization. And as about 50 wildfires rage across Sweden, no respite from the heatwave is yet in sight. Lennart Nilsson, a 55-year-old cattle farmer from Falkenberg near Malmo and co-chair of the Swedish Farmers Association, said it was the worst drought he had experienced.  “This is really serious,” he said. “Most of south-west Sweden hasn’t had rain since the first days of May. A very early harvest has started but yields seem to be the lowest for 25 years – 50% lower, or more in some cases – and it is causing severe losses.”  If no rain comes soon, Nilsson’s association estimates agricultural losses of up to 8bn Swedish kronor (£700m) this year and widespread bankruptcies. The drought would personally cost him around 500,000 kronor (£43,000), Nilsson said, adding that, like most farmers, he is now operating at a loss.  The picture is little different in the Netherlands, where Iris Bouwers, a 25-year-old farmer, said the parched summer had been a “catastrophe” for her farm. “Older families around me are comparing this to 1976,” she said. “My dad can’t remember any drought like this.”  The Bouwerses expect to lose €100,000 this year after a 30% drop in their potato crop. After investing in a pig stable over the winter, the family have no savings to cover the loss.   Asked what she would do, Bouwers just laughed. “Hope and pray,” she said. “There is not much more I can do. I wouldn’t talk about bankruptcy yet, but our deficit will be substantial. It probably means we need to have a very good talk with the bank.” If anything, the situation is even worse in Poland, Belarus and the Czech Republic, where vegetation stress has taken hold. In parts of Germany, some farmers are reportedly destroying arid crops. After June was declared the second warmest on record, the European commission pledged to help farmers with a raft of measures, including the temporary suspension of “greening” obligations partly intended to prevent climate change. Farmers who have diversified their crops and invested in irrigation are in a better position to handle extreme weather events, which will become more common as the climate warms. But that is not an option for smallholders with monocultures and little access to irrigation. Jannes Maes, a small dairy farmer in Flanders and the president of the European council of young farmers, said concerns about insolvent farms were rising but were not the only problem.  “Bankruptcies would be hard,” he said, “but the economic loss farmers are suffering is often just as bad because they are hidden bankruptcies that have been prevented by wasting family capital on a farm.”  Thomas Duffy, an Irish dairy farmer from County Cavan, said the drought “won’t break us, but our feeding costs are 50% higher than last year and all the money we’d normally be putting into improving conditions for the cows and infrastructure is now going to silages [winter feed] and buying forage.” The European Drought Observatory (EDO) has described the drought as “an extensive and severe anomaly” affecting Scandinavia, Scotland, Ireland, the Baltics, the Netherlands and northern Germany. A spokeswoman for the EU’s Joint Research Centre, which oversees the EDO, said farmers should prepare to adapt to a warmer climate with “diversification or change of crop types and varieties, but also a more efficient use of water”. All water-related sectors “should be preparing sustainable adaptation measures towards an increase of drought frequency and intensity in the future”, she said."
"The NHS is experiencing a “summer crisis”, with increased emergency admissions and uncomfortable conditions in buildings not equipped for the heat, while the Met Office has warned that the UK temperature record of 38.5C could be broken on Friday. Authorities in Greece are dealing with the aftermath of devastating wildfires that killed at least 85 people, while efforts to control blazes in Sweden and in California continue. In Japan, 23,000 people have been taken to hospital in the past week and the weather described by officials as a “disaster”. In Algeria, a new African record has been set of 51.3C. Weather systems are highly complex and scientists are cautious about assigning specific causes to one-off events. But experts are already pointing to global warming as a driver for the current heatwave, with a study based on computer models and temperature data due to be published by scientists at Oxford University on Friday. Meanwhile, a new report from the environmental audit committee points to the likelihood of more frequent heatwaves in future, and the UK government’s failure to prepare adequately for them.  There’s nothing wrong with enjoying the heatwave, as many people are. Such a long spell of warm weather is extraordinary and, for sun lovers, a treat. No doubt many are hoping it doesn’t break before they take their holidays. But whether or not any more records are broken, or wildfires ignited in the coming weeks, the claim that rising temperatures have nothing to do with the global state of extreme weather must not go unchallenged. When the former US environment secretary Scott Pruitt was asked about climate change following Hurricane Harvey last year, he said that it was not the right time to talk about it. The opposite case is that the aftermath of an extreme event, when the atmospheric conditions have become the news, rather than the backdrop to the news, can be a “teachable moment”, when different kinds of conversations become possible. One of those conversations is the one about adaptation. Since some effects of climate change are now inevitable, we must deal with them. As this week’s committee report says, building regulations must be altered to ensure heat resilience, and new measures must be brought in to improve drainage and water efficiency. The public information campaign that the committee calls for is even more urgent. The 2008 Climate Change Act commits the UK government to reducing emissions by 80% of their 1990 levels by 2050. The latest British Social Attitudes survey showed that more than 90% of British people accept that climate change is happening. But only around a quarter describe themselves as very worried about this. Politicians, along with journalists, scientists and others, have a responsibility to make sure that people know what to expect and can make informed decisions – for example, about how to heat and insulate their own homes. Treating the symptoms of climate change makes no sense if the causes are not tackled at the same time. British laws – as well as the Paris agreement – commit the UK government to doing this, meaning decarbonisation of the electricity supply, heating and transport. These measures have cross-party support, but commitment by politicians is inconsistent. Just a few weeks ago, parliament approved a new runway at Heathrow, a decision that now faces a legal challenge. This week, the government gave approval for fracking in Lancashire, enraging all those who fear that this is proof – combined with slashed solar subsidies, the de facto ban on new onshore wind farms, and the rejection of the Swansea bay tidal scheme – that the government is unenthusiastic about renewables. Enjoy the sun if you can. We only live once and in countries with temperate climates such as the UK not all of the effects of climate change are necessarily harmful. Domestic tourism could even benefit. But don’t lose sight of the suffering caused by higher temperatures. In all our hands rests the future of life on earth."
"In my corner of south-eastern Ireland, even a comparatively modest heatwave has been taking its toll. “We’re just not made for this weather,” said the woman at the petrol station. “It has to end soon.” And, indeed, it did, the rain spilling down that very evening. But though it brought relief to our yellowed fields and gardens, we didn’t need the downpour to grant us a return of sanity – because, unlike the UK, we hadn’t lost our marbles in the first place. It’s a strange thing to look at your nearest neighbour, until a few weeks ago your home, and wonder if it’s losing it. To look at its leaders and movers and shakers and think: “Are they high?” Last week’s corker: stockpiling food on the outside chance that the catastrophically hobbled Brexit talks do not suddenly surge forwards and yield a happy ending. I’ve found myself humming The Quartermaster’s Song (“There are mice, mice, mice/ Running through the rice, at the Quartermaster’s store”) as I think of Dominic Raab counting in the boxes of hardtack and pemmican, growing ever more furious as the supermarket top brass ring to tell him they haven’t any shelf space left.  It is, of course, not funny. We can safely assume that taking back control was never supposed to mean growing our own onions in a window box and bartering scraps of ham on street corners and yet here we seem to be. Add in the latest headlines – health chiefs warning of outbreaks of super-gonorrhoea – and you begin to think that things might be going slightly awry. Ah, a nation of hungry, sun-stroked belligerents with the clap. Meanwhile, two developments of a more cheering, but nonetheless mildly puzzling, nature. Those of a certain vintage will recall Saturday afternoons round at your nana’s watching wrestling on the telly – Mick McManus, Jackie Pallo, Kendo Nagasaki (real name: Peter Thornley), Giant Haystacks (Martin Ruane) and Big Daddy (Shirley Crabtree). These guys had it all: the names, the costumes, the bizarre rituals (Catweazle licking a lucky toad between rounds). They were who we watched when we weren’t watching Leonard Sachs barking up the acts on The Good Old Days and the snooker programme Pot Black, even if you didn’t have a colour set. This was a time when truly sophisticated television – by which I mean Bergerac – was a rare and carefully husbanded treat. But now, wrestling is back! As of teatime yesterday, you can watch Dave Mastiff (aka Human Hate Machine) and Grado (The Chubby Wee) slugging it out, with the addition of two female wrestlers, nicknamed Lilith and Viper. And while Mastiff’s declaration that this new incarnation of British wrestling is “like the punk rock scene used to be” might not bear close examination, I’m willing to get with the 1976 vibe. “Greetings, grapple fans!” And today’s political scene is agreeably amenable to the retro-feel. Young people are declaring themselves communists and free-floating liberals are plotting new parties. Jeremy Corbyn, 40-odd years ago a Haringey councillor calling for free dentistry and the national ownership of everything, hasn’t even had to change his Donovan hat. On the other side of the house, Jacob Rees-Mogg looks like he’s stepped off the front page of the Daily Sketch, where he jumps out of his Triumph Stag to rail against union leaders meeting behind closed Downing Street doors for beer and sandwiches. But in all this disarray, a truly delightful moment, this time courtesy of the 1980s. In Albert Square, Walford, the home of the BBC soap opera EastEnders, residents are about to see a long-lost face, that of Dr Harold Legg, beloved GP and community stalwart. Dr Legg, who appeared in the very first episode, and who subsequently found himself at the heart of several major storylines, many of them also featuring Ethel Skinner and Dot Cotton. What could be more bolstering than the revival of a treasured doctor? One whose fictional back story – his Jewish family driven from the East End during the rise of Oswald Mosley and the British Union of Fascists, but who himself returned to serve and nurture the community – hardly seems out of kilter with the times. The actor who plays Dr Legg, Leonard Fenton, is now 92, and has a career that encompasses such TV series as Secret Army and Shine on Harvey Moon. What a swansong. But nostalgia, as we know, is dangerous, and although these cultural throwbacks and revivals are pleasant, they can’t displace the depth of our current troubles. As numerous experts, including the food writer Jack Monroe and the botanist James Wong, are in the process of pointing out, the potential shortage of food and medicines will have a disproportionately grave effect on those least equipped to withstand them, and even the apprehension of the instability and duress they will cause is damaging. In the heat of the last few weeks, it seems as though people were losing their minds and were driven to ever more ingenious ways of keeping cool. One such was the idea of drenching a sheet in cold water, then wrapping it around oneself before attempting to sleep. But as the mercury dips – for now at least – the country and those gifted its governance need to be careful that a cooling swathe of linen doesn’t become a winding sheet.Put more simply: it’s time to get a grip. • Alex Clark is an Observer columnist"
"Eleven teams participated in a recent Stanford Energy Modeling Forum (EMF) project, examining the economic and environmental impacts of a carbon tax. The studies included “revenue recycling,” in which the funds generated from a carbon tax are returned to taxpayers either through regular household rebate checks (similar to the Citizens’ Climate Lobby [CCL] and Climate Leadership Council [CLC] proposals) or by offsetting income taxes (similar to the approach in British Columbia). Among the eleven modeling teams the key findings were consistent. First, a carbon tax is effective at reducing carbon pollution, although the structure of the tax (the price and the rate at which it rises) are important. Second, this type of revenue-neutral carbon tax would have a very modest impact on the economy in terms of gross domestic product (GDP). In all likelihood it would slightly slow economic growth, but by an amount that would be more than offset by the benefits of cutting pollution and slowing global warming.  Meanwhile, House Republicans are again on the verge of introducing a Resolution denouncing a carbon tax as “detrimental to American families and businesses, and is not in the best interest of the United States.” The modeling teams examined four carbon tax scenarios, with starting prices of $25 or $50 per ton of carbon dioxide, rising at 1% or 5% per year. These are somewhat modest policy scenarios; CCL proposes a starting tax of $15 per ton rising at $10 per year, and the CLC proposes $40 per ton rising around 4% per year. The most aggressive policy considered by the Stanford EMF teams ($50 per ton rising 5% per year) falls in between these two proposals. The modeling studies consistently found that for all four carbon tax policies considered, whether the revenue is returned via rebate checks or by offsetting income taxes, the direct economic impact is minimal: in every policy scenario, in every model, the U.S. economy continues to grow at or near its long-term average baseline rate, deviating from reference growth by no more than about 0.1% points. We find robust evidence that even the most ambitious carbon tax is consistent with long-term positive economic growth, near baseline rates, not even counting the growth benefits of a less-disrupted climate or lower ambient air pollution The last sentence is critical. The analyses consistently found that coal power plants would be the biggest losers if a carbon tax were implemented, and the costs associated with health impacts from other pollutants released by burning coal (e.g. soot and mercury) are substantial. Phasing out coal power plants results in significant health and economic benefits to society.  So does slowing global warming, of course. A working paper recently published by the Federal Reserve Bank of Richmond concluded that US economic growth would slow by an extra 0.2–0.5% per year if we stay on our current climate path (3–3.5°C global warming) than if we meet the 2°C Paris target. This compares favorably to a less than 0.1% per year slowing of the US economic growth rate under the carbon tax scenarios. In short, climate change will slow American economic growth. If we don’t curb global warming, the economic impact will be larger. If we implement a carbon tax to help meet the Paris climate targets, the economic impact will be negligible, and will be offset by the benefits of phasing out dirty coal power plants. The Stanford EMF studies also consistently concluded that a carbon tax is an effective way to curb carbon pollution, especially in the power sector: carbon price scenarios lead to significant reductions in CO2 emissions, with the vast majority of the reductions occurring in the electricity sector and disproportionately through reductions in coal … Expected economic costs (not accounting for any of the benefits of GHG and conventional pollutant mitigation), in terms of either GDP or welfare, are modest The analyses also found that the rate of increase of the carbon tax was more important than the starting price. For example, a tax of $50 per ton of carbon dioxide rising by 5% per year would cut carbon pollution 33–56% by 2040. A tax of $25 per ton rising 5% per year cuts it by 25–50% by 2040. However, the policies including a tax increasing at just 1% per year would result in a short-term cut (of about 20–40%), but carbon pollution would remain stable at those levels.  These results suggest that the most effective carbon tax might start relatively low to give taxpayers time to adjust, but increase rapidly over time, similar to the CCL proposal, which a separate report projected to cut carbon pollution 52% by 2040. The Stanford EMF studies also found that returning the tax revenue by offsetting income taxes was slightly more beneficial for the economy than using dividend checks as the rebate mechanism, but the former is a regressive policy and the latter is progressive. Real-world examples demonstrate that pricing carbon pollution is smart. British Columbia’s emissions have fallen as its economy has continued to grow. California’s carbon cap and trade system has helped the state meet its climate targets 4 years ahead of schedule, while its economy has flourished. NEWS RELEASE: Climate pollutants fall below 1990 levels for first time ➡️ https://t.co/8FaHsL8rXD #AB32 #SB32Achievement roughly equal to taking 12 million cars off the road or saving 6 billion gallons of gasoline a year #ActOnClimate pic.twitter.com/bVRCGpX4vh Economic analyses consistently show that cutting carbon pollution will benefit the economy, and that a revenue-neutral carbon tax is an efficient way of accomplishing that goal. That’s why there’s a 95% consensus among economists that the US government should commit to cutting carbon pollution, with 81% favoring a market-based solution like a carbon tax."
