"Directing proceedings from a stage emblazoned with BP’s green and yellow sunburst livery, chairman Carl-Henric Svanberg appeared aglow with satisfaction at the oil-and-gas group’s shareholder meeting two weeks ago as plaudits rained in from the unlikeliest quarters. Environmentally concerned investors, led by those acting for the Church of England, were queuing up to shower Britain’s biggest fossil fuel company with praise for what they saw as the board’s “completely unprecedented” decision to endorse a resolution tabled on climate change by a coalition of activists, some of whom had links to BP’s fiercest critics. Bill McGrew, global governance manager at America’s largest pension fund Calpers, had flown to London especially. “Calpers says thank you to BP … for its leadership on this issue,” he told the meeting. Helen Wildsmith of CCLA, which manages £1.5bn of funds for the Church of England, said: “I would like to thank you for the constructive engagement we’ve had with BP … the company’s support for this resolution demonstrates both leadership and responsiveness to shareholder concerns.” But a series of Guardian interviews with activist shareholders raises uncomfortable questions about the extent to which leading campaigners collaborated with oil firms behind closed doors, leaving a misleading impression of a dramatic victory for environmentalists. When it came to the voting, the BP resolution — thanks in large part to an endorsement from the board — won near-unanimous support, backed by 98% of shares cast. The result was heralded as a famous victory.  Catherine Howarth, chief executive of ShareAction, whose members include Greenpeace and Friends of the Earth, described it as “an important day for shareholder democracy”, adding: “Climate change is everybody’s business, and today proves it.” Five years earlier, ShareAction (then called FairPensions) had led an earlier activist campaign at BP and Shell, forcing climate change resolutions on to the meeting agenda. On that occasion, the resolution had been called for the companies to review their investments in Canadian oil sands. Both BP and Shell responded by advising investors to vote down the proposals. They were duly rejected, each, coincidentally, by the same margin of 94%. ShareAction played only a supporting role in this year’s resolution and a spokesman made clear it had not been involved in discussions with BP. He said the campaign group was proud of the vote, adding: “We’re glad the Guardian is asking questions that prompt all of us to consider what the next generation of investor engagement [with companies] might look like.” Investor-requisitioned ballots are a rarity. Ordinarily, resolutions at stock-market-listed companies are drafted under the authority of the board; few stray beyond the dry and uncontroversial requirements of company law – the re-election of directors, the appointment of auditors, etc – and most pass on a wave of strong support from institutional shareholders. Of those shareholder-generated resolutions that do make it on to meeting agendas, most are drafted by investors hostile to management. Typically they are advanced by financially motivated shareholders seeking to overturn board policy, or even oust directors. But, however unorthodox BP’s vote appears, it looks set to be quickly replicated next month by similar activist interventions at two other oil groups. Landslide votes are expected in the Netherlands at Shell, and in Norway at Statoil, after their respective boards announced support for climate change resolutions tabled by many of the same activists behind the BP vote and almost identical in substance. Each calls for greater disclosures from the companies about how climate change might affect their future business. Revealing Statoil’s support at the end of last week, the company told shareholders: “Statoil’s board welcomes shareholder interest in better understanding the company’s risk exposure and strategic approach to climate change … [and] recommends the general meeting to support the proposal.” But the Guardian has learned that, behind the scenes, it was in fact Statoil which first made contact with the activists, not the other way round.  Wildsmith said: “[Statoil] called us up and said: ‘We’d find it really useful to have a shareholder resolution like this [the BP resolution], can some of your co-filers quickly get themselves together and file something for us?’.” In a statement, Statoil described the conversation differently. It explained that every year it contacts shareholders it suspects might put forward resolutions. This was “to assist them on the practicalities”.  The statement added: “We did not ask for the [climate change] resolution to be filed … [and] how the board would assess the suggested resolution was not part of our dialogue [with activists].”  But Guardian interviews with activist shareholders repeatedly raised questions about the extent to which the shareholder resolutions had been contrived for presentational effect, and whether later endorsements from company boards had been stage-managed. Wildsmith, who led activist efforts that culminated in the BP resolution, told the Guardian activists had received “input” from BP while they were drafting the resolution wording. The campaigners later met with Svanberg in early December and BP had privately signalled in advance it expected to endorse the resolution, she said. Such was the strong agreement between BP and activists on the eventual wording of the resolution, Wildsmith recalled, that an option to drop plans for a vote – instead allowing BP to quietly adopt the agreed measures – was discussed, but rejected. In a statement, BP said: “While there was consultation and engagement before filing, BP did not influence the wording of the resolution, the decision to file was that of the shareholders alone and BP took no decision on whether to support the resolution until after it had been formally and properly filed and carefully considered.” The BP resolution had been filed in January and the company announced the board had decided to endorse it on 5 February — well in advance of the shareholder meeting which took place 12 days ago. Days earlier, Shell had announced that its board was backing a near-identical resolution. Shell declined to answer questions about its dealings with activists. A spokesman said: “Shell has extensive ongoing engagements with investors.”  Wildsmith told the Guardian: “It took two months to write the BP shareholder resolution. Every word has been carefully crafted. We had input from the company … We listened very carefully and thought about what they [BP] were saying.” From the outset, Wildsmith had made clear that the activist coalition she had been building since 2011 wished to create a “new normal” for shareholder resolutions. Proposals from the group were to be deliberately drafted with a reasonable hope of winning board endorsement, in contrast to the traditionally hostile resolutions previously tabled by activists. This new approach was described as “stretching but supportive” of the board. But the climate change resolutions have been accused by some of requiring very little new of BP, Shell and Statoil. One commentary from Reuters’s investment blog Breakingviews argued: “Demands are hardly taxing, so a refusal [by the board] might look defensive.” It added: “The information [demanded in the resolution] will give investors a way to measure progress, but is otherwise pretty benign for now. It’s not as if the coalition is trying to force the company to suddenly change how it does business.” Another source, who was involved in activist efforts, admitted the resolution was “woolly”, with much hinging on how it was interpreted by the companies. A second long-standing shareholder activist not involved in the coalition, told the Guardian the proposals asked companies “to do something that was not particularly stretching and that many companies were already doing”. Ian Greenwood, of the West Yorkshire pension fund, who acted as deputy to Wildsmith on the BP resolution, said it marked “a change in the way [shareholders] do engagement” with companies. “This demonstrates that if you work with the company over a period of years … you can come to something which is actually beneficial to them, and they can demonstrate to the markets they’re doing something that major institutional shareholders think is the right thing to do.” Describing the activists’ private meeting with Svanberg, Wildsmith said: “We met with the chairman of BP right at the beginning of December. Everybody talked about the fact they were going to take it [the resolution] in the spirit intended — which was a big hint that they were going to support it, but obviously they needed to go through board meetings … It’s certainly fair to say that we took away a strong clue; it’s not fair to say everyone shook hands on a deal.” According to Wildsmith, such was BP’s support for the proposal in early December that there was a even talk of ditching the resolution and simply allowing BP to adopt the climate change disclosure commitments without further investor involvement. “We did have that discussion: do we just put the resolution in the filing cabinet now and say it’s done its work? We all decided we needed this moment [at the shareholder meeting] where you get to vote for it. “Resolutions help amplify the voice of the long-term investor because the short-term signals in the marketplace are so strong. Having this vote … stays there on the books, year after year, reminding everybody that us – the providers of capital – are really interested in how this company manages itself through this complex, multi-decade, low-carbon transition to everybody’s benefit.” Wildsmith said she was aware tactics used by her coalition risked being criticised by some investors for being “overly inventive” but nevertheless argued “supportive resolutions” were emerging as a valuable new tool for long-term investors. “We’re trying to do something different here. We’re trying to create a new sort of shareholder resolution – a ‘board-supported shareholder resolution’ … It’s almost everybody saying: ‘The long-term matters here.’”"
"Australia should aim to slash its greenhouse gas emissions by 30% by 2025, compared with 2000 levels, in order to catch up to other countries’ efforts and prove it is a “good global citizen”, according to a Climate Change Authority review. The CCA, an independent statutory agency that advises the government, also recommended that Australia ramp up its emissions cuts even further by 2030, within a target range of 40% and 60%, again based on 2000 levels. The report restates the authority’s position that Australia should raise its immediate emissions reduction target from 5% by 2020 to 19% by the same year, warning that in the absence of stronger action “the task of achieving credible 2020 and subsequent targets will become progressively more challenging.” The Australian government has issued a discussion paper on what the country’s post-2020 emissions target should be, ahead of crunch UN climate talks in Paris in December. The US has already committed to a 26-28% cut in emissions below 2005 levels by 2025, while the European Union has a goal of a 40% cut on 1990 levels by 2030. China has agreed to peak its carbon output by around 2030, while the UK, Russia and Germany have all also submitted new targets. Australia, by comparison, has missed a UN deadline to reveal its post-2020 emissions target and has faced questions from China, the US and Brazil over the effectiveness of its Direct Action policy, which replaced the carbon pricing system, scrapped by the Coalition last year. The CCA report notes that while Australia contributes only 1.3% of the world’s greenhouse gas emissions, its fossil fuel-heavy economy is the largest per capita emitter in the industrialised world and that its efforts “should be comparable with those of other wealthy developed countries and free of any special pleading.” The report adds that it is in Australia’s interests to keep to an internationally agreed goal of limiting warming to 2C above pre-industrial times, noting that if this limit is breached, the Great Barrier Reef will be greatly diminished, the number of heatwaves will soar and southern Australia could face an 18% drop in spring rainfall by 2090. Bernie Fraser, chairman of the CCA, said that if the 30% target was adopted, Australia would still be an “outlier” in terms of high per capita emissions but it would gain credibility at the Paris talks. “This would likely be considered the behaviour of a good global citizen, and go some way to answering those who have questioned Australia’s commitment to climate change policy in recent times,” he said. “It would also give Australia the right to expect other countries to behave in like fashion.” However, Fraser said that Australia will have to work hard to catch up with other countries and that failure to beef up the current climate policy – which several experts doubt will achieve the 5% goal – will make it “pretty challenging” for the country to meet a 30% reduction target by 2025. “We are starting behind others in this race and the others aren’t slowing down,” he said. “The US and others are planning to increase the pace of their gallop. “If Australia were to put together an effective package of measures, we could get to the 30% target.” The CCA has previously raised doubts over whether Direct Action, which pays businesses that wish to reduce their emissions, will ensure the 2020 target is met but Fraser said it may be enough due to “slackness” in the economy, which pushes down energy consumption. It remains to be seen how closely the government will ponder the CCA’s recommendations, given that it tried and failed to scrap the advisory body. “We haven’t got a very good strike rate,” Fraser said. “We did recommend a rather more ambitious target than the minus 5%, but that didn’t get much of a run. “We recommended that the large scale renewable energy target scheme remain at 41,000 gigawatt hours and that didn’t get much favour. So that’s two strikes and we’ve stepped up to the plate for a third time. Let’s see what happens this time.” The CCA will produce further reports on the costs and methods of achieving its recommended emissions reduction."
"Shell warned on Thursdaythat further jobs and investment are at risk in the North Sea as it slashed annual global spending by a further $2bn (£1.3bn) and reported a 56% slump in first-quarter profits. The Anglo-Dutch oil group also said there would be no slowdown in its controversial plans to start drilling in the Alaskan Arctic this summer where it hopes to discover large-scale oil reserves alongside evidence of gas found in the past.  Shell accepted the Guardian’s Keep it in the Ground Campaign had raised the profile of climate change but said it believed divestment from fossil fuel companies could be counter-productive. Simon Henry, the chief financial officer, said the planned takeover of rival BG could be a “springboard” for further cutbacks, adding that Shell “is not necessarily a natural owner of assets in the North Sea but there are other companies who may well have more expertise” given the age of those energy fields.  Shell cut 250 jobs from its UK offshore base at Aberdeen last summer and signalled others could go as the oil company announced a further reduction in its overall global spending from $35bn to around $33bn this year. Henry said positive North Sea tax changes by the government and the establishment of a new Oil and Gas Authority had only gone so far. “[Ministers] have to move quickly to make it attractive – at the moment its not.” Hit by a massive fall in oil prices since last summer, Shell’s first-quarter earnings, excluding one-time items, fell from $7.33bn to $3.25bn.  Profits for the first three months of 2015 at Shell’s exploration and production arm plunged from $5.7bn a year to $675m. However, profits from downstream operations - which include refining and other non-production businesses - rose from $1.58bn to $2.65bn . That increase helped group earnings exceed analysts’ average forecast of $2.42bn. Shell’s key international rival, Exxon Mobil, also unveiled a big downturn. Its first quarter earnings slumped46% slump to just under $5bn. That was also ahead of Wall Street expectations, because refining margins benefited from lower input costs - but they were still the weakest figures since 2009. A second US oil group, ConocoPhillips, performed even worse plunging to a $222m underlying loss.  Exxon chief executive, Rex Tillerson, told an industry conference last week that low oil prices are “going to be with us for a while.” Shell’s chief executive Ben van Beurden said: “Our results reflect the strength of our integrated business activities against a backdrop of lower oil prices. In what is clearly a difficult industry environment, we continue to take steps to further improve competitive performance by redoubling our efforts to drive a sharper focus on the bottom line in Shell.  The Shell boss said the business had sold assets worth more than $2bn so far this year “as we successfully reduced our onshore footprint in Nigeria.”  He said Shell was cutting costs and capital spending; and expected to make further savings by “deferring and reshaping new projects.” The items excluded from Shell’s earnings included a gain of $1.4bn from selling operations and a credit of $600m resulting from tax cuts on North Sea operations announced in the budget. BP’s first-quarter results beat City forecasts on Tuesday due to strong downstream business and because it accounted for the full expected benefit of the North Sea tax cuts. Like Shell, BP’s exploration and production business suffered a profit slump caused by the collapse in the oil price. Shell said it would be slowing investment in US shale, Canadian oil sands and Iraq to conserve cash but was determined to press ahead with its plans to take a 25-vessel “armada” to drill in the Chukchi Sea off Alaska in the coming months. Henry said climate change was a “very serious issue” and had noted the divestment push in the Guardian’s Keep it in the Ground campaign. It was up to shareholders whether they bought or sold Shell stock, he said. There was a danger that new investors, he argued, may be less interested in a” grown up dialogue” about global warming. “I’m not sure it’s an improvement in transparency or corporate governance or a proper discussion around the impact of climate change.”"
nan
"The future has a long history in art. Romantic painters loved to picture what the great buildings of their time would look like as ruins. The architect Sir John Soane commissioned the artist Joseph Gandy to paint Soane’s masterpiece the Bank of England not as it looked when spanking new, but as the grand vision of decay it would one day become. Soane’s apocalyptic fantasy of his own building was probably influenced by the French painter Hubert Robert, who in 1796 pictured the Louvre as a roofless ruin overgrown with weeds. The art of Pablo Genovés resurrects and restages such visions of architectural catastrophe. In his series Precipitados, this contemporary Spanish photographer creates grand European interiors – opera houses, libraries, baroque palaces – in which floods of water or seas of sand push against bookcases, inundate staircases, crash into wrought-iron gates.  In one picture, Genovés imagines the sea surging into the Louvre’s Grande Galerie – a direct quotation of Hubert Robert’s sublime dreams. It is his passion for European architecture that makes this horror picture show so distinctive. The power of these photomontages is in the collision of timeless cultural grandeur with overwhelming natural destruction. The imagery is haunting: books and art, memory and history are all about to be lost. There is, of course, one great difference between earlier artistic impressions of the end of civilisation and these contemporary cataclysms. Today, the end of the world as we know is not a romantic fantasy, but a potential reality. Overwhelming scientific evidence minutely charts human-caused climate change. Sombre analyses carefully map the likely consequences of melting ice caps and rising sea levels on a precise timeline. We can’t look at these surreal images as playful acts of imagination; they are reasonable predictions. These nightmares have already been seen, not as art but as news. Hurricane Katrina caused scenes as strange and monstrous as those by Genovés. When part of New Orleans lay underwater a decade ago, photographers did not need any special effects to find apocalyptic images of inundation. Hurricane Sandy afforded similarly stupendous images of devastation on the east coast of the US. The west of England also became a diluvial waterscape in February 2014. Genovés creates haunting visions of apocalypse with the enthusiasm of a consummate catastrophist. But every day the flood becomes less mythic; every day, the evidence grows to make these monstrous images more prosaic. The elemental death of civilisation was once a dark theme for imaginative artists. Today, it is a pressing and all too real emergency that our imaginations struggle to comprehend."
"Invest in renewable energy, protect indigenous land rights, plant drought-tolerant crops, build strong and sturdy housing – the list of ways to mitigate and adapt to the effects of climate change goes on, but what are the best ways to communicate them? For climate campaigns, the difficulty often lies in representing the full global scale of the issue without appearing too emotive or dramatic. Conversely, those only featuring a small part of the picture can be accused of being too simplistic.  The 2009 film, Lessons of the Loess Plateau, looked at the large-scale environmental restoration project undertaken in northern China. The documentary shows how the stark and dusty wasteland was transformed into a luscious agricultural landscape. Pragmatic and results-focused communications are compelling – the film shows the huge potential of environmental restoration – but with such a complex issue, perhaps a variety of approaches should be used. So what are the most effective ways to present climate solutions? Is it time to change the language used in climate campaigns? What is the role of social media and what innovative tactics are out there? Join an expert panel on Thursday 30th April, 1–3pm BST, to discuss these questions and more.  The live chat is not video or audio-enabled but will take place in the comments section (below). Get in touch via globaldevpros@theguardian.com or @GuardianGDP on Twitter to recommend someone for our expert panel. Follow the discussion using the hashtag #globaldevlive. Panel Adrian Yeo, community organiser, #PowerShiftMsia, Kuala Lumpur, Malaysia, @ninoamigo, @PowerShiftMsia Adrian is a community organiser, strengthening civil society to take action on climate change Hoda Baraka, global communications manager, 350.org, Cairo, Egypt, @hodabaraka, @350Hoda is an environmentalist, currently leading worldwide communications for 350.org, a global climate campaign Jamie Clarke, executive director, Climate Outreach Information Network, Oxford, UK, @climateoutreach, @JamieWClarkeJamie runs the Climate Outreach Information Network, Europe’s leading climate communication organisation Esther Agbarakwe, founder, Nigerian Youth Climate Coalition and #ClimateWednesday, Abuja, Nigeria, @estherclimateEsther is a campaigner, working on environmental sustainability, social and environmental policy analysis, and biodiversity conservation Wael Hmaidan, executive director, Climate Action Network, Beirut, Lebanon, @whmaidanWael has campaigned on climate change and sustainable development for 20 years and leads the Climate Action Network. Elke Weber, professor of international business, Columbia University, New York, USElke founded and co-directs the Centre for Research on Environmental Decisions  Richard Munang, climate change programme coordinator, United Nations Environment Programme - Africa, Nairobi, Kenya, @mtingemRichard coordinates Unep’s regional climate change programme in Africa, focusing on policy and action Emma Pinchbeck, head of climate and energy, WWF-UK, Woking, UK, @ELPinchbeck, @wwf_ukAs head of WWF UK’s team of energy and climate policy experts, Emma leads the organisation’s work on reducing carbon emissions "
nan
nan
