"Climate change is the single greatest security threat to the Pacific, and all countries must meet their commitments under the Paris climate agreement, the 18 countries of the Pacific Islands Forum said on Wednesday. The first assertion of the strongly worded Boe Declaration says all Pacific nations, including Australia, “reaffirm that climate change remains the single greatest threat to the livelihoods, security and wellbeing of the peoples of the Pacific, and our commitment to progress the implementation of the Paris agreement. “Leaders reaffirmed the importance of immediate urgent action to combat climate change and … called on countries, particularly large emitters, to fully implement their … mitigation targets, including through the development and transfer of renewable energy, in line with committed timeframes.” Leaders of the Forum Islands countries also called for the US to return to the Paris agreement and the commitments it made under President Barack Obama. The Boe Declaration said the security challenges being faced by Pacific nations were broader and more complex than in previous generations. The forum committed its members to addressing humanitarian assistance, environmental and resource security, transnational crime and cybersecurity. Australia will work with regional security agencies to establish a Pacific Fusion Centre to better share intelligence and target threats including illegal fishing, drug trafficking and other cross-border crimes. But the forthright declaration on climate is awkward politically for Australia, with its new prime minister, Scott Morrison, apparently at odds with his own government’s Energy Security Board over whether Australia will meet its Paris targets of a 26% reduction in emissions from 2005 levels. The government does not have any emissions reductions policies in place to achieve the target. Morrison told a radio program on Wednesday that “the business-as-usual model gets us there [meeting the Paris targets] in a canter”. But the Energy Security Board said business as usual – and a failure to implement the now-discarded national energy guarantee – would mean the electricity sector would “fall short of the emissions reduction target of 26% below 2005 levels”. The Australian government’s apparent ambivalence towards a low-emissions climate policy has disquieted its Pacific neighbours. As a region, the Pacific has produced the least carbon of any areaon Earth but its citizens have felt the impacts of climate change first, and most acutely, through rising seas, increased salinity, and more frequent and severe natural disasters. Low-lying island Pacific countries including Kiribati are forecast to be among the first on the plant to disappear underwater if rising sea levels are not arrested. Xavier Matsutaro, the national climate change coordinator for Palau, a small nation in the north-west Pacific, told the Guardian Australia’s relationship with the Pacific was “dysfunctional”, adding that Australia was also responsible for diluting the strength of previous regional declarations on climate change. “Australia is a bit of an anomaly, because on the floor [of climate summits] they’re basically sometimes as far right as Trump in some of their views on climate change, at one point they even denied that it existed … But then on a regional basis they’ve actually given a lot of support to our region,” Matsutaro said. “Sometimes the way I think about it ... it’s like you’re in a relationship and you get abused by your spouse but at the same time they feed you and clothe you and things like that,” he said. “You could say it’s a bit of a dysfunctional relationship.” In a blistering speech in Sydney last month, Samoa’s prime minister, Tuilaepa Sailele, called climate change an “existential threat ... for all our Pacific family” and said any world leader who denied climate change’s existence was “utterly stupid”."
"The trade minister, Simon Birmingham, has claimed Australia will honour its Paris climate agreement commitments but failed to name a mechanism for emissions reduction in government policy. In the wake of the Coalition government removing the emissions reduction component from its signature national energy guarantee before Scott Morrison replaced Malcolm Turnbull, the issue is shaping up as a major test before the Wentworth byelection. Turnbull’s son Alex has spruiked for donations on behalf of Labor’s candidate Tim Murray, citing energy policy as a key consideration when the progressive Liberal inner-city electorate goes to the polls. On Sunday Birmingham said that Morrison “has made very clear we will continue to honour our commitments” including the Paris climate agreement, as Australia had done for the first and second round of Kyoto targets. “We continually see, in terms of that abatement target required to meet the 2030 targets, that gap is closing with each update and we’ll continue to work on the policy settings to make sure that is achieved,” he told Sky News. Asked if this would include emissions reduction in the electricity, agriculture or transport industry, Birmingham said the government would “encourage adoption of new technologies and new practices, all of which have played a big role meeting targets to date”. “We will continue to watch closely in terms of the projections around the abatement task and work hard to make sure Australia meets and fulfils our obligations.” On Saturday Scott Morrison said that Australia’s commitments to its Paris targets “haven’t changed”. “Australia stands on its record. I mean, we hit our first target, exceeded it by 128m tonnes,” he told reporters in Indonesia. “We’re on track to meet our second Kyoto target and exceed it by 294m tonnes.” Alex Turnbull has intervened in the Wentworth campaign over the issue of energy policy, calling for donations Labor’s candidate for Wentworth on Twitter. He cited the need for a federal integrity commission, donations reform and a “sane energy policy”. Best bang for the buck you'll get in political donations in your life. Tight race, tight margin for government, big incremental effect whatever happens. If you want a federal election now this is the means by which to achieve it. https://t.co/YgTQGhQwBa At a press conference in Sydney, Morrison played down Turnbull’s intervention, suggesting that “I’m sure Alex’s only message today is happy father’s day to Malcolm”. Asked if it was odd that Turnbull’s son was seeking donations for the Labor candidate, Morrison said it “strikes [him] as a democracy”. Far from staying silent on Sunday, Turnbull doubled down on his earlier comments, arguing that “the market disagrees” with the proposition that the Liberal Party’s energy policy will reduce wholesale prices. “Paris agreement had zero impact on prices [by the way],” he said. Turnbull argued that energy market participants had an incentive to correctly predict the trajectory of prices. “It is crystal clear what those with the right incentives think about what scrapping the Neg means – prices will rise.” On Sunday the former member for Wentworth – Liberal Peter King – signalled his intention to seek preselection.  Appearing on Sky New’s Outsiders, King suggested the ideal candidate for Wentworth would be someone with experience, “not associated with big business”, with resources and “campaign muscle” who has shown “through his public record he has the long-term interests of the community at heart”. King did not articulate a vision for emissions reduction, instead focusing on the need to lower power prices. “We’re exporting our coal and our gas to India and China, they’re then using it to produce cheap power and selling back products to us at a higher rate – so we lose out twice,” he said. King argued that renewable energy is given $2.8bn a year in subsidies – a figure generated by the Minerals Council most of which is accounted for by solar feed-in tariffs provided by state governments. King suggested that blockchain technology could be used so that “if you want to pay more for green power, fine, but if you’re doing it tough or want to pay less you ought to have that opportunity too”."
"Britain has thousands fewer electric car charging points than required because councils are frustrating their rollout, according to one of the country’s biggest energy companies. Big six energy firm SSE said that when it started work three years ago, it had hoped to install 6,000 charging points in London by now, but had fitted just 762 because of delays by local authorities.  The company is the contractor putting in the chargers for the Source London network, run by French firm Bolloré. Sadiq Khan, the mayor of London, has backed electric vehicle infrastructure to help clean up the capital’s dirty air, but his rhetoric has reportedly not filtered down to the local level. Slow decision-making and bureaucracy in councils, coupled with different approaches to charge points across the capital’s boroughs, are understood to have hamstrung the rollout. Kevin Welstead, the sector director for electric vehicles at SSE Enterprise, said: “Progress has not been rapid. The issue is that we have to effectively negotiate with each of the 33 individual London boroughs so we can install charge points alongside their parking bays and some are more progressive on the electric vehicle agenda than others.” The Guardian understands that 130 charging points are in limbo in Southwark, a borough which is otherwise seen as good on electric cars. While the points were given planning approval in 2016, permission has not been given by highways management, meaning they cannot be installed. Planning permission expires next year. Welstead said ministers and Khan had rightly supported electric vehicles, but added: “Our experience as an infrastructure provider on the ground is that this message has not seeped all the way through.” One possible reason for holdups could be the financial problems that austerity has imposed. Cuts to central government grants have led local authorities to shed staff, including those on transport teams, and remaining staff are understood to be stretched to capacity. We’d like your help to find out more about current or future cuts to
UK council services. If you’re aware of any where you live, please get
in touch. You can share your knowledge and possible news tips by filling in this encrypted form
– anonymously if you wish. One of our journalists may be in touch and we will consider some
of your responses in our reporting. You can
read terms of service here. Another explanation could be that some boroughs are not seeing much demand from constituents, so are not prioritising approvals. There has also reportedly been a growth in very localised opposition, including in conservation areas. However, there are hotspots of demand for charging points, including Camden, Islington, Kensington & Chelsea, Hammersmith & Fulham and Southwark. The mayor of London launched an electric vehicle infrastructure taskforce in May, focused on “rapid chargers”, not the slower chargers that comprise most of the Source London network. There are nearly 4,000 charging points in London, according to Zap Map. London Councils, which represents the city’s 33 boroughs, denied holding back the switch to electric cars. Councillor Julian Bell, who chairs the group’s transport and environment committee, said: “London boroughs are committed to supporting environmentally friendly transport and are leading the way in delivering an effective network of electric vehicle charging points across the capital.” He added that boroughs also had “a duty to consider the needs of pedestrians and other road users and to make sure these services are delivered to high standards”. Southwark council did not deny that 130 chargers were in limbo, but said it had 100-150 lamp-post electric car charging points planned for the next 12 months."
"Australia’s relationship with the Pacific region on the issue of climate change has been described as “dysfunctional” and “abusive” – providing aid to the region to deal with the effects of global warming but undermining attempts to halt its progress, according to a climate change representative for the Pacific nation of Palau. Xavier Matsutaro, the national climate change coordinator for Palau, a small nation in the north-west Pacific, said Australia’s relationship with the Pacific was “dysfunctional”, adding that Australia was also responsible for diluting the strength of previous regional declarations on climate change.  “Australia is a bit of an anomaly, because on the floor [of climate summits] they’re basically sometimes as far right as Trump in some of their views on climate change, at one point they even denied that it existed … But then on a regional basis they’ve actually given a lot of support to our region,” said Matsutaro. “Sometimes the way I think about it ... it’s like you’re in a relationship and you get abused by your spouse but at the same time they feed you and clothe you and things like that,” he said. “You could say it’s a bit of a dysfunctional relationship.” Matsutaro spoke to the Guardian in Palau a week before leaders, including Palau’s minister of state Faustina Rehuher-Marugg, met in Nauru at the Pacific Islands Forum, where climate change was a key issue discussed by the group.  Leaders are set to sign a new security agreement that labels climate change as the “greatest threat” to the Pacific region. Citizens of the region have been among the first to feel the effects of climate change, with rising sea levels and increased natural disasters in the region. The summit comes at an awkward time for Australia, as the new prime minister, Scott Morrison, faces pressure from some members of his party to abandon Australia’s commitment to reducing emissions under the Paris agreement. Matsutaro said Australia, which has historically been the key aid partner for the Pacific region, had supported projects in Palau related to climate change, including a coastal erosion project and research on coral bleaching. Australia even provided research on the impact of climate change on Palau which formed the basis for a section of Palau’s climate change policy. But when it came time to make commitments on climate change, Matsutaro, who has attended COP meetings on Palau’s behalf for the last five years, said Australia was regularly out of sync with the rest of the region, and was responsible for diluting the strength of resolutions on the environment. “They’re responsible for making our declarations weaker sometimes in the region. So there’s been forums that were formulated so [Australia] won’t be involved in it, they’re not members, so that whatever language that really reflects our views and our circumstances is actually reflected in the declaration,” he said. Pacific leaders have called for Australia to do more to reduce emissions and act to curb the effects of climate change. Last week in a blistering speech in Sydney, the Samoan prime minister called climate change an “existential threat ... for all our Pacific family” and said that any world leader who denied climate change’s existence should be taken to a mental hospital. The prime minister of Fiji, Frank Bainimarama, who has opted to travel to Bangkok for an extra session of the COP23 climate change negotiations instead of attending the Pacific Islands Forum, excoriated global leaders for their inaction on climate change, saying leaders had promised much but delivered little. “If all the noble intentions of all the good people who have built this process since 1992 could be converted to clean energy, we could resolve the crisis now. But intentions are not actions.” He said history would condemn leaders who failed to properly address the impacts of climate change. “Would any of us like to return to our people and tell them that we had the chance to do something truly great and truly necessary for the world we will pass to our children, but we lacked the will to get it done?”"
"Why bother to learn anything in school if politicians won’t pay attention to the facts? This simple realisation prompted Greta Thunberg, 15, to protest in the most effective way she knew. She is on strike, refusing to go to school until Sweden’s general election on 9 September to draw attention to the climate crisis.  Her protest has captured the imagination of a country that has been struck by heatwaves and wildfires in its hottest summer since records began 262 years ago. Every day for two weeks, Thunberg has been sitting quietly on the cobblestones outside parliament in central Stockholm, handing out leaflets that declare: “I am doing this because you adults are shitting on my future.” Thunberg herself is a diminutive girl with pigtails and a fleeting smile – not the stereotypical leader of a climate revolution. “I am doing this because nobody else is doing anything. It is my moral responsibility to do what I can,” she says. “I want the politicians to prioritise the climate question, focus on the climate and treat it like a crisis.” When people tell her she should be at school, she points to the textbooks in her satchel. “I have my books here,” she says in flawless English. “But also I am thinking: what am I missing? What am I going to learn in school? Facts don’t matter any more, politicians aren’t listening to the scientists, so why should I learn?” Thunberg’s protest might come as a surprise to anyone seduced by Sweden’s reputation as a climate pioneer and champion of the environment. This year the country enacted “the most ambitious climate law in the world”, aiming to become carbon neutral by 2045 and comfortably beating the 2015 Paris climate targets along the way. “This is too little too late, it needs to come much faster,” Thunberg says. “Sweden is not a green paradise, it has one of the biggest carbon footprints.” Her parents want her to give up her protest and go back to school. “My teachers are divided,” Thunberg says. “As people they think what I am doing is good, but as teachers they say I should stop.” One teacher to have downed tools to join her protest is Benjamin Wagner, 26. He expects to lose three weeks’ wages – and his job – as a result of his strike. “Our inability to stop climate change is like the efforts to stop world war one – we knew for years it was coming, they arranged all sorts of conferences, but still they didn’t prevent it,” Wagner says. “Greta is a troublemaker, she is not listening to adults. But we are heading full speed for a catastrophe, and in this situation the only reasonable thing is to be unreasonable.” There are signs that more Swedes are listening. The Green party, a partner in the centre-left coalition government, was languishing in the polls before the country was hit by more than 60 forest fires, which raged for weeks through a rural tinderbox created by the unprecedented drought. Now the party’s support is up by half to about 6%. “I am very impressed by Greta’s courage and determination,” says Janine Alm Ericson, a Green member of parliament. “But I am also sad that she feels she has to be there – the political parties in Sweden have not done enough. Thanks to the hot summer it has become easier for people to imagine what climate change can mean for us and others in Europe if we continue to ignore what is happening.” Outside parliament, Stella d’Ailly, 45, an art director, has come to join Thunberg’s protest. “I feel like I am dying inside if I don’t protest,” she says. “Sweden may be well organised to recycle our trash, for example, but we do nothing to cut the amount of plastic bottles and packaging in the first place. We need drastic change.” Thunberg’s own awakening to the climate crisis a few years ago caused upheaval in her family. Her mother, the well known opera singer Malena Ernman, has given up her international career because of the climate effects of aviation. “Greta forced us to change our lives,” says her father Svante. “I didn’t have a clue about the climate. We started looking into it, reading all the books – she has read them too.” Her teachers were telling her to turn off the lights and save paper, then flying off to New York for a holiday. For Greta, this was just not good enough: “Everyone believes that we can solve the crisis without effort, without sacrifice,” she wrote in an article widely circulated on social media and translated into English. While on strike, she has done a lot of homework and read three books, her father says. “She is supposed to be in school, we cannot support her action. But we respect that she wants to make a stand. She can either sit at home and be really unhappy, or protest and be happy.” Greta has Asperger’s syndrome, which in the past has affected her health, he says. She sees her condition not as a disability but as a gift which has helped open her eyes to the climate crisis. “The best thing about my protest has been to see how more and more people have been coming and getting involved,” Greta says. “I don’t care if I get into trouble at school. I believe that one person can make a difference.”"
