"Indigenous groups claimed a victory at the UN climate talks in Bonn on Wednesday as governments acknowledged for the first time that they can play a leadership role in protecting forests and keeping global temperatures at a safe level. Long marginalised and often criminalised in their home countries, the “first peoples” – as they often refer to themselves – also achieved breakthroughs in terms of official international recognition of their rights, autonomy and participation in negotiations.  This represents considerable progress for the world’s 370 million indigenous peoples, whose territories are estimated to contain 20% of the world’s tropical forest carbon and often have to defend it against encroachments by loggers and farmers.  “This is a victory for indigenous peoples who have always been fighting for recognition of our rights as a way to protect forests and tackle climate change. This is a big advance,” said Juan Carlos Jintiach of Coica, a group representing indigenous communities in the Amazon. For much of the past 20 years, indigenous groups have been a disgruntled, fractious presence on the fringes of climate talks who were primarily portrayed as victims, but this has gradually changed along with a growing body of research showing that respect for the territorial rights of communal land is one of the most cost-effective ways of sequestering carbon.  The 2015 Paris accord recognised the contribution of indigenous knowledge in dealing with climate change, but the document approved in Bonn this week goes further by acknowledging that countries “should, when taking action to address climate change, respect, promote and consider their respective obligations on the rights of indigenous peoples and local communities.” It also proposes greater participation of indigenous communities in “leadership roles” and mentions this will have budget implications, opening the possibility that they could be covered by the Green Climate Fund.  “This shows that the international community increasingly recognises the way indigenous peoples and local communities manage their lands and territories can be an important climate change solution, because they help to protect forests and other natural resources. Now for the first time the UNFCCC [United Nations Framework Convention on Climate Change] is establishing concrete mechanisms, with funding to support those efforts,” said Penny Davies of the Ford Foundation. In a sign of the change in status, the French president, Emmanuel Macron, was scheduled to meet indigenous representatives in Bonn on Wednesday. China, which is keen to appear as a climate leader, has also softened its position on indigenous rights, long shaped by Beijing’s concern about separatist movements in Tibet, Xinjiang and Inner Mongolia. Governments should now be obliged to talk to indigenous communities when drawing up national climate targets, though their influence remains to be seen. Former Brazilian environment minister Izabella Teixiera welcomed the move and hoped it would have positive domestic as well as international implications.  “Indigenous rights are really important to move towards a fair, low-carbon planet,” she said. “I hope this can also help us avoid backsliding on this agenda in Brazil.” Clare Shakya of the International Institute for Environment and Development said new mechanisms for indigenous participation should not be used to channel their voices away from the main debate.  “This is an important step forward but only if it really does mean that indigenous and local communities are listened to and their knowledge recognised,” she said.  “This decision is an opportunity to make sure that they drive the solutions to tackling climate change. Throughout this climate meeting numerous representatives from developing countries have said how top-down responses to addressing climate change actually marginalises them. Today’s decision is a chance to change that.”"
"The risk posed by climate change would be factored into projections from the government’s independent economic forecaster if Labour took office, the shadow chancellor will announce on Tuesday. John McDonnell will highlight the human and economic costs of manmade climate change, calling it the “greatest single public challenge” and say the government should include the fiscal risks posed by global warming in future forecasts. The landmark change would, for the first time, put climate change on an equal footing with other complex challenges affecting the public finances such as demography. Under a Labour government, the Office for Budget Responsibility would be given total independence, McDonnell will announce, saying the forecaster would report directly to parliament rather than the Treasury. Speaking at the Institute for Public Policy Research on Tuesday, McDonnell will say that meeting the challenges of climate change will require “a transformation of our institutions and how our economies are run”. McDonnell said that Labour “wants to ensure that the overwhelming challenge of climate change is addressed from the very centre of government. This includes the potential losses to the public finances. “The public deserve to know what impacts we might expect on the national purse from the degradation of our environment. Sound, responsible economic management should already be accounting for this.” Labour Treasury sources said the party wanted to ensure that long-term impacts of climate change and environmental damage, including effects on food prices, flooding and loss of productivity in more frequent extreme weather, could have a direct impact informing economic policymaking. McDonnell will argue that the effects of manmade climate change are already having an economic effect. Costs in recent years have included more frequent flooding, which the Environment Agency estimates now costs £2.2bn annually.  Over the summer, the Bank of England said it had begun its own investigations into the extent of the banks’ exposure to the effects of climate change, announcing it was “initiating a review of climate-related risks in the UK banking sector”.  Several other authorities in Europe, including in Germany and Sweden, have also been examining the financial consequences of climate change. But the UK would be the first country in the world to mandate the assessment done by an independent fiscal council. Under Labour, the OBR would be given additional resources to deliver the best economic modelling of environmental impact, McDonnell will say. “It will become a new centre of expertise for environmental macroeconomics,” he will say. The shadow chancellor said he would “guarantee and reinforce that independence of the OBR by making the body report to parliament rather than the Treasury.  “We want the public, whether businesses or voters, to be absolutely confident that the public finances are properly scrutinised and managed.” Environmentalists welcomed the proposal though cautioned that the effects of climate change could not all be given economic value.  Greenpeace UK’s chief scientist, Dr Doug Parr, said the change would “help concentrate the minds of future governments on the urgency and scale of the challenge” of climate change on the economy.  “Major companies and financial institutions have already started factoring in the impacts of climate change in their forecasts, so it’s right that the UK government should do the same for the public purse,” he said.  “Not all environmental degradation can be translated into monetary values, but if you just look at the billions of pounds of damage caused by floods, you can see why the impact of climate change on the government’s balance sheets cannot be ignored.” Michael Jacobs, director of the IPPR commission on economic justice, said the change would be an important shift. “Over the last few years the Bank of England has been telling the financial sector that it must report on the investment risks arising from climate change,” he said.  “It is very welcome that Labour is now signalling that government – through the OBR – should do the same with its macroeconomic forecasts. This is an important way to ensure that climate change is properly integrated into economic policy.”  Friends of the Earth CEO Craig Bennett said the change would be “welcome news” and said the effects of climate change “could easily dwarf the huge financial crisis from which the world is still recovering.”  The WWF also backed the change and said other parties should follow. “All political parties need to ensure long-term planning for the environment is at the heart of their programmes,” Karen Ellis, WWF’s chief advisor on economics and development, said."
"Ministers from governments around the world meeting in Bonn for the final days of the UN climate talks must prove they can pass “the Trump test” by moving on without the US on issues crucial to combating global warming, a leading climate economist has said. “It’s about getting on with it,” Lord Nicholas Stern told the Guardian. “They have to get on with it. But there are good signs.”  He said the recent meeting of the International Monetary Fund had proved countries were prepared to pass the test. “[We will have] the absence of the US for a little bit, but the determination at that meeting was striking. There is a determination to get on with things come what may.” A former World Bank chief economist, Stern was the author of the landmark review of the economics of climate change in 2006, which showed that tackling greenhouse gas emissions sooner would cost less and yield more economic benefits than waiting for years, or decades, until the results of climate change are clearer. The COP23 talks discussing crucial issues related to climate change began in the former West German capital, Bonn, last week and will finish on Friday. Ministers began arriving on Wednesday for the final “high-level segment” of the talks, which are expected to include toughening pledges to cut greenhouse gas emissions made at the historic Paris conference in 2015. Trump has begun the process of US withdrawal from the Paris agreement, which will take several years, but in the meantime the US will continue to participate in the talks. So far, the US has taken little part in discussions, but this could change in the final days. “Trump could be passive and do very little, or could be obstructive. I suspect the former, though not with great confidence,” said Stern. “The officials [sent by the US to Bonn] are a long way down the pecking order, which really suggests passive disengagement rather than an aggressive blocking strategy. But there is no predicting what the Trump administration will do.” Stern said this was why other major countries bore a greater responsibility for making progress without the White House. He pointed to China and India, which he expected to play a strong role in furthering the Paris agreement. “We should recognise that these countries are moving very quickly [on greenhouse gases],” he said. “My view is that [emissions from] China will peak by 2030. In India, the price of solar power has fallen to three cents a kilowatt hour [on a par with coal]. That is remarkable. The dial is really turning up in India now, which is really important.” India has been a reluctant participant in previous talks. Six years ago, when the UN’s climate conference was held in Durban, India and China stood alone in holding out against the proposals which led to the Paris agreement. They eventually agreed, and China went on to take a leading role in the run-up to Paris, but India’s position has been less clear. The country’s prime minister made an angry speech in Paris saying that developed countries should take more responsibility, but the country signed up to the ensuing agreement and since then, according to Stern, there has been much more support within the Indian government. Stern also called for more focus on the ways for poorer countries in particular to adapt to the effects of climate change. He said this should be known as fostering “resilience”, rather than adaptation as it used to be known, because resilience requires a broader range of measures and skills and it makes more sense to build and retrofit cities and infrastructure in such a way as to improve their resilience to all potential natural disasters, not just the effects of climate change. He called for resilience to be built into all discussions on international development, in order to help the world’s poorest to cope with the social, economic and climate-driven problems that may arise, and in some cases are already taking place."
"While the EU is extolling its “climate leadership” at the UN climate talks in Bonn, in Brussels it has just agreed to prolong its emissions trading system – providing big polluters with billions of euros in subsidies. Some EU member states could use a sizable chunk of these funds to carry on burning fossil fuels, with Poland, for instance, looking to prolong the lifespan of its ageing coal infrastructure. Using emissions trading revenues to extend the life of coal-fired power plants is extremely irresponsible and works directly against efforts to halt catastrophic climate change. But coal financing is just the tip of the iceberg. Emissions trading-linked subsidies to big polluters could reach close to €200bn between 2021 and 2030. The largest share of this figure represents free pollution permits handed out to steel and cement producers, helping them to delay the transition away from fossil fuel dependency. Emissions trading benefits big polluters far more than it does the climate. With the conclusion of the negotiations between the EU commission, parliament and council, the EU has shown that it remains a long way from taking responsibility for its fair share of global climate action. Maxime Combes Attac FranceBelén Balanyá Corporate Europe ObservatoryJavier Andaluz Ecologistas en AcciónFrida Kieninger Food and Water EuropeClémence Hutin Friends of the Earth EuropeDorothy Grace Guerrero Global Justice NowJo Ram PlatformAntonio Tricarico Re:CommonLyda Fernanda Transnational Institute  • Chancellor Philip Hammond has a chance to use his autumn budget, on 22 November, to help tackle Britain’s toxic air crisis. Despite calls for change, the Treasury continues to subsidise certain highly polluting diesel engines, allowing them to burn red diesel. One example of this outdated subsidy supports the second engines that cold delivery trucks often have. Main diesel engines, used to propel the truck, are subject to increasingly tough Euro emission standards. But second engines, used to keep the back compartment cold while transporting food, are extremely weakly regulated, enabling them to emit six times as much nitrogen oxide and 29 times as much particulate matter as the main engine. But the Treasury subsidises the diesel for these second engines by £126m a year. The chancellor was right to announce a consultation into red diesel use earlier this year, and he must now end the diesel subsidies for a delivery truck’s second engine. Especially when zero-emission engines are affordably available on the market and could make an immediate positive impact on the air we breathe across the UK. Matthew Farrow Executive director, Environmental Industries Commission Tony Lewis Head of policy, Chartered Institute for Environmental Health Rob Wood CEO, GasRec Scott MacMeekin CEO, Dearman  • Join the debate – email guardian.letters@theguardian.com • Read more Guardian letters – click here to visit gu.com/letters"
"In Pointe Michel, on the Caribbean island of Dominica, I met a woman sitting in the middle of a pile of rubble. On her right there was a fridge and on her left a ruined mattress – the only recognisable possessions among the jumble of concrete, wood, metal, glass, galvanised iron and everything else that just a few weeks ago used to be her home. She and her family had been spared but they had lost everything when the wrath of Hurricane Maria exploded there, another terrifying manifestation of climate change.  Just down the road, MP Denise Charles, who was taking me round the island to assess the damage, pointed to a spot marked with debris, trees and boulders. At first I thought she was showing me a damaged road. Then she told me there used to be three houses on that spot. Fourteen people are thought to have perished when Maria smashed these homes into nonexistence. Everywhere I went these stories were repeated. Every corner of this precious island, decimated. Flying in, I did not recognise Dominica, the land of my birth. The once flourishing, green vegetation that rolled over every mountain and carpeted the valleys is gone. It has been replaced by sickly brown, bald patches of land and naked trees, stripped of their bark and lying on the ground like discarded matchsticks or sticking up in the air in stark defiance. Travelling around the country was difficult, with recently constructed roads caved in and barely accessible. I was shell-shocked when I visited Scotts Head, a beloved fishing village that holds many fond memories for me. It was virtually unrecognisable. Every house on the water’s edge is gone. In their place is now a beach, some rubble and a solitary boat, the only reminder of the once flourishing fishing trade. In Barbuda, another Caribbean island, there is a similar tale of utter devastation. Driving through the ghostly empty streets on the evacuated island it was hard to imagine that just two months ago this was a vibrant community. Our guides spoke about landmarks in the past tense. “This used to be a church, this was the police station,” pointing to a roofless blue building. I walked around a primary school that looked like it had been bombed, and a hospital that would have to be rebuilt almost from scratch. These pictures are seared into my memory. The stories of utter terror in the dead of night, of not knowing if you will survive, of people emerging the next morning like zombies, of funerals and memorials, will be in my mind every time I go into a meeting about my 52 member states. But now, the glare of the media spotlight is dimming and my fear is that this story will slide off the international agenda. We absolutely cannot allow that to happen, because what I witnessed in the last week are two countries in the Caribbean in deep humanitarian crisis. And what makes it even more worrying are the rules that the international community has set to help make aid distribution fair. There is a huge question mark over whether some of the countries affected by Irma and Maria will be able to get the help they need. Dominica is currently classed as upper middle income, which still makes it eligible for Overseas Development Assistance. But Antigua and Barbuda is a high-income country, which excludes it from receiving that assistance. Under criteria set by the Organisation for Economic Cooperation and Development, those islands will probably cease to be recipients of assistance this year. The fact is, it is not fair to exclude higher income but climate-vulnerable countries from that vital assistance when they are stuck by a cataclysmic disaster. Certainly not in this new epoch in which category 5 hurricanes, which used to come once in a lifetime, are coming within weeks of each other and with a new kind of ferocity. What Hurricanes Irma and Maria demonstrated, with vicious clarity, is that a high-income country could be made destitute in a matter of hours. It’s heartening that, after tireless advocacy from the Commonwealth and other organisations, and leadership by the UK, these rules are going to be reviewed. My worry is that change will not happen quickly enough to meet the mammoth challenges facing the Caribbean and other regions that have been so grievously damaged by a season of climatic upheaval. All those involved in making these rules, such as the World Bank and the OECD’s Development Assistance Committee, have to consider seriously our present reality and to create eligibility criteria that adequately respond to what countries, particularly those more prone to natural disasters, are actually experiencing. This is a concern for all of us; because just before the Caribbean hurricanes, hundreds died in mudslides in Sierra Leone and in floods in Asia, and thousands were displaced. This is not just about a woman, thousands of miles away, sitting amid the wreckage of her home. This is about a rapid, drastic change in climate that is wreaking havoc on our planet. Even in Ireland, Storm Ophelia claimed three lives last month. We need to accept the new reality of fast and furious natural disasters and have a plan to deal with it. We need a targeted global response that enables us to implement the Paris agreement on climate change and better coordinate a rapid reaction, with everything taken into account: search and rescue, regional coordination and legal impediments, such as the revision of aid rules. But it also needs to recognise that the human spirit demonstrated by the Commonwealth during this traumatic period is something upon which we can build. We need all hands on deck. If not us, who – and if not now, when? • Patricia Scotland is secretary general of the Commonwealth"
