"I strongly agree with George’s Monbiot’s comments regarding David Attenborough’s latest BBC series, Dynasties (Attenborough has betrayed the living world that he loves, 7 November). Why have most of his wonderful programmes been blind to the tsunami of environmental destruction we have unleashed? Some years ago I confronted Alastair Fothergill, series producer of many of Attenborough’s programmes, at a public meeting: “The Earth is in distress: why do you ignore human impacts?” His response: “Our audience does not want to be disturbed.” What about the mess that future generations will be left with?  In the 1980s I worked at Channel 4 for Fragile Earth, which broadcast some 20 environmental documentaries a year. But as soon as Michael Grade took over as CEO in 1988, he sacked the commissioning editor – advertisers did not like disturbing programmes. And so the global devastation continues largely unreported in TV documentaries.  British TV has also systematically deprived us of information about solutions to the world’s environmental problems. In some countries, major new green industries are flourishing, but viewers in Britain are being left uninformed. We need well-presented programmes helping us to make the right decisions – as consumers, as parents and as voters. Herbert GirardetAuthor and consultant; co-founder, World Future Council • If David Attenborough is unwilling or unable to offer potential solutions to the world’s environmental crisis, perhaps the Guardian should invite those who may have solutions to offer these in a series of features with global mass-media and social-media partners. Contributors could include people who understand that population can be lowered and welfare improved by global development based on justice and greater power for women: there are many examples of this which expose the intellectual poverty of neo-Malthusians. It could include the ideas of economists who reject conventional “growth” as the only way forward. It might tap into the “feasible utopia” ideas of red-green media and thinktanks plus the work of academics who lead the search for sustainability. NGOs and unions could have a role, and there would be space for scientists – but not the Tomorrow’s World types who promised cosy technological fixes for all our problems, passifying a bedazzled public. We must tap into the mass of talented but largely unheard folk who have ideas that begin with the understanding that “another world is possible”.Trevor PhillipsNorwich • The BBC has been guilty of ignoring or dumbing down important information about climate for a long time. Many other organisations that should know better are also guilty of not shouting loud enough about the consequences of global warming: there has been consistent fear among NGOs that frightening people would have adverse effects. They are all complicit in this cover-up.Maureen EvershedDorridge, West Midlands • I couldn’t agree more with George Monbiot. We are not children; we do not need to be protected from the truth because it may make us uncomfortable. Our planet is on the cusp of a downward spiral leading to monumental disaster unless we all do something very quickly. And yet the BBC appears to be more interested in audience numbers, still determined to make safe, appealing programmes with David Attenborough at the helm. He is in an almost unique position to make a powerful statement about the remaining wonders, which still exist, but will most certainly disappear in the not too distant future. And with their disappearance our own species will surely not survive. My generation, and David Attenborough, will be long gone when what’s left of the Earth’s future population will be struggling to stay alive on a very bleak, barren and silent planet. Will they look back and be glad that we were entertained?Carol KnightTisbury, Wiltshire • I sympathise with the concern that George Monbiot expresses. I think there is a problem that people are liable to be put off by all the warnings of the disastrous consequences. It is very difficult to tread the right line between very bad predictions and reassuring us that something can be done. Avoiding single-use plastics is something people can easily aim for and feel that they are preventing a whale from being killed by plastic. I felt sad to see the recent pictures of all the plastic that one whale had ingested. Then I thought of all the creatures that will never be born because of climate change, and that is even more sad.Janet PoliakoffNottingham • Your excellent article reporting the devastating effects of humans on other animals illustrates how important it is to avoid further increasing our environmental footprint (Annihilation of wildlife a threat to civilisation, scientists warn, 30 October). A policy promoted by the Guardian, and supported by its readers, requires a huge increase in our environmental footprint: reducing greenhouse gas emissions by replacing fossil fuels with renewable energy. For example, the late David MacKay showed that in order to meet UK energy needs, solar, wind and biomass “farms’ would need to occupy 5%, 10% and 75 % of our available land area, respectively. The required offshore wind turbines would occupy an area equivalent to a 13km thick strip around the entire UK shore. Wave machines would need to stretch across the entire 500km Atlantic coastline. Can we reduce greenhouse gas emission without increasing our footprint on this planet? Yes, by exploiting the densest form of energy: nuclear. Although feared by the public, nuclear has the best safety record of all forms of energy, and is far safer than fossil fuel. Even the most catastrophic nuclear accidents, such as the ones at Chernobyl and Fukushima, eventually caused very few deaths (43 after Chernobyl and none at Fukushima).If we want to protect other species from humans and avoid catastrophic climate change, we need to shift our focus from renewables and expand nuclear energy. Prof Anton van der MerweSir William Dunn School of Pathology, University of Oxford • Join the debate – email guardian.letters@theguardian.com • Read more Guardian letters – click here to visit gu.com/letters • Do you have a photo you’d like to share with Guardian readers? Click here to upload it and we’ll publish the best submissions in the letters spread of our print edition"
"For the fourth-generation crab fisherman John Beardon, the warming of Pacific waters off the coast of California has meant toxic crabs, shortened fishing seasons and a near decimation of his livelihood as a crab boat captain. Now he would like to see the industry he says is responsible pay for the damage. On Wednesday, associations representing California crab fishermen like Beardon filed suit against 30 fossil fuel companies seeking to make the companies pay for the harm global warming has caused to California’s fisheries. The suit demands that petroleum interests finance the changes that will be needed to sustain the crab fishing industry in the future.  “We just about can’t make a living fishing crabs any more,” said Beardon, who has seen the earnings he can make with his 35ft crab boat, Stormy II, cut in half in recent years because of the effects of ocean warming. “I’d like to see the industry that caused this take responsibility for that.” The lawsuit, filed in California state superior court by the Pacific Coast Federation of Fishermen’s Associations, is the first legal action by a private industry group seeking to hold the fossil fuel companies responsible for major losses attributed to global warming. It seeks unspecified damages from defendants including Chevron, ExxonMobil and BP. The suit also names 27 other petroleum companies. “We’re taking a stand for the captains and crew, their families and the business owners that support the fleet,” said Noah Oppenheim, the association’s executive director. “The fossil fuel companies named in our lawsuit knowingly caused harm, and they need to be held accountable.” The suit follows a slew of legal actions filed in the last 18 months by government agencies, including the cities of New York City and San Francisco and the state of Rhode Island, claiming that the petroleum industry has long known about the devastating effects their products cause to the climate but has done little to stop them. In June, a federal court judge threw out two suits from the cities of San Francisco and Oakland. Judge William Alsup of the US district court for the northern district of California wrote in his ruling that while he accepted the science behind global warming, “the problem deserves a solution on a more vast scale than can be supplied by a district judge or jury in a public nuisance case”. He also cited the benefits that have come from petroleum products. Early this month, the US supreme court refused to stop a lawsuit brought by a group of children and young adults, which seeks to force the US government to do something about climate change. Another federal court recently paused the case after the Trump administration requested a temporary stay. The fishermen’s suit raises the question of who should have to bear the costs of financing the major adaptions that industry – and society – will have to make to survive global warming. “Defendants have known for nearly 50 years that greenhouse gas pollution from their fossil fuel products has a significant impact on Earth’s climate, including a warming of the oceans,” reads the suit. Yet “defendants concealed the dangers, sought to undermine public support for greenhouse gas regulation, and engaged in massive campaigns to promote the ever-increasing use of their products at ever greater volumes”. Chevron, which has a major refinery in the San Francisco Bay Area, did not immediately return calls from the Guardian. But R Hewitt Pate, Chevron’s vice-president and general counsel, called for cooperation, not blame, after the dismissal of the San Francisco and Oakland cases in June. “Tackling the difficult international policy issues of climate change requires honest and constructive discussion,” he said. “Using lawsuits to vilify the men and women who provide the energy we all need is neither honest nor constructive.” Starting in 2015, crab fishermen have had to contend with dramatically shortened fishing seasons because the warming of ocean waters has caused huge algal blooms along the Pacific coast. The blooms were blamed for causing a buildup of a neurotoxin, domoic acid, in the crab population, making the crabs potentially poisonous to eat. The start of the 2015 crab season, usually in November, had to be pushed back until the following March. The season was shortened in 2016 and 2017 as well. This year, the crab season will be allowed to open as usual, on Thursday, but one section of the northern California coastline will be closed for fishing. The unpredictable and dramatically shortened seasons have taken a huge toll on the fleet of small fishing boats that usually supply a bounty of fresh Dungeness crab for the state’s restaurants and holiday tables. “For some of these fishermen, losing a season means having to sell the boat. And many of them did,” said Oppenheim of the disastrous 2015-16 season. “We’re talking about families having to go to the bread line.” In releasing the suit, the fishing association called for the petroleum companies to fund studies that will help crab fishermen survive ocean warming and suggested that money could be used to study new ways of making crab fishing viable, such as keeping crabs in holding tanks so that they could expel toxic acids. Beardon, who fishes for Dungeness out of Crescent City, California, said he has had to go to work as a logging truck driver during the summer months in order to sustain his family crabbing business. “The last three years have been really hard,” said Beardon, “Our community came together and held a fish fry to help our crew members. But fish fries and disaster relief are no solution to these closures we’re now seeing year after year after year.”"
"Six months ago, when I stood on this bridge over Waskerley beck, which flows from the head of the Tunstall valley, the reservoir that it supplies was brimful. A rapid thaw after late heavy snowfall, followed by torrential rain, had left a pair of great-crested grebes piling up water weeds in a desperate attempt to keep their nest site above rising flood water.  Today, after the driest summer I can remember, a third of what was 66 acres of deep water is still mud. The sluggish beck meanders through the sediment towards a shallow lake, its rate of flow akin to replenishing an empty swimming pool using an egg cup. It will take many weeks of heavy rain to recharge the groundwater in the surrounding fells to the point where a refilled reservoir will cascade over the dam wall spillway again. Tunstall reservoir, built in 1879 to store drinking water, is now relegated to the role of maintaining summer water flow in the River Wear, three miles downstream at Wolsingham. It has been stocked with rainbow trout and all summer they have become concentrated in a shrinking volume of water. I counted 12 fishermen this morning: only one was using a rod and line; six were cormorants and five were herons, taking full advantage of such easy feeding opportunities. The idiom “shooting fish in a barrel” came to mind. I walked home through Backstone Bank wood, ancient oak woodland on the eastern flank of the reservoir, across a wooden bridge over another stream, where the trickle of water barely disturbed the autumn leaves that spun down into its rocky bed. The morning’s climate change news had been of a Met Office report describing a pattern of wetter winters and longer, drier summers. The reservoir’s water level has sometimes been low in the past, but it seems likely that this year’s exceptional weather experience will become the new normal. I’ve known this secluded valley for most of my life, with its farms, fellsides, wetlands and woodlands, all interlinked. There is now a sense of urgency in appreciating the here and now, before too much changes too fast."
nan
"“Wildfires don’t care about wealth or status,” began the New York Times this week, describing the celebrity homes obliterated by fire in California. But what the report didn’t add, leaving it instead to Neil Young’s website, was that climate change cares even less. As President Trump took time out of his busy schedule protecting his hair and insulting the French to blame poor forest management, Young laid it on the line: “As a matter of fact this is not a forest fire that rages on as I write this. We are vulnerable because of climate change.” In the early stages of the climate crisis, it often felt as if the opposite were true: floods, droughts and heatwaves were always somewhere else’s problem, usually the global south, where they could be chalked up to some pre-existing vulnerability, in a shoulder-shrugging: “OK, so earthquakes aren’t great, but if they’d had better building regulations …” Times moved on. This year, the global heatwave was so pronounced that even habitual climate sceptics – the Sun newspaper, for example – felt moved to point out that the world appeared to be on fire.  Yet nothing brings the environment closer to home than when it affects people who seem a world away, people such as Miley Cyrus and Cher, who you can’t imagine facing any problem more serious than which diamond shoes to pack. If they can’t escape this reality, then it must be real. Right? If Young was the first celebrity to explicitly name the new normal, there is a distinctive tone to most of the statements: an outpouring not of loss, but of care for the rest of the community, notably, those who have died; statements of gratitude to firefighters; a recognition of what is important – pets, loved ones and other people – versus what is not – bricks, mortar and money. Cyrus and her parter, Liam Hemsworth, have donated $500,000 (£384,000) to victims of the fire. I have no idea what that represents as a proportion of their wealth; still, it’s an unusual and laudable thing, if your first thought, in the face of the charred remains of everything you own, is to give more away. In short, this is a vivid inflection point in the world’s journey, like a public information film about climate change. If all the money in the world won’t protect you, what is the endpoint of any equation where profit is pitted against the environment? If every star’s first thought is of the people they love, and even Robin Thicke’s second thought is of people he only barely knows (“It’s a great community, it’s a community of wonderful people, a lot of parents whose kids go to the same school as my kid. It’s just devastating”), there is a parable here about priorities, and the hierarchy of needs, and the fundamental nourishment of the human spirit, and it’s delivered – unbelievably – by the people with the best tunes. The devil must be spitting feathers; he thought he had those guys sewn up. Climate-change denial is dangerous, not because it has major governments by the throat, but because it is shameless: it will reject the facts on a page, and the evidence before its own eyes. It will blame anyone but the real culprits, and marshal that blame to suit a narrative of scarcity and threat. But there does come a point when rhetoric runs out of road, is swallowed up by a more awesome spectacle; the authentic human response to the bite of a reality that can’t be denied for ever.  "
"It’s been a year of natural disasters. After Irma, Maria, Harvey, hurricane Florence left a devastating landscape in the Caribbean. Extreme temperatures across the northern hemisphere have caused devastating fires from Europe to the US. Dozens have been killed in the Philippines after typhoon Mangkhut triggered landslides. And the worst consequences of climate change are yet to come.  It is a huge challenge for rich countries and for developing nations, a sisyphean task: how to collect enough revenue to respond to major catastrophes, while at the same time trying to lift billions of people out of poverty? Look at Indonesia. Disasters are a familiar tragedy in the world’s fourth most populous nation, with its thousands of islands across hundreds of miles of ocean. This should make disaster risk planning crucial. It is not the case, as the latest earthquake and tsunami showed. Reports revealed that parts of the tsunami alert system didn’t work. In some areas, there were no sirens at all. The death toll is still climbing. Indonesia is the largest economy in south-east Asia and is projected to become the fourth largest economy in the world by 2050, behind China, the US and the EU. However, this prediction depends on its capacity to secure sufficient public revenue. It is the only way to finance, for example, the preparation and maintenance of earthquake-resistant buildings and infrastructure and warning systems. Natural disasters tend to worsen economic inequality in already critical situations, such as that in Indonesia. While many have been lifted out of poverty in the past two decades, the gap between the rich and the poor has grown faster than in any other south-east Asian country. The government now has an ambitious medium term strategy to deal with wide wage disparities and dramatically unequal access to infrastructure, education and health services. Addressing all these challenges requires revenue. At an average of 17.6% of GDP, tax collection in the Asia-Pacific region is among the lowest in the world, a level regarded by experts as totally insufficient to achieve sustainable development goals. And with big companies paying less and less taxes, most governments have the same answer: austerity. In the past decade, the average corporate tax rate in the Association of Southeast Asian Nations (Asean) region has fallen from 30 to 22%, reflecting global trends. While these lower tax rates may attract higher levels of foreign investment, they come at a very high price: less fiscal revenues means less money to construct vital public services and infrastructure, not to mention less money to prepare for the effects of natural disasters. The only winners in this race to the bottom are multinationals, which end up paying almost no taxes. Vito Tanzi, the former head of the IMF’s Tax Policy Division, has branded such tax-avoiding companies “fiscal termites” for eating away the foundations of tax systems around the world. In his recent book, Termites of the State, Tanzi acknowledges that while no fiscal house is fully insulated from these tax pests, developing countries – especially those with mineral resources – are particularly vulnerable. Developing economies such as Indonesia rely heavily on corporate income tax bases. The IMF reports that the revenue lost from tax evasion in developing countries is 1.3 times larger, as a share of GDP, than it is in advanced economies. It’s a tough fight that involves tackling power elites, overcoming deep institutional resistance, pursuing inclusive forms of growth, eliminating unacceptable levels of poverty and building quality health and education systems for all. But the fight back is underway. The global debate about the tax dodging behaviour of unscrupulous multinationals is beginning to pay dividends. Civil society campaigning has led to the creation of a template for country by country reporting which could eventually expose the scale of tax avoidance in the region. The Independent Commission for the Reform of International Corporate Taxation (ICRICT), of which I am a member, is putting forward a bold agenda of international tax rules from a perspective of global public interest rather than advancing national corporate interest. In the last decade Indonesia has made great progress towards its sustainable development goals. What a tragedy it would be therefore if this emerging Asia-Pacific middle class fails to emerge because multinational companies continue to get away with dodging tax and ransacking these nations of their wealth. • Wayne Swan is the former treasurer and deputy prime minister of Australia and a member of the Independent Commission for the Reform of International Corporate Taxation (ICRICT)"
