"Global demand for oil will still be growing in 2035 even with an enormous growth in electric cars in the next two decades, with numbers on the road rising from 1m to 100m, BP has predicted. The oil and gas giant predicted that despite electric cars spreading rapidly and renewable energy recording exceptional growth, oil demand would still rise because of rising prosperity in the developing world. BP said electric cars would not be a “gamechanger” for the oil industry. “It’s not Teslas and the US. It’s the fact that 2 billion people, much of that in Asia, are moving to middle incomes, can buy their first motor car and that drives up oil demand. It’s that stuff that really matters,” said Spencer Dale, BP group’s chief economist.  Publishing its energy outlook, which forecasts long-term trends and informs the company’s internal strategy, BP predicted global energy demand would grow nearly a third by 2035. Fossil fuels would still account for 75% of the energy mix, slightly down on the 80% BP forecast last year. Oil demand was unlikely to peak until the mid-2040s, Dale said, in a prediction similar to that of the International Energy Agency but much later than some other observers think. The analysts Wood Mackenzie believe oil demand could “peak well before 2035”, while BP’s rival Shell has talked of a peak as soon as five years’ time. BP has been attacked in the past for repeatedly underestimating the growth of wind and solar power in its annual outlook. Its latest update expects renewables to be the fastest-growing fuel source in coming years, at 7.6% annually, compared with 1.6% for gas and 0.7% for oil, with China driving the largest growth in green energy. Greenpeace accused the company of peddling a “fantasy future where the world fails to act on climate change”. Greg Muttitt, senior adviser at campaign group Oil Change International, said: “Every year BP has predicted a slowdown in renewable energy growth, and every year it has been wrong – but it’s done so again today. And BP says electric cars are going nowhere in the next 20 years, a view not shared by the car industry.” Some forecasts, such as Bloomberg New Energy Finance’s, see more than 200m electric cars globally by 2035. BP’s base case foresees 100m electric cars by then, or 5% of the global car fleet. That’s up from 57m in the company’s outlook last year because of falling battery prices, although BP admitted there was a large uncertainty over the numbers. “BP’s 2017 outlook has increased its electric vehicle projections on last year, but this still lags far behind the potential penetration if the technology were to take off, meaning there is still a risk of the company misreading oil demand,” said James Leaton, head of research at the Carbon Tracker Initiative, a London-based thinktank. BP said the election of Donald Trump as US president and his domestic “America First” pro-fossil-fuel energy plan, published last week, was unlikely to have a big impact on efforts to tackle climate change. But a withdrawal from the Paris climate deal – as Trump has promised – would be more serious.  “My instinct would be in terms of climate, the actual implications of changes in US policy are unlikely to be a big gamechanger,” said Dale. “But what could be a big gamechanger is if the US stops playing its global leadership role, and by stopping it then has significant implications for the wider international community, and the wider commitment, that could have more impacts.” The energy company said the future held “an increasing abundance of oil”, claiming there is enough technically recoverable oil in the ground to meet the world’s entire demand twice over to the middle of the century. But it is not clear how much of that would be economically possible to extract, and the company does not disclose the oil price underpinning its forecasts. An Opec deal reached last year by the world’s largest oil producers to curb production has helped the oil price recover from $30 a barrel last year to about $55 today. Dale would not be drawn on what he thought the price would be in 2035 but said he did not think the current level was sustainable. “I look at what’s happening with investment, with those major oil-producing economies, that [today’s price] doesn’t look like a very sustainable number,” he said. The outlook predicted coal’s ongoing decline would see gas overtake it as the world’s second largest source of energy by 2035, with fracking for US shale driving much of the gas growth.  BP said improvements in energy efficiency and an increasingly lower carbon fuel mix would slow the growth in global carbon emissions, from the 2.1% annual growth of recent years to 0.6% in the next two decades. While describing that as “good news”, it admitted this still put the world on a path to dangerous global warming."
"Barnaby Joyce has refused to commit the government to maintain the Renewable Energy Target, after a report that conservative Coalition MPs want to ditch it if the United States pulls out of the Paris climate agreement. The deputy prime minister ruled out pulling out of the Paris agreement, but criticised “romantic” renewable targets set by states and said MPs were free to think and say what they like about the RET. Australia’s self-imposed target is to achieve 33,000 gigawatt hours of energy from renewable energy by 2020, a target of about 23%. The Abbott government cut the target from 41,000 gigawatt hours in 2015, but the principle of the RET still enjoyed bipartisan support. On Monday the Australian quoted several unnamed conservative MPs who want to ditch the RET, arguing it would help sharpen the Coalition’s attack on Labor’s plan to lift renewable energy to 50%. Tony Abbott and the South Australian senator Cory Bernardi have both publicly argued for the scrapping of renewable energy targets. On Monday Joyce was asked on ABC’s AM if he supported dumping the RET and Australia’s Paris greenhouse gas reduction targets, given the US may withdraw from the Paris climate agreement. “We have an agreement, we’ve signed [it] and we’re honouring that agreement. “We’re ahead of where we need to be ... We’re doing it in a vastly cheaper way than what the Labor party has proposed, with its carbon tax and emissions trading scheme.” Asked what Australia would do if the US withdrew, Joyce said it was a matter for the US. On the report his colleagues were speaking out against the RET, Joyce said: “People have the benefit of free will, they can think what they wish. And on the backbench they can say what they wish.” Asked if the government would retain the RET, Joyce said only “we don’t sign agreements to pull out of them”, in another apparent reference to the Paris agreement not the RET. Australia’s Paris commitment is to reduce emissions to 26-28% on 2005 levels by 2030, but does not specify how emissions reductions must be achieved. The RET is contained in federal legislation and is not mandated by the Paris agreement. Joyce said Australia’s needed commitments to be achievable and would “not put undue pressure on our power prices and deliver affordable electricity to the Australian household”. “That’s why we have an issue with states who go it alone on [renewable energy] targets that are way beyond the capacity for even them to provide, and South Australia is a classic example.” He said South Australia’s targets were “romantic” and as a result the state “couldn’t get the lights on”. Despite government claims Australia is on track to meet its Paris commitments, Australia’s emissions are rising and projected to keep doing so to 2030, meaning the country will fail to meet its 2030 targets. The prime minister, Malcolm Turnbull, told Triple M in Melbourne on Monday that Australian industry, such as the Alcoa aluminium smelter in Portland, needed open markets and affordable electricity. He said Labor and Bill Shorten were “enemies” of both those aims. “They are threats to both trade and ... affordable electricity with their utterly unrealistic renewable targets that they have no way of achieving in any affordable way.” The Liberal MP, Julian Leeser, told Sky News: “We’re committed today to the 23% renewable energy target – that is the energy target that we have.” But Leeser suggested the government’s position on the RET may change after the Finkel review of Australia’s energy mix. “I am for evidence based policy ... In the event evidence is presented that we should reduce that target, well then we should look at reducing or increasing the target as the case may be, but I support the 23% target.” Shadow climate change minister, Mark Butler, told a press conference in Adelaide it was clear “a growing Trumpian faction within the Liberal Party is determined again to smash renewable energy in Australia”. He said Joyce’s interview amounted to a “resounding refusal” to endorse the RET that was settled less than two years ago. Butler said when Abbott planned to cut the RET in 2014 investment in renewable energy collapsed 88% and a government panel of experts said that abolishing the target would actually put upward pressure on prices."
"If you had “National Parks subtweet the new president” on your 2017 bingo card, today’s your lucky day.  After the US National Parks Service was temporarily banned for retweeting images comparing Trump and Obama’s inaugurations, the official Twitter account of the appropriately named Badlands National Park, based in South Dakota, appeared to go rogue by posting a series of now-deleted tweets on climate change.  The tweets were eventually deleted, and, while the official accounts may not be saying much right now, some “alternative” accounts have been set up. One, @BadHombreNPS tweeted: “Hey, friends. Here to support @BadlandsNPS with the science facts they can no longer share!” Hey, friends. Here to support @BadlandsNPS with the science facts they can no longer share! The most popular is @AltNatParkSer, which bills itself as the unofficial “resistance” team of the US National Parks Service. Can't wait for President Trump to call us FAKE NEWS. You can take our official twitter, but you'll never take our free time! One of its initial tweets read: “Mr Trump, you may have taken us down officially. But with scientific evidence & the Internet our message will get out.” The owner of the account has yet to respond to the Guardian’s request for comment, but told reporters:  Hi @JettGoldsmith This accnt being run by several active NPS rangers and friends. We promise 100 percent that we include environmental scientists and far too much coffee. #ResistTrump https://t.co/dV5DZjtmfh As of yet, it has not been verified whether the account is actually run by National Park employees. Eagle-eyed tweeters noticed the account had tweeted about the British general election in 2015.  @WingsScotland Oi, fellow plebian. What say you, honourable rev, on the elecshun result? A National Parks official told BuzzFeed the climate change tweets were posted by a “former employee” who was not authorised to use the account. They added: “The park was not told to remove the tweets but chose to do so when they realised that their account had been compromised.” This isn’t even the first time National Parks Twitter accounts have run afoul of the Trump administration. Over the weekend, they were temporarily told to halt tweeting after its main account retweeted pictures comparing the turnouts of Trump and Obama’s inaugurations. They later apologised for the “mistaken RTs”. We regret the mistaken RTs from our account yesterday and look forward to continuing to share the beauty and history of our parks with you pic.twitter.com/mctNNvlrmv"
"Falling costs of electric vehicles and solar panels could halt worldwide growth in demand for oil and coal by 2020, a new report has suggested.  A scenario that takes into account the latest cost reduction projections for the green technologies, and countries’ pledges to cut emissions, finds that solar power and electric vehicles are “gamechangers” that could leave fossil fuels stranded.   Polluting fuels could lose 10% of market share to solar power and clean cars within a decade, the report by the Grantham Institute at Imperial College London and the Carbon Tracker Initiative found.  A 10% loss of market share was enough to cause the collapse of the coal mining industry in the US, while Europe’s five major utilities lost €100bn (£85bn) between 2008 and 2013 because they did not prepare for an 8% increase in renewables, the report said.  Big energy companies are seriously underestimating the low-carbon transition by sticking to their “business as usual” scenarios which expect continued growth of fossil fuels, and could see their assets “stranded”, the study claims.  Emerging technology, such as printable solar photovoltaics which generate electricity, could bring down costs and boost take-up even more than currently predicted.  Luke Sussams, a senior researcher at Carbon Tracker, said: “Electric vehicles and solar power are gamechangers that the fossil fuel industry consistently underestimates.  “Further innovation could make our scenarios look conservative in five years’ time, in which case the demand misread by companies will have been amplified even more.”  James Leaton, head of research at Carbon Tracker, added: “There are a number of low-carbon technologies about to achieve critical mass decades before some companies expect.”  The cost of solar has fallen 85% in seven years, and the report finds panels could supply 23% of global power generation by 2040 and 29% by 2050, entirely phasing coal out and leaving natural gas with just a 1% share.  By 2035, electric vehicles could make up 35% of the road transport market, and two-thirds by 2050, when it could displace 25m barrels of oil per day.  Under such a scenario, coal and oil demand could peak in 2020, while the growth in gas demand could be curtailed.  It could also limit global temperature rises to between 2.4C and 2.7C above pre-industrial levels, while more ambitious action by countries than currently pledged, along with falling costs of solar and electric vehicles, could limit warming to 2.1C to 2.3C.  But the report shows that cutting carbon from the power sector and road transport may not be enough to achieve international climate targets, so emissions reductions from other sectors such as heating buildings and heavy industry will also be needed. "
"A plan for new coal power plants, which government ministers say could reduce emissions from coal-generated electricity by 27%, would cost more than $60bn, a new analysis has found.    Achieving the same reduction using only renewable energy would cost just half as much – between $24bn and $34bn – the report found. The resources minister, Matthew Canavan, and the energy and environment minister, Josh Frydenberg, have been arguing for new coal power plants to be built in Australia. Last week, Canavan released analysis he commissioned from the industry department, which found replacing all Australia’s coal power stations with the latest “ultra super-critical” coal-fired power stations would reduce emissions in that sector by 27%. Frydenberg has also raised the conclusions in interviews, and promoted the benefits of coal power. Neither has responded to questions about the cost of reducing coal-fired power emissions by 27% using the latest technology. So Dylan McConnell from the Climate and Energy College at the University of Melbourne crunched the numbers, and found that the 27% reduction in the coal sector could be achieved, but it would cost $62bn. McConnell said at a conservative estimate, achieving the reduction would require 20GW of new capacity. According to the latest estimates from the CSIRO, new ultra super-critical black coal costs $3,100 per kW to build. “No wonder no one wants to talk about the costs,” McConnell said. He said $62bn would be enough to build between 35GW and 39GW of wind and solar energy. Because that would produce less electricity than 20GW of coal power, it would not completely replace coal power, but it would reduce its emissions by up to 65%. And that would amount to an emissions reduction of between 50% and 60% in the electricity sector as a whole. McConnell found that if the 27% reduction in emissions from the coal generation sector were to be achieved with renewables, rather than with new coal, about 13-19GW of renewable energy would be needed, which would cost between $24bn and $34bn. He said the scenario proposed by Canavan and Frydenberg would end up with 20GW of highly polluting coal power stations that were unlikely to be retired for decades. On the other hand, McConnell said, if that money were spent on renewables, it would leave some coal and gas in place, which ultimately would still need to be removed to meet long-term emissions reduction targets. Neither Canavan nor Frydenberg responded to questions about the costs of building new coal power stations. In a statement, Frydenberg said only that the government was committed to a “technology neutral” approach to meeting emissions targets. “Arbitrarily excluding certain technologies for ideological reasons will lead to higher cost outcomes,” the statement said. The Opposition spokesman for climate change and energy, Mark Butler, said: “This analysis clearly shows the government is off on an economically and environmentally irresponsible frolic with their trumpeting of ‘clean coal’. “As the Australian Industry Group and many others have made clear, replacing our existing coal power with more coal power just doesn’t stack up; either on environmental or economic grounds. “This is just the latest effort of a weak government to appease its irrational extreme right wing and distract from the fact they’re simply incapable of delivering real policy solutions to our significant energy challenges,” Butler said. McConnell pointed out that the latest coal-powered fire stations were not at all “clean”. They produced about 700 grams of CO2 for every kilowatt hour of electricity – much more than the 400 grams from new combined cycle gas turbines, and much more than the average produced by OECD countries, 420 grams per kilowatt hour in 2014, according to the International Energy Agency. OECD countries will need to reduce that figure to just 15 grams per kilowatt hour if the world is to keep global temperature increases below 2C, the agency has said."
"Sweden’s deputy prime minister, Isabella Lövin, has published a photograph of herself signing a climate bill surrounded by her closest female colleagues, apparently mocking a photo of US president Donald Trump. Lövin, who also serves as environment and development aid minister, is seated in the photo at a desk as she signs the bill under the watchful eye of seven female colleagues, including one who is visibly pregnant.  Just signed referral of Swedish #climate law, binding all future governments to net zero emissions by 2045. For a safer and better future. pic.twitter.com/OqOO2y8BU6 The picture seems to be a reference to a series of photos of Donald Trump signing executive orders, including the reintroduction of the ‘global gag rule’, which were widely mocked.  The pictures were taken of Donald Trump on 23 January in the White House, as he signed a decree barring US federal funding for foreign NGOs that support abortion, as his all-male colleagues looked on. This group just made it more difficult for women to get access to health care worldwide. You tell me what's wrong with this picture. pic.twitter.com/8UQFWg8qO3 Sweden, a pioneer in women’s rights, is known for its high level of women in the workplace, including in parliament and government. “We are a feminist government, which shows in this photo. Ultimately it is up to the observer to interpret the photo,” Lövin said. The climate bill she is signing in the photo aims to make Sweden carbon neutral by 2045 and “marks a new era in Swedish climate politics,” Lövin wrote. “There is a global demand for climate leadership. I want to show that Sweden is ready to take that leadership,” she added. Sweden has criticised the Trump administration’s approach to climate policy as it announced legislation binding future governments to a goal of phasing out greenhouse gas emissions by 2045, among the most ambitious by any developed nation. Lövin urged European countries to take a leading role in tackling climate change, now “the US is not there anymore to lead”. Seven of eight political parties – all but the far-right Sweden Democrats – agreed to pass a binding law obliging future governments to set tougher goals to cut fossil fuel use every four years. The law will come into force from 1 January 2018. Sweden’s goal would demand at least an 85% cut in domestic greenhouse gas emissions by 2045 from 1990 levels, the government said. Remaining emissions would be offset, for instance by planting forests that soak up carbon as they grow or by investments abroad.  The European Union as a whole has set a target of an 80-95% reduction in greenhouse gas emissions by 2050. “2045 is a good year,” Lövin said of the target for reaching zero net emissions, adding: “I personally believe we could get there even earlier.” Among EU nations, she said, Britain, Denmark and Finland have also passed climate laws meant to make long-term policies less easily overturned and to give more certainty to investors.  By contrast, Trump has called climate change a hoax and wants to bolster the domestic coal and fossil fuel industries. He has threatened to pull out of a 2015 Paris agreement on climate change but also said he has an “open mind”.  Lövin said Sweden wanted to set an example at a time when “climate sceptics [are] really gaining power in the world again,” and felt encouraged by pledges by China and India to fulfil their commitments to the Paris Agreement. China is “investing billions and billions of dollars in solar … it’s a game changer,” she said, warning that “those that are still wanting to invest in fossil fuels will be ultimately the losers.”"
