"The signposts have been around for decades, and the territory is increasingly well mapped. So while the past may be a foreign country, the future is an increasingly familiar one – in which we continue to be alarmingly ourselves. In this vivid and disturbing climate-change novel, Chris Beckett, winner of the Arthur C Clarke award, compellingly illustrates the consequences of our species’ fatal hard-wiring. Though a knight’s move away from his acclaimed sci-fi trilogy Dark Eden, Mother of Eden and Daughter of Eden, his new work shares a preoccupation with the survival and evolution of societies in inhospitable worlds.  From the very first page, Beckett depicts Earth as a Frankenstein’s monster of a planet in which the disturbed climate functions as both setting and antagonist. In the US, “Big Hydro” has usurped the fossil fuel industry, but the damage is still playing out: it is a nation of vast, rotting forests, choking dust bowls and hurricanes of such extremity that “unprecedented” has become a redundant adjective. With its weather, shorelines and demographics in flux, the isolationist superpower is split into a rich north and a poor south recovering from a succession of wars triggered back in the Tyranny. (Was the tyranny Trump’s? Beckett names no names.) With 40% of the population now Hispanic, por cierto and jesucristo are part of the Anglo lexicon. The privileged classes are known as delicados, while refugees from the drought belt and the Storm Coast are referred to as barreduras (dirt), “dusties” and “storm trash”. Ignorance levels are casually shocking: most citizens have not heard of Abraham Lincoln. Against this backdrop, fake news stories, rumours and opinions – many generated by “silvertongue” AI capable of generating jokes and sophisticated rhetoric – are so deeply embedded in the culture that real facts are mere raw material to be re-tooled, showcased or suppressed for political expediency. As the novel’s British protagonist Holly notes, persuasion operates on “a calculus of dread and comfort … Which way offers, if only fractionally, the higher level of security, the lower level of threat?” As a PR executive, these are the waters in which the ambitious Holly has opted to swim. When she agrees to serve on the presidential campaign of her new boss, the quixotic senator Steven Slaymaker, her historian boyfriend Richard and their delicado friends become alarmed at the turn her ambitions are taking. But as an outsider, Holly shares the blue-collar Slaymaker’s disdain for bleeding hearts and hand-wringing. And the attitude is a vote-winner: according to Pollcloud, which Holly can access on the whispernet in micro-seconds, 63% of the population agrees with the statement, “I wouldn’t expect the government to help me, so why should I help others?” Skilled in the manipulation of the masses, Holly also knows how to capitalise on liberal-elite hypocrisies: when addressing an audience of billionaires at a fundraiser, she evokes America as a nation built by people willing to make sacrifices. “This raised a big cheer. Sacrifice was always a moving and uplifting idea, and particularly so if you were not the ones who were going to have to make it.” It’s a rare moment of humour in a dark, morally troubling world spent in the company of a protagonist whom Beckett – to his credit – seems to be almost defying us to like or respect. Having watched her parents campaigning fruitlessly for systemic change, Holly is refreshed rather than repelled by Slaymaker’s brand of pragmatism, which unashamedly accepts that successful politicians are sharks: if they stop setting the agenda, they die. Action, right or wrong, soon becomes Holly’s guiding imperative too – spawning a brainwave that will have dramatic consequences for the entire North American continent. By the time Beckett’s story reaches its dystopian conclusion, the reader is forced, through Holly, to contemplate the choice between dirty but effective action and clamorous passivity. With no obvious third way, Beckett poses the question: is it better to roll up your sleeves and do something – perhaps anything at all – than to observe or avert your gaze? America City is an uneasy read that manages to feel both timely and urgent. In positing his story as a slice of future history, Beckett’s focus is less on the speculative question “what if?” than the more provocative and poignant “what when?” And in setting it within the lifetime of any baby born now, he offers an intelligent, visceral reminder that unless we change what today looks like, tomorrow will be turbulent indeed. Liz Jensen’s The Uninvited is published by Bloomsbury. • America City is published by Atlantic. To order a copy for £16.14 (RRP £18.99) go to bookshop.theguardian.com or call 0330 333 6846. Free UK p&p over £10, online orders only. Phone orders min p&p of £1.99."
"Did you know that three meat companies – JBS, Cargill and Tyson – are estimated to have emitted more greenhouse gases last year than all of France and nearly as much as some of the biggest oil companies like Exxon, BP and Shell? Few meat and dairy companies calculate or publish their climate emissions. So for the first time ever, we have estimated corporate emissions from livestock, using the most comprehensive methodology created to date by the UN’s Food and Agriculture Organization (FAO).   And before the meat and dairy industries descend upon COP23 to broadcast their “feed the world” narrative, let’s set the story straight: their emissions could lead us to a point of no return. We’ve found that the top 20 meat and dairy companies emitted more greenhouse gases in 2016 than all of Germany, Europe’s biggest climate polluter by far. If these companies were a country, they would be the world’s seventh largest greenhouse gas emitter.  It’s now clear that the world cannot avoid climate catastrophe without addressing the staggering emissions from the largest meat and dairy conglomerates.  Over the past few decades, the meat and dairy majors have become immensely powerful and have successfully pushed policies to support rapid growth of industrial meat and dairy production and consumption around the world, at all costs.  One consequence, among many, is that livestock production now contributes nearly 15% of global greenhouse gas emissions, even more than the transportation sector. If production continues to grow as projected by the FAO, emissions will escalate to the point where industrial meat and dairy production alone will undercut our ability to keep temperatures from rising to an apocalyptic scenario. At the upcoming COP23 climate meeting in Bonn, Germany, the world’s largest meat and dairy companies will tell a different story. They’ll explain that their production is necessary for world food security, and that they should therefore be let off the hook, or better yet, get incentives for tinkering with their greenhouse gas emissions.  This is not true.  These companies produce a vast amount of highly subsidized meat and dairy in a handful of countries where these products are already overconsumed. They then export their surpluses to the rest of the world, undercutting the millions of small farmers who actually do ensure food security and bombarding consumers with unhealthy processed foods. In Bonn, the big meat and dairy companies are also likely to spend much time and money talking about efficiency, while expanding production. They will say that the only way to effectively reduce emissions is by squeezing out ever more milk from each dairy cow or by bringing beef cattle to slaughter ever more quickly.  Such “solutions” would only compound the industry’s horrific treatment of workers and animals and exacerbate the environmental and health crises caused by the industry.  They would also condemn the 600 million small-scale farmers and 200 million herders who depend on livestock for their livelihoods and who do feed billions of people every day with moderate amounts of meat, dairy and eggs. These small producers are the backbone of food systems that can arrest and address climate change. They are the ones who need to be supported and strengthened. If we are serious about feeding the planet while fighting climate change, the world needs to urgently invest in a transition to food systems that hinge on small-scale producers, agroecology and local markets.  These systems provide for moderate levels of meat and dairy, but they do so in a way that regenerates soils, provides livelihoods to rural and urban communities and makes crops and animals resilient to the vagaries of an unpredictable climate.  The solutions exist; they just need to be urgently implemented. The first step is to redirect public money from factory farming and agribusiness towards small-scale agroecological family farms. Governments should also use their buying power to support small producers, helping them to build jobs and markets for local products.  As numerous cities make energy choices to tackle climate change, so too should municipalities invest in farm-to-hospital and farm-to-school programs that deliver healthier food and strengthen rural communities while emitting fewer greenhouse gases. It is time to stop the dairy and meat giants from destroying the climate and shift our support to making our small farmers, herders and ranchers resilient."
"The US has changed the focus of one of its few public events at the Bonn climate talks to emphasise coal and nuclear power, in a sign of the Trump administration’s goals at the talks. An event next Monday, opening the second week of the ongoing UN negotiations, was originally billed as promoting clean energy. However, it has since been changed to emphasise coal and nuclear power.  The event was first billed with the title Action on Spurring Innovation and Deploying Advanced Technologies but was subsequently changed. The same event has now been retitled to: The Role of Cleaner and More Efficient Fossil Fuels and Nuclear Power in Climate Mitigation. The speakers are listed as the same, but the explanation of the event’s focus has also changed markedly, from talk of “innovative solutions” and “transforming development pathways” to a strong statement in favour of fossil fuels. It now reads: “It is undeniable that fossil fuels will be used for the foreseeable future, and it is in everyone’s interest that they be efficient and clean. This panel will explore how the US will be a leader in cutting carbon emissions through cleaner, more efficient fossil fuels and other energy sources.” There was no explanation of the change. A US state department official declined to comment before the event but noted it would be open to all at the conference. However, observers said the change was in line with the US government’s stance at the talks, which are focused on how to improve countries’ carbon-cutting targets under the Paris agreement of 2015. Andrew Light of the World Resources Institute said: “Whoever the Trump administration is trying to target with this event, it isn’t people in the negotiating hall – they’re clearly focused on the booming global markets in renewable energy. At best, this event will be a curiosity, given the isolation of the US now in the international process.” Although US president Donald Trump has begun the process of removing the US from the Paris agreement, this will not take effect, under the UN processes, until 2020. This means the US is still a party to the agreement and still present at the talks. However, for the first time in at least a decade, the US has no visible official representation. Under Obama, there was always a large US pavilion at the annual meetings – and even under George W Bush, who vowed to keep the US out of the Kyoto protocol even when other countries had ratified it and brought it into force in 2005. At Bonn, the US occupies a small locked room that often seems unoccupied. There is no pavilion, and Monday’s event on coal and nuclear power is the first public sign of the US government’s engagement, though the UN said US delegates were present at at least some of the many meetings taking place around the event."
nan
"Syria has decided to sign the Paris agreement on climate change, the world’s final functioning state to do so. The surprise decision, taken amid a brutal civil war in the country, will leave the US as the only country outside the agreement if it follows through on President Donald Trump’s vow to leave. Syria’s decision brings to 197 the number of nations signed up to the landmark 2015 pact on global warming, the first in more than 20 years of UN negotiations to bind both developed and developing countries to a clear limit on temperature rises.  The 2015 Paris climate agreement is the first truly global deal to tackle climate change. It commits governments to limit temperature rises to no more than 2C (3.6F) – which scientists say is the threshold of safety, beyond which the effects of global warming are likely to become catastrophic and irreversible –  and to pursue efforts to limit the temperature increase to 1.5C. It has been signed by 197 countries. The US is on course to become the only country outside the agreement if it follows through on Donald Trump’s vow to leave. President Barack Obama signed the accord and it was ratified before his term of office ended, but this summer Donald Trump began the process of withdrawing from it. Withdrawal will take several years under UN rules, so the US officially remains a party until 4 November 2020, the day after its next presidential election. The US is the only country to renege on the agreement. Civil society groups said the US, the world’s largest economy and second biggest emitter of greenhouse gases after China, was now isolated on the world stage. Paula Caballero, global director of the climate programme at the World Resources Institute, said: “Now the entire world is resolutely committed to advancing climate action – all save one country. This should make the Trump administration pause and reflect on their ill-advised announcement about withdrawing from the Paris agreement.” Michael Brune, executive director of the Sierra Club environmental group, said: “As if it wasn’t already crystal clear, every single other country is moving forward together to tackle the climate crisis, while Trump has isolated the US in an embarrassing and dangerous position. Trump’s desperate moves to help corporate polluters by refusing to acknowledge the climate crisis shows he neither cares about leadership nor does he understand it.” Observers said that although the White House could withdraw the federal government from the pact, cities and states in the US would continue to take action on climate change, for instance by investing in renewable energy. The French government, according to reports, said Trump had been excluded from the invitations to more than 100 world leaders to meet in Paris for a climate conference next month, to follow on from the Paris agreement. The US delegation in Bonn, where two weeks of UN climate negotiations are in their second day, did not respond to the Guardian’s request for comment. The US is participating in the Bonn talks, according to the UN climate chief Patricia Esposito, but its contributions so far have been low-key. Under UN rules, it will continue to be allowed to do so until the formal withdrawal can be completed in 2020. At the Bonn talks, called COP23 in the UN jargon, countries are hoping to come up with a roadmap to meet the goals set out in the Paris agreement. In 2015, countries agreed to hold rising temperatures to no more than 2C, which scientists say is the limit of safety, beyond which the ravages of climate change are likely to become catastrophic and irreversible. Such a roadmap must include ways to toughen the promises on curbing greenhouse gas emissions that countries made in Paris. The Paris pledges are not in themselves enough to satisfy the 2C limit, and if left unchanged would lead to a 3C rise in temperatures, according to studies. A 3C rise would mean far higher sea level rises, heatwaves and droughts afflicting large swaths of the globe and making agriculture impossible in those areas, while devastating floods would increase in other areas. To meet the Paris goals, countries will have to ratchet up their commitments on emissions reductions, which will be a difficult negotiation. Scientific advice at the Bonn conference has been clear, however: this year is likely to be the third warmest on record, confirming a warming trend that bears the fingerprints of human activity affecting the global climate. Syria’s decision was largely symbolic, given the country’s disarray, and follows a similar announcement before the Bonn talks by the only other holdout on the Paris accord, Nicaragua. Also at Bonn, the Vatican Pontifical Academy of Sciences warned in unusually strong terms that unchecked climate change and air pollution would put “the very fabric of life on Earth, including that of humans, at grave risk”. The Pope warned in a preface to the Vatican report that “transport, industrial fumes, substances which contribute to the acidification of soil and water, fertilisers, insecticides, fungicides, herbicides and agrotoxins in general” were risks to millions, with the poor at particular hazard, and warned that technology from the business sector might not be the answer. The Pope has been increasingly outspoken on environmental issues, sending out an encyclical on climate change ahead of the Paris agreement. The European Environment Agency reported that the EU was on track to meet its goals on reducing emissions by 2020, with a slight fall in greenhouse gas output last year, but would require more effort to meet its 2030 targets under the Paris agreement."
"The United Nations should give a “seat at the table” to a powerful group of US states, cities, tribes and businesses that are committed to taking action on climate change, Michael Bloomberg has urged. In an apparent bid to circumvent US president Donald Trump’s moves to withdraw from the Paris accord, the billionaire philanthropist also said the world body should accept an alternative set of US climate commitments alongside national pledges to reduce carbon emissions.  The former New York mayor was speaking at the UN’s climate change conference in Bonn, Germany, during the launch of the America’s Pledge report. The report has found that US states, cities and businesses that have signed up to reduce greenhouse gas emissions together represent a GDP of about $10tn. That is more than any nation except the US and China. “If this group were a country, we’d be the third-biggest economy in the world. We should have a seat at the table,” Bloomberg said. “If Washington won’t lead, then mayors and governors will.” Bloomberg – who is also a UN special envoy for cities and climate change – was among a high-level alternative US delegation that included Californian governor Jerry Brown, four senators, several mayors and representatives of major US corporations. Together they claim to represent a majority of people in the US. “The American government may have pulled out of the Paris accord but the American people are still committed to its goals,” Bloomberg said. “And there is not a thing the government can do to stop us.” The rival US group have overshadowed the muted official US delegation, which has shown the priorities of the Trump White House by scheduling a meeting at the talks focusing on the future of coal. The packed America’s Pledge launch event took place in the US Climate Action Center, an inflatable dome that the alternative US delegation is using as its headquarters. Although it is outside the official conference hall, its close proximity, huge space and packed crowds highlighted the high status of the rival body. It also got a top-level endorsement from the organisers. “They may be non-state actors, but they are leaders in this process. America’s Pledge sends a powerful message to the world that America is still in the game,” said Frank Bainimarama, the prime minister of Fiji, which is the president of this year’s UN conference. Patricia Espinosa, executive secretary of UN Framework Convention on Climate Change, said she would take the report to the official parties at the conference centre. “We’re standing at the edge of something truly special,” she said in an upbeat assessment of the progress made so far in the US and elsewhere on the adoption of clean energy such as wind and solar. She said the world was moving from the information age to the “age of renewal.” In an atmosphere often reminiscent of a campaign rally, Senator Ed Markey, a Democrat from Massachusetts, said the solar industry in the US had created 50,000 jobs in 2016 – equivalent to the entire coal mining industry – and that the renewable industry as a whole would employ half a million workers by 2020. “This is the greatest blue-collar job creation in two generations,” he said. Many major US corporations have also signed up to the campaign. Laura Phillips, senior vice-president of sustainability at Walmart, said a transition to clean energy made economic sense.  She said the world’s biggest retailer had enough solar cells on its supermarkets to cover 190 football fields and had saved $1bn in fuel bills: “It’s good for business, it reduced emissions and it’s good for our community.” But critics argue carbon trading and massive investments in technology do not deal with the root causes of the problem, which are overconsumption and capitalism. The event was interrupted by protesters who raised banners declaring “False Solution for the Planet” and chanted “We are the solution. Don’t trade pollution!” in reference to California’s carbon cap-and-trade scheme. In a raucous five-minute exchange with the hecklers, Jerry Brown accepted that governments need to do more, but he said it was necessary to make the transition in stages rather than all at once.  “That is good noise,” he said to the chanters. “But it doesn’t get the job done. You need a plan ... the perfect can be the enemy of the better.” Several speakers highlighted the progress made in their regions. Pittsburgh mayor Bill Peduto said a blue-green alliance between labour unions and renewables companies had revitalised his city after the post-industrial decline of its traditional steel industry.  “Time goes in only one direction. If you wait for the mills and mines to reopen, you’ll be left in the past,” he said."
