"Rising global temperatures mean pests will devour far more of the world’s crops, according to the first global analysis of the subject, even if climate change is restricted to the international target of 2C. Increasing heat boosts both the number and appetite of insects, and researchers project they will destroy almost 50% more wheat than they do today with a 2C rise, and 30% more maize. Rice, the third key staple, is less affected as it is grown in the tropics, which are already near the optimal temperature for insects – although bugs will still eat 20% more. Rising heat stress on crops is already expected to cut cereal yields by about 10% for 2C of warming, but the new research indicates rising pest damage will cause at least another 4-8% to be lost. With 800 million people chronically hungry today and the global population rising towards 10bn, increasing pest destruction will worsen food security. “For many, many people in the world there is already a shortage of food, so it is not like we can afford to spare [more],” said Prof Curtis Deutsch at the University of Washington, US, who led the work. “A lot of people in the world, the most vulnerable, can’t afford to give up anything.” The UK is the worst affected of significant wheat producers, with pest losses expected to more than double from 5% to 11%, and Canada will suffer the biggest increase in maize losses, from 6% to 10%. The world’s biggest growers will also see a major impact, with China’s wheat losses rising 50% and and US corn losses going up by a third. The losses are likely to be underestimates as the scientists did not consider factors such as increased transmission of crop diseases carried by insects, or losses after harvest when the grain is stored. The research also did not assess the risk of population explosions of insects that can wipe out crops, due to the complexity of such events. Action by farmers to try to avoid new pest losses is unlikely to be successful, said Prof Rosamond Naylor at Stanford University, US, and one of the research team. “Increased pesticide applications, the use of [resistant] genetically modified crops and practices such as crop rotations will help control losses from insects. But it still appears that under virtually all climate change scenarios, pest populations will be the winners.” The research, published in the journal Science, started with well-established knowledge about how rising temperature affects insects. “Warmer temperatures increase insect metabolic rates exponentially [and] increase the reproductive rates,” said Deutsch. “You have more insects, and they’re eating more.” The team then added data on today’s pest losses and used a range of climate change models to estimate future losses – all showed significant damage. Overall, losses were found to increase by 20-50% for 2C of warming above pre-industrial levels and 40%-100% for 4C. The latter will be reached this century if carbon emissions are not cut soon. “The overall picture is, if you’re growing a lot of food in a temperate region, you’re going to be hit hardest,” said Scott Merrill at the University of Vermont, another member of the team. Europe’s breadbasket is among the hardest hit, with 11 nations predicted to see a rise in pest losses of 75% or more. “France will get a double whammy,” said Merrill, as it is a top five producer of both wheat and maize. Another big wheat producer, Russia, will see losses rise from 10% to 16% with 2C of warming. Across the globe, an extra 200m tonnes of grain are expected to be eaten by insects in a 2C warmer world. The research was deliberately conservative and so did not allow population explosions of pests to take place in the computer simulations, as it’s difficult to model how these develop, but such explosions cannot be ruled out. Deutsch noted that warmer winters have led the pine bark beetle to kill off forests across North America: “They just come out gangbusters in the spring. You can see the damage to space.” “It is an example of what can happen when you have huge tracts of land that are essentially single crops species with one major pest,” he said. “That is similar in many respects to what agriculture has produced – miles and miles of a single plant.” He also said insect population explosions are seen in fossils from warming periods in the Earth’s past. Markus Riegler, at Western Sydney University in Australia and not part of the research team, said the new work was the first global analysis. “The results show that insects will cause significantly increased grain loss across many regions of a warmer world,” he said. The work used data on 38 insect species but Riegler said the results should be verified for more pests in future. “The substantial increases in pest damage forecast call for action on climate change [emissions] and adaptation,” he said. “Everyone must be involved in change: farmers, industries, policymakers and wider society.”"
nan
"Drivers in Europe have paid €150bn more on fuel than they would have if their vehicles had performed as well on-the-road as in official laboratory-based tests, according to a new report. Car companies have legally gamed official tests of fuel economy for many years by, for example, using very hard tyres during tests or taking out equipment to make cars lighter. The gap between test and actual performance has soared from 9% in 2000 to 42% today.  Analysts at research and campaign group Transport & Environment have now calculated that this difference cost motorists in Europe €150bn (£136bn) in extra fuel between 2000 and 2017. UK drivers paid €3.5bn more in 2017 alone, and a total of €24bn since 2000. A new more realistic lab test is now in place but the European commission uncovered new evidence in July that this was also being gamed by carmakers. This means the increases in fuel efficiency being demanded by the EU as part of its action on climate change are still being undermined and drivers will continue to use more fuel than policymakers intend. Greg Archer, at Transport & Environment, said carmakers’ claims of big improvements in fuel consumption are illusory: “Despite regulations to reduce emissions, there has been no real-world improvement in CO2 emissions for five years and just a 10% improvement since 2000 – far less than the industry like to claim. The victims are citizens that have paid out €150bn for more fuel and are also suffering the consequences of unchecked climate change.” A spokeswoman for the European Automobile Manufacturers’ Association (ACEA) said: “It is a matter of fact that technological improvements to new cars have resulted in major CO2 reductions in the past decades, leading to important savings for consumers.” Until recently, all cars underwent a lab-based fuel efficiency test called NEDC. But legal loopholes allowed manufacturers to produce much lower emissions in the tests than on the road, thereby undermining an EU drive towards lower carbon emissions and more economical motoring. Some discrepancy between a standardised test and real world driving is expected, so the Transport & Environment calculations used the 9% gap in 2000 as a starting point. It then worked out how much less fuel drivers in Europe would have needed if that gap had remained constant, rather than rising to 42%. As well as costing motorists more, the gap means CO2 emissions from cars were 47m tonnes more than intended by the regulations in 2017 alone. A new more rigorous test, called WLTP, applies to all new cars sold from September 2018 and it is far more reflective of real world driving, being longer and involving faster accelerations. It also eliminates some of the test loopholes. However, the European commission’s Joint Research Centre (JRC) found evidence that car makers were still gaming the new test, although in an unexpected way – to report higher emissions. The rationale for this is that the new WLTP will be used as a baseline for the 15% CO2 reductions proposed by the commission for cars by 2025. Tactics used were starting tests with a depleted battery, meaning more fuel was used to charge it up, and switching up gears more slowly, so the engine speed was faster for longer. These inflated the results by 4.5% on average and up to 13% for some vehicles, the JRC said. Transport & Environment said the gaming could mean carmakers have to deliver just half the emissions reductions intended. “ACEA fully agrees that CO2 values should not be artificially increased on purpose in any way that would undermine the post-2020 CO2 targets,” the spokeswoman said, adding that the issue “is not an industry-wide problem”. All companies should ensure future CO2 reductions are not delivered by optimisation of the testing procedure, she said. A separate report from the UK’s RAC Foundation has found that tens of thousands of popular cars will be unable to use a new fuel that may be introduced to cut carbon emissions. Regular petrol already contains 5% bioethanol, which is produced from plants, but ministers are proposing to increase that to 10%. However, 634,000 cars would be incompatible with E10 fuel by 2020, according to the analysis. Many are vintage vehicles but some are popular family cars, including 28,000 VW Golfs and 16,000 Nissan Micras. A current government consultation suggests that larger garages offering E10 in future must also offer standard E5 as well."
"In America today, it’s rare to see political leaders respond to a threat with an appropriate evidence-based policy solution. At the national level, more often we see actions that aggravate existing problems or create new ones. California – the country’s most populous and economically powerful state – has been a welcome exception. California has been battered by extreme weather intensified by climate change. From 2012 to 2016 the state was scorched by its worst drought in over a millennium. Weather whiplash struck in 2017, when much of the state broke precipitation records. This combination led to devastating mudslides and created the conditions for the most destructive and costly wildfire season on record in 2017, followed by the state’s largest-ever wildfire in 2018, which broke the previous record (set in 2017) by more than 60%.  All of these impacts have been exacerbated by global warming. The past five years have been California’s five hottest on record. And so, the state’s leaders decided to do something about it. California had already set a renewable portfolio standard in 2002, strengthened by Governor Arnold Schwarzenegger’s 2008 executive order requiring that 33% of electricity be generated by renewable sources by 2020. Governor Jerry Brown signed Senate Bill (SB) 350 in 2015, expanding the requirement to 50% renewables by 2030.  Last week, California state lawmakers passed State Senator (and candidate for US Senate) Kevin de León’s SB 100, which amps up the target to 50% renewables by 2026, 60% by 2030, and 100% from “renewable energy resources and zero-carbon resources” by 2045. The more aggressive clean energy targets are justified. Not only does California need to make up some of the climate slack created by the Trump administration, but the state is now ahead of its targets, with 29% of electricity last year generated from renewables and over 50% from zero-carbon sources (including nuclear and hydroelectric power). According to the latest California Climate Change Assessment Report, global warming impacts will continue to batter the state: Kevin de León specifically cited the record-breaking wildfires as a key factor in generating the votes to pass SB 100, which had been under debate for nearly two years.  ""Our state is one big tinderbox,"" says @kdeleon in closing on #SB100. ""Wildfires are not longer seasonal."" @HunterCutting, in case you're still wondering whether #cawildfires affect #SB100 debate. Similarly, with its air badly polluted by smoke from wildfires, the Spokane, Washington City Council approved an ordinance setting a goal to get 100% renewable electricity by 2030. And after being struck by Hurricane Harvey in 2017, an increasing number of Houston-area residents accept human-caused global warming (64%) and are concerned about its impacts (52%). It’s hard to deny the reality and adverse impacts of human-caused climate change when they’re hitting people at home. California has long been a leader in climate solutions. The state is home to nearly half of all electric vehicles in the country (over 350,000), with by far the highest per-capita EV ownership of any state. California uses the least electricity per capita of any state, has a carbon cap and trade system, and a thriving economy. California is also leading the way in fighting the Trump administration’s backwards climate policy rollback. Next week, the state will even host a Global Climate Action Summit.  Unfortunately, a new study found that while local climate action like California’s is important, it’s insufficient to make up for the Trump administration’s inaction. To achieve the needed cuts in carbon pollution, federal policy is needed. That means replacing the current Republican leadership and its platform of climate denial with a Democratic leadership like California’s."
"The former president of the National Farmers’ Federation, Brent Finlay, has accused politicians of “jumping in front of the cameras” while shirking effective policy work on drought and climate change. As Scott Morrison and his special drought envoy, Barnaby Joyce, toured south-west Queensland on Tuesday, Finlay described the former deputy prime minister and agriculture minister as the last in a long line of ministers who had “no real appetite” for national drought policy in a changing climate. “Climate change and connectivity are the two biggest issues facing the bush. Climate change is real and we have to have a national drought policy framed on what we know about climate change – the two are interlinked,” Finlay told Guardian Australia. “Instead of jumping in front of the cameras when a drought is on, we need them to do the grunt work on effective financial measures that allow our farmers to build up cash reserves in the good times to draw upon when the dry comes again.” He also called on governments to start rewarding good farmers who prepare for drought rather than the “less efficient” farmers. Finlay said politics had caused a failure of a national drought policy which should apply some structure to how farmers cope in drought and the nature of government assistance. “I went to Labor and the Coalition in 2013 when nowhere in Australia was in drought,” Finlay said. “The Labor government had dropped the exceptional circumstances funding program and I made the comment, this is gone now, what is the national drought policy? “Labor said they would do a policy before the 2013 election. [Former Coalition agriculture shadow spokesman] John Cobb said there would be something on drought. When Barnaby was appointed, he said it will be in the agriculture white paper. It was not there. Building a national drought policy “always seemed too hard”, he said. The white paper did not include climate change in its terms of reference and the NFF was not consulted on those terms. Finlay would like to see drought treated as a new category in natural disaster arrangements to embed a structural mechanism beyond the politics of the day. Dry spells could then be monitored using data from the CSIRO and the Bureau of Meteorology and when the outlook turned towards drought, conditional government assistance that rewarded good managers would kick in. “Farmers acknowledge drought is a regular part of agriculture and with climate change we will potentially see more and more and that’s what we need,” he said. “The climate is changing, you can see it in the eyes of farmers who dismissed it as rubbish eight years ago. By recognising climate change, it is empowering resources to support agriculture.” He would like to see a permanent drought commissioner placed in the prime minister’s office to be proactive on policy development and climate monitoring. This would be a significant move, as it would place the commissioner out of the hands of the agriculture minister, who is a National party minister in any Coalition government. “The permanent drought commissioner needs to be in PMO, we need to keep it at arms length from those politicians that feel they are directly effected. If it’s in PMO and hopefully its bipartisan, it elevates the management of the position.” Finlay was president of the National Farmers Federation for three years from 2013, coinciding with the last months of the Gillard-Rudd Labor government and Barnaby Joyce’s first three years as agriculture minister. He was also chair of the NFF’s national drought committee. Finlay said the government should put all ideas on the table to change the thinking on drought policy towards a model that rewarded good farm managers. “It’s not going to make me popular to say it but unfortunately current drought assistance measures reward our less efficient farming operators at the expense of those families who’ve been better prepared for drought. “You’ve only got to look at our current weather patterns to know that climate change is real and we should expect more extreme weather including more droughts in the future.” Guardian Australia has contacted Barnaby Joyce’s office for comment."
"Climate change is putting one of the world’s oldest beer varieties at risk, environmental scientists and one of Belgium’s leading artisan brewers have said. A study into temperatures in Brussels and the Pajottenland region south-west of the Belgian capital has raised doubts over the future of the sour lambic beer produced exclusively in the region.  Lambic is fermented in the open air through exposure to wild yeasts and airborne native bacteria. It relies on night-time temperatures of between -8C and 8C (18F-46F) for cooling and inoculation. The traditional brewing season runs from October to April, with bezomerd – Brussels dialect for a beer that has had “too much summer” – a possibility if it is produced any later. After cooling, the lambic is placed in wooden barrels where it is exposed to microbes living on the wood. The perfect temperature for ageing lambic is below 25C, above which the risk of unwelcome bacteria spoiling the beer rises. A joint project between the climate scientists Mark and Asa Stone, Adam Harbaugh from the beer research site Lambic.info and the Brussels brewery Cantillon found this limited brewing window has shortened from 165 days in the early 1900s to about 140, as temperatures have pushed it later into the autumn and brought the season prematurely to an end in early spring. It is feared the number of brewing days will shrink further, bringing the risk of a similar disaster to 2015, when beer had to be thrown away due to excessive temperatures. Dr Mark Stone, a director at the University of New Mexico’s Resilience Institute, said: “The impacts of climate change are often gradual until a tipping point is crossed. Our results show that Cantillon is experiencing shifting brewing conditions, and that adaptation to avoid crossing a threshold will require changes in brewing operations that are outside of their traditional methods. “The threat of climate change on traditional lambic production at Cantillon is indicative of the broader issue. That is, the impacts are not fully recognised until a threshold has been crossed, and adaptation strategies often exacerbate the problem while delaying the inevitable.” Cantillon, which produces 400,000 bottles of the sour beer a year, has warned its ability to produce the beer could be under threat in the long term. Jean Van Roy, Cantillon’s owner, told the Brussels Beer City blog that he believed if he artificially cooled the wort – a liquid extracted during the mashing process – it would change the taste of the beer. “If tomorrow I would have this problem every season, financially it could be a bit difficult, so we would have to change something,” he said. “[But] I would hate to do that … Or we move the brewery to go up north to begin to brew in Denmark, in Sweden, I don’t know.”"
"Sir James Dyson, the billionaire inventor and Brexit backer, has unveiled expansion plans to accommodate more than 2,000 workers at his Wiltshire research facility, more than doubling capacity for electric-vehicle testing. Coming despite severe warnings over lost jobs and investment from no-deal Brexit, his technology company is spending about £200m to expand the testing facility on a former second world war airfield at Hullavington, near Malmesbury in the west of England. The investment comes a year after Dyson announced plans to create an electric vehicle to propel his high-tech household goods company to become a rival to Tesla, the carmaker started by the US billionaire Elon Musk. The British engineering company is developing a car that is due to be ready for road testing in 2020, with the first deliveries coming a year later. Dyson’s expansion plans for the research and development site, which is already home to about 400 workers, include planning applications for more than 10 miles of vehicle-testing tracks with high speed sections, hills and off-road routes to put its new electric cars through their paces. Although only recruiting about 300 more automotive workers at present, planning details show the 45,000-square-metre site will ultimately have space for more than 2,000 people. In addition to the testing track, there will be a cafe, sports centre, recreation space and supporting technical facilities. Dyson has yet to make a decision on whether it will mass-produce its electric vehicles in Britain once testing is complete. Although it designs and develops products in the UK, supporting high-value jobs, it manufactures them in cheaper locations such as Singapore and elsewhere in the far east. The company employs more than 12,000 people around the world with about 4,800 in the UK, centred around Malmesbury. Alongside its vacuum cleaners, hand dryers and car development, the company is working on battery technologies, high-speed electric motors, vision systems, machine learning and artificial intelligence. Despite difficult trading conditions facing many firms after the Brexit vote amid heightened political uncertainty, Dyson has not changed his view that leaving the EU would be best for the country. Before the referendum he was among the most prominent business supporters of Britain leaving the EU despite fiercely vocal support for remain from many other senior figures in business and industry. “Brexit can supercharge British technology and refocus minds on global trade if only we grab the opportunity with both hands – the government must embrace it and support British businesses,” he told the Guardian. Several major industrial companies and carmakers, including Airbus, BMW and Jaguar Land Rover, have warned a hard Brexit would trigger a reassessment of jobs and investments in Britain. Economic growth has slowed since the referendum, while households are more than £900 worse off, according to the governor of the Bank of England."
