"In northern Minnesota, there’s a near-mythic expanse of lakes and boreal forests known as the North Woods, packed with spruces, firs, red and bur oaks, and other trees. It’s in danger of vanishing forever.  The North Woods joins the ever-lengthening list of regions threatened by climate change. Temperatures in Minnesota have increased by more than 1.5F since record keeping began, according to a 2013 report by the state’s interagency climate adaptation team. Temperatures have risen even more in the northern portion of the state, and the growth is picking up speed, with more than 80% of the recorded increase happening since 1980.  These increases are expected to continue through the next 50 years, joined by more days of extreme heat, heavier precipitation and other changes to the region’s climate. As rainfall and other conditions shift because of climate change, once iconic species like spruce and fir may move northward, either leaving the forests replaced by unproductive grasslands or given over to the hardwoods more common further south. Climate change, the state report says, will “likely exacerbate and intensify the effects of invasive plant species, insect pests, and tree diseases”. In other words, the forest – like others across the northern United States and southern Canada – could disappear. Now the conservationists most driven to save the forest may do so only by changing its nature for good.  In the hope that it may be able to save the North Woods, the Nature Conservancy’s North Dakota, South Dakota and Minnesota chapter has begun experimenting with a controversial technique that – if proven to be successful – could lead to trees being moved from distant reaches of the state’s forests to those most threatened by climate change. Led by Meredith Cornett, the chapter’s science director, the conservancy wants to test “assisted migration”, a lightning-rod conservation practice that broadly means moving species from one region to another either to help that species or the target region adapt to changing conditions.  In actuality, assisted migration is a nuanced concept. The Nature Conservancy study, called the Iron Range Experiment, is a small test meant to compare how specific tree species – and genotypes, or variations – within those species fare under different climate conditions and forestry practices.  Here’s how it will work: Nature Conservancy will plant seeds for 100,000 red oak, bur oak and white pine trees on 2,000 acres of federal, state and local forests in Minnesota’s Iron Range. Seeds from each species will come from two zones: one from within the test range, and another from distant parts of the species’ historic range (mostly from southern Minnesota, and, in some cases, a portion of Michigan where the trees exist).  Researchers from the University of Minnesota Duluth will then manage these test forests in different ways to find out whether varying how the trees are planted and managed affect how each species fares; how different climate conditions affect their viability; and whether seeds originating from other parts of the forest – where different conditions exist – impact how two seemingly identical trees withstand the same conditions.  If the trees moved from distant zones prove to adapt well, this kind of assisted migration could be adopted as a way to maintain the health of forests that might otherwise be decimated by climate change.  Some critics argue that this type of intervention would change the essential character of the forest. Indeed, some of the species being moved are the hardwoods that may one day replace the North Woods’ conifers in any case as a result of climate change.  But Meredith Cornett, the science director of the Nature Conservancy chapter conducting the experiment, compares managing forests to restoring historic buildings. In both cases, she says, sacrifices are controversial – and, perhaps, necessary.  For example, she asks, is it better to restore a historic home to an exact copy of its original construction, or to use modern knowledge and new technologies to protect the structure? When should such a home’s conservationists hew to historic building techniques and finishes, and when should they install new wiring, place well-insulated storm windows and avoid lead-based paint?  “We’re still trying to maintain the character of the home and keep [it] there in the neighborhood, but the world has changed, and we’ve got new tools available to us,” Cornett says. The term “assisted migration” was coined after proposals to transplant Torreya Pines from Florida to North Carolina in 2007 sparked heated debate. But Julie Etterson, the University of Minnesota biologist conducting the study with the Nature Conservancy, says the definition of the practice isn’t completely clear. Critics often seem to judge assisted migration projects using a double standard: traditional forestry practices are far more disruptive than the movement of small samples of distant genotypes that are part of the same species, she claims. “I think that’s a little bit ridiculous given what foresters do, which is wholesale movement of genotypes across the landscape,” Etterson says. “It seems like in the context of the lumber industry that’s fine. In the context of climate change, you’re breaching some sort of conservation barrier that’s inappropriate.” What’s more, Etterson says, the impact of assisted migration is unclear. In fact, clarifying the process and its effects is a large part of the Iron Range experiment. “My general feeling is we just don’t know enough about the consequences of genetic mixing to go full force into widespread assisted migration, so I’ve been working with the Nature Conservancy in the design of experiments that we might do,” she says. Christopher Preston, an environmental ethicist at the University of Montana, says many ecologists would consider Etterson’s form of assisted forestry as different from migration for agriculture or timber because of the intention behind each practice. “A lot of environmentalists in the environmental ethics community are a little leery of assisted migration because it is [a little] like nature plus the human hand,” Preston explains. “Is it better I have these species here through the help of my hand or to not have this species at all? Is it better to leave some landscapes untouched and let things unfold?” Many ecologists believe that moving a species, even a tree, from its native ecosystem to put it somewhere else transforms it into something else. “It’s a little bit like a polar bear in a zoo,” Preston says. “Some people think that’s no longer a polar bear.” For Cornett of the Nature Conservancy, Minnesota’s natural and cultural identity is intricately linked, and – she argues – the state needs novel approaches to preserve its North Woods. “It is a wild place and it has tremendous recreational and cultural value, to say nothing of the jobs it supports and so on,” she says. It’s not hard to see the economic impact of forestry in Minnesota. According to a data sheet provided by the Nature Conservancy, the state’s forests are responsible for 20,000 jobs and more than $2bn in annual wages, as well as $7bn in timber harvest values. The forests are also responsible for hundreds of millions of tourism dollars. The state’s woodlands also provide considerable quality of life benefits for people in the region. “When it comes to protecting water quality, healthy forests may be as close as we get to a silver bullet,” the Conservancy explains in its data sheet. “They are nature’s own water purification system, absorbing pollutants and trapping sediment before they damage lakes, rivers and groundwater.” But while there’s no question that Minnesota’s forests benefit its citizens, Preston says that environmentalism isn’t only about ensuring that nature serves human needs.  “It’s about letting the earth be,” he says. “The ecosystem services language is one you have to use carefully. If it’s about restoring the ecosystem function, then there are arguments to think that that’s probably a good idea. Preserving function with a little bit of help from humans might be something that humanity can do.” While some ecologists believe that humans have meddled enough with the wilderness, others take a more pragmatic perspective. Cornett argues that there is an urgent need to do something to help Minnesota’s forests survive. “We could argue that we should just let nature take its course, but nature has never really faced this situation before,” she says. “We’ve just never seen things changing at this pace.” Besides, she points out, northern Minnesota’s 6m acres of forests have been managed for more than a century. “My sense is we’re choosing to actively manage a landscape that has already been actively managed,” she says. Etterson goes even further, saying that, rather than tinkering with nature, the experiment may contribute to re-establishing connections that can no longer happen naturally. “It is a little interventionist, but I don’t think it’s unnatural,” she says. While management is an ongoing process, it’s becoming more controversial – particularly in light of climate change. In recent weeks, publications ranging from Ensia to the New York Times have covered the topic, which is growing increasingly hot in scholarly circles. One scholar discussing this is John Pedlar, a Natural Resources Canada forest landscape biologist (pdf). Although he still worries about “designer ecosystems”, he says, he’s abandoned long-held beliefs about conservation over the last five to 10 years because of climate change.  “I was someone who was a real believer of keeping things in their own ranges,” he says. “The quote that hits home for me is that ‘climate change changes everything.’ It’s true. It’s just a game changer.”  Bill Lascher is a freelance journalist based in Portland, Oregon, currently working on a book about World War II-era foreign correspondent Melville Jacoby. His website is www.lascheratlarge.com. The Vital Signs platform is funded by Avery Dennison, Domtar and Chiquita. All content is editorially independent except for pieces labelled advertisement feature. Find out more here."
"The Intergovernmental Panel on Climate Change (IPCC) has corrected a controversial claim that small amounts of global warming could have overall positive economic impacts, after I pointed out that it was based on inaccurate information. The final version of the IPCC’s report on Impacts, Adaptation and Vulnerability was published without fanfare on the web this week, including a chapter on Key Economic Sectors and Services.  The final draft of the chapter, which was published in April, featured a section on the aggregate economic impacts of climate change, containing the statement: “Climate change may be beneficial for moderate climate change but turn negative for greater warming.” But the version published this week omits the statement because it was based on faulty data. The statement had been inserted into the draft report at a late stage in the preparation process, and after it had been sent to independent reviewers, including me, for comment. It was based on a paper by Richard Tol, a professor of economics at the University of Sussex, who was also a coordinating lead author on the economics chapter of the IPCC report. The paper was one in a series by Prof Tol which had reviewed studies by a number of researchers on the potential economic impacts of climate change. However, the first paper in the series, published in the Journal of Economic Perspectives in 2009, had contained a number of errors, including a claim that some other studies had found net positive impacts for warming of less than 3C. Unfortunately, Tol had not used the correct figures from these studies. I discovered the errors after a draft of the IPCC chapter was leaked online in January, and I alerted Tol and the other authors of the report. The IPCC acknowledged the mistakes in the draft and agreed that the final version should not include them. In May, the Journal of Economic Perspectives published an update and correction to Tol’s paper, in which he admitted the errors. However, Tol’s 2009 paper had already been heavily promoted by climate change sceptics. In October 2013, The Spectator magazine published a front–page article under the headline ‘Why climate change is good for the world’. It was written by Viscount Ridley who, likeTol, is a member of the Academic Advisory Council of the Global Warming Policy Foundation, which was set up by Lord Lawson to campaign against the UK Government’s climate change policies. Viscount Ridley’s article stated: “Prof Tol calculated that climate change would be beneficial up to 2.2C of warming from 2009 (when he wrote his paper).” Tol caused controversy in April when he announced that he had withdrawn from the team preparing a summary of the IPCC report on the grounds that he did not agree with the other authors. The summary points out: “Economic impact estimates completed over the past 20 years vary in their coverage of subsets of economic sectors and depend on a large number of assumptions, many of which are disputable, and many estimates do not account for catastrophic changes, tipping points, and many other factors.” It concludes: “With these recognised limitations, the incomplete estimates of global annual economic losses for additional temperature increases of ~2C are between 0.2 and 2.0% of income.” A number of economists have criticised the models used to estimate future losses due to climate change, and an official journal of the American Economic Association published a collection of papers last year which examined their usefulness. Robert Pindyck, professor of economics and finance at the Massachusetts Institute of Technology (MIT), declared: “These models have crucial flaws that make them close to useless as tools for policy analysis.” Lord Nicholas Stern, chair of the Grantham Research Institute on Climate Change and the Environment at London School of Economics and Political Science and president of the British Academy, pointed out: “Scientific models, because they omit key factors that are hard to capture precisely, appear to substantially underestimate these risks.” He added: “Many economic models add further gross underassessment of risk because the assumptions built into the economic modelling on growth, damages and risks, come close to assuming directly that the impacts and costs will be modest and close to excluding the possibility of catastrophic outcomes.” In a new paper due to appear in the The Economic Journal, published by the Royal Economic Society, Stern and Dr Simon Dietz show that if models are amended so that climate change impacts can affect the drivers of economic growth, they find that rising global temperatures could lead to a collapse in living standards.  "
"Tim Birkhead has been monitoring guillemots for 42 years – with intriguing results. His surveys, carried out on Skomer island in Wales, have provided key information about the wellbeing of the sea birds’ population around the British Isles and has also produced important insights into the health of our seas. However, the zoologist’s four-decade-long project is now threatened with closure. The newly formed quango Natural Resources Wales has said it will not continue to fund the £12,000-a-year survey, as part of a cost-cutting exercise. Unless cash can be raised as a matter of urgency, this year’s survey will be the last.  The news has dismayed the 64-year-old professor of zoology at Sheffield University. “This is an incredibly short-sighted decision,” Birkhead said. “We have built an extremely important database of guillemot population parameters and breeding rates, which tells a great deal about variations in numbers of these birds, about the health of their populations and about the health of our seas in general. But that entire database is now under threat merely to save a modest amount of money.” Among the data gleaned from the Skomer study has been the discovery that guillemots are now breeding, on average, two-and-a-half weeks earlier than they did 42 years ago. “That is a clear signal that climate change is having a direct impact on the behaviour of these sea birds,” added Birkhead. Birkhead first visited Skomer in 1972 to begin his PhD on the guillemot population there. “It was a ridiculously ambitious task, I realised later. Guillemots do not start breeding until they are seven years old, so you cannot hope to get an accurate picture of their reproductive success until you have amassed many years of data. That is why I decided to maintain the survey every year since then and so have been involved in studying Skomer guillemots for all these decades.” In the 1930s there were around 100,000 pairs on Skomer. By 1972, when Birkhead first began work there, that had fallen to 2,000 pairs, probably because of oil spills from ships sunk during the second world war. Since then, numbers have rebounded, so that there are now around 25,000 pairs of guillemots on the island. “Guillemots are doing well there, but they are doing very badly in other parts of Britain. In Shetland they have virtually stopped breeding because their favourite food, the sand eel, is now being fished by humans. We need to keep a very careful eye on the guillemots of Skomer because fluctuations in populations can tell so much about the changes humans are making to the natural world,” said Birkhead. However, a spokesman for Natural Resources Wales denied that the decision to block funds for the Skomer guillemot project would jeopardise future understanding of the bird’s behaviour. “Public spending is very tight at present and we have to prioritise the projects we support. The decision to cut the funding for this study was taken more than a year ago by our predecessor body, the Countryside Council for Wales,” he said. “Sheffield University was given plenty of warning that funds would no longer be available for the survey. In any case, we continue to fund important monitoring of birds – including guillemots – on Skomer. Although it is not as detailed as the work by Sheffield University, it provides us with the information we need to properly protect the reserve.” However, Birkhead said these other surveys had produced misleading results and would not provide the breadth of information that has been generated by the Sheffield study about the population changes in the guillemot. “These birds are excellent indicators of the health of the ocean,” said Birkhead, who has launched a crowdsourcing appeal to raise money for the project. “I have had a very good response to that appeal, but it is a shame that research of such importance has to be funded in this hand-to-mouth manner.”"
"MPs should follow in the footsteps of the Rockeller family, Glasgow University and churches around the world by pulling their pension fund investments out of fossil fuels, according to Caroline Lucas. The Green party MP says the £487m Parliamentary Contributory Pension Fund should join the movement of hundreds of institutions worldwide who have already divested $50bn (£31bn) from gas, coal and oil investments as a way of tackling climate change. A University of Oxford study says the campaign has grown faster than any previous divestment movements, including those on apartheid and tobacco.  Lucas has written to Brian Donohoe, the chairman of the fund’s trustees board, telling him that she is particularly concerned that the fund is contributing to global warming and of the economic risk to such assets if governments put in place “effective climate regulation”. “MPs, parliament, should be demonstrating a positive way forward, it’s incumbent to make sure our house is in order. It’s not helpful if parliament is setting an example whereby we’re not shifting our pension funds to sustainable sources and inadvertently potentially accelerating climate change,” Lucas told the Guardian. Last month, Glasgow became the first university in Europe to vote to pull its endowment out of fossil fuels. Students across the UK are lobbying universities to follow suit, including King’s College London where campaigners met the vice-principal last week and the School of Oriental and African Studies where a decision is expected later this year. Lucas said the divestment campaign had benefited from comments by the governor of the Bank of England, Mark Carney, who said earlier this month that the “vast majority of reserves are unburnable.” “There’s a strong economic reason [to divest] ... That these pension funds might not be performing as well as they might appear, once you factor in the fact that the investment in fossil fuels could well be unrealisable if we take seriously the fact we need to be weaning ourselves off fossil fuels and stay below 2C warming,” Lucas said, adding that she expected the call to attract cross-party support. Donohoe, a Labour MP for Central Ayrshire, said he did not think fossil fuels were an investment the fund should avoid, or pull out of. “We’ve got to balance what individuals like she [Lucas] will say about certain investments... [with] the good of the fund. Now that doesn’t mean to say we go down an amoral road, with tobacco or whatever else, clearly we don’t. But fossil fuels is something else completely. I just don’t think that’s an issue in itself that we would want to avoid any form of investment [in].” He added that his personal view was that Lucas was a lone voice on the issue. “I don’t know what she’s talking about frankly. If she’s talking about stopping taking coal out of the earth, that would have to be universally applied, there’d be a closure to all coal-fired power stations. That would have quite a significant impact on Soctland and perhaps elsewhere. I don’t know where she’s coming from on this one.” The fund does not disclose how much of its value is invested in fossil fuels."
