"Victoria has announced a plan to reduce its net carbon emissions to zero by 2050. The move places Victoria at the head of the pack of states and territories, along with South Australia, which has the same 2050 target, and the ACT, which has other strong emissions and renewable energy targets. Victoria’s move could be more significant, though, since it contributed significantly more to Australia’s overall emissions.  After the recommendations of a review, the Labor state government announced it would legislate the targets by amending the Climate Change Act 2010. As part of the plan announced by the premier, Daniel Andrews, a “pledge program” called Take2 was also launched, where individuals, as well as government, business and community groups, were invited to pledge to play a role in reducing the state’s emissions to zero. The Victorian government said it would make pledges in various sectors, including energy, agriculture and transport, in order to make an orderly transition to a low-carbon economy. “Updating our laws and introducing a target to reduce emissions in Victoria will ensure we take advantage of the new jobs and economic opportunities created by renewable energy,” Andrews said. Cam Walker, the campaigns director of Friends of the Earth Australia, welcomed the move but said final judgment would be reserved until several other key policies were announced, including the Victorian renewable energy target, the coal policy and the fracking policy. The interim targets for 2020 and beyond would also be essential for judging the value of the plan, Walker said. “Taken collectively, that will give us a meaningful sense of where they are going with all this,” Walker said. “Today is not an endpoint but it is a significant point along the way. It’s the first time the premier has fronted the issue of climate change and really owned it.” Environment Victoria also welcomed the announcement. “Setting a clear target for reaching zero climate pollution provides a strong signal for all future government and business decisions,” Environment Victoria’s chief executive, Mark Wakeham, said. “We need to reach this target as quickly as possible.” He said although 2050 was some time away, it had implications for actions today. “Pursuing new coal or gas projects is inconsistent with a plan to decarbonise the economy,” he said. “Instead we need to embrace our renewable energy resources.” The Victorian Greens said the announcement set targets too far in the future and failed to make targets compulsory or set a policy to phase out coal. “If Labor is serious about climate change, they shouldn’t just announce they will maybe do something by 2050,” the Greens’ environment spokeswoman, Ellen Sandell, said. “They must urgently phase out coal and set a strong renewable energy target now.” "
" The week in which the self-taught education expert Michael Gove announced that “the people of this country have had enough of experts” is clearly not the best one for his cabinet colleague, the former miner Patrick McLoughlin, to admit that the experts got it wrong over diesel cars. By cutting the duty on low-sulphur diesel back in 2001, the then chancellor, Gordon Brown, correctly thought he was helping meet carbon-reducing climate change targets in Britain. Unfortunately no one explained that the harmful pollutants such cars emit – nitrogen oxides – can quickly build to lethal levels.   Or, as the fellow ex-minister and motor sports enthusiast Lord Drayson cheerfully put it during the VW rigged-tests scandal still engulfing the world’s carmakers, they’re “literally killing people”. For once the hyperbolic cliche was right. On some (expert?) estimates, 9,500 people suffer avoidable deaths each year in the capital alone. That’s true of many of our lifestyle choices, of course, though it’s been a while since a chancellor cut the duty on cigarettes to encourage smoking. McLoughlin signalled that he may have to ask George Osborne – or Nigel Farage if he is Boris’s chancellor – to reverse the tax break.  Meanwhile, a lot of well-meaning types, including me, went out and bought diesel cars as a small way of helping save Australia’s coral reef and other species threatened by climate change, also including you and me. It may not all be caused by human activity, but the experts – there we go again – are overwhelmingly of the view that most of it is and we must act together to offset its consequences. And there in a nutshell is the problem Gove so casually addressed. Experts are divided over the causes of the climatic changes we see all around us in every country, aren’t they? Well, no, actually. About 97% of those who are supposed to know what they’re talking about support the consensus.    It’s not hard to see why the populist in Gove knows he can get easy applause for denouncing experts and their expertise. In advanced secular societies like ours voters have been encouraged to look to highly educated technocrats, not to priests or princes, to provide the guidelines on how best to live.  But, just like priests and princes, they sometimes get it wrong. Only this week, the Guardian’s intrepid Sarah Boseley reported another retreat from the fats-are-bad campaign of recent decades. Good fats are good in sensible quantities and not as bad as Killer Sugar which food makers used as a comforting substitute.   So the problem is twofold. Experts get it wrong and are sometimes forced to change their minds. “When the facts change, I change my mind. What do you do, Sir?” as John Maynard Keynes famously remarked. If some experts don’t like admitting fallibility how much harder is it for lay men and women who have embraced advice they are now told to discard? There’s much to be said for “common sense”, for learning from experience what may be right for you – or for your children or career – as it may not be for others. Expertise should be on tap, not on top, as we used to say. Passing the buck when things go wrong is a bad side-effect too, along with routinely trying to sue people who have done their best, doctors for example. Of course, there are issues and circumstances where the experts’ advice should be taken more seriously than on others. Climate change decisions or brain surgery matter more than Michael Billington’s advice on theatre or nice Jamie Oliver’s idea of a good pesto. It’s still no guarantee they’ll be right. Which takes us back to Europe – an issue on which the advice of most experts across most fields is that we should Remain. But the direct experience of many ordinary citizens points the other way, most notably in their varying encounters with immigration on its current scale, and the effects, good and bad, that it has.  There’s no point in “experts” telling them that immigration is good for the British economy as a whole, when they don’t live and work or send their kids to school in a whole; they do so in a specific place. It doesn’t make them racists or bigots to express concern, though some may be.  So mouthy Nigel Farage was surely correct in ITV’s election debate exchanges with David Cameron on Tuesday when he spoke of falling GDP per capita, ie per head, mattering more than rising overall GDP whose benefits may not be fairly shared (they aren’t). Cameron was wrong. Is he mostly wrong and opportunist, as Brexiteers suggest? In my judgment, no. Reading the experts with a pinch of salt – here’s InFacts – I tend to find their version of events more trustworthy than Vote Leave’s. Knowing Boris Johnson tolerably well over many years my jaw hits the floor whenever I read that the rascal is trusted on Europe – a man who was sacked by the Times for making up quotes and later sacked by the then Tory leader, Michael Howard, for being less than truthful about an affair. But there you are. Leave campaigners say that remain camp’s experts were wrong in urging Britain to join sterling to the eurozone. That’s not true either. Many experts – the Observer’s veteran economics pundit Bill Keegan is one – were vocal critics of the euro project (and of Schengen) but do not support Brexit.  The success of the Brexiteers is to have a better ear for discontent on the street, in the factory or supermarket and to pander better to popular resentments and prejudice. It is what Donald Trump is doing so well in the US. That success rests on perceived failures by elites and by decades of overconfidence built on postwar economic success that has now turned sour. The populists offer glib, popular answers. “It can’t be any worse, so let’s take a punt,” they say. “Yes, it can,” is the correct answer, but hardly an inspiring one. Surely it is no coincidence that both Brexit and Trump’s campaigns are full of climate change sceptics too. “Let’s take a punt, it’ll be fine.”  That’s quite a punt. Funny weather we’re having, eh?"
"When it comes to confronting climate change, the world’s cities are proving that there’s strength in unity. The historic climate agreement reached in Paris in December, which was approved by nearly all of the world’s nations, was made possible in part by the progress that cities have made by working together.  Today, the two biggest coalitions of cities in the world – the EU-based Covenant of Mayors and the UN-backed Compact of Mayors – are forming an alliance to link more than 600 million city dwellers in the fight against climate change.  Cities are key to solving the climate change challenge. They account for most of the world’s carbon emissions, and mayors often have control over the largest sources. Just as importantly, mayors have strong incentives to attack those sources because steps that reduce carbon also improve public health and strengthen local economies.  Clean air is increasingly a factor business leaders weigh when deciding where to invest. Cities can also act quickly to confront climate change, without the political and bureaucratic hurdles that often hold back national governments. By sharing smart strategies, cities of all sizes have led the way in addressing climate change, and as a result, the UN has given cities an official role in international climate diplomacy for the first time. In the European Union as well, cities are increasingly seen as crucial allies in the transition to a low-carbon economy. Our new alliance, now called the Global Covenant of Mayors for Climate & Energy, will provide unprecedented support for city efforts and accelerate progress against climate change in a number of ways, including:  The Global Covenant will link more than 7,100 cities, representing more than 600 million people, in one unified effort to address the causes and impacts of climate change. Cities will speak with one clear, coordinated voice, sending a strong signal to national governments that they are committed to this fight and to assisting one another. It will also help us expand and recruit new members, with a focus on parts of the world where cities are growing most rapidly, including Africa, Latin America and south-east Asia. The Global Covenant will enable cities to collect and report climate data in a standardised, comparable way, allowing them to track their progress and hold one another accountable. It will also allow the UN to identify the contributions that cities are making toward the goals set in Paris, which will underscore how important cities are to meeting them. Modernising infrastructure networks can be costly, and city governments are increasingly turning to private investors to help finance such projects. But, especially in developing nations, many cities lack credit ratings and cannot access international capital markets. To help remedy this, the Global Covenant will feature an advisory group of financial institutions that will offer guidance to cities. The goal is to direct more capital to low-carbon urban infrastructure that will generate economic returns.  One of the best steps national governments can take to fight climate change is to empower their cities with the tools and autonomy they need to act. Some cities aren’t able to borrow money on their own. Others don’t have the authority to write their own building codes or energy efficiency regulations. Others lack control over mass transit. The more cities are given control over their own operations, the more progress nations will be able to make reducing emissions – which will incentivise more national governments to empower their cities. In the fight against climate change, cities are where the action is. The new Global Covenant of Mayors is a historic milestone for the global community of cities, and it will go a long way toward ensuring that the nations of the world are able to meet – and exceed – the goals they set in Paris."
nan
"The Chinese government has outlined a plan to reduce its citizens’ meat consumption by 50%, in a move that climate campaigners hope will provide major heft in the effort to avoid runaway global warming. New dietary guidelines drawn up by China’s health ministry recommend that the nation’s 1.3 billion population should consume between 40g to 75g of meat per person each day. The measures, released once every 10 years, are designed to improve public health but could also provide a significant cut to greenhouse gas emissions.  The Chinese Communist party has found unusual allies among Hollywood celebrities, with actor Arnold Schwarzenegger and director James Cameron involved in a series of new public information adverts encouraging Chinese people to consume less animal flesh to help the environment.  Should the new guidelines be followed, carbon dioxide equivalent emissions from China’s livestock industry would be reduced by 1bn tonnes by 2030, from a projected 1.8bn tonnes in that year.  Globally, 14.5% of planet-warming emissions emanate from the keeping and eating of cows, chickens, pigs and other animals – more than the emissions from the entire transport sector. Livestock emit methane, a highly potent greenhouse gas, while land clearing and fertilizers release large quantities of carbon.  “Through this kind of lifestyle change, it is expected that the livestock industry will transform and carbon emissions will be reduced,” said Li Junfeng, director general of China’s National Center on Climate Change Strategy and International Cooperation.  “Tackling climate change involves scientific judgement, political decisions, entrepreneurial support, but at last, it still relies on involvement of the general public to change the consumption behavior in China. Every single one of us has to believe in the low-carbon concept and slowly adapt to it.” Meat has gone from rare treat to a regular staple for many Chinese people. In 1982, the average Chinese person ate just 13kg of meat a year and beef was nicknamed “millionaire’s meat” due to its scarcity. The emergence of China as a global economic power has radically altered the diets of a newly wealthy population. The average Chinese person now eats 63kg of meat a year, with a further 30kg of meat per person expected to be added by 2030 if nothing is done to disrupt this trend. The new guidelines would reduce this to 14kg to 27kg a year.  China now consumes 28% of the world’s meat, including half of its pork. However, China still lags behind more than a dozen other countries in per capita meat consumption, with the average American or Australian consuming twice as much meat per person compared to China.  According to a new report by WildAid, the predicted increase in China’s meat consumption would add an extra 233m tonnes of greenhouse gases to the atmosphere each year, as well as put increased strain on the country’s water supply, which is already blighted by polluted and denuded rivers and groundwater. The report warns that unchecked Chinese meat consumption will also degrade its arable land and worsen the country’s problems with obesity and diabetes. An estimated 100 million Chinese people have diabetes, more than any other country.  Research released by the thinktank Chatham House in 2014 forecast that China alone is expected to eat 20m tonnes more of meat and dairy a year by 2020 and warned that “dietary change is essential” if global warming is to not exceed the 2C limit eventually imposed at the climate accord in Paris last year.  A separate report by scientists at the Oxford Martin School this year found that the widespread adoption of vegetarianism around the world could bring down greenhouse gas emissions by nearly two-thirds. “China’s move to cut meat consumption in half would not only have a huge impact on public health, it is a massive leadership step towards drastically reducing carbon emissions and reaching the goals set out in the Paris agreement,” said James Cameron.  “Animal agriculture emits more than all transportation combined. Reducing demand for animal-based foods is essential if we are to limit global warming to 2C as agreed at COP21.” Despite the Chinese government’s new commitment to reducing meat consumption, it may be difficult to convince the country’s rising middle classes to cut down. There are also strong cultural traditions attached to the eating of many animals, especially pigs. The Chinese character for “home” depicts a pig underneath the roof of a house.  Recently, Chinese companies have been buying farms in the United States and Australia to provide feed for the country’s dairy and beef industries. In late 2013 a Chinese company, Shenghui, purchased the largest US pork producer, Smithfield Foods, to help keep up with demand. “China’s consumption of meat is skyrocketing,” said Jeremy Haft, an adjunct professor at Georgetown University in Washington, DC and author of a 2015 book, “Unmade in China: The Hidden Truth about China’s Economic Miracle.” “China’s demand for meat will continue to grow and support hundreds of thousands of jobs in the US meat industry,” he added. “From a climate perspective, the methane will still be created, but will be shifted to the United States.”"
"Rich countries must ratify the climate change agreement reached in Paris last December, one of the world’s most at-risk nations has warned. Thoriq Ibrahim, environment and energy minister of the Maldives, told the Guardian that there was “no time to waste”, in ratifying the agreement that was reached more than six months ago, and that it should be a matter of urgency for industrialised countries.  So far, almost the only countries to have passed the accord into law are the small islands most at risk from rising sea levels, and other smaller developing nations. France became the first large industrialised nation to ratify the Paris agreement only earlier this month, although a ceremony was held in New York in April at which countries were supposed to affirm their commitment to the international agreement. At Paris, nearly 200 countries agreed to hold global warming to no more than 2C above pre-industrial levels.Most of the world’s biggest economies came forward with their own domestically-binding targets for cutting carbon in the next decade or longer. For the poorest nations, likely to be most affected by climate change, the ratification is an urgent matter, said Ibrahim.  “France’s ratification is not only another indication of how seriously the international community takes the Paris agreement, but it also brings us another step closer to having it take effect,” he said. “Small island states were the first 14 countries to ratify the agreement and deposit their instruments of approval with the UN. We encourage all countries, large and small, to do the same.” He added: “The faster we bring the climate agreement into force, the faster we can take the action required. And we have no time to waste.” One of the key issues for the Maldives is the damage being done to coral reefs, an issue recently highlighted by a major Guardian investigation into the plight of the world’s most famous corals, the Great Barrier Reef in Australia. The Maldives have also experienced a high degree of coral bleaching, a sign of the death of reefs that comes from warming waters, pollutants and other environmental problems. Ibrahim said: “Analysis of the most recent data from the government research station shows variable levels of coral bleaching. We are closely monitoring the situation through assessment of permanent [coral] sites. It is important that we understand the recovery process on a scientifically sound basis.” Coral reefs are a key attraction for tourists to the Maldives, where visitors are one of the key drivers of the local economy. The government is sensitive about the impacts of global warming on the islands’ reefs, fearing that people will stop coming if the reefs are in danger. Ibrahim said the government and the private sector were conducting research into reef health, with a view to helping the reefs recover from their bleaching. But the future survival of the reefs would be dependent on the world keeping to the limits on carbon agreed in Paris. “It is important that we keep anthropogenic impacts to a minimum at the critical time of recovery,” he said. “We intend to widen the scope of environmental impact assessments of developments on reefs so that project activities that impact corals and coral reef habitats will be minimised.”"
nan
