"Countries settled on most of the tricky elements of the “rulebook” for putting the 2015 Paris agreement into practice. This includes how governments will measure, report on and verify their emissions-cutting efforts, a key element because it ensures all countries are held to proper standards and will find it harder to wriggle out of their commitments.  There was a row over carbon credits, which are awarded to countries for their emissions-cutting efforts and their carbon sinks, such as forests, which absorb carbon. These credits count towards countries’ emissions-cutting targets. Brazil, which hopes to benefit from its large rainforest cover, insisted on a new form of wording that critics said would allow double counting of credits, undermining the integrity of the system. This issue has been put off until next year. Largely absent from these talks, which had a technical focus, was the key question of how countries will step up their targets on cutting emissions. On current targets, the world is set for 3C of warming from pre-industrial levels, which scientists say would be disastrous, resulting in droughts, floods, sea level rises and the decline of agricultural productivity. The key deadline is 2020, when countries must show they have met targets set a decade ago for cutting their emissions, and when they must affirm new, much tougher targets. The Intergovernmental Panel on Climate Change (IPCC), the global body of the world’s leading climate scientists, warned two months ago that allowing warming to reach 1.5C above pre-industrial levels would have grave consequences, including the die-off of coral reefs and devastation of many species. If we extrapolate from the IPCC’s findings, the world has little more than a decade to bring emissions under control and halve them, which would help to stabilise the climate. After years in which the world’s carbon emissions appeared to be stabilising, they are on the rise again. Coal use continues and oil is still the engine of much of the world’s economy. Clean energy is coming on-stream at a faster rate than many predicted, and the costs of it have come down rapidly, but its adoption needs to be speeded up. Infrastructure, such as energy generation plants, transport networks and buildings, is a central issue: infrastructure built now to rely on high-carbon energy effectively locks in high emissions for decades to come. Some people are also saying we need to invest in projects to remove carbon from the atmosphere, and a new focus of the talks is helping countries to adapt to the effects of climate change. The US, Russia, Saudi Arabia and Kuwait joined forces to prevent the conference fully embracing the IPCC’s findings, watering down a statement to a weak commendation of the timing of the scientists’ report. Australia joined with the US in a celebration of coal, and Brazil signalled its climate scepticism under Jair Bolsonaro by withdrawing its offer to host next year’s talks. But the EU, a handful of other developed countries and scores of developing nations including the poorest and most vulnerable affirmed that they would strive to meet the IPCC’s advice on limiting warming to no more than 1.5C. The UN will meet again next year in Chile to thrash out the final elements of the Paris rulebook and begin work on future emissions targets. But the crunch conference will come in 2020, when countries must meet the deadline for their current emissions commitments and produce new targets for 2030 and beyond that go further towards meeting scientific advice. That conference may be held in the UK or Italy, both of which have bid to be hosts. The UK’s intention in offering to host is to signal it will retain its role on the world stage after Brexit. The event may also provide a welcome change from wranglings over Brexit and intractable trade deals. But whoever hosts will have a diplomatic mountain to climb, if the fractious nature of this year’s talks is anything to go by."
nan
"The UN climate change talks ended late on Saturday night in Poland with a deal agreed on how to put the 2015 Paris agreement into action, but with other contentious problems left to be resolved next year. Countries thrashed out the complex details of how to account for and record their greenhouse gas emissions, which will form the basis of a “rulebook” on putting the Paris goals into action. But difficult questions such as how to scale up existing commitments on cutting emissions, in line with stark scientific advice, and how to provide finance for poor countries to do the same, were put off for future years.  In the final hours, agreement was held up by a debate over the market in carbon credits, awarded to countries for their emissions-cutting efforts and for their carbon sinks, such as forests, which absorb carbon dioxide. Brazil wanted an amendment that would benefit the country for its large rainforest cover, but this was opposed by others as it could allow the double-counting of carbon credits, undermining the integrity of the system. This question has now been pushed back to next year’s annual conference. Brazil’s stance, however, under incoming president Jair Bolsonaro, who also rescinded the country’s offer to host next year’s talks, presages troubles to come. Brazil has been a reliable supporter of the annual talks in the past, and has worked to broker deals between the developed and developing world. Without that support in future, the talks are only likely to grow more fractious. Even when Brazil’s carbon-credits issue was postponed, a further obstacle was opened up by Turkey, which wants to be counted as a developing country rather than a developed one. Weary delegates finally filed into the closing session at nearly 10pm to hail the compromise agreement. Despite these hitches, the two-week conference – the 24th Conference of the Parties to the United Nations Framework Convention on Climate Change, known as COP24 – finally ended in clarity, at least on some of the key building blocks for putting the Paris agreement into action. David Waskow, of the World Resources Institute, said the final deal was “a good foundation for countries to go about implementing the Paris agreement”. He added: “It sets the direction of travel and will spur countries to take action. Now countries need to go home and do their homework, by increasing their commitments [on emissions].” But the key question of whether countries are doing enough to cut their emissions, in the light of the recent Intergovernmental Panel on Climate Change (IPCC) report that predicted dire consequences if temperatures were allowed to rise more than 1.5C above pre-industrial levels, was left out. The IPCC’s report in October showed that the world must change course drastically in the next decade to avoid the consequences of a 1.5C rise, including the die-off of coral reefs, droughts and floods, and a decline in agricultural productivity over many areas. This year has seen extreme weather across many parts of the globe, and the fourth highest global average temperatures on record, while the IPCC warning is the starkest yet to come from scientists. António Guterres, secretary-general of the UN, praised countries for coming to an agreement, but demanded more. “The approval of the Paris agreement work programme is the basis for a transformative process which will require strengthened ambition from the international community,” he said. “Science has clearly shown that we need enhanced ambition to defeat climate change. From now on, my five priorities will be: ambition, ambition, ambition, ambition and ambition.” He cited the need for countries to toughen their emissions-cutting targets and to adapt their infrastructure to cope with the effects of climate change. Jennifer Morgan of Greenpeace said: “A year of climate disasters and a dire warning from the world’s top scientists should have led to so much more. Instead, governments let people down again as they ignored the science and the plight of the vulnerable. “Without immediate action, even the strongest rules will not get us anywhere. People expected action, and that is what governments did not deliver. This is morally unacceptable.” Gareth Redmond-King, head of climate change at WWF-UK, said: “[There has been] some positive progress, but we have not yet done enough. The world is in a state of climate emergency and yet some of our leaders prefer to stay in a state of denial. “Everyone’s future is at stake. We need all countries to get much more serious about climate ambition."
"Britain is bidding to host the UN climate change conference in 2020, the biggest since the Paris agreement was signed in 2015, as part of the government’s aim to be seen as a green leader. The conference will mark a vital deadline for countries to comply with their commitments on reducing greenhouse gas emissions and move on to tougher targets for the decade to 2030, and so it is likely to be a fractious affair.  If successful, the move would be a strong signal of the UK government’s determination to retain its role on the world stage after Brexit. Claire Perry, the climate change minister, flew to Poland on Thursday after taking part in the Conservative party’s vote on Theresa May’s future, which she called “24 hours of political self-indulgence”. Perry told journalists: “We have to make sure we can deliver a good COP [Conference of the Parties], as 2020 will be a really vital COP, and we absolutely want to be part of that process [of making it a success].” She pointed to the UK’s efforts in cutting greenhouse gas emissions and investing in green jobs, saying Britain had decarbonised faster per unit of GDP than any other country in the past decade, and created 400,000 jobs in the low-carbon economy. “We have a really good track record in the UK,” she said. In Poland, the UK joined with other EU member states and scores of developing countries in committing to scale up their ambition on climate change, with a focus on preventing global warming from breaching 1.5C above pre-industrial levels, in line with scientific warnings. The UN awards the hosting of the COP, as the annual meeting is known, usually by alternating among developed and developing countries, and different continents, though the rules can be somewhat flexible. Next year’s host was supposed to be Brazil, but the incoming president, Jair Bolsonaro, is hostile to the Paris agreement and has withdrawn the offer. Chile and Costa Rica are understood to be considering alternative bids. Some campaigners at the current climate change talks in Poland, which have stalled over continuing disagreements on how to implement the Paris agreement, praised the UK’s move. Gareth Redmond-King, the head of climate change at WWF UK, said: “This is great news and we welcome the bid to host the 2020 [conference]. It’s an opportunity for the UK to lead the way on climate change at a time when the need for action has never been starker.” COP26, as the 2020 conference is known in UN jargon, will also be notable for the role of the US. Under Donald Trump’s presidency, the country has begun the process of withdrawal from the Paris agreement, but that could be halted if he is replaced in the 2020 election. Bolsonaro has indicated he may take Brazil out of the Paris agreement, and the divisions between developed and developing countries that have characterised the current talks are likely to remain in the intervening years, giving the UK a diplomatic mountain to climb to make a success of the talks if awarded host-country status. "
"In the face of the emerging climate emergency (Letters, 10 December) and projected unconstrained growth in global fossil fuel use, this is a plea for people with relevant expertise and influence to take forward the idea for a “non-proliferation treaty” (NPT) for fossil fuels, floated by Andrew Simms and Peter Newell (theguardian.com, 23 October) and supported by Bill McKibben, Naomi Klein and others (Letters, 30 October). The analogy between fossil fuels and fissile nuclear materials is imperfect, but it should not be overlooked that the nuclear NPT promotes cooperation in and equal access to “peaceful use” of nuclear technology. “Peaceful use” of fossil fuels could mean their continued but decreasing extraction, within enforceable limits constrained by the Paris agreement goals, and an offsetting role for carbon capture and geo-sequestration (funded by fossil fuel producers). Safeguards and oversight could be provided by a new United Nations monitoring agency, akin to the International Atomic Energy Agency, which could also administer a global fossil carbon budget.  Fossil fuel companies extract their products where relevant governments permit. The number of nations permitting extractions on scales that threaten all of us is greater than the number of nuclear weapons states, but it is nevertheless small. This could make rapid negotiation of a fossil fuel “NPT” relatively tractable. It would not even have to include all producer nations at first to be effective.Hugh RichardsStroud, Gloucestershire • Join the debate – email guardian.letters@theguardian.com • Read more Guardian letters – click here to visit gu.com/letters • Do you have a photo you’d like to share with Guardian readers? Click here to upload it and we’ll publish the best submissions in the letters spread of our print edition"
"Environmental and progressive activist groups are urging Australia’s major banks and financial institutions not to fund new coal projects now that the Morrison government has flagged taxpayer assistance for power generation. The Australian Conservation Foundation, GetUp, Greenpeace, Environment Victoria, the Australian Youth Climate Coalition, the Australian Centre for Corporate Responsibility and the Australia Institute wrote on Thursday to chief executives of the major lenders, warning the provision of finance for new coal, or retrofits of old coal-fired power stations, would be inconsistent with their public commitments to the Paris agreement.  The pressure on financial institutions follows the energy minister, Angus Taylor, calling for expressions of interest in new power generation projects to be underwritten by taxpayers, including, potentially, new coal builds or retrofits. The government has made it clear that the new projects must be coal, gas, batteries or pumped hydro to be eligible for the government underwriting. A very tight timeframe is also proposed, with proponents having to put their hands up by January 23. The environmental groups have told the banks the evidence is in on climate change, and an urgent response is required to combat the risks. The groups have told the banking chiefs they risk providing finance for stranded assets if they finance new coal projects. “We strongly believe that the provision of finance from your financial institution for any new coal generation project or any retrofit to extend the life of an existing coal generator, would be inconsistent with your public position on climate change, counter to the concerns of your customers, and unmindful of the high risk of any new coal investment resulting in a stranded asset.” The Investor Group on Climate Change – an organisation representing more than 70 Australian and New Zealand institutional investors with more than $2 trillion of funds under management – has raised similar concerns with Taylor. The IGCC has told the energy minister subsidising high-emission electricity generation is inconsistent with the objectives of the Paris agreement and exposes the assets to substantive carbon price and transition risks. “For around a decade, investors and banks have been expressing no appetite for exposure to new coal fired generation assets in Australia and investors are unlikely to provide any capital towards new high emission generation assets moving forward,” the IGCC’s letter to Taylor says. “Institutional investors would strongly oppose any policy that indemnifies new generation from current and future carbon risk”. The IGCC also advises the government not to set itself up as the “central planner of generator investment”. It says if the government pursues policies that “effectively nationalise part of the electricity market at short notice” there will be significant impacts on investor confidence and market efficacy. While progressive groups have moved into overdrive at confirmation that coal is in the mix, the lobby group representing Australia’s resources giants has welcomed the government’s move. Tania Constable, the chief executive of the Minerals Council of Australia, said on Thursday the immediate focus of the underwriting program should be ensuring that investors are able to replace Liddell power station’s capacity “with a technology mix that will maintain reliability and security at the lowest sustainable cost”. Government conservatives are focused on Liddell, and have wanted Taylor to use his much vaunted “big stick” divestiture powers to extract the ageing power plant from AGL, its current owner. AGL plans to retire the plant and replace it with a mix of gas and renewables. But the “big stick” legislation cannot be passed before budget week next year, and it appears to lack the necessary support to clear the Senate. Labor and the Greens are opposed to any taxpayer support for coal projects, and will continue efforts once parliament resumes next year to try to frustrate the Coalition’s program, potentially by attempting to amend the divestiture bill, which stalled in the final sitting week, to include a prohibition on power companies receiving commonwealth support. The MCA said any contracts agreed under the underwriting program needed to be honoured by a future government. The government’s policy document suggests phase one of the underwriting program is anticipated to commence in the first quarter of 2019 – which puts some of the decision making pre-election in the event the government goes to the polls in April. Labor has attempted to warn market participants it does not support taxpayer support for coal projects, but has a policy at the federal level of honouring contracts."
"Pacific countries vulnerable to climate change have urged Australia to abandon coal power generation within 12 years, and to prohibit new coal plants or expansion of existing plants. The call from 15 small Pacific island states came one day after the Australian government called for expressions of interest in new power generation projects, indicating it would be prepared to use taxpayer money to underwrite new coal plants. Leaders warned Australia’s relations in the Pacific were being eroded by a perceived intransigence in Canberra over coalmining. As the COP24 UN climate talks in Poland remained stalled over an unwillingness from major emitters to commit to further carbon emissions cuts, frustrated Pacific states, traditional allies of Australia, said the world must abandon coal-powered energy generation. The Fijian prime minister, Frank Bainimarama, the outgoing president of COP23, said: “We call on all OECD countries to quickly phase out their use of coal by 2030 and for all other countries to phase out their use of coal by 2040. There must be no expansion of existing coal mines or the creation of new mines.” Australia and the US have both this week said publicly they have no plans to begin phasing out coal-generated power. “The United States has an abundance of natural resources and is not going to keep them in the ground,” Donald Trump’s international energy and climate adviser, Wells Griffith, told a US-government-run panel discussion on fossil fuels at the UN climate talks. Australia’s ambassador for the environment, Patrick Suckling, told the same panel: “Fossil fuels are projected to be a major source of energy for a significant time to come.” Asked whether the Pacific declaration on abandoning coal was directed specifically at Australia and the US, Bainimarama was curt but diplomatic: “We request that everybody increases their ambition – that goes for everyone, all countries.” The prime minister of the Cook Islands, Henry Puna, told the Guardian the phase-out of coal was critical to the survival of Pacific island states. “We have made that call,” he said. “It is not directed at any one country, but it applies to all. We know that coal power plants are a significant cause of the climate change we see affecting the whole world.” The Tuvalu prime minister, Enele Sopoaga, cited the Boe Declaration, which Australia signed in Nauru in September, stating that climate change was the single greatest threat to the security and wellbeing of Pacific peoples. “It is unfortunate that we are hearing that Australia might continue to go on coalmining, opening up new mines, [such as] the Adani project [for the Carmichael mine in Queensland],” Sopoaga said. “I was in Canberra last week. I spoke to PM Scott Morrison, and the understanding I got from him was that, yes, they are seriously looking into coal efficiency … and also relooking at the proposal for the Adani project. I said, ‘Prime minister, our partnership onwards, bilateral or regional, in this period of the Boe Declaration, will be centrally influenced by coalmining in Australia and I hope you set a pathway to move away from coalmining and focusing on renewable energy’.” Sopoaga told the Guardian he proposed an annual high-level meeting between Australia and Pacific partners, specifically focused on countering climate change in the region. Bill Hare, director of climate analytics and former Intergovernmental Panel on Climate Change report lead author, said the Pacific states were right to be concerned about coal. “Their call for an end to coal by 2030 – including new mines – is highly relevant to Australia – their regional neighbour,” Hare said. “The timing is important, just as the government announces plans to underwrite a new coal-fired power station. I hope Australians will listen, even if their government won’t.” The Pacific island states also called for the establishment of an international protection regime to protect people displaced by climate change. While Australia has publicly positioned itself with the United States, representatives from several countries say it has played a constructive role inside the negotiating rooms at the climate talks, where the “rule book” for the implementation of the 2015 Paris agreement is being hammered out. The environment minister, Melissa Price, met the UN secretary general, António Guterres, after the secretary general flew back to Poland, concerned the talks had reached an impasse. A spokesman for the minister said, as a courtesy, she would not be discussing details of her meetings at the COP. Price told the Guardian: “Australia takes a technology-neutral approach to our electricity generation. We are focused on reducing emissions through a range of technologies while maintaining the stability and reliability of our grid and keeping electricity prices down.” But Australia’s schism with the Pacific islands over climate change is a diplomatic discomfort. As China has rapidly increased its involvement and influence across the Pacific through massive infrastructure projects and loans, Australia has sought to buttress its position as the regional hegemon, with a new commitment of $2bn for infrastructure. But its perceived political intransigence on climate, particular its commitment to maintaining, and even expanding, coal power generation, is alienating it from Pacific neighbours – historic allies, many of which are low-lying atoll nations experiencing the effects of climate change most acutely."
nan
