"A leading international climate change economist has urged Tony Abbott not to “wish away” the evidence for climate change or prevent it from being discussed at the upcoming G20 summit because of “local politics” and a “lack of courage” to confront the scientific evidence. His comments come as the Intergovernmental Panel on Climate Change [IPCC] release the most rigorous synthesis of climate change science to date, making it clear that without urgent cuts in greenhouse gas emissions, global temperatures will rise by more than 2 degrees.  In a commentary for the Guardian, Nicholas Stern, chair of the Grantham Research Institute on Climate Change in the UK and a former World Bank chief economist, wrote that climate change action by politicians was now urgent, with lives and livelihoods at risk. “With each successive decade being warmer than the last globally, and this year shaping up to be the hottest ever recorded, the reality of climate change is undeniable, and cannot be simply wished away by politicians who lack the courage to confront the scientific evidence,” he wrote. “[It] should place enormous pressure on the Australian prime minister, Tony Abbott, to make it a major agenda item at the G20 summit later this month, instead of shunting it to the sidelines. The G20 summit would provide the most effective platform for world leaders to discuss transitioning to a low-carbon economy, he wrote. “Yet the local politics of a country of less than 25 million is being allowed to prevent essential strategic discussions of an issue that is of fundamental importance to the prosperity and well-being of the world’s population of 7 billion people.” The IPCC report provides evidence of the impact climate change is already having around the world through rising temperatures, shifts in extreme weather, disappearing glaciers and ice sheets, and advancing sea levels. Avoiding the worst impacts of climate change would mean staying below the threshold warming of 2 degrees, the report says, which will only be achieved if annual emissions will need to be reduced by about half by 2050 compared with 2010. “The IPCC report makes plain that further delays in tackling climate change would be dangerous, and ‘wait and see’ would be a profoundly irrational policy,” Stern wrote. “The report should be high on the agenda for the leaders of the world’s 20 most powerful nations, responsible for the majority of the world’s greenhouse gas emissions, when they meet in Brisbane on 15 November.” In August, a group of medical scientists led by the Nobel laureate Prof. Peter Doherty published an open letter Abbott urging him to make climate change a G20 agenda item and reduce carbon emissions."
"Owen Paterson’s proposal to scrap the UK’s Climate Change Act is “bonkers”, “doesn’t stack up” and shows the former environment secretary does not understand the risks from global warming, according to politicians, economists, campaigners and scientists. In a lecture to be delivered on Wednesday for Lord Lawson’s Global Warming Policy Foundation thinktank, Paterson is expected to say the legislation risks blackouts and holding back investment in shale gas.  The law, which was the first of its kind when it was passed in 2008, makes it a legal requirement for the UK to cut carbon emissions 80% on 1990 levels by 2050. Paterson, who has previously said significant global temperature rises of 1-2.5C would only be modest and who claimed he was sacked as minister to appease the “green blob”, is to call for a repeal of the act unless other countries adopt similar carbon-cutting laws. “Blind adhesion to the 2050 targets will not reduce emissions and will fail to keep the lights on. The current energy policy is a slave to flawed climate action,” his speech will say, according to the Sunday Telegraph. “It will cost £1,100bn, fail to meet the very emissions targets it is designed to meet, and will not provide the UK’s energy requirements. In the short and medium term, costs to consumers will rise dramatically, but there can only be one ultimate consequence of this policy: the lights will go out at some time in the future.” The Tory MP will also reportedly say that “instead of investing huge sums in wind power”, the UK should invest in shale gas, combined heat and power, small nuclear reactors and managing energy demand, but the 2050 target stands in the way of such technologies.  Lord Stern, author of the influential 2007 report on the economics of climate change and recent New Climate Economy report, said Paterson had failed to understand the risks posed by climate change. “Repealing the Climate Change Act now would be a perverse backward step by the UK, with the worst possible timing. It would create additional uncertainty about the direction of government policy, undermining the confidence of investors, and increasing the cost of capital for new energy infrastructure.  “Its perversity would be even greater because the costs of renewables have fallen by extraordinary amounts in recent years and there is growing medical understanding of the damage to human health from the pollution caused by fossil fuels. This is a further example of the former environment minister’s complete failure to understand the immense risks from unmanaged climate change, as documented by national academies of sciences around the world.” Baroness Worthington, one of the architects of the Climate Change Act and shadow minister in the lords for the Department of Energy and Climate Change, said Paterson’s proposal was “utterly bonkers”.  “He obviously hasn’t read it [the act], is my overall conclusion. There’s nothing in the act that tells you how to get to the [2050] target, it’s completely flexible.” She added that it was “ludicrous” to suggest there was enough support to repeal an act that was passed in 2008 with cross-party support that she called unprecedented.  “It would take a huge parliamentary debate. At the current time, when all the evidence is that climate change is getting worse and we need urgent action, I can’t see any desire to repeal this act. It’s the desire of a small group of fanatics who don’t even know what the act does.” Only four MPs, including three Conservatives, opposed the legislation when it was passed. Kevin Anderson, a climate scientist and deputy director of the Tyndall Centre, said the act should be strengthened and the timetable brought forward.  “In part I agree with Owen Paterson; his proposals on demand management and recovering waste heat from thermal power stations are to be welcomed. Moreover, we certainly need to revisit the Climate Change Act – but to significantly strengthen it in line with the science underpinning our prime minister’s international commitments on the 2C goal [of keeping average global temperature from rising above 2C].  “Policy informed by evidence demands both much tighter carbon budgets and an 80% target that is for 2030 – not 2050. Owen Paterson’s populist proposal to threaten to scrap the act if others don’t join in is far removed from that of a measured and scientifically informed government confronting difficult and dynamic issues.” Richard Black, director of the Energy and Climate Intelligence Unit, said “a large number of the elements don’t stack up” in Paterson’s argument.  He said: “The Climate Change Act does not mandate use of renewable energy, the Coalition government has just opened its capacity market auction specifically to ensure that the lights don’t go out, bills will not rise ‘dramatically’ in the short term, and small-scale nuclear reactors are not taking off primarily because investors are not convinced of their viability. “On the other hand, his support for combined heat and power and demand management will find a lot of support among energy academics and – ironically – the green movement, who don’t want to see additional fossil-fuel-fired power stations being built if we don’t need them.” Paterson’s claim that the lights will go out because of current energy strategy is at odds with the regulator Ofgem, which says disruption to supply is not “imminent or likely”."
"The UK energy minister, Ed Davey, says that compromise is possible over plans for a goal of improving energy efficiency 30% by 2030 in a climate and energy package that EU leaders hope to agree next week. David Cameron’s government has led calls for a legally enforceable carbon cut of at least 40% in the package but balked at a sub-goal for energy use – even a non-binding one – for fear that a ban on high-powered vacuum cleaners could be used as campaigning ammunition by Ukip.  A third goal to ensure a renewable energy market share of at least 27% across Europe by 2030 has been endorsed by Davey as “a very clever compromise by the EU” because it is non-binding at a state level, meaning the UK can use other technologies such as nuclear and carbon capture and storage to meet the carbon target.  But Davey told the Guardian that he might have some flexibility on the efficiency target issue. “I don’t ever talk about red lines whether in coalition negotiations with other partners or in Europe,” he said. “It is important that we listen to others and find a way forward.” “We are strong supporters of energy efficiency,” he added. “The question is: what is the most appropriate way of doing it?” Most EU states view an energy efficiency target as the most cost-effective way of cutting dependence on Russian gas imports, while environmentalists see them as the most verifiable form of emissions reduction. On the other side, energy intensive industries such as steel and cement manufacturers oppose obligations to save energy on cost grounds, as do coal-producing states such as Poland. But the business sector is divided on the issue. The insulation firm, Knauf Insulation, sent David Cameron a letter last week threatening to divest from Europe unless a 35% energy efficiency target was agreed. The German company has already shut one Italian plant, while opening others in Malaysia and Turkey. “Right now the only thing that would lead us to view Europe as an attractive investment destination is a political commitment which signals that the EU is serious about energy efficiency,” Knauf’s CEO Tony Robson wrote.  Gene Murtagh, the CEO of construction manufacturer, Kingspan, which employs 2,500 workers in the UK also wrote to the prime minister last week, warning that “a binding 30% energy efficiency target is the very minimum needed to give me the confidence to expand Kingspan’s UK operations.” This week, another 11 businesses – including Ikea, Unilever and Philips – sent Cameron a letter calling for a robust energy savings target, as did the mayors of several British cities, including Bristol, Aberdeen and Leicester. The British position though remains for an non-bindingenergy saving target of just 25%, which the EU believes would represent a halving of current rates of progress over the next 16 years, at the same time that events in Ukraine have shot energy security up the political agenda. “If you look at central and east European countries, or at the Netherlands and others, they are having problems with too many targets that create inflexibilities for them,” Davey said. “They all want to lower emissions and share the UK’s position on an ambitious greenhouse gas reduction target but they want to do that in way that gives them flexibility. In some cases that will be by using energy efficiency, but not in all cases.” Davey added that a strong 2030 energy and climate agreement on 23 October would send a powerful political signal to the Russian premier Vladimir Putin about Europe’s energy security. “We’ve seen Russian aggression and Putin using energy as one of his strategic tools. It is a serious issue for the EU,” he said. “If we fail to reach agreement next week, we will be laughed at in Moscow. They will say: ‘They can’t even get their act together on energy. We can’t take them seriously. The EU is divided, weak and therefore vulnerable.” EU officials say that hopes of a deal emerging from a leaders’ summit on 23 October have risen with advances being made on Polish demands for more burden-sharing and financial solidarity – much of it from Germany – to help east European countries to meet the carbon target. Davey has garnered praise for leading work on this, but a Polish government official told the Guardian that a deal was far from done. “I don’t see any progress I’m afraid,” he said. “I hope that that there will be some in the coming days.” "
"The Climate Change Authority (CCA) will conduct another review of the renewable energy target (RET) before December, as the government struggles to win Senate support to wind back the scheme. The Coalition had intended to abolish the CCA, and despite the authority’s statutory obligation to review the RET, it handed the task to a three-person panel headed by self-professed climate change sceptic Dick Warburton.  That review recommended closing the large-scale RET to new entrants, effectively freezing new investment by bringing the current target of 41,000 gigawatt hours of renewable energy by 2020 to around 16,000GWh, or else linking any increase to a pick up in electricity demand. But after fierce resistance from industry and concerted criticism of that review, the federal cabinet has asked the environment minister, Greg Hunt, and the industry minister, Ian Macfarlane, to try to reach a bipartisan agreement about the future of the program that would allow continued investment without fear of continued policy change. Another meeting is scheduled for this week between Hunt and Macfarlane and the shadow treasurer, Chris Bowen, Labor’s resources spokesman, Gary Gray, and its environment spokesman, Mark Butler. Labor has indicated it is prepared to support exempting the aluminium industry from the scheme, which would bring the 41,000 target down to around 39,000 gigawatt hours, but appears unwilling to move very far beyond that point. In a statement, the CCA said its review “will have regard to the role of the electricity sector in cost-effectively meeting the national emissions reductions goals that are in Australia’s interest, in the period to 2020 and beyond”. After the government’s successful abolition of the carbon tax it has not yet managed to legislate “Direct Action” – its proposed alternative policy to meet Australia’s 2020 emissions reduction target – and it has not yet set a post-2020 target. The review will also take into account the absence of other climate policies. “In the authority’s view, key considerations for reviewing the RET are the need to reduce greenhouse gas emissions (both now and in the longer term), and the critical role that a decarbonised electricity sector will play. “In the absence of alternative policies to decarbonise Australia’s electricity supply, severely curtailing the RET would risk stalling Australia’s progress, at a time when climate change science makes it clear that rapid reductions in emissions are required,” the statement said. The authority has previously recommended Australia’s 2020 target be trebled to 15%. It said its new review would draw on its previous work as well as the Warburton review. It is seeking submissions."
"European leaders were expected to strike a broad climate change pact obliging the EU as a whole to cut greenhouse gases by at least 40% by 2030. But key aspects of the deal that will form a bargaining position for global climate talks in Paris next year were left vague or voluntary, raising questions as to how the aims would be realised.  Draft proposals were given to national delegations on watermarked paper in sealed envelopes as the EU summit in Brussels started on Thursday, in an attempt to prevent leaks. The proposals pencilled in two 27% targets – for renewable energy market share and increase in energy efficiency improvement. The former would be binding only on the EU as a whole. The latter would be voluntary, although it could be raised to 30% by a review in 2020. The Brussels summit was dominated by arguments over energy savings and climate policy, with countries from Poland to Portugal pleading special circumstances and threatening to veto any breakthrough unless their demands were met. Acute divisions over the energy policy were reflected in the fact that summit “sherpas” were still meeting on Thursday afternoon to draft a deal for the leaders. David Cameron was keen to minimise any perceived loss of UK sovereignty over energy policy, for fear of further exposure to attacks from the Eurosceptic wing of his Conservative party and Ukip. The prime minister insisted that policies aimed at boosting renewables and saving electricity be voluntary for member states. “It’s important that you’ve got flexibility over your energy mix,” said a Downing Street spokeswoman. Cameron hoped to cut the energy efficiency figure to 25%, but was prepared to accept 27% as long as it was not binding on Britain. Poland, heavily dependent on coal-fired energy production, threatened to block the deal unless the costs to its economy and industry were discounted by €15bn-€20bn (£12bn-£16bn) between 2020 and 2030, under a complicated system of concessions from the EU’s carbon trading system. Concessions granted Poland will allow it to continue reaping hundreds of millions of euros in free allowances to modernise coal-fired power plants. Of eight EU nations eligible for the free allocations, Poland claimed 60% of the total up until 2019. A poll by TNS and YouGov for the online activist group Avaaz late last week found that 56% of Poles thought that EU financial support for energy should back clean energy rather than fossil fuels. “It’s scandalous,” said Julia Michalak, a spokeswoman for Climate Action Network Europe. “A continuation of free emission permits for Poland’s coal-reliant energy system would be a grave mistake. Leaders who came to Brussels to agree new historic climate goals, are actually discussing whether to hand out money to Europe’s dirtiest power plants.” Intense bilateral discussions between Cameron, the German chancellor, Angela Merkel, and other EU leaders over the last week tried to find ways of placating the Poles, who have kept open their option of vetoing the summit outcome. Portugal and Spain demanded a more substantial system of electricity interconnectors across the Pyrenees enabling them to market surplus renewable energy in France, which is heavily nuclear-dependent and reluctant to open its energy market to competition from the Iberian peninsula. The final draft said the interconnectors system should be expanded to be capable of carrying 15% of electricity generated in the EU, but this figure was merely a recommendation. Diplomats and officials said the Portuguese were deeply unhappy. It was not clear whether the leaders would reach an agreement. “It will be very hard negotiations,” said a senior German official. “This is just a first step,” said a French diplomat. “Then everything has to be turned into European legislation. It’s complicated.” The anticipated 40% greenhouse gas cut by 2030 would be measured against benchmark 1990 levels. That figure is to be binding on the EU and the minimum level achieved, with Germany and Britain happy to agree a higher figure. But the details of how the burden is spread across 28 countries have still to be settled, suggesting that the agreement would be simply a negotiating position for next year’s crunch talks in Paris on a global climate change deal. Tony Robson, the CEO of Knauf Insulation – a leading insulation firm that had threatened to divest from Europe unless firm energy saving targets were announced – said that the 27% figure for energy efficiency improvement was “no better than business as usual” in an open letter to EU leaders. A 27% target “sends a strong signal to the energy efficiency industry to ‘leave Europe and make your investments elsewhere’,” he wrote."
nan
nan
"Ukip is casting a shadow over Europe’s climate change policy, MEPs say, as David Cameron and EU leaders arrive in Brussels on Thursday to agree goals on carbon emissions and energy. The meeting on Thursday and Friday is a chance for leaders to set out their stall for action to tackle greenhouse gas emissions ahead of a global UN summit in Paris next year, where it is hoped nearly 200 countries will agree a climate pact.   But MEPs say the UK is “dancing to Ukip’s tune”, and undermining a strong goal on saving energy for fear of being seen to be pandering to the EU over rules on energy-guzzling devices, such as high-powered vacuum cleaners and inefficient light bulbs. Europe is on track to meet goals adopted in 2009 to cut emissions 20% by 2020 and have 20% of energy come from renewable sources such as wind power, but is lagging behind a third target to cut energy waste 20% by the end of the decade. The subsequent financial crash means a slower pace of climate action has been tabled for 2030 versions of the targets. Cameron’s government has made the running in calling for emissions cuts of at least 40% and up to 50% if other countries act, but it has also tried to block strong targets for renewable energy and for reducing energy use – which many experts say is the only verifiable way of ensuring that emissions have actually been cut. British opposition to EU oversight of national energy policy is long-standing but MEPs, EU commissioners and diplomats increasingly cite Ukip’s rise, and tabloid campaigns over EU measures to improve the efficiency of household items such as vacuum cleaners, as factors influencing Cameron’s thinking. “It seems to me that the Conservatives are dancing to Ukip’s tune,” the Labour MEP Seb Dance told the Guardian. “In opposing binding targets on renewables and energy efficiency, they are completely following Ukip’s lead and it is regrettable to say the least.” Green MEP Claude Turmes said: “Further watering down of the package is expected to come from the UK pushing for even lower ambition on [energy] efficiency. The EU is being taken hostage by Cameron’s internal party struggle with eurosceptics from Ukip.”  The Liberal Democrat MEP Catherine Bearder called on Cameron to build on the European coalition that she said the energy minister, Ed Davey, had taken a leadership role in constructing.  “David Cameron must not bow to Ukip pressure and try to sabotage Ed’s good work,” she said. “Any watering-down of targets would do irrevocable damage to the EU’s status as a leader in the fight against climate change in the build-up to global talks in Paris next year.” Dance said: “You just can’t push short-term party political interests on the basis of a few by-election results and some polls, to put the entire EU climate and energy policy on the back-burner . It is absolutely ridiculous, a complete abdication of responsibility and leadership on the PM’s part and I’ve no doubt that this is motivated by a fear of Ukip and the fact that so many of the PM’s party in the past secretly – and now increasingly openly – agree with Ukip’s position.” Roger Helmer, Ukip’s European parliament leader and energy spokesman, has controversially said climate change is a “myth” and that “fossil fuels are the future” of British energy policy. Following the furore over vacuum cleaners, his most recent intervention in EU parliamentary debate was to condemn what he said were plans by Brussels to regulate for more efficient electric kettles. He told the Guardian that Ukip would be campaigning on the doorstep in the next election over energy prices, an issue which the Daily Mail today linked to EU green energy policies, citing a report by the pro-free market Open Europe think tank. “In many areas we are leading Conservative party opinion because we are saying what many Conservative party members and MP’s actually believe,” he said. “Conservative backbenchers and activists are saying ‘we’re really embarrassed because Ukip has a sensible policy in this area and the Conservative party doesn’t’.” He continued: “The EU’s climate and energy policy is a disaster.It is damaging the economy and driving energy intensive business offshore, frequently to jurisdictions with lower standards. I primarily blame Brussels, but the current government has made climate policy worse than it needs to be under EU law.” Ukip’s positioning has already raised hackles in Brussels, with the EU’s energy commissioner Gunther Oettinger warning earlier this summer that campaigns against efficiency measures were being used as a proxy for stirring anti-European sentiment. “Political parties have fulminated against the Union’s efforts to reduce the energy consumption of, for example, light bulbs, vacuum cleaners and coffee machines,” Oettinger wrote in a letter to energy ministers. “We have seen similar attempts in the past, when national press [sic] has used these measures in a way that risks creating anti-European feelings amongst citizens. This should not be taken lightly. Attempts at undermining ecodesign and energy labelling directly undermine our energy policy.” Energy efficiency measures increased business competitiveness, cut household bills, and reduced CO2 emissions, Oettinger said.  "
