"Seven years ago, Greg Combet, then a Labor minister, implemented a carbon price in a minority parliament, an experience so arduous it helped curtail his political career. Now, safely outside political life, he looks on with bemusement about where the climate and energy debate has washed up. On Tuesday, Combet launched a new report by the Industrial Relations Research Centre at the University of New South Wales investigating how countries such as Australia can achieve a fair transition for coal workers displaced as the economy decarbonises.  It got a bit lost in the wash of the week – let’s face it, it’s hard for substance to compete with the rolling spectacle of political dysfunction – but it’s an interesting bit of analysis funded by the CFMEU’s mining and energy division. In 2011 Combet had to fight almost everyone in the country to get the clean energy package legislated. Business was hostile. The energy sector was hostile. Barnaby Joyce was screeching apocalyptically about $100 lamb roasts. But while Combet’s experience was everyone shouting at him for doing something, we’ve now come full circle. Now, all the shouting is about the current government doing nothing. Business and energy retailers are on the frontline of increasingly frantic calls for policy certainty. The Gillard government would have killed for the conditions the Coalition has blown away over the last three years with reckless abandon. In any case, Combet ventured out this week about the future of coal. He insists the outlook is clear. If the world, and specifically Australia, is to do what is necessary to contain warming at 2C, then almost all coal-fired power will be gone by 2040. “That’s only 22 years away,” he tells Guardian Australia. “The energy companies get it. This is very much front of mind for the asset holders, and they want rational policy. They aren’t fighting it anymore. They don’t want stranded assets.” He says the energy market is going to transition “whether or not we’ve got Scott Morrison at the helm” and government owes it to people who will be materially affected in the transition to play it straight. “Workers in coal power stations need to know the truth. You really have to tell people the truth about structural change when it’s coming – you can’t be populist about it”. Earlier this year I asked the resources minister Matt Canavan whether he felt an obligation to help Australian communities face up to the inevitability of a carbon-constrained future. He responded as if I’d committed a thought crime. Labor, for its part, is putting a package of measures together. It’s likely to include a new statutory authority to oversee the transition and the programs intended to ameliorate it; specific industrial relations arrangements to ensure workers are managed through the process; and programs to drive economic diversification. Labor took a policy on coal transition to the last federal election, but it has to be re-engineered in some respects to take into account lessons learned from the closure of the Hazelwood plant, and also to reference the requirements of the reliability obligation in the national energy guarantee. Scott Morrison dumped the emissions reduction component of the Neg – it was a casualty of the Liberal leadership implosion – but Labor is likely to keep the policy with its own tweaks. A Labor Neg will have a higher emissions reduction target than the 26% proposed by Malcolm Turnbull, which will drive coal closure, but the reliability obligation (which requires retailers to provide sufficient quantities of dispatchable power to the grid) could mean that some coal persists in the system in a reserve capacity. Labor’s objective is to land the policy before the party convenes in Adelaide in mid-December for its national conference. The government’s new energy minister, Angus Taylor, is pushing in the opposite direction. Taylor is a bright bloke, with a lot of expertise in energy, which makes some of the positions he is pursuing hard to comprehend. While the science says the energy sector has to transition, and quickly, Taylor is digging in for coal. He’s signalled he wants to extend the life of existing plants and achieve new investment in generation by offering government support, including the possible indemnification of new coal-fired power from future carbon risk, which transfers the risk of these projects from private proponents to taxpayers. Taylor will also meet with the energy companies in Sydney next week to waggle his finger censoriously at them over their pricing behaviour. Now, why? Because he needs an outcome on that before voters go to the polls next year, because Morrison, in the spirit of handing on a poisoned chalice, has dubbed him the minister for getting power prices down. Power prices are high, and it would be terrific if they were lower. Ministers should stick up for the interests of consumers, that’s a given, but we also need ministers to think about interests that extend further than the next six months – something this government has become incapable of doing, which is what happens when the sum of your mistakes forces you to live minute to minute, without much care for whether anything connects to anything else, or whether things make sense. As the chairman of the Clean Energy Finance Corporation, investment banker and company director Steven Skala, noted this week, the transition is on in the energy market. It can’t be reversed. Business has moved. The financial markets have moved. “The question now is not one of direction, but of pace,” he said. Unlike some disruptions, which present too quickly for governments to ameliorate the effects, we can see this one coming. We are living through the first phase of it. When it comes to Australia’s 8,000 coal workers and the communities that depend on those workers spending their incomes locally, governments can either pretend they can hold back the future, indulging inane, virtue signalling with Alan Jones about “fair dinkum” power while letting real people be crunched in the transformation, or they can act to make the shift as just as possible. The report Combet launched this week warns that a hands off approach has left many retrenched workers and their communities with very difficult transition problems. “Because of lack of subsequent support, some problems – like intergenerational unemployment, poverty and poor physical and psychological health – continue and worsen with time, becoming entrenched and systemic,” it says. “These people, their families and communities have been left to carry the main costs of structural adjustment. This represents a very unfair transition.” So here’s a thought. Instead of “fair dinkum” power, perhaps we could contemplate some “fair dinkum” action?"
"Heatwaves in the UK are lasting twice as long as they did 50 years ago, ice days are disappearing and tropical nights are starting to occur as far north as Middlesbrough, according to a Met Office report. The first study of climate extremes in the UK by the government agency shows the longer-term trend behind this summer’s prolonged spell of high temperatures and the weakening of winter frosts. In line with numerous other research papers on the rise in global temperatures, it also highlights how weather patterns are being pushed off a normal path as a result of human emissions of carbon dioxide and other greenhouse gases. Until now the annual UK Climate Report has focused on monthly and yearly statistics, but a new supplement adds a series of indices on extreme weather. Mark McCarthy, the manager of the National Climate Information Centre, said: “Monthly, seasonal and annual climate data provide a valuable record of the changing climate in the UK. However, these average figures have a tendency to mask extreme weather and climate events. So in our latest report we have focussed on those measures which record weather extremes.” The new report shows that warm spells – when the maximum temperature is above the 90th percentile for the time of year – are becoming much more prolonged. From 1961 to 1990, the average longest warm spell each year was 5.3 days. From 2008 to 2017 this more than doubled to 13.2 days. This year, which is not included in these statistics, was even longer at 17 days. The south-east has seen an especially striking increase over the same period, up from an average of 6.1 days to 18.3 days. Tropical nights – when minimum nighttime temperatures remain above 20C – are being measured for the first time. They were almost unheard of until a couple of decades ago. Even the famous hot summer of 1976 never saw any of these nights, which are particularly gruelling for the elderly and infirm because they provide no respite from the heat. Since 1995 they have started to be recorded in London, Kent, the Isle of Wight and even occasionally in Wales and the north-east.  McCarthy said tropical nights were still very rare but he expected them to occur more frequently in the future. “With projections in climate suggesting warmer temperatures, it is useful to have this metric in place so that future changes can be monitored.” McCarthy said he was most surprised that extremes of hot and cold were changing at different speeds. While the temperature on the hottest day of the year has risen roughly in line with the average annual rate of warming since 1961, the coldest day has warmed at twice that rate. In the 30 years until 1990, the bitterest winter night in the UK averaged -8.5C. From 2008 to 2017 it was -6.8C. Parents who walk their children to school in the depths of winter may also have noticed there is less ice on the path than during their own childhoods. This is confirmed by the metric of “icing days”, which shows that the average number of days each year with freezing temperatures has fallen from 4.8 to 3.2. In the south-east last year there was not a single day averaging below 0C. The weather is becoming a little wetter and more dreary. The maximum daily deluge each year has risen by 17% from 64mm to 75mm, while the longest wet spell has increased from an average of 12.4 days to 12.9 days. The longest dry spell has become shorter, falling from 20.5 days with less than 1mm of rain to 18 days, though this year has brought such severe droughts that many farmers have had poor harvests. Many have already had to feed their winter food stocks to their animals and face increased costs as a result. In August the government was forced to relax rules on how much groundwater farmers were allowed to use after agriculture bodies warned continued dry weather could lead to food shortages and increased prices. Last month the UN’s top climate body warned that unless global temperature rises are held to 1.5C above pre-industrial levels, the world is likely to face catastrophic impacts from climate change, with flooding, droughts and extreme heat all more prevalent. Governments will meet in Poland in December for the latest round of negotiations over how to implement and strengthen the recommendations of the 2015 Paris agreement."
"Too many polar bears are roaming the Canadian Arctic, and the growing population is posing an increasing threat to Inuit communities, according to a controversial new government report which has been bitterly contested by environmental scientists. The draft report was prepared by the Nunavut government, and consists of submissions from Inuit community groups across Canada’s northernmost territory. Public consultations are set to start on Tuesday before the government unveils the final report later in the year. “Inuit believe there are now so many bears that public safety has become a major concern,” said one section of the report, according to the Canadian Press. “Public safety concerns, combined with the effects of polar bears on other species, suggest that in many Nunavut communities, the polar bear may have exceeded the coexistence threshold.” The renewed focus on polar bears comes after a tragic summer for the region: two people were killed by bears in separate attacks, including father Aaron Gibbons, who died protecting his children. Researchers agree that polar bears represent a growing threat to Inuit communities, but say that is because climate change has pushed them closer to human settlements – not because the bear population is growing. “There seems to be a divergence between scientists and Inuit on the threat that climate change poses to this species,” said Andrew Derocher, a polar bear researcher at the University of Alberta. Scientists and conservation groups have warned that a warming climate has reduced sea ice and the availability of prey, pushing bears on to the mainland – and closer to humans. But Inuit argue their own observations are often ignored, and the new report highlights a growing tension between scientific research and Inuit knowledge based on from thousands of years of living in the region. “We know what we are doing, and western science and modelling has become too dominant,” wrote the Kitikmeot regional wildlife board as part of its submission to the report. “Our knowledge, is not the same as thousands of years ago. If your life depended on it, you’d better know what the ice condition is,” said Gabriel Nirlungayuk, an Inuk hunter of Rankin Inlet. “Our knowledge has always evolved.” Aerial surveys are often used by scientists to determine the population health of bears. But Nirlungayuk said that some of the best hunting conditions for polar bears are during stormy, foggy weather that grounds aircraft – when bears can sneak up closer to their prey.  The polar bear hunt remains a critical and lucrative component of life in the northern communities. Hunters can receive as much as $10,000 for pelts, with residents parcelling up and sharing the meat for food. Canada has long resisted legislation that would terminate the harvest. While Inuit and scientists disagree on the population of the bears, they both foresee problems in the future. Derocher worries bears will continue to show up in communities, drawn in by numerous attractants – putting both humans and bears in harm’s way. “We’ve been saying this for years: we’re going to have a lot more problem bears. And if we don’t get on top of it, we’re going to see a lot more issues coming down the road,” he said. Nirlungayuk agrees. “We want to enjoy being out on the land with our families. But today, people need to carry a rifle all the time just to enjoy the great outdoors.”"
"Roger Kelly had been up through the night, watching the orange glow emanating from the hillside above his home of 30 years. The Seminole Springs mobile home park, a co-op of 215 small lakeside homes tucked into the canyon between Malibu and Agoura Hills, was on the warpath of the most destructive fire to ever hit Los Angeles and Ventura counties.  By the early morning on Friday last week, flames were quickly billowing toward them. “The way the smoke was coming you just knew it was on the other side of the hill and about to jump,” he say. His wife was ready with essentials packed. “I never thought we would burn here,” he said. “So, I just grabbed my surfboard” and left many other possessions behind. But before the day was through on Friday, half the neighborhood would be gone, leveled into ash and metal, foundations and car-frames. Referred to as a “hidden gem” by those who live there, most outsiders – even southern California locals – didn’t know the Seminole Springs neighborhood existed until an aerial view of the Woolsey fire caught by a local TV helicopter showed what was left behind. Roughly 100 small homes, which had once been closely clustered together in the canyon, had been reduced to rubble. Lots of people here consider one another family. That’s why the broadcast footage haunted residents. “I probably looked at that screenshot 100 times trying to figure out [who was spared],” Kelly said. “I could see my neighbor’s house, but I couldn’t really see mine. It was killing us, my wife and I.” By Saturday the president of the park had called – his home was safe. But in a tight-knit community like this, the relief couldn’t be fully felt, as neighbors suffered. “I didn’t know my place was there for sure, until I saw it with my own eyes,” he said, explaining why he evaded blockades set by the authorities and returned to the evacuated area over the weekend. “We came over the little hill and I saw it and … I couldn’t believe it. I got so overwhelmed with emotion. Just to see all the devastation.” Most members of the mobile home park, which was built in 1969, had lived there for years, raising their families together. It was the kind of place no one wants to leave, once they snag a spot. Initially constructed as a senior community, over the last few decades Seminole had begun to welcome families with children and recently, the 215 units were filled by a mixture of old and young.  The Seminole Springs website shows brightly colored kayaks adorning the shore, trails that lead past the lake into the green hillsides overlooking the community. There’s a pool, a BBQ area, and a lounge. “It was a gem,” Kelly said. “And it will be again. We hope.” Kelly adds: “In my opinion because we are a community of 215 families and homes –and we have been here for 40 years – we should have been a priority, rather than saving the big fancy homes built way in the middle of nowhere.” The Woolsey fire, which is still burning across more than 97,620 acres near Malibu in southern California, is 47% contained after six days of an around-the-clock firefight. The Los Angeles county fire chief, Daryl Osby, said the battle against this giant blaze, which has now scorched an area larger than the city of Denver, has been the most difficult he’s seen in his 35-year career.  So far, it has consumed more than 435 structures, a number officials say is likely to rise as damage crews finish their assessments. “I feel bad that we lost any homes,” Osby told the Guardian. Though he didn’t know the specifics of the Seminole Springs fire, he said it was something he would assess in the coming months when officials study the fire’s progression. “We did the best we could,” he adds, emphasizing that their teams had to use the limited resources they had to focus on saving lives. “I think we were successful at that objective, preventing death. Unfortunately, it was at the expense of people’s homes.” Carol Ornelas’s home was perhaps the last one that burned before the fire moved past the neighborhood. She lived in one of the few decimated houses in the lower-part of the park. Her three best friends, who live in the upper-part of Seminole Springs, all lost their homes. “We all moved there to be in the same place. But now it’s unbelievable,” she said. “Usually, if something terrible happens to one of your friends you can all rally to help that person – but it is all four of us.” ﻿Now she is resting with a friend and trying not to focus on the negatives. Ornelas had just moved her 94-year-old mother into an assisted living facility, and had recently brought all her family’s keepsakes to her Seminole Springs unit. She and her husband, a drummer, also had the only photo of him playing for Sonny and Cher hanging on the wall. Nothing could be recovered from the wreckage. “They are just things,” she said, “but they are things that we absolutely can never replace. Things that are not valuable so to speak, but they are the things I wanted to have forever. That’s the worst part – losing the things you can’t replace.” Houston Waye, a new resident who moved into Seminole Springs in February, left on Thursday evening to ensure his wife, animals, and two-year-old baby were out safely, but he returned on Friday afternoon, avoiding blocked roads by hiking in through a back route. In the first scramble to get out, he’d barely brought any of his own things. “I had two dogs, a cat, a tortoise and a two-year-old,” he said. By the time he returned, most of the damage was done. But he and others worked to ensure the smoldering patches wouldn’t reignite. The homes on the edge, between the line of saved homes and burned ones, were ablaze when he arrived. Waye and a neighbor who stayed through the ordeal used hoses to put them out. “This will bring out the best in a lot of people,” their neighbor Brandon Rubin said, calling helpful residents heroes. His was one of the homes still standing, but as someone who both grew up in Seminole Springs and who returned to live there with his girlfriend, receiving the news was “one of the most bittersweet things you can imagine”, he said. “There are faces to all those homes that you see gone,” he said. “Close to 100 homes were lost. That is a lot of people in trouble. ” But, he is certain they will rebuild – and they will do it together. “Like any community it’s not perfect. But we all love each other. We are all there for each other,” he said, adding: “the stuff is gone. But we are here. We are strong people and we are going to get through it – together.”"
nan
"The social media influencer Jack Harries has said young people have a duty to protest against environmental destruction, as he took part in a day of protest in London that led to at least 14 arrests. The 25-year-old, whose YouTube channel has 4 million subscribers, spoke to the Guardian as he helped hold a 68-metre banner over the side of Westminster Bridge with the words: “Climate change: we’re fucked”. Harries, who has made a number of films about environmental destruction, said he was willing to use his social media influence to inspire his followers to take action over the climate. He said: “As a young person growing up in London I feel scared for the state of my future [and] overwhelmed by the news about climate change, and I feel like our government is simply ignoring the problem. “It’s worth noting I don’t want to be here, but I feel that it’s my duty as a young person to make our voices heard and to force our governments to listen because, ultimately, it’s our future that’s at stake.” He added: “Climate change is a global issue and it’s up to all of us to stand up to be heard. I think we have gone past the point of turning off our lightbulbs or having shorter showers. This is an existential threat. Young people should be angry and should be demanding change from their leaders. “For far too long leaders have avoided action on climate change because they have banked on the fact that young people don’t understand. We are here today to tell them that we do understand the issues, and we are scared.” Harries spoke at the beginning of a new day of action by the Extinction Rebellion group, which is orchestrating a week of events planned to bring London to a standstill. They say they have 500 activists who have signed up to be arrested. ""this is ecocide, this is genocide""#ExtinctionRebellion environment protester explains her actions in cuffs as she is arrested outside Downing Street pic.twitter.com/QLEv2WIOQy #ExtinctionRebellion activist arrested outside Downing Street pic.twitter.com/EgbecyxkxW Seven protesters were held outside Downing Street after spraypainting messages on the walls beside the gates, gluing themselves to fencing and lying on the ground holding food containers reading “food shortages are coming”. Seven more were arrested outside the Department of the Environment, Food and Rural Affairs (Defra) after a group ran up to Nobel House, Westminster, and spraypainted the walls with messages including the extinction symbol and “climate breakdown = extinction”. #ExtinctionRebellion protesters daub slogans and @extinctsymbol on the walls of @DefraGovUK pic.twitter.com/nv05OcSyDi ""if we carry on like this my grandchildren have no future""Derek Langley accepts responsibility for graffiti on @DefraGovUK as part of #ExtinctionRebellion protests pic.twitter.com/ffsjP32S6I Derek Langley, 63, from Cambridge, was among those who stood with paint-stained hands in the air to take responsibility for the action. He said: “If we carry on like we are now, my grandchildren have no future, absolutely no future. This is the last-ditch attempt, it’s too late to try anything else.” A second protester, facing police who arrived minutes later, said: “You don’t have to waste your time with CCTV because we’re not running away and we’ve got paint on our hands.” A spokesperson for Extinction Rebellion said the protesters used water-based spray chalk, which washes away easily. "
