"Mining companies are campaigning for the G20 leaders’ meeting to support continued use of coal as a solution to the global “energy poverty” crisis, as Australia resists the inclusion of climate change on the formal agenda. Peabody – the world’s largest private coal miner – has launched an online campaign titled the “Lights On” project to convince G20 leaders meeting in Brisbane next month that access to coal-fired power is crucial for “empowering” developing countries. The G20 push, using social media and video, is part of an international campaign the company commissioned with PR firm Burson-Marsteller targeting China, America and Australia, called “Advanced Energy for Life”. While the prime minister has resisted pressure from the United States and Europe for climate change to be included in the G20 agenda on the grounds that it does not fit the meeting’s economic focus, Peabody’s Australian president Charles Meintjes was invited to make a presentation to a workshop for the G20’s energy program in Brisbane in August. In the presentation Meintjes argued that “coal is the only affordable fuel, at scale, to meet rising energy needs” of the world’s poor, including graphs claiming a clear correlation between rising coal consumption and rising life expectancy and global GDP. Dr Simon Bradshaw, of Oxfam Australia, said the mining industry was “very active” in the lead up to the G20, but contrary to its arguments, renewable energy “offers a far better prospect for increasing access to electricity in most countries and most markets”. “Climate change is a major threat in the fight against hunger and poverty and coal burning is the single biggest contributor to climate change,” Bradshaw said, adding that it would be “very unfortunate” if G20 leaders accepted the coal industry’s “self serving arguments.” He said in his opinion the presentation, made to industry and non-government representatives and international energy officials, drew some “very dubious correlations and mounted some pretty unsophisticated arguments.” The participants were not told to keep the slideshow confidential or secret. Guardian Australia has obtained a copy of the presentation, which can be seen here (pdf). “It would be highly inappropriate if the G20 was to be captured by the vested interests of companies spruiking last century’s dirty energy sources”, said Dermot O’Gorman, the chief executive of WWF Australia. “Poor people in developing countries deserve access to clean, safe and affordable energy sources and this should be the primary motivation for the G20, rather than protecting the coal industry and running the risk of creating stranded assets.” Abbott has played down the chances of climate change being discussed by the world leaders who will gather in Brisbane because its primary focus was “economic security, our financial stabilisation, the importance of private sector-led growth.’’ But despite Australia’s reluctance, Barack Obama’s international adviser, Caroline Atkinson, told the Australian Financial Review this week that since G20 economies generated 80% of the world’s carbon emissions the meeting should give political impetus to “specific steps” to reduce global ­warming. Opening a new coal mine on Monday, Abbott said: “let’s have no demonisation of coal. Coal is good for humanity.” Abbott did not attend the special UN climate summit in New York in October, where both Obama and British prime minister David Cameron urged decisive action to contain global warming. The government has said it will include energy efficiency in the G20 discussions, and during those talks other leaders are likely to raise climate change."
"Islanders from the Tulun Atoll where forced relocation is presently underway are reporting what some believe is the beginning of the end. Breadfruit trees have been destroyed, the soil isn’t good enough to grow crops. The sea water is eating away at the land. Tulun Atoll is not alone. Across the Pacific islanders are reporting similar changes as the sea is creeping up. Given that sea level rise is not uniform across the world (forget the bathtub that fills evenly!) it’s not surprising that in some island communities the impacts are becoming more quickly apparent.   And it won’t get better anytime soon. Previous sea level rise projections of around 1m by the end of the 21st century have recently been revised upward as new scientific studies published earlier this year found a doubling of Antarctic ice loss, and satellite based data revealed that the collapse of a large part of Antarctica is now considered unstoppable. The studies suggest that, over time, ice losses in East and West Antarctica “will change the coastline of the world” and may even amount to “global coastal destruction”. It’s hardly surprising that leaders of some of the most low-lying island nations in the world, including Kiribati, Tuvalu and the Marshall Islands, are more and more desperate to raise the plight of their islands. Tuvalu prime minister Enele Sopoaga even likened climate change to “a weapon of mass destruction”. The desperation of islanders is understandable. Countless low-lying islands around the world protrude only a metre or two above sea level and are acutely vulnerable to even very small rises in sea level. Their very existence is threatened by human-induced sea level rises and other climate change impacts such as coral bleaching, ocean acidification, storm surges, coastal erosion, saltwater intrusion and freshwater contamination. And yet small island developing states have contributed less than 1% to the global stock of greenhouse gasses now in the atmosphere.  What this means is that island communities are overwhelmingly not responsible for the rises in temperatures and sea levels which are increasingly threatening their survival. Some Pacific atolls are already relocating their island communities, and Kiribati has reportedly already bought tracts of land in Fiji to prepare for such a future relocation scenario. The Maldives - where none of the coral islands protrude over 1.8m above seal level - has also talked about doing this. It’s heartening that New Zealand has recently granted residency to a family from Tuvalu, accepting their landmark claim that climate change effectively thwarted their return home. While it’s the first successful application of this type, it certainly won’t be the last time that climate change will force islanders to seek safer shores elsewhere. New Zealand’s decision is commendable for a number of reasons, including recognition by the immigration and protection tribunal of climate change as an important causal factor in long-term displacement and human wellbeing. It’s also a tacit acceptance that the international refugee convention is not the appropriate or only instrument for offering protection, justice and a lifeline of hope to Pacific climate change refugees. Indeed, the refugee convention has already been determined to be irrelevant for climate change refugee situations by New Zealand’s court of appeal which earlier this year refused to recognise climate change refugee status to a family from Kiribati, arguing that in the absence of persecution Ioana Teitiota did not meet the legal definition of a conventional refugee. There are growing calls for action to help these island nations. A few weeks ago the executive director of the United Nations Environment Program Achim Steiner called on the world to help small island states win their battle against climate change. He said that island states are “microcosms of our larger society ... the rest of the world should not let them drown”. This call was echoed by Tuilaepa Aiono Sailele Malielegaoi, prime minister of Samoa, who demanded world leaders “rise above the rhetoric and forge binding agreements on climate change” at the climate change summit in New York. Given Australia’s number one position as the worst carbon emitter per capita among major western nations it seems hardly surprising that islanders from Fiji, Samoa, Vanuatu and other small island developing states have been turning to Australia with growing exasperation demanding the country demonstrate an appropriate response and responsibility. Being a multicultural nation of migrants and migrant descendants, and a major per capita contributor to the climate migration issue, Australia already seems ideally positioned to become a world leader in the area of climate migration both morally and practically. Australia is neither single-handedly responsible for the problems nor for the solutions, but “first-mover advantage”can matter as much in policy framework design as in business or chess.  PhD research has shown that preparedness in climate migration is about learning the lessons early and preparing a meaningful, measured, positive and proactive policy response for the benefit of affected individuals and communities in countries of origin and destination. New Zealand’s decision to recognise climate change as a factor in forced migration marks a moral and ethical precedent that Australia and other countries have yet to emulate. In the long run a new type of migration category for climate migrants from Pacific islands seems inevitable. With this in mind three key questions remain. First, is the history of humanity not primarily a story of migration; and is the human narrative not replete with forced and voluntary human movement? Second, is it not befitting to empathise with the plight of fellow human sojourners and accept new climate migrants within our borders and communities? And third, when will other nations follow New Zealand’s example and recognise that climate change migration is a growing reality?"
"This weekend 12 enormous blocks of ice weighing 100 tonnes will be left to melt in Copenhagen’s City Hall Square as a striking visual representation of the reality of climate change. The ice, collected from a fjord outside Nuuk, Greenland and displayed in clock formation, is intended to be a physical wake-up call to encourage people to transform climate knowledge into climate action. Later this month, the UN Intergovernmental Panel on Climate Change (IPCC) will present its Fifth Assessment Report, the most comprehensive assessment of scientific knowledge on climate change since 2007. But it may not lead to action. The information presented by the IPCC is overwhelming and scary and most of it, too complex to be able to translate into effective actions.  The Ice Watch installation is intended to make the climate challenges we are facing tangible. Perception and physical experience are cornerstones of art, and they may also function as tools for creating social change. The problem is that all too often citizens of the developed world feel disconnected from – or may be fortunate to be unaffected by – the major problems in the world. We do not see ourselves as active agents in the global community. Climate change, poverty, war, disease – these are challenges that compete for our attention. The information age in general, and public awareness campaigns in particular, have succeeded in making most of us know that these challenges must be addressed. But there is a tremendous disconnect between what we know and what we feel, and, consequently, what we do about them. Being touched by a book, by music, or a work of art gives you a jolt. It shifts you into a new place. This profound experience is not necessarily about getting to know something new. Often when we are touched, we become aware of what is already within us, something we recognise and maybe even identify with, but have not yet verbalised or felt, deep down. This is why looking at a great painting can be liberating and why theatre can connect our heads to our hearts. When we embody knowledge through experience, we turn it into a force that can guide and shape our actions, in global as well as local contexts. Society and action are not external to art; they are a vital part of it, and there is a long tradition of making thoughts, feelings, and ideas not just perceived and felt, but also relevant in and for societal contexts. The positive stories of transitioning to a sustainable world are out there and should accompany and temper the doomsday scenarios, because they show the way forward. Certainly, it is important to present the data behind key challenges facing the world today, but action does not necessarily grow from here. Linking knowledge with an embodied sense of who we are and want to be, of responsibility for our children and grandchildren and of commitment to the future, is necessary to mobilise action. Culture is a strong ally in this endeavour. Where conventional methods of display and communication deployed in, for instance, commercial spaces target people as consumers, cultural spaces invite people inside and hold their attention and presence in a different way. These spaces are bottom up; they tend to create trust and a feeling of empowerment for the individual. Culture helps us, as individuals and groups to experience our interconnectivity, our interdependence, and may move us to do something together, to act with each other, to become conscious, active members of the ‘global we’. By using art, architecture, storytelling, and other cultural activities and by illustrating the correlation between a sustainable lifestyle and a happier and healthier life, we can achieve the shift needed for real climate change action to happen. Therefore, we need to accompany strategy plans, position papers, and limits for CO2 omissions with cultural work. We call on novelists, playwrights, architects, sculptures, painters, photographers, and other cultural activists to create and make tangible, the option of a sustainable world. We need to understand that life-enhancing measures can be undertaken on behalf of the Earth, its climate, all of us, and our individual and collective future. It’s time to realise that we are not going to solve the climate crisis through our rational mind alone. Action on climate change requires more than information provided by IPCC reports and other sources. It requires inspiration. We need to be inspired and motivated to change our lifestyles, building codes, travel habits, food choices, energy sources, economic and social indicators, political processes, and much more. Elke Weber is the Jerome A. Professor of International Business at Columbia University, Usairena Bauman is professor of sustainable urbanism at University of Sheffield, and Ukolafur Eliasson is an artist Read more stories like this: Join the community of sustainability professionals and experts. Become a GSB member to get more stories like this direct to your inbox"
"America’s energy-related carbon pollution rose 2.5% last year despite President Barack Obama’s efforts to fight climate change, according to new federal data. The rise in emissions from burning coal, oil, natural gas and other fossil fuels was one of the steepest on record in the last 25 years, according to the Energy Information Administration’s Monthly Energy Review.  The increase in carbon pollution is a setback for Obama, who has been heavily promoting his progress in cutting America’s greenhouse gas emissions. Obama told 120 world leaders at the United Nations climate summit last month that America had done more under his watch to fight climate change than any other country. But the EIA figures show that America’s greenhouse gas emissions are now rising again after several years of decline during the recession. The chill Arctic temperatures of last year’s polar vortex can shoulder much of the blame. The EIA said the rise in emissions was largely due to home heating because of the cold weather. The data also showed a 4.8% increase in the use of energy from coal, and a 10% fall in energy from natural gas. Emissions were still 10% below 2005 levels. But the latest figures deepen doubts about whether America will meet its existing commitments for a 17% cut in emissions by 2020 without additional actions, or make the cuts required in the coming decades even deeper.  Until last year, America was on track to meeting that goal, with emissions falling by more than 13% from 2005 to 2012. But that has shrunk to just 10% over the last year or so. Meanwhile, the pressure is on to do more. World leaders have agreed they need to keep global average temperature from rising two degrees Celsius above pre-industrial levels to prevent the worst consequences of climate change. America, along with other countries, is expected to pledge further actions on climate change early next year."
"There are deep connections between the prosperity of companies, the vitality of cities and the health of our environment. The more vulnerable cities are to climate change, the greater the risks to the businesses located within them. The greater the locally specific climate-related risks to business operations and capital investment, the less likely a city will attract, retain and support the commerce it requires to employ its people and maintain its tax base. As far as climate risk is concerned, therefore, cities and companies are tightly linked. In 2013, the Carbon Disclosure Project and C40, the network of cities sharing best practices in both forestalling and adapting to climate change, produced a report titled Wealthier, Healthier Cities. In it, they catalogued the ways in which the actions of cities ought to result in increased economic activity and growth.   For example, research shows that positive economic outcomes often stem from investments in public transit, increasing green space, and building infrastructure for walking and cycling, among other initiatives. The study claimed that 62% of all reported emissions reduction activities being undertaken by cities have the potential to make cities more attractive to businesses. Although encouraging, this type of analysis doesn’t say much about the role of business in the process of decarbonisation or increasing resilience. It focuses on the advantages associated with business locating in cities addressing climate change. This year, the same organisations teamed up with Bloomberg Philanthropies to produce a new report, Protecting our Capital. This time, it’s based on the replies of nearly double the number of cities as 2013. It includes data about the concerns of companies, closing the circle with reports such as Risky Business, which examine the business risks due to climate change. In 2014, it’s clearer that the interests of cities and of companies are much more closely aligned than one might expect.  This report is not as sunny as 2013. It’s about the preservation of capital that can be destroyed by extreme weather. It’s about the risks to property and operations that need to be mitigated, and about who’s working to mitigate them. Cities, which have long been on the front lines of the battle against climate change, are businesses’ best allies. By rebuilding infrastructure that reduces the risks of flooding, windstorms, drought or famine, cities allow companies to operate in a lower risk environment. Because they are more likely than national governments to recognise the real and present dangers, cities are best positioned to listen to the concerns of companies  The report reaches three conclusions: cities get it, cities are closely aligned with business priorities, and cities’ adaptation to climate change benefits business. “Cities are providing information, incentives and regulations that assist businesses to be more resilient to climate change.” The common sense of risk and their mutual need for resilience is the basis for a high degree of collaboration. The report identifies the alignment of the shipping industry and port cities, of the food and agriculture industry with many centres such as Bologna, and of the financial industry with urban banking and financial centres. Rising sea levels, water scarcity, and extreme weather have the ability to devastate industries together with their industrial centres.  We have known for a long time that business and location are inextricably linked. Decades ago, Michael Porter devised the notion of competitive cluster, showing us how industries related to place, in his Competitive Advantage of Nations. Paul Krugman published Geography and Trade in 1991. This report is a reminder that cities and companies share the same risks as the earth inexorably warms. Perhaps it is this inexorability which prevents closer collaboration between city governments and companies. Together they are already responsible for much of the progress we have made in decarbonisation. Together, they are beginning to forge alliances to prevent catastrophic global warming and mitigate its risks. Read more stories like this: Join the community of sustainability professionals and experts. Become a GSB member to get more stories like this direct to your inbox"
"They say all politics is local so this week when scientist John Church published a report in the world’s most prestigious science journal, Nature, about sea level rise, it made me look out my kitchen window.  I live in a town where sea level rise is not just academic. My life is spent surrounded by salt water. My home is a very modest south coast fibro cottage on a promontory at Moruya Heads, four hours drive south of Sydney.  Writing about his new paper, Time of Emergence for Regional Sea-Level Change, Church said: Our new analysis of sea-level projections ... indicates that regional sea-level rise will be generally noticeable before 2030. By then the average sea-level rise globally will be about 13 centimetres higher than the average sea level calculated between 1986 and 2005. As soon as I had read Church’s report I went and scrabbled through my files for a letter that had arrived in my letterbox a couple of months ago from the Eurobodalla Shire Council. Across the road from me is the main channel of the Moruya River and my back boundary is a tributary of the estuary, known as Gilmours Creek. At the end of my road are two spectacular beaches that are part of the Batemans Marine Park. I don’t need to consult charts to see whether it is high tide or low – I just look across the water. It’s the kind of sleepy little place where the postman is the same guy nearly every day, and he waves when he delivers the mail. In August he dropped off an envelope from the council.  I am writing to advise you of a draft report relating to sea level rise that is currently on public exhibition … As the owner of a property that is currently identified as ‘potentially at risk from future sea level rise’ we invite you to comment and give feedback during the exhibition period. If the report is adopted, it will provide the basis for consideration of sea level rise in future plans and policies including the preparation of the Coastal Zone Management Plan for Eurobodalla which will include public consultation. Like most people, I have been concerned about climate change as an esoteric issue. I have worried about how it will impact on my children and grandchildren. But here was climate change in my actual letter box – formal correspondence about how climate change was going to impact on me. The impact would be real and probably financial as well as practical. Who wants to buy property that is labeled “potentially at risk from future sea level rise”?  Still, I am very fortunate. While my property drops down to sea level at the rear, my actual home is probably a good 13 metres above a high tide. That is a long way above Church’s 13 centimetres. But down the road from my house the terrain drops to a long low flat area with houses at current sea level. The road itself is already almost lapped by seawater when there is a summer king tide. The biggest town in the Eurobodalla, Batemans Bay, is one of the nation’s most vulnerable communities to sea level rise. Once you start looking around even a relatively undeveloped community like mine you start to see that there is a lot of critical infrastructure that already sits on the very edge of being submerged. And planning mayhem will not just be a problem for the Eurobodalla. This will be a story played out in every local government area around Australia, in every captial city and in every multi-billion dollar port facility and seaside airport – especially Sydney’s Kingsford Smith.  I have always reassured myself that this coast where I live has looked the same ever since I first started coming to this area as a toddler. There are individual rocks on beaches that I have forever known to watch out for when I am catching a wave, sand spits and bays that have, for decades, seemed immutable. But if Church and his colleagues are right the coastline itself and the first law of Australian real estate – an ocean view is gold - is about to be re-written.  • James Woodford is writing on marine science through a non-profit journalism project funded by the Pew Charitable Trusts"
