"Democrats don’t have a plan to address climate change comprehensively – or even to a significant degree – if they regain control of the US government in the near future, despite criticizing Republicans as the party of pollution. After failing to get conservatives on board to limit planet-warming gases through legislation or regulation, Democratic leaders in Washington are now wary of wading into another tough political fight, despite an intensifying environmental crisis.  If Democrats win back the House in Tuesday’s midterm elections, their strategy is to hold oversight hearings on Donald Trump’s environmental rollbacks and pursue more incremental and popular measures, according to close observers and a senior Democratic aide. Environmental advocates hoping progressive politicians will lead efforts to save the planet may be shocked to learn there’s no wide-ranging strategy or headline-grabbing legislation waiting to be unveiled – even if Democrats take the White House in 2020. The party’s efforts as currently planned won’t be enough to spur the rapid transformation in how society operates that leading scientists say is needed to spare humanity from the worst of rising temperatures, extreme weather and massive societal and economic disruptions. But few in the party – or the big environmental groups that traditionally support it – are prepared to admit this outright. “Obviously, a transformative government response to climate is clearly needed based on what we’re seeing from science. We have about 10 years left to really be doing something, but it’s hard [for us] to do because the Republican party is largely in denial on this,” said Congressman John Delaney, a Maryland Democrat running for president in 2020. Congressman Ted Deutch, the Florida Democrat and cofounder of the bipartisan Climate Solutions Caucus in the House, said he’s not “rosy eyed” that Democrats in the majority could get Republicans to reverse their stances on the environment and climate. “But I’m also not a cynic,” Deutch said. “I don’t reject the possibility of a major piece of legislation, and I think it’s possible to put together a bipartisan bill.” Democrats have a decent chance of winning a majority in the House of Representatives in the 6 November midterm elections this year, while the Republicans are predicted to keep control of the Senate. A senior Democratic aide familiar with the party’s policy blueprints was resigned to the situation. The aide said it doesn’t make sense for the House to work on legislation that Republicans in the Senate will never take up. The source, who spoke on the condition of anonymity because the issue is politically sensitive, said Democrats will instead try to encourage infrastructure projects to prepare communities for climate change and invest in green power.The source said “increasing public awareness will be a huge part of an eventual solution” and that Democrats hope to lay that groundwork. But the current leadership isn’t considering anything like the contentious cap on greenhouse gases that Democrats pushed for in 2009 or a tax on industry for carbon pollution. The aide said Republicans have “demonized” attempts to slow climate change, making the issue politically intractable. That is despite almost daily reports of melting glaciers, dying wildlife and worsening storms in the US and across the globe.Democrats don’t only fear futile battles over legislation with Republicans. They also are wary of turning moderate Americans against the party if climate solutions raise the cost of living. George David Banks, a former Trump White House energy and climate adviser, said Democrats aren’t planning any major legislation because they are “still dealing with the fallout from the failure of Waxman-Markey”. Democrats have twice tried and failed to take major steps on climate change. In 2009 when they controlled Congress and the White House, the House passed the controversial “Waxman-Markey” proposal to cap greenhouse gases, but the Senate never took it up following a massive lobbying campaign against it that included ads warning of higher gasoline prices. After that defeat, the Environmental Protection Agency in 2015 finalized a rule for power companies to burn less coal. But the supreme court halted it and Trump’s administration is in the process of rolling it back. Progressive environmental advocates say Democratic leaders, including Nancy Pelosi, the House minority leader, aren’t thinking big enough now. “What I worry about is that Pelosi is going to get bogged down with oversight and is going to introduce a bunch of small-bore tax credit bills,” said RL Miller, the cofounder of the grassroots-focused advocacy group Climate Hawks Vote. Miller cautioned that while smaller federal efforts and states’ work to limit climate pollution are good, the US will still need to make big changes across every sector of its economy. Polling shows that while a majority of Americans care about climate change, few rank the environment as the most important problem. “What I expect Democrats to do is not what I hope Democrats would do,” she said. While 72% of voters backing Democrats see climate change as a “very big” problem, only 11% of those supporting Republicans do, according to the Pew Research Center, making any consensus extremely difficult.  But Sarah Hunt, the cofounder of the Joseph Rainey Center for Public Policy, who works with conservatives on climate efforts, said Democrats should offer an “alternative vision”, even if they don’t think it would succeed with Trump in the White House. Elan Strait, the World Wildlife Fund’s US climate campaigns director, argued the action just isn’t in Washington. “There’s no cigar back room where people are hammering out a climate deal because that’s not where the movement is right now … the movement really is at the city and state level,” he said, despite reports that local action isn’t enough. The carbon tax method, to charge businesses and their customers for greenhouse gas pollution, recently won a Nobel prize but currently has limited support in Washington, despite multiple proposals from some Democrats and Republicans. For now, the US policies under discussion do not come close to matching what science requires. Katharine Hayhoe, a climate scientist at Texas Tech University, said she is “not aware of any comprehensive plan that would accomplish what the US needs to do” to meet the commitments it made to other countries in the Paris climate agreement, which is meant to keep warming to 2C but is not on track to succeed. “I want to see action, and so far there has been precious little of it,” Hayhoe said."
"More than a year after the US Environmental Protection Agency took down information on climate change from its website for an “update”, it now seems uncertain whether it will ever reappear. In April last year, the EPA replaced its online climate change section with a holding page that said the content was being updated to “reflect the agency’s new direction under President Donald Trump”.  Information previously found at epa.gov/climatechange made it clear that human activity was warming the planet, resulting in harm to Americans’ health as well as crucial ecosystems on which humans depend. The “update” page has now given way to a page that simply states: “We want to help you find what you are looking for.” Below, there are links to search other areas of the EPA website, as well as to an archived “snapshot” of the site from the day before Trump became president in January 2017. The switch was observed by the Environmental Data & Governance Initiative, which tracks changes in government websites. “It’s an embarrassment. It is a ghost page,” said Judith Enck, who was EPA regional administrator during Barack Obama’s presidency. “It’s a bit like Amazon not allowing the public to order books via its website – it’s that fundamental. There’s no other issue at the EPA more important than climate change; it affects air, water, health and whether large parts of the world will survive.” Scott Pruitt, a climate change skeptic who was Trump’s pick as EPA administrator until he resigned in July amid a long-running ethics scandal, repeatedly questioned basic scientific understanding of climate change while he headed the agency, such as whether carbon dioxide is a primary driver of planetary warming. The EPA under the Trump administration has attempted to roll back all key measures designed to address climate change, such as limits on pollution from coal plants, rules to prevent methane emissions from oil and gas drilling and tighter fuel efficiency standards for cars. Andrew Wheeler, a former coal lobbyist who is now acting EPA administrator, has said “federal regulations are not necessary to drive greenhouse gas reductions”. A senior EPA official, who asked not to be named, said: “Wheeler has been somewhat meticulously going through the mess Pruitt left behind and I think is finally getting to the place of making some decisions on stuff.” The official added: “I’ve been surprised that we are still even talking about climate change and that there are still people nominally assigned to that beat in the air office.” Enck said that EPA career staff are “frustrated” and “ashamed” about the new stance on climate change and urged her former colleagues to speak out. The administration also began taking the ax to climate change language across other government websites in the spring of 2017. “The EPA website is used by decision and policy makers, not just for high school student assignments,” she said. “The lack of timely, accurate information is part of a much deeper problem that the agency is on the sidelines of the most urgent environment issue of our time.” The EPA was contacted for comment."
"How to push green issues up the political agenda is a question that has exercised environmentalists for decades. Do dark warnings about the world that awaits us if we do not curtail carbon emissions and protect forests and oceans motivate people to act, or scare them off? Are apocalyptic visions such as that in Cormac McCarthy’s novel The Road what we need to open our minds, or an inducement to give up trying? Opinion is divided, as events of the past week have illustrated. In advance of his latest wildlife television series, Dynasties, David Attenborough said at the weekend that too many warnings about endangered species are a “real turn-off”. A few days earlier, the activist group Extinction Rebellion launched a campaign of civil disobedience by demanding a zero-carbon economy by 2025. Writing in advance of a protest in London that saw 15 people arrested, Green MEP Molly Scott Cato said she and others have been driven to break the law after spending years ringing alarm bells and being ignored.  Influenced by thinkers including Charles Eisenstein and Erica Chenoweth, whose ideas about peaceful protest have also been taken up by opponents of President Trump, and with a commitment to grassroots organising that is similar to 350.org (the anti-fossil-fuel organisation launched in the US by Bill McKibben in 2007), Extinction Rebellion aims to foment a mass movement that will change history. Elected politicians, goes the argument, have failed, as have businesses and other organisations including environmental charities. Carbon emissions and biodiversity loss are out of control. The “unimaginable horrors” of unchecked warming and habitat destruction mean more radical tactics are called for – and morally justified by the dangers, in the eyes of protesters. While the current focus on the extinction crisis is novel, and a contrast to more familiar warnings about emissions, the notion that environmental activism encompasses lawbreaking is not new. The Green party of England and Wales approves of civil disobedience in the statement of underlying principles known as its “philosophical basis”. Greenpeace has engaged in nonviolent direct action alongside the traditional NGO tools of lobbying and petitions since the 1970s. Activists have used occupations and blockades as techniques in protests against road-building, airports and coal-fired power stations. They have also mounted protests against sponsorship by oil companies in museums. Most recently, attempts to frack in Lancashire have been disrupted by protesters, three of whom were freed from prison last month after successfully appealing against sentences that judges found to be “manifestly excessive”. The heightened language of emergency and breakdown employed by this new grouping will not appeal to everyone. Nor is it intended to. It is rational to be sceptical about whether the protesters will achieve their aims. But on the basis of the most recent warnings about rising temperatures and species decline, and chancellor Philip Hammond’s failure to mention climate change at all in last week’s budget, it is not rational to deny that they are justified in rebelling against the government’s inaction. Their sense of urgency is welcome."
nan
nan
"Climate action is way off course in all but one of the world’s 20 biggest economies, according to a report that shows politicians are paying more heed to the fossil fuel industry than to advice from scientists. Among the G20 nations 15 reported a rise in emissions last year, according to the most comprehensive stock-take to date of progress towards the goals of the Paris climate agreement. The paper, by the global partnership Climate Transparency, found 82% of energy in these countries still being provided by coal, oil and gas, a factor which has relied on an increase of about 50% in subsidies over the past 10 years to compete with increasingly cheap wind, solar and other renewable energy sources. The G20 nations spent $147bn (£114bn) on subsidies in 2016, although they pledged to phase them out more than 10 years ago. Governments have said they will change, but on current commitments the world is on course for a 3.2C rise in average global temperatures, more than double the lower Paris threshold of 1.5C, which scientists have said represents the last chance to save coral reefs, the Arctic ecosystem and the wellbeing of hundreds of millions of people at risk of increased drought, flooding and forest fires. “The gap is still very big,” said Jan Burck, one of the authors of the report. “The G20 is not moving fast enough.” Comparing the goals and policies of different countries, the paper found that only India was on course to stay below the upper limit set by the Paris agreement of 2C, while the worst offenders – Russia, Saudi Arabia and Turkey – would take the world beyond 4C. China, the world’s biggest emitter, stabilised its releases of carbon for a couple of years by reducing dependency on coal, but this positive trend slipped last year. Indonesia, Brazil and Argentina have promised to cut deforestation but the destruction rate of forests shows no sign of reversing. Britain has made the fastest transition, with a 7.7% decline in the use of fossil fuels between 2012 and 2015, but the report warned that this could stall in the years ahead because the government had cut support for feed-in tariffs, energy efficiency and zero-carbon homes. The authors said political pressures in the G20 countries, with more subsidies for fossil fuels, were working against effective climate action. “There is a huge fight by the fossil fuel industry against cheap renewables. The old economy is well organised and they have put huge lobbying pressure on governments to spend tax money to subsidise the old world,” Burck said. These political pressures are likely to intensify as governments are called upon to extend emissions cuts to the transport and agriculture sectors. The report said G20 emissions needed to start declining in the next two years and halve by 2030 if the world were to avoid more than 1.5C of warming, though not one country in the group had set a credible target to do this. The UN climate talks in Katowice, Poland, in December –the COP24 conference – will start a two-year process for governments to deliver on their commitments to reduce emissions. Although there are national leaders hostile to tackling climate change, such as in the US and Brazil, there is still hope they will be open to taking their share of the responsibility. Christiana Figueres, former executive secretary of the UN framework convention on climate change, said: “Global emissions need to peak in 2020. The Brown-to-Green report provides us with an independent stock-take on where we stand now. This is valuable information for countries when they declare their contribution in 2020.” • This article was amended on 14 November 2018. An earlier version included figures from the report that were corrected after publication, when it said that fossil fuel subsidies in G20 countries have doubled between 2007 and 2016, from $75bn (£58bn) to $147bn (£114bn). The two figures were not comparable, because the 2007 figure did not include data for all G20 countries included in the 2016 figure. The increase over the past 10 years is about 50%, not double. In addition, an earlier version misspelled Jan Burck’s last name as Buerck. This has been corrected."
"Plans to build a huge new UK gas power station are facing a challenge from an environmental law group that argues the project would breach the government’s recommendations on climate change. ClientEarth, which has repeatedly defeated the government in court over its air pollution strategy, has submitted an objection to the planning inspectorate over Drax Group’s proposed 3.6GW plant in North Yorkshire.  The intervention is the first by the lawyers against a gas project in the UK. Sam Hunter Jones, a lawyer at the group, said it had acted because the Drax scheme marked a tipping point in the amount of new gas planned by energy firms in the UK. The UK has already given planning approval for 15GW-worth of large-scale gas plants, including at Eggborough, which is not far from the Drax site. Adding the Drax project would take the total to about 18GW, three times the 6GW of new gas the government estimates the country will need up to 2035. Hunter Jones said: “The UK government claims to be a climate leader, yet if major energy projects such as this from Drax are granted planning consent, the UK will risk carbon lock-in that would seriously undermine its ability to meet its climate change commitments.” The planning inspectorate is expected to make its recommendations to the government next spring, with ministers to decide later in the year. ClientEarth believes it has grounds for success under national policy statements that planners have to consider, which say such a major project’s impact must not outweigh its benefits. The group’s written submission said approval risked making the UK’s future decarbonisation significantly more difficult and expensive. Drax said future energy scenarios in the UK indicated the country would need more gas plants in the future to fill in the gaps around wind and solar power. The company also said that building the gas project would enable it to turn off its two remaining coal units in 2023, two years before the government’s coal phase-out deadline of 2025. Andy Koss, Drax Power’s CEO, said: “Our Repower project will deliver cost-effective, high-efficiency, flexible gas power to the grid. By reusing some of our existing infrastructure, including the grid connection and cooling towers, the development will be cost-effective and very competitive.”"
