"David Cameron, Nick Clegg and Ed Miliband have signed a joint pledge to tackle climate change, which they say will protect the UK’s national security and economic prosperity. The agreement of the three party leaders is highly unusual and comes amid a general election campaign that is becoming increasingly bitter.  The prime minister, deputy prime minister and leader of the opposition have all clashed over green issues, but the joint declaration states: “Climate change is one of the most serious threats facing the world today. It is not just a threat to the environment, but also to our national and global security, to poverty eradication and economic prosperity.” “Acting on climate change is also an opportunity for the UK to grow a stronger economy, which is more efficient and more resilient to the risks ahead,” the joint statement says. “It is in our national interest to act and ensure others act with us.” A senior UK military commander has warned previously that climate change poses as grave a threat to the UK’s security and economic resilience as terrorism. The declaration was hailed as “inspiring leadership” by Al Gore, former US vice president and by multinational business leaders as a clear message that the UK is a good place for climate-friendly investment. The cross-party agreement in the UK contrasts sharply with the US, Australia and Canada, where right-of-centre politicians argue against the need to act on global warming. The world’s governments have pledged to tackle climate change and have set a UN summit in Paris in December as the deadline for a global deal. The Conservative, Liberal Democrat and Labour leaders have pledged “to seek a fair, strong, legally binding, global climate deal which limits temperature rises to below 2C”, the level seen as the threshold of dangerous global warming. The leaders have also pledged “to work together, across party lines, to agree [UK] carbon budgets”, which are required by law but which caused serious cabinet clashes in 2011. The leaders’ third pledge is “to accelerate the transition to a competitive, energy-efficient low-carbon economy and to end the use of unabated coal for power generation.” The UK green economy has grown strongly, even during the years after the global economic crisis in 2008, and employs about a million people, but has been hit by political uncertainty due to rows over wind farms and solar power. “This agreement represents inspiring leadership and true statesmanship by all three men,” said Gore. “The political courage it represents on all sides is exactly what our world most needs in order to solve the climate crisis.” Paul Polman, CEO of Unilever, said: “The importance of this pledge cannot be overstated. In this critical year, this sets a terrific example for other countries to follow.” Polman warned in an article for the Guardian this week that “powerful vested interests in high-carbon businesses are desperately opposing these changes”. Juergen Maier, CEO of Siemens, which started building on a £310m wind turbine factory in Hull in January, said: “The low-carbon transition represents a major economic opportunity and this demonstration of cross-party support sends a clear message that the UK remains a good place for global companies to do low-carbon business.” The joint statement, brokered by the Green Alliance and other NGOs, was released on Saturday, the same day that the Go Fossil Free movement persuading investors to dump their fossil fuel stocks is holding a global day of action, with events in over 50 countries. The fast-growing divestment campaign has already seen 180 institutions worth a combined $50bn get rid of their fossil fuel investments, including local governments, universities, churches and health-care providers. A series of analyses have shown that the coal, oil and gas industry already have three times more fossil fuels ready to be extracted than can be burned, if the pledge by the world’s governments to keep global warming under 2C is to be kept. The campaigners argue that the fossil fuel industry is therefore not just a threat to the climate, but also to investors’ money, as trillions of dollars is being spent exploring for fossil fuels that will be worthless if climate change is tackled. Archbishop Desmond Tutu, told the Guardian in 2014: “We need an apartheid-style boycott to save the planet.” Banks that fund fossil fuel investments are also being targeted on the day of action in the UK, South Africa and Australia. In the UK, at least 1,400 people will switch their accounts away from the big five banking groups in protest at the £66bn they invested in fossil fuel extraction in 2012 alone."
"Back in January, the Guardian carried a story about Forum for the Future having decided to no longer work with Shell or BP. I explained the grounds on which we came to that decision, and while acknowledging “our failure” to turn what were once good working relationships with both those companies into anything resembling sustained traction, I also reminded readers that this experience had, if anything, reinforced our commitment to working with those companies in other sectors intent on bringing about real transformation. The response to the article has been illuminating – broadly supportive, apart from a number of hostile voices pointing out that we should have severed our ties with Shell and BP many years ago. But I’ve been particularly struck by the reaction from old colleagues either still working in the sector, or only recently out of it, reminding me yet again of the very personal dilemmas faced by many people working in “big oil” and other fossil fuel businesses. First, an historical anecdote. Back in 1997, John Browne (BP’s CEO at that time) made a bold decision to pull out of the Global Climate Coalition, the principal voice of climate denialism inside the industry in those days. Externally, the response was uniformly positive, apart from the other oil majors, who were vitriolic in their contempt. Internally, this decision (and Browne’s subsequent initiatives under the Beyond Petroleum rubric) was enthusiastically received. As Browne himself said at the time: “You need the will and the minds of the people inside a company to achieve anything.” It went down particularly well when exposed to the “dog and duck test”: among friends and families, BP employees noticed a marked uplift in warmth and positive reactions to their company. One of my BP colleagues at the time described it as the Beyond Pariah effect. It is impossible for most BP and Shell employees not to have some kind of personal stake in the overall positioning of their companies on climate change. And that stake is all about the interface between science and personal morality. As we all know, the science of climate change is highly dynamic. But almost without exception, most climate scientists would now agree that the evidence of accelerating, manmade climate change has got increasingly robust since the late 1980s, let alone since 1997. Teams of people inside these oil majors track the state of that science carefully, and as the consensus deepens around the threat of severe (and possibly irreversible) impacts of climate change on humankind, the personal moral dilemmas deepen proportionately. For a few, it gets to the point where they can no longer justify working in the sector. For many, the level of discomfort may be somewhat amplified, but the pros of sticking in there continue to outweigh the cons, not just because of financial reasons, but because of loyalty to colleagues and (rather more rarely these days) a feeling that it may still be possible to turn their particular oil tanker around. It’s only fair to add, in my experience, that most employees do not spend a huge amount of time explicitly defining that discomfort threshold. After all, their companies have a clear and continuing licence to operate from governments, regulators and citizens alike, they do their best to stay the right side of the law, and many of them as individuals are as uncertain or complacent about the potential impacts of manmade climate change as the rest of society. But once acquired, through proper application to the science, knowledge about causes and consequences cannot easily be put aside. Many Shell and BP employees are themselves scientists and engineers, and correspondingly uneasy about decision-making processes in society that may present themselves as evidence-based policy but are, in effect, exactly the opposite. Let’s personalise this for a moment. Imagine a relatively senior employee, perhaps in strategy, investor relations or upstream, diligently tracking the cut-and-thrust of the scientific debate, fully informed about the work of the Intergovernmental Panel on Climate Change, and curious enough to track down the work of the outliers – both on the heading towards apocalypse end of the scale and those in the more sceptical or outright denialist camps. Then imagine that those inquiries led that person to the following unavoidable conclusions: 1. That climate change is indeed predominantly manmade.2. Is already impacting the lives of hundreds of millions of people.3. Is likely to get much worse, much faster.4. Is giving rise to phenomena in the Antarctic and the Arctic that are already described by some scientists as potentially irreversible. At that point, the personal moral dilemma may well become too onerous to bear. Or at least, too onerous if their company has shown no serious sign of transforming their role in the energy economy. I’m trying to avoid being judgmental here, in some kind of absolutist way. It’s always much more nuanced and complex than an article like this can ever do justice to – which means I have little time for the kind of extremist critics who describe all employees in fossil fuel companies as morally bankrupt. And though I’m a huge admirer of the eminent US economist and commentator Paul Krugman, I find it hard to buy into his idea that anyone who denies the evidence about climate change should be “punished in the afterlife” on the grounds that “this kind of denial … is an almost inconceivable sin”. But neither am I prepared to condone those who think it’s somehow OK to go on living out one’s well-paid working life in a morality-free zone. No one has that right. And as the moral dimensions of accelerating climate change become more present in our debates, I suspect that more and more employees in the world of fossil fuels will find anxiety slowly turning to anguish. Forum for the Future will be delving into sustainability issues from a rather different, more reflective perspective at the Reconnections at Findhorn course, taking place at the Findhorn Foundation from 26-30 April. The leadership hub is funded by Xyntéo. All content is editorially independent except for pieces labelled ‘brought to you by’. Find out more here. Join the community of sustainability professionals and experts. Become a GSB member to get more stories like this direct to your inbox. "
"To mention the Caribbean is to conjure up images of sun, sand and sea. Yet the island region’s reputation for crystalline blue waters washes over a critical problem for many of its 30 territories: water scarcity. Hard as it might be to believe, water-related risks in picture-postcard Caribbean islands such as Saint Lucia, Barbados, Antigua and Jamaica compare to those in the Western Sahara and parts of the Middle East, according to the World Resources Institute’s Aqueduct rankings. Some islands, such as Curaçao and Aruba, simply lack decent rainfall. For most, however, it’s a case of “feast or famine” between wet and dry seasons, observes Paul Choules, senior vice president of business development at Water Standard, a Houston-based water treatment firm. In addition, changes in weather patterns in the Caribbean due to climate change are exacerbating existing water challenges. “Places are not getting rain where they used to get rain, and places are getting rain where they [used not] to”, Choules says.  Desalination is not new to the Caribbean, but extracting clean water from seawater is becoming an increasingly integral part of the region’s search for water security. Since 2007, 68 new desalination plants have been built across the Caribbean, which now boasts an installed capacity of 782,000 cubic metres of purified water per day, according to the Caribbean Desalination Association (CaribDA).  Some islands, such as St. Martin, St. Thomas and the British Virgin Islands, where UK-based water treatment firm Biwater just inaugurated a new $43m (£28m) plant with a 10,400 cubic metres daily capacity, are almost entirely dependent on the technology for their domestic water supply.  A lot of these islands could not survive without desalination. Their overall economies would collapse “A lot of these islands could not survive without desalination. Their overall economies would collapse”, says Choules, who describes the technology as a “drought-proof solution” in a world facing ever more erratic weather patterns. Desalination isn’t without its challenges, however. By far the biggest and most obvious relates to energy consumption. Huge amounts of power are required to operate commercial-scale desalination – power that is often produced by importing expensive fossil fuels. With large natural gas deposits offshore, Trinidad and Tobago is a rare exception to such import dependency. The fact that the twin island country is home to the largest reverse osmosis desalination plant in the Western hemisphere - Desalcott - is therefore perhaps no coincidence. “We’ve got industry that can afford to pay for it [desalinated water] and large water demand … but desalination in general is relatively expensive, [so] it’s more difficult for small islands that don’t have the industry”, says John Thompson, general manager of Desalcott and president of industry group CaribDA. Energy typically amounts to one-third of a typical plant’s operating costs, increasing to as much as two-thirds in some cases, says Thompson. Being quick to adopt energy-efficiency innovations has therefore become a hallmark for the region’s desalination operators.  It’s a view echoed by Gerard Pereira, vice president of engineering at Consolidated Water, a desalination firm based in the Cayman Islands where electricity costs around $0.40 per kilowatt hour – more than four times the price in the US. “Just out of necessity, we design and build the most efficient plants in the world”, says Pereira. Consolidated Water was among the early adopters of isobaric energy recovery devices, which Pereira credits for helping recover up to 98% of the unused energy in the waste streams of desalination plants. The Grenadine islands of Petite Martinique and Curaçao, meanwhile, recently installed two solar-power desalination plants in a $2.1m project part-funded by UK development agency DFID. “The Caribbean has tended to be where a lot of firsts have happened”, Pereira says, pointing out that Aruba and Curaçao built the first commercial desalination plants more than 80 years ago.  Advances in membrane and pump technologies present further ways of reducing desalination’s energy requirements, but the sense from industry experts is that many of the big energy-saving wins may already have been had.  “There is a thermodynamic limit for desalination”, says David Maingot, regional sales manager at LG NanoH20, a manufacturer of nanocomposite membrane technology that has carried out about 20 retrofits in the Caribbean over the last three years. “We’re getting close to that, so it’s kind of limiting unless you change the actual reverse osmosis technology.” Alongside its dependency on expensive - not to mention carbon-intensive - power supply, environmentalists have raised concerns over the impacts of large-scale desalination on marine life. In particular, open intakes of seawater can cause fish and other larger organisms to become trapped. A potentially safer alternative lies in subsurface intakes from coastal aquifers, a technique that extracts seawater from beneath the seafloor or beaches. This is now being carried out in a handful of Caribbean locations (pdf) where site conditions are suitable. CaribDA’s Thompson admits that desalination is no panacea. Ideally it should constitute only “one choice out of a number of options”, he says, and not necessarily the top one either. However, while desalination may be more expensive and energy-intensive than some options, desalination remains the crucial answer to freshwater access in regions with heavy dry seasons. The water hub is funded by Grundfos. All content is editorially independent except for pieces labelled ‘brought to you by’. Find out more here. This content is brought to you by Guardian Professional. Become a GSB member to get more stories like this direct to your inbox."
"Reforms to strengthen the EU’s flagship policy for cutting carbon, the emissions trading scheme (ETS), will start at the end of 2018 following a vote by MEPs on Tuesday. The carbon market is supposed to drive Europe’s transition to cleaner sources of energy, but a cocktail of recession, free allocations to polluters and over-achievement on green energy targets have created a flood of 2bn allowances. That has led to a carbon price of around €7 (£5) per tonne, too low to encourage power companies to switch from polluting fuels such as as coal.  Under the new compromise proposal, around 1.6bn surplus allowances will be taken off the market and put into a market reserve, two years ahead of the commission’s preferred timetable. “We still believe that this reform should come sooner rather than later,” the Labour MEP Seb Dance told the Guardian. “However, the compromise deal does represent a significant improvement on the suggested start date of 2021. We have ensured that the number of backloaded and unallocated allowances will be reduced and won’t be returned to the market, which would lead to further destabilisation.” The market reform should prevent nightmare scenarios, such as a 4.5bn carbon credit glut by 2020 forecast by the environmental think tank Sandbag. A new report today by analysts Reuters Thomson Point Carbon estimates that by 2020, the reforms could nudge carbon prices up to €20 per tonne.  From April, the UK will have its own carbon floor price of £18 a tonne, pushing British prices close to the €30 a tonne price envisaged at the ETS’s inception, which could trigger fuel switching from coal to gas.  The energy minister Ed Davey called for reforms to be introduced even earlier, by 2017, in a joint ministerial statement signed by his counterparts in countries including Germany, the Netherlands and Denmark. “Ambitious and early action is good for Europe, providing the certainty needed to create investment, jobs and growth as we move to a low-carbon economy,” Davey said. “Delay will only cause investor uncertainty, raise costs for businesses and ultimately leave consumers to pay the price.” Reuters Thomson Point Carbon say that a one year difference in start dates will only add a Euro to prices.  But environmentalists argue that the reforms do not dispatch underlying questions about the ETS’s effectiveness as 400m allowances will be allowed to trickle back on to the market before 2030. Another 300m carbon credits will go to an innovation fund, whose low carbon credentials are yet to be proved. In the meantime, the delay until 2019 will allow further carbon allowance surpluses to accrue.  “Postponing necessary reforms until 2019 is simply irresponsible in times of a climate crisis,” said Femke de Jong, a policy officer at Carbon Market Watch. “Every year we wait with setting up the reserve, the surplus that is suffocating the EU carbon market will grow bigger, pushing the EU’s cornerstone climate instrument closer to the brink of collapse.” Keith Taylor, the Green MEP for South East England added that “with big climate change talks coming up in Paris in December it’s crucial to create effective mechanisms to ensure that excess carbon allowances cannot undermine emission reduction targets.”  The EU expects carbon markets to play a major part in international emissions cutting efforts, and UN-accredited offsetting under an exotic array of schemes can be used by countries to meet their carbon reduction targets. This has led to criticisms of schemes for human rights abuses and scams involving the destruction of industrial gases in Asia. Until a ban in 2011, over 80% of the EU’s offsets were spent on these latter projects, which the EU’s then-climate commissioner later admitted had a “total lack of environmental integrity”. One Carbon Market Watch report estimated that “up to 70% of all offset credits issued from the [UN’s] clean development mechanism between 2013 and 2020 may not represent real emissions reductions”. Nonetheless, carbon trading schemes have already been set up in South Korea, California and Quebec, with China due to roll out a regional carbon market next year that could fully cover the country by 2020. International spot carbon prices vary from around US$13 (£8.4) a tonne in California to $6 a tonne in China and $9 a tonne in South Korea. "
"An investigation by Greenpeace and the Climate Investigations Centre reported in the Guardian and New York Times this weekend showed that the work of Willie Soon — an apparently ‘scientific’ voice for climate scepticism — had accepted more than $1.2 million from the fossil-fuel industry over the 14 years. As Suzanne Goldenberg’s report stresses, although those seeking to delay action to curb carbon emissions were keen to cite and fund Soon’s Harvard-Smithsonian credentials, he did not enjoy the same sort of recognition from the scientific community. He did not receive grants from Nasa or the the National Science Foundation, for example — the sorts of institutions who funded his colleagues at the Center for Astrophysics. Moreover, it appears that Soon violated ethical guidelines of the journals that published his work by not disclosing such funding. It seems to be a story of someone working outside the usual codes of modern science. But Soon is not a singular aberration in the story of science’s relationship with the fossil fuel industry. It goes deeper than that.  Science and engineering is suffused with oil, gas and, yes, even coal. We must look this squarely in the eye if we’re going to tackle climate change. The fossil fuel industry is sometimes labelled anti-science, but that’s far from the truth. It loves science — or at least particular bits of science — indeed it needs science. The fossil fuel industry needs the science and engineering community to train staff, to gather information and help develop new techniques. Science and engineering also provides the industry with cultural credibility and can open up powerful political spaces within which to lobby.  In the UK, BIS/ DECC 2013 oil and gas strategy is an especially brazen example of how science is expected to serve the fossil fuel industry’s interests. Aside from a bit where the government agrees to consider its role in improving public perception of the UK oil and gas industry, the strategy expresses much concern over the supply of skilled staff and R&D spend in the sector, with a clear expectation that the government should support industry here.  But this relationship runs deep, just think of how many geology departments are still known as a School of Mines. And it’s not a problem of history, or something pushed simply pushed on science by the government. Take, for example, the UCL/BHP Billiton Institute for Sustainable Resources, or the BP/ Manchester materials lab. There are also deals like NERC and Shell, or Cambridge and Shell, or the long list of industrial sponsors at the Heriot-Watt Institute of Petroleum Engineering. Members of the scientific community sit on fossil fuel company boards — e.g. Imperial’s Alice Gast and Chevron — and vice versa. And there’s science communication too. Museums, for example. And news media (there might well be an advert for an fossil fuel company above this article). This relationship sits at the heart of many key scientific institutions. It’s not just a matter of a few embarrassing cases in the corner. This isn’t climate change denial. It’s also, in many ways, totally understandable. The fossil fuel industry remains a large part of the economy, and universities feel it is their responsibility to work with them (and it rarely means working in the manner Willy Soon seems to have). Still, that doesn’t mean it’s not also problematic, that it’s not also sometimes still managed badly, and that it’s not also locking us into particular types of futures, leaving others — less polluting — options under-developed.  In trying to ‘practise what you preach’ we sometimes see scientists argue about whether they should fly to conferences or not. Which is fair enough, perhaps (and, incidentally, may help open up science to women, but that’s another issue). But also possibly a distraction from much larger, much deeper questions.  The scientific community warned us about the link between fossil fuels and climate change. They continually tell the rest of the world to be more evidence-based. Can they heed their own advice?"
