"Donald Trump’s latest Supreme Court nominee Brett Kavanaugh accepts that humans are causing global warming and we need to take action to stop it. The problem is that he doesn’t trust the experts at EPA to do so and wants to erode their authority to regulate carbon pollution.  When discussing Chevron and climate change, we usually focus on the company’s legal liability. However, in Kavanaugh’s context, ‘Chevron deference’ is even more important. The term refers to the fact that courts will generally defer to government agency interpretations of laws as long as Congress hasn’t spoken directly to the issue at hand. David Doniger, director of the climate and clean air program at the Natural Resources Defense Council noted that Kavanaugh doesn’t believe Chevron deference applies on issues of major importance. In a recent net neutrality case, Kavanaugh argued, “While the Chevron doctrine allows an agency to rely on statutory ambiguity to issue ordinary rules, the major rules doctrine prevents an agency from relying on statutory ambiguity to issue major rules.” That’s Kavanaugh’s position on climate change. In oral arguments before his DC Circuit Court of Appeals in a 2016 Clean Power Plan case, Kavanaugh said: This is huge case … it has huge economic and political significance … it’s fundamentally transforming an industry by telling existing units you in essence have to pay a penalty, a huge financial penalty in order to continue to exist, in order to shift from coal plants to solar and wind plants, at the same time the coal mining industry is in essence greatly harmed, as well. But while regulating carbon pollution would have a major impact on the fossil fuel industry, the same is true of most pollutant regulations. It’s nevertheless EPA’s job to regulate pollutants, and the agency has been doing exactly that since its inception. In the 2016 oral arguments, Kavanaugh said that the Clean Air Act is “a thin statute, it wasn’t designed with [greenhouse gases and climate change] specifically in mind.” But EPA was created to address various types of pollution, and the Clean Air Act gave it that legal authority. As the Act’s text notes: the growth in the amount and complexity of air pollution brought about by urbanization, industrial development, and the increasing use of motor vehicles, has resulted in mounting dangers to the public health and welfare The Clean Air act also defined the term “air pollutant” very broadly to allow EPA the flexibility to regulate any new sources of pollution that the agency might identify in the future: The term “air pollutant” means any air pollution agent or combination of such agents, including any physical, chemical, biological, radioactive (including source material, special nuclear material, and byproduct material) substance or matter which is emitted into or otherwise enters the ambient air. And it gave the EPA Administrator the authority to regulate any pollutants that threaten public health and welfare: For the purpose of establishing national primary and secondary ambient air quality standards, the Administrator shall within 30 days after December 31, 1970, publish, and shall from time to time thereafter revise, a list which includes each air pollutant … emissions of which, in his judgment, cause or contribute to air pollution which may reasonably be anticipated to endanger public health or welfare The Clean Air Act even envisioned EPA’s regulatory authority extending to impacts on the climate: All language referring to effects on welfare includes, but is not limited to, effects on soils, water, crops, vegetation, manmade materials, animals, wildlife, weather, visibility, and climate… In the landmark 2007 case Massachusetts v. EPA, the Supreme Court affirmed that greenhouse gases qualify as air pollutants, and EPA therefore has authority to regulate them if the agency determines that they may endanger public health or welfare. In its 2009 Endangerment Finding, that was indeed EPA’s conclusion: greenhouse gases in the atmosphere may reasonably be anticipated both to endanger public health and to endanger public welfare .... The major assessments by the U.S. Global Climate Research Program (USGCRP), the Intergovernmental Panel on Climate Change (IPCC), and the National Research Council (NRC) serve as the primary scientific basis supporting the Administrator’s endangerment finding. In a key 2014 case Utility Air Regulatory Group v. EPA, the Supreme Court ruled 7 to 2 that EPA can continue to treat greenhouse gases as pollutants subject to regulation under the Clean Air Act and can apply those regulations to power plants. Justices Scalia, Roberts, and Kennedy joined the majority decision. The good news is that Scalia’s position in this case was modeled after a prior Kavanaugh opinion. But generally speaking, Kavanaugh doesn’t trust the EPA experts to regulate carbon pollution. In the 2016 oral arguments before his court, Kavanaugh laid out his case for why Congress, not the EPA should tackle climate change: Earth is warming, and humans are contributing, and I understand the international collective action problem here, I understand that very well, and I understand the frustration with Congress, I live that, too, everyone understands that. But under our system of separation of powers, and this is why it’s so important that we maintain that, Congress is supposed to make the decision. You might say, you know, this Congress is not going to, they’re not going to do anything, but that’s not how we get to make decisions … for a big question like this Congress can do things like job training programs, and community college assistance, and welfare assistance, and drug programs for the people who are out of work, and that becomes more of a problem, that’s why the separation of powers principle matters, because Congress can look at something like this in a well-rounded approach, and that was the difficulty obviously that happened in the Senate. But for us to do it, for you to do it, all the people who are left behind are just left behind. Kavanaugh is right that Congress could and should do a better job tackling carbon pollution than EPA. For example, Hillary Clinton developed plans to both tackle climate change and help coal communities adapt. But Republicans in the White House and Congress are owned by the fossil fuel industry, and thus unwilling to advance serious climate legislation. However, the fact that Congress won’t act as long as Republicans are in charge doesn’t lessen EPA’s authority to regulate carbon pollution. Kavanaugh’s unwillingness to defer to EPA’s legal authority is wrong. The Clean Air Act is very clear that EPA should regulate pollutants that may endanger public health and welfare, and greenhouse gases certainly qualify. If Kavanaugh is seated on the Supreme Court, he’ll join the other conservative justices in eroding EPA’s ability to regulate carbon pollution. EPA won’t take serious action until there’s a Democrat in the White House anyway; nor will Congress act unless Democrats are in charge of that branch of government. Kavanaugh just represents one more Republican obstruction to climate action."
"As a third-generation farmer from Harden in New South Wales, I’ve weathered climate extremes my whole life. It’s simply part of doing business in one of the most variable climates in the world. The truth is, Australian farmers are good at what they do, and we know when things are changing.  NSW last year was 2 degrees above the baseline average, without an El Niño in sight. This year we’ve already seen 100% of the state drought-declared. The minimal amount of winter crop that has sprouted is sizzling on the stalks or bitten hard by severe -5C frosts. To the north the dams are parched and farmers across the state are close to walking off the land. It’s not just the farmers, either. In the past five years, my local town, amalgamated against the wishes of the local population, has struggled to keep council staff. We have seen a local bank and a favourite watering hole close. We are about to lose our Landcare facilitator who has been a critical element in natural resource management, sustainable farming and drought support. We can and must do better. This is not a “hard-done-by farmer” narrative. We’re tough and we manage our resources carefully, making decisions based upon the best available evidence and always keeping one eye to the future. This is an area with a long history of working with scientists and advisers to be prepared for future agricultural, environmental and economic shocks. But, the first step to managing for the future is to grapple with reality. And the reality is that our climate is on a devastating trajectory. Much as our politicians like to deny reality, out here – beyond the air-conditioned hallways of parliament – we’re already dealing with increasingly extreme weather as a result of global warming. So, a message to our elected representatives. Get your heads out of the coalpit and back into the real world. We need meaningful action now; including support for regional communities and funding for Landcare facilitators to be driving up driveways and checking on those whose lives are being destroyed by your failure to take action. We need a good heavy dose of reality injected into Australian politics. On Monday, my fellow farmers and I will stand outside parliament and rally for our future. A future in which our kids have a chance to farm and our government no longer hides from the truth. The alternative is simply unthinkable. • Peter Holding is a mixed cropping and sheep producer with 40 years’ experience on his family farm"
"An international meeting in Bangkok fell short of its aim of completing fruitful preparations to help an agreement be reached in December on guidelines for implementing the 2015 Paris climate change agreement. The six-day meeting, which ended on Sunday, was scheduled to step up progress in the battle against rising global carbon emissions by adopting a completed text that could be presented at the COP24 conference in Katowice, Poland, three months from now.  A primary objective of the 2015 Paris agreement, to which 190 nations subscribe, is to limit the global temperature increase by 2100 to less than 2C and as close as possible to 1.5C, which is vital to the survival of island nations threatened by rising seas. But the absence of guidelines for meeting that goal has led to fears that not enough action is being taken. There have been notable disagreements over fair financing for implementation of the rules by developing countries, and the technical details of their reporting on progress. Patricia Espinosa, executive secretary for the United Nations Framework Convention on Climate Change, said on Sunday at the closing press briefing for the Bangkok meeting that progress was made on most issues but nothing was finalised. The meeting was attended by representatives of most of the countries party to the Paris agreement, as well as the United States, which has announced that it is pulling out of the pact. Espinosa said there was “limited progress” on the issue of contributions from developed nations to developing countries, adding that she is “hopeful” that future discussions will be productive because of the importance of the issue. “On the core issues of forward-looking climate finance and the degree of flexibility developing countries should be given on the information and reporting requirements for national commitments under the Paris Agreement, negotiators were stalemated in Bangkok,” said a statement from Alden Meyer, director of strategy and policy for the Union of Concerned Scientists, a US-based activist group. “It’s now up to the incoming Polish presidency and officials leading negotiations to find ways to bridge the deep differences on these issues and to secure agreement in Katowice on a robust, comprehensive package of rules to implement the Paris Agreement,” he said. Harjeet Singh, climate policy manager for ActionAid International, said that a vital component of the Paris agreement is for wealthy nations to provide financial assistance to developing countries as they fight natural disasters brought by climate change. But he said wealthy and developed countries “led by the United States and including countries such as Australia, Japan and even the European Union” refused to clearly show “how much money they are going to provide and how that is going to be counted.” Advocacy for the developing countries was led at the meeting by China, said Meyer, but was also supported by others, including India, Iran, Saudi Arabia and Malaysia. Activists were critical of Washington’s lobbying at the meeting, especially because president Donald Trump has announced plans to have the US withdraw from the Paris pact, which had been heavily promoted by his predecessor, Barack Obama. “The US has announced its withdrawal from the Paris Agreement but still negotiates as if it is a party, weakening international cooperation by not contributing to finance and technology transfer to developing countries,” Meena Raman, legal adviser at Third World Network, said in an emailed statement. Climate change is a polarising issue in the United States, and some states and local communities have announced policies supporting the Paris agreement. Thousands of governors, mayors, company CEOs and civil society leaders are expected to gather this week in San Francisco for the Global Climate Action Summit."
"Climate change activism has always had the stubbornly tough task of mobilizing the public to confront a slow-moving, largely invisible problem while being stymied by a fantastically wealthy fossil fuel industry and an array of sceptics in politics and the media. Climate campaigners would, therefore, be forgiven a few moments of despair in the era of Donald Trump. Trump's election elicited two large public howls from those concerned about climate change – the People's Climate March and the Science March, held within days of each other in April last year – but any hopes of persuasion have now given way to attritional confrontation and attempts to bypass the administration altogether. Now a series of marches and other events across 70 countries on Saturday called Rise for Climate Action, is framed as a grassroots movement aimed squarely at spurring local mayors, businesses and state leaders to slash emissions regardless of Trump, with the hope a future president will find the momentum impossible to ignore. “I'd hesitate to say we are giving up on the federal government at the moment but we have to be realistic,” said May Boeve, the executive director of 350.org, a climate change campaign group that is a lead organizer for Saturday. “Quite a lot can be done at the city level and we have an opportunity to highlight that. We are up against huge obstacles and Donald Trump is a massive one. This is about being clear what we are asking for when the opportunity presents itself.” The message being honed for the Rise for Climate Action is one of a swift transition to 100% renewable energy, with the image of fossil fuel companies painted as being little different from their tobacco counterparts. Many of those taking part in the various marches and other events in the US will be highlighting the aspects of society worsened by climate change, such as inequality and racial prejudice. Miya Yoshitani, of the Asian Pacific Environmental Network, will be taking part in the main climate march, which expects to attract tens of thousands of people in San Francisco, to decry the air pollution suffered largely by black and Asian American communities in the Bay Area. “There are refineries and freeways so air quality is a big issue for everyone, but race is a bigger factor than income as to how bad you get it,” she said. “The Bay Area is known to be a very progressive place, with its technology and innovation, but it's also a place of extreme inequality. There is massive gentrification and displacement of people and climate change is a huge threat multiplier for those things. “Here, climate change is things like sea level rise, wildfires and drought but it's also housing affordability and energy costs. The effects are going to be borne by low-income communities that already miss out on school and work days because of air pollution. It's not a distant threat, it's here right now. “I grew up in Chicago but moved here in the 1990s and have seen these huge changes with the growth of the dotcom companies. We feel [California governor] Jerry Brown has failed some of these communities and we have to let him know we will hold him accountable.” The San Francisco march, timed as an unofficial curtain raiser for the Global Climate Action Summit that starts in the city next week, will demand that Brown end fossil fuel extraction and begin the complete shift to renewable energy recently backed by California lawmakers. Activists fear that even states purportedly progressive on climate change, such as California, are leaving behind certain communities. “California is on fire at the moment and we have flooding and heatwaves caused by a fossil fuel industry that is being allowed to continue when everything needed for a just transition is available,” said Pennie Opal Plant, an environmental campaigner of Yaqui, Mexican, Choctaw, Cherokee and European descent. “Native people are going to be at the very front of the march because we are on the frontlines of fossil fuel extraction and processing. In the Bakken oil fields [an area in Montana, North Dakota and South Dakota] there are high rates of cancer, in the tar fields of Canada they've destroyed and poisoned huge areas of boreal forests where people hunt and find medicines. “My family has lived in the Bay Area since the 1930s and Chevron and the other refineries have just got bigger and bigger. It's been a constant struggle and the rates of cancer and asthma are very high. In our tribal traditions we understand we are responsible for the wellbeing for the coming seven generations. As a grandmother I'm concerned we are not handing a healthy environment on to my grandson and his generation.” Opal Plant said it was “devastating” to see the Trump administration throw open large tracts of land for oil drilling and coalmining, including areas in the Arctic and Utah considered crucially important both spiritually and for hunting. “It's an horrendous nightmare to think they'd drill in the Grand Canyon or Bears Ears [national monument in Utah],” she said. “We've got to rise up because that's how slavery was abolished, that's how women got the vote and how civil rights came about. There's nothing more important right now than to rise up to ensure a livable environment for the future.” Protesters in Puerto Rico will demand that the US territory rebuild its electricity grid, which was shattered by Hurricane Maria last year, with renewable sources such as solar and wind, while people will gather in Miami to call for greater urgency to confront the threat of sea level rise. Others will target specific projects, such as a planned electricity substation in Boston, located in a flood-prone area of a diverse neighbourhood, and a new oil pipeline near New Orleans that acts as an extension of the controversial Dakota Access endeavour. “This pipeline starts on indigenous land and it ends in St James, an African American area that is already surrounded by a dozen petrol-chemical facilities,” said Anne Rolfes, who grew up near the heart of the oil industry in Lafayette, Louisiana. “We will be demanding that people in St James get an evacuation route for when one of these plants explodes, because there isn't one at the moment. It's a pretty pathetic request really, to be frank. “Stopping the pipeline is an urgent issue too but we need a damn evacuation route. If you're rolling over the top of these communities you've at least got to let them have a way out. “Elected officials pretend to care about flooding but they've never met a petrol-chemical project they didn't like. These areas in Louisiana are going underwater but it's just one big anti-climate science parade. “It's not as if we have any level of government that is responsive at the moment but acting now is better than if we just did nothing. To some degree you need blind faith in some sort of miracle down here. I think we will have around 200 people for the protest, which is quite good for Louisiana.” Some of those taking part dismiss any focus on Trump as merely a distraction from decades of decisions in the US that have placed minority communities directly in harm's way from power plants, landfills and other sources of insidious pollution. “I'm tired of doing marches in Minnesota. People do them and go home and say 'I've done my bit now,' which isn't how it works. We need a strong, lasting movement,” said Sophia Benrud, a chef who is helping set up an event explaining the dangers of climate change in a district of east Minneapolis historically blighted by industrial pollution. “The Trump administration isn't what is motivating me. I hate politics. This is about my life, my family. We have had white people setting our agenda for a long time. Look at Flint and the problems there. Would you ever see that in a wealthy white neighbourhood? Obviously not. “I've always cared about the planet. I'm the woodland creature out of all of my friends; I would happily never live in the city again. Climate change is a symptom of people not being taken care of. If we don't take care of people and of inequality, we will never solve this problem.”"
