"The word “biodiversity” is employed once in the Paris agreement’s 32 pages. “Forests” appears a few times, but “oceans”, like biodiversity, scores just a single appearance. There is no mention of extinction. Wildlife, coral reefs, birds, frogs, orchids, polar bears and pikas never show up anywhere in the document. This is hardly surprising: the landmark agreement in Paris – the boldest yet to tackle climate change (which is saying something, but not nearly enough) – was contrived by one species for the benefit of one species. It was never meant to directly address the undeniable impacts of global warming on the world’s eight million or so other species – most of them still unnamed. But many experts say this doesn’t mean biodiversity won’t benefit from the agreement – especially if the 196 participants actually follow through on their plegdes and up their ambition quickly.  “[The agreement] is critical for people and it is critical for biodiversity,” said Edward Perry, Birdlife’s climate change policy coordinator, who dubbed the passage of the Paris agreement in December “monumental.” Most biodiversity experts concurred that the Paris agreement was an important step forward, but none thought it would be enough to counter the vast risks posed to biodiversity by global warming. Indeed a recent study in Science found that more than 5% of the world’s species will likely go extinct even if we manage to keep temperatures from rising more than 2C, the uppermost target outlined in Paris.  “[The Paris agreement] doesn’t go far enough, but that really misses the point,” said Nancy Knowlton, a coral reef expert with the Smithsonian Institution. “It moves us in the right direction, finally, and future efforts can be even more ambitious. To paraphrase Voltaire, we can’t let the perfect be the enemy of the good.” Scientists have identified thousands of species that have already been hit by global warming or will likely be in the near-future. For example, Edward Perry pointed to a recent scientific review by his organisation that found a quarter of the world’s most-researched birds have already been negatively impacted by climate impacts. “According to climate projections, there will be more than twice as many losers than winners under climate change [for birds],” said Perry, who noted that, to date, scientist have pointed to 2,300 birds with traits that makes them “highly vulnerable” to global warming. Already, climate change has disrupted some bird’s food sources, messed with the timing of fledgling and migrations, and shrunk the range of cold-loving species. Birds are a good example of how climate change is already impacting wildlife because they are the best studied group on the planet. Yet, they aren’t the only ones feeling the heat. Climate change is also likely playing a role in the current amphibian crisis, which has seen around 200 amphibians vanish for good in recent decades. “Pathogens are always smaller than their hosts, with faster metabolisms, and should therefore be able to acclimate more quickly to temperature shifts,” explained Moore. “This is a phenomenon that will not just affect amphibians!” Currently, habitat destruction remains the biggest threat to amphibians, making species more vulnerable to even slight climatic changes, according to Moore.  “Amphibians have survived four mass extinctions associated with major climate disturbances. What is pushing them over the edge now, I believe, is a perfect storm of lethal conditions that we have created.” Still, no one knows for certain how climate change will impact the majority of the world’s individual species, just as we don’t even know how many species share our planet (pegged at anywhere from 3 to 100 million, though a study in 2011 came up with an estimate of 8.7 million). But we can broaden our view. Just as there are some human communities living on the front lines of climate change – such as low-lying island states or drought-prone countries – there are also particular environments that scientists view as super vulnerable to climate change. Coral reefs are considered one of the most biodiverse ecosystems on the planet, and the most species-rich in the oceans. Their counterpart on land may well be cloud forests, which are high-altitude forests often blanketed in clouds – and also ridiculously rich in biodiversity. Similarly, coral reefs and cloud forests occupy very small slices of the planet: cloud forests make up only around 1% of the world’s forests and coral reefs less than 1% of the ocean’s floor. And both are feeling the heat. Coral reef expert, Joshua Cinner with James Cook University, said that climate change is delivering three separate punches to coral reefs: hotter oceans lead to higher incidences of coral bleaching, ocean acidification (which, like global warming, is caused by carbon dioxide emissions) makes it more difficult for corals to build and maintain their skeletons, while more powerful storms fueled by climate change can wreck reefs. For reefs, Cinner said, the climate crisis “isn’t something off in the far-flung future. It has already happened, and will continue to happen.” This year, record high temperatures driven by climate change – and exacerbated by El Niño – has led the National Oceanic and Atmospheric Administration (NOAA) to declare only the third global coral reef bleaching event on record. The key here is global: usually bleaching events are regional or localised. When it comes to coral reefs, Cinner called the Paris agreement “a step in the right direction,” but also pointed out that even keeping temperatures below rising 1.5C – an aspirational goal in the Paris agreement – would not be enough to avoid further damage to the world’s reefs. “It is important to understand that it is not like 2C, or even 1.5C, is a threshold whereby everything will be OK...The point is that even with a 1.5 degree rise, we are looking at very serious problems for many coral reefs.” Amphibian-expert Moore agreed that there was significant uncertainty about biodiversity even with the 1.5 degrees goal in the Paris Agreement. “It’s impossible to know what a world with temperatures 1.5C above pre-industrial levels will look like...but just talking about it ad nauseam is like debating who should call the fire department whilst watching your house burn down.” Instead, he said, it’s time for action. Cloud forests, like coral reefs, have evolved to survive within certain temperature gradients. Already, scientists have documented cloud forests literally migrating upslope to escape warming. But, according to David Lutz, a forest ecologist with Dartmouth, cloud forest species “do not appear to be migrating as fast as they need to be to keep up” with steadily rising temperatures. “As the world grows warmer – or as periodic heat waves become more fierce – these species literally have nowhere to go but heaven,” said William Laurance, a noted rainforest scientist with James Cook University. “I think we’ll lose more biodiversity from tropical mountains than anywhere else in the world.” The situation becomes even more complicated by the fact that many of these forests won’t even be able to migrate as far as possible. Instead, as tree seedlings sprout upslope they will run into high-elevation cattle ranching, at least in the Andes. “As trees attempt to migrate up into this grassland, they will be either eaten by cows, or burned when the pastures are intentionally burned to encourage grass growth,” said Lutz. If strategies to allow cloud forest to migrate as far as possible aren’t developed many of them are likely to vanish, taking innumerable species found no-where else with them. The Paris agreement noted “the importance of ensuring the integrity of all ecosystems, including oceans, and the protection of biodiversity,” but went into few details about how individual countries should, or even could, go about safeguarding imperiled species in the face of rising temperatures. What the agreement did do, however, was acknowledge the importance of conservation in protecting carbon sinks, often referring specifically to forests. Moore, who called this inclusion “particularly significant,” said “we cannot talk about addressing climate change without stemming the rampant loss of the world’s forests.” Experts said they hoped the agreement would boost initiatives like REDD+ (Reducing Emissions from Deforestation and Forest Degradation), a UN programme that proposes to use funding from rich nations to pay developing countries to keep forests standing. Under negotiation for the better part of a decade, REDD+ projects are just beginning to launch – and the initiative made a number of important appearances at the Paris talks. Prior to the meeting, the UK, Germany and Norway put down $5bn to reduce deforestation in the tropics, while African nations pledged to restore 100 million hectares of forest across the continent over the next 15 years. If done correctly – and with involvement by locals and indigenous groups – such programmes could go a long way toward preserving biodiversity on land. But, some experts have become concerned not just about direct impacts on biodiversity from climate change, but how a warmer future could increasingly pit humans against wildlife. “We have anecdotal evidence that poaching increases when droughts or floods affect food production,” explained Nikhil Advani, WWF’s senior program officer of climate change adaptation, who also noted that when hydroelectric power plants fail during droughts people often turn to forests for fuel. He added that many of the big mammals that WWF focuses on “will be more affected by these indirect impacts from people than any direct impact of climate change.” The international group is launching a crowdsource data campaign, WWF Climate Crowd, in order to better understand such threats. Climate change poses a unique difficulty to biologists as they have to cut through several layers of uncertainty to understand how biodiversity might respond in 10, 20 or even 100 years. But given the rising observable impacts on species – from Arctic ice melt to worsening forest fires to record droughts in the Amazon – the risks are impossible to ignore. “I just can’t get past the nagging feeling that we’re putting off a lot of tough decisions,” said Laurance, who attended the talks in Paris and pointed to plans by India and China to keep building new coal-fired power plants despite the countries’ climate commitments. “[We’re] essentially relying on our children and grandchildren to make even bigger sacrifices and bear heavier costs because we weren’t really willing to grapple with these issues ourselves.” But Knowlton with the Smithsonian Institution is more optimistic. “When social change happens it can happen very quickly – this is what gives me hope...Will climate change in ten years look like marriage equality today? I think so.” The existence of thousands of species may well depend on it. "
"Thousands of power plants around the world may face severe reductions in their ability to generate electricity by mid-century due to water shortages, according to new research. Hydro- and thermo-electric (nuclear, fossil-fuelled, biomass-fuelled) power plants are vulnerable to dwindling rivers and reservoirs as the planet warms, a study published in Nature on Monday said.  These technologies, which provide 98% of global electricity supply, depend on abundant water to cool generators and pump power at dams. Lower river levels and warmer water temperatures could reduce generating capacity by as much as 86% in thermo-electric- and 74% in hydro plants, according to researchers at Wageningen University and the International Institute for Applied Systems Analysis. It comes as water demand for power generation is set to double within the next 40 years, the report said. Drought-stricken hydro producers have reverted to dirtier energy sources in the past to shore up tottering grids. Global warming is set to boost river levels in Canada, India and central Africa as global weather patterns shift. Yet most hydroplants are in regions forecast to see shortages, like South America, which generates almost two-thirds of its electricity from hydro. If those plants became 10% more efficient in producing electricity that could offset the constraints, the study said. Converting to seawater and dry air cooling would achieve the same result for thermo-electric plants, but likely raise energy bills. Switching from coal to gas-fired power plants, whose cooling towers need less water, was preferable. Non-hydro renewable sources are growing, but are unlikely to be the dominant sources of power generation over the course of the century, the study said. Planners were urged to take heed of future constraints as they build new plants, which remain in operation for several decades. “Considering the increase in impacts of water constraints on power generation and the long design lifetime of power plant infrastructure (∼30–60 years for thermoelectric power and 80 years for hydro power), adaptation options should be included in today’s planning to fulfil the growing electricity demands in the next decades.”"
"British Airways says that it has been forced to shelve a groundbreaking £340m scheme to create 16m gallons of jet fuel from London’s rubbish every year, partly due to a lack of government support. The shadow transport minister, Richard Burden, pledged to table parliamentary questions about the affair, saying that government backing for the project had been derisory.   The Green Sky project was due to open in 2017 at an ex-oil refinery in Thurrock, Essex, where it would have turned into gas 575,000 tonnes of household waste otherwise destined for landfill sites or incinerators. Enough green fuel would have been produced to power all BA’s yearly flights from London City airport twice over, with carbon savings equivalent to taking 150,000 cars off the road. But BA told the Guardian that the project had now been mothballed because of low crude oil prices, jitters among investors, and a lack of policy engagement from 10 Downing Street.  “The government needs to support innovative aviation biofuels projects such as this if they are to progress,” said Cathy West, a BA spokeswoman. “Aviation fuels are not eligible for incentives that road transport fuels receive, making it difficult to build a business case to invest in UK aviation fuels projects. This affects investor confidence.” “British Airways’ decision to scrap their green fuels project is immensely disappointing,” Burden said. “The government has questions to answer on why it is not looking to support the industry’s innovative attempts to recycle waste to use as fuel.  “At a time when the government has delayed a decision on Heathrow and Gatwick partly for environmental reasons, it is ludicrous that the government is not backing the industry’s attempts to deliver cleaner fuels.”  BA wants jet biofuels brought under the government’s Renewable Transport Fuels Obligation, a move it believes could help trigger the building of a dozen green fuel plants by 2030.  Without such guarantees, airlines may feel obliged to sign alternative fuel deals at market rates that become less attractive when oil prices suddenly drop. “The UK is currently losing out to countries that have prioritised and incentivised developments in the sustainable aviation fuels market,” West said. Some 150 workers were expected to staff the Solena Fuels plant, which BA had committed to pay £35m each year for a decade, in a bid to lower its carbon footprint. But Solena, a US company, filed for bankruptcy three months ago and BA has now switched its attention to other waste-to-fuels firms where joint projects are thought to be at the due diligence stage. Chris Malins, the fuels programme manager of the International Council for Clean Transportation, said that commercialising these projects was a challenging process, beset by a lack of EU policy certainty after 2020 and a “valley of death” between R&D tests and market-scale production.  “Things could have been done on the policy side here to help these plants get built which were not done,” he said. “Investments won’t go to alternative aviation fuels without policy certainty and access to the same incentives as road diesel. “It is a shame as this project looked like a great opportunity to do something genuinely sustainable on a ground-breaking scale.” Aviation is the fastest-growing source of carbon dioxide emissions, currently thought to be responsible for around 5% of global warming by scientists at the UN’s Intergovernmental Panel on Climate Change. New market mechanisms to green the industry will be debated at an International Civil Aviation Organisation conference later this year. Use of second-generation biofuels to power jets is widely seen as one of the most promising technologies. A recent study found that BA and Lufthansa were emitting 51% more carbon dioxide than the least polluting airlines. "
"The north pole could be hotter than Chicago, Vienna or Istanbul on Wednesday due to the low pressure system that has brought tornados to Dallas and high winds and heavy rainfall to the UK. The Arctic could reach temperatures about 35C (63F) warmer than average for this time of year, meteorologists have warned.  Computer model projections earlier this week suggested that the air temperature at the pole, which is currently shrouded in 24-hour darkness, could reach 5C, rather than the usual -30 to -35C, according to Mashable. This would make it milder than much of Canada and the US. Temperature fluctuations are fairly common in the Arctic, where shifts in sea ice cover can significantly affect local air temperatures, but such a strong variation is extreme. “That’s absolutely terrifying and incredibly rare,” meteorologist Eric Holthaus told Slate.  “By any yardstick, these are extremely warm and likely record readings for the north pole,” noted climate blogger Robert Scribbler. The strange weather coincides with an unusually warm winter in Europe and the eastern US and torrential flooding in parts of south America. The warm weather could affect the buildup of Arctic sea ice during the winter. Ice cover has already been vastly reduced by global warming. The conditions have been caused by one of the biggest storms ever to hit the northern Atlantic, reaching speeds of up to 230mph. Storm Frank lashed the north of England, Scotland and Northern Ireland with downpours and gale force winds on Wednesday. Temperatures have reached or exceeded freezing point at the north pole during December on only three occasions since 1948, according to meteorologist Bob Henson of WeatherUnderground."
"Too many people in the corporate sector are still in denial about climate change, according to Katherine Garrett-Cox, the CEO of investment firm Alliance Trust.   Speaking at a Guardian Sustainable Business debate on the role of business in tackling climate change, Garrett-Cox, herself an outspoken advocate on the issue, said: “Within the last 12 months, I’ve had conversations with CEOs of major corporates in Europe and they just say, ‘It’s not real, it’s not something I should be bothered about’.” It is “scary” how little discussion there is at boardroom level about whether climate change is a risk at all, she added. One month on from a landmark climate change deal at UN talks in Paris, Garrett-Cox hopes this will be the tipping point for businesses waking up to climate change. Ikea’s sustainability chief Steve Howard agreed, saying 2016 presents the corporate world with “an unprecedented opportunity” to reinvent its business models in line with the challenge. However, speaking at the event, the UK’s only Green party MP Caroline Lucas said the government was making this transition more difficult: “This is a government that doesn’t like scrutiny ... and that’s part of the whole way it’s going about its green policies.”  The UK government has been widely criticised since its election in May for making a series of changes to environmental policy such as scrapping subsidies for onshore wind, ending the green deal scheme that helps homeowners insulate their homes and cutting support for the solar industry, which has since seen a number of firms going into liquidation. “What this government is doing in the name of being business friendly is constantly moving the goalposts so that no one knows where it’s going to be safe to invest,” she said. “The green economy is actually one of the best places to invest for jobs, to enable us to get out of the economic crisis we face as well as to keep emissions down.” And moving to a green economy means rethinking consumption patterns, especially in the west, according to Howard . “If we look on a global basis, in the west we have probably hit peak stuff. We talk about peak oil. I’d say we’ve hit peak red meat, peak sugar, peak stuff … peak home furnishings. If you look on a global basis, most people are still poor and most people actually haven’t got to sufficiency yet. There is a global growth opportunity ... but it’s a distribution issue.” Ikea has hit the headlines for introducing a raft of environmental policies in the last year. It has pledged to invest €1bn (£755m) in renewable energy and measures to help poorer communities deal with the impacts of climate change; announced that 100% of the energy used to power its shops and factories will come from clean sources by 2020; and phased out all non-LED lightbulbs from its stores. Leading climate change scientist Kevin Anderson, from the Tyndall Centre for Climate Research, was more sceptical and said the idea that the green economy would enable people in the west to consume more was irreconcilable with international climate change commitments. “At a global level – if you want to see any level of equity around the globe – the idea that people like us can consume and see improvements in material wellbeing is to me not compatible with what the science is telling us about climate change … there are real problems if we try to tell people that, actually, if we’re really clever in the wealthy parts of the world that we can have our cake and eat it. That misunderstands the severity of the challenge we’re facing.” Anderson said that in the future it could be necessary to introduce a shorter working week, he added. “Under the current model you need growth because there is a pursuit of productivity, which people always say is a good thing. If we have an increase in productivity that means you have fewer people producing the same number of goods. If you want to then maintain employment you have to maintain growth to have the same number of people employed,” he said. “So you have to start unpicking all these pieces and saying, ‘Well what would that mean for our society?’ There are different reasons why we might be looking at a world where we have to work fewer hours. We consume fewer goods but we have a higher quality of life in that time that we have available.” The panel featured:"
"The International Monetary Fund is calling for a carbon tax on aviation and shipping to help deliver global climate goals. A charge of $30 a tonne on carbon dioxide embedded in international transport fuels could have raised $25 billion in 2014, the influential Washington DC-based body estimates.  In a report released after 195 countries struck a UN climate pact in Paris, it said carbon pricing should be “front and centre” in efforts to curb global warming. Levies on so-called bunker fuels were “promising”, it said, and a possible source of climate finance – support for developing countries to go green and adapt to shifting weather patterns. Emissions from planes and ships, around 4% of the global total and rising, were not directly addressed in the Paris agreement. It is up to the UN-backed authorities, the International Civil Aviation Organization and International Maritime Organization respectively, to regulate the international sectors. The IMF noted there were “challenges” to imposing a levy, including the need for international coordination and legal issues, “but the practicalities should be manageable”."
nan
nan
nan
