"World leaders should give international efforts to fight global warming a new push by ratifying the historic Paris climate deal in person, according to France’s foreign minister. Laurent Fabius, who steered December’s UN talks, wants heads of state to ratify the accord at a meeting in April in New York, so that it can be enshrined in international law. Nations accounting for more than 55% of global emissions must formally sign up before the Paris agreement can be made official.   He told the Guardian he had discussed the plans with UN secretary general Ban Ki-moon a few days ago, gaining his support, and was “pretty confident” that heads of government would attend what would be the third leaders’ climate summit in a little over six months.  “We should have the leaders there, to give a new impulse [to the implementation of the accord],” he said of the New York meeting, which he will preside over. “At the first day of Paris [which leaders attended] there was a tremendous push. It’s time for a new push in April.”  Fabius is acutely aware that, despite the success of the Paris negotiations, much more needs to be done before the future of the accord is secure. “There are many things which can go wrong,” he told the Guardian. “We have to avoid being lazy. We have to be calm, and to be hopeful. We have to talk to developing countries.” He pointed to the need to tackle emissions from aviation and maritime transport, which were omitted from the UN talks, and which he said are urgent.  More work is needed on setting out clear rules on how to monitor emissions in a “transparent” fashion, he said. African countries must be assured that they are receiving the support that was promised to them at Paris. Businesses must also receive cooperation from governments to develop new clean technologies that will be “decisive” in bringing down emissions.  Fabius also called for a renewed focus on the possibility of putting a price on carbon, pointing to a Chinese plan to institute a national system of carbon trading from next year. This would be a major step forward, he said. At Paris, 196 countries agreed to limit greenhouse gases in line with scientific advice, to avoid temperature rises of more than 2C, and to review their commitments and progress on meeting them every five years. This framework is legally binding, and most countries - including all the biggest emitters - also set out national targets for emissions, to 2025 or 2030.  Fabius addressed the European parliament in Strasbourg on Wednesday, asking MEPs for their continued support for plans for the EU to meet its obligations on greenhouse gas emissions. He set out “four Ps” which he said are needed to implement the Paris agreement: the process of ratification of the accord, including the April meeting; clarifying the principles underlying the agreement, such as a precise definition of climate change financing, rules on the conduct of the five-year reviews and the transparency of monitoring emissions; the pre-2020 period, during which countries must make progress on their existing emissions goals; and preparing for this November’s UN climate conference, ‘COP22’. The success of the Paris conference was a rare bright moment in a dark end to 2015 for France, scarred by the terrorist attacks in November that left 130 people dead and scores more wounded. Fabius hailed the agreement as a triumph for international cooperation. “This is about security and peace,” he said. “There are massive risks to global warming, which could lead to widespread conflict. We have to stop that risk from becoming reality. That means this agreement was actually about peace for future generations, and current generations. This is a chaotic world, and a dangerous one. The Paris agreement is making the world safer.” Relaxed in a fashionably high-collared brown leather jacket as he travelled by French government plane to a snow-covered Strasbourg, Fabius reflected that the signing of the Paris accord had been just a beginning, though a very important one.  “We need to look for concrete measures now,” he said. “I think that will arrive. The shift [to tackling climate change] has been made now, and there will be no turning back.”  For the year ahead, Fabius has a punishing schedule of climate meetings as part of his role as president of the COP, which under UN convention continues until COP22 in November. After the summit in April there will be a meeting in Germany in May to discuss some of the details of the accord, then a further conference in Washington DC in May or June hosted by the US, followed by a meeting of local authorities from around the world in Nantes, France, in September, as well as meetings held with the IMF and World Bank, and the UN general assembly in September. During that time, it is widely expected that Fabius will leave his post as foreign minister, perhaps to be succeeded by his long-time rival Ségolène Royal. He has been tipped in France as a potential future candidate for UN secretary-general, with his steering of the Paris conference having burnished his credentials.  Though he declined to speculate on his future, Fabius noted that he could remain COP president without being French foreign minister."
"A look back at 2015 reveals some shocking corporate scandals, notably in September, when two of the world’s most powerful companies were spectacularly caught with their pants down. On 16 September, Inside Climate News revealed that ExxonMobil, the world’s fourth largest oil company, was aware of the environmental effects of burning fossil fuels as far back as the early 1980s. Instead of acting, however, it had chosen to spearhead climate denial. Just a few days later, car giant Volkswagen admitted to installing emissions test cheating software in up to 11m of its diesel cars. A study by scientists at West Virginia University had shown that Volkswagen’s diesel cars’ on-road NOx emissions were several times the legal limit.  While these two revelations may be unrelated, they reveal common threads that have created a business environment conducive to such repeated wrongdoings. Brought together, these threads – I would argue – can be viewed as four behavioural traits that have come to define today’s corporation:   The search for scale was typified over a century ago by Ford Motor Company. The term Fordism was coined to describe a strategy of growth to achieve economies of scale.  A century later, Volkswagen’s declared goal was to be the world’s number one car company by 2018. Volkswagen bet on its “fuel efficient” diesel-powered cars to achieve this and made an unethical choice to fit these cars with defeat devices, while pursuing a misleading advertising campaign around “clean diesel”.  For its part, ExxonMobil clearly saw the consequences of pursuing fossil fuels, but still chose to lead the denial lobby as that best served its financial interests in oil and gas. It spent more than $30m (£20.3m) between 1998 and 2014 funding climate scepticism, according to Greenpeace.  No doubt it recovered those costs many times over as it grew to become one of the largest corporations in the world, but it did so at immense public cost – the advancing upheavals of climate change.   Exxon’s brand of “scientific” lobbying obfuscated reality, reduced the urgency of climate change responses and was downright unethical.  Despite agreeing to stop funding climate denial in 2007, the company was since found to have donated $2.3m (£1.5m) to members of Congress and climate denying lobby group the American Legislative Exchange Council. The company also donated millions annually towards election campaigns. 85.5% of their US political donations in 2014 were directed towards the Republican Party, of whose remaining 2016 Presidential Candidates, none accepts climate science.  The VW scandal has thrown a spotlight on the relationship between car makers and regulators. The responsible investment charity ShareAction mobilised a coalition of 19 investors with £625m assets under management to write to car companies including VW to ask for clarity on their lobbying position around emissions legislation.  Even today, lobbying is seen in the corporate world as a fundamental right, and shamelessly so. Corporate lobbyist Grover Norquist famously said,  “I’m not in favour of abolishing the government. I just want to shrink it down to the size where we can drown it in the bathtub”. A corporation does have a right to be heard, but at what cost? The kind of lobbying that furthers private profits by frustrating regulation that protects public wealth is morally questionable. It is also economically questionable when it destroys more public wealth than it creates private profits.  This brings us to the penchant for internalising profits while externalising costs. When VW decided to install emissions test defeating devices, it appears not to have considered the negative environmental consequences of emitting around 1m tonnes of pollution every year, or the financial loss to US taxpayers, who were billed $51m for VW’s green car subsidies. And what might the cost be for what Bill McKibben called the “wasted decades”, when Exxon – one of the world’s biggest, most powerful companies – knew about the dangers of climate change and chose to look the other way?  Corporate externalities are the biggest free lunch in human history and, like all free lunches, cannot go on forever. Consumers need clear information if they are to choose which products to buy based on transparent, quality-assured information on the true costs of different products, not just the shelf price.  Unfortunately, such information is rarely provided. In our media-dominated world companies routinely misinform their customers through unethical and unaccountable advertising.  Almost a hundred years ago, Listerine was credited for the “invention” of chronic halitosis as a health condition to promote its production of mouth washes. Its ad campaign from the 1920s – “Can I be happy with him in spite of that” – helped raise their revenues from $115,000 to $8m in just seven years.  The underlying purpose of advertising is to influence consumers’ decision-making, so it cannot avoid being manipulative. It preys on human insecurities, converting them into wants and wants into needs from which arises demand, which feeds production, volume and profits.  Gradually, a realisation is dawning that our dominant model for business is fatally flawed.  But all is not lost. Corporations can and sometimes do define social purpose. They can and sometimes do create positive externalities, such as the training of hundreds of thousands of aspiring young Indians by Infosys, or Tesla’s declaration of intent to make public its battery technology patents.  These are not instances of mere philanthropy, but examples of doing business in a way that creates smart strategic advantage while at the same time delivering public value. They show that a new world is possible: that of  a corporation which delivers shareholder profits but not at the cost of stakeholders. "
"David Cameron has defended his government’s record on the environment and climate change, saying suggestions of backsliding are “total and utter nonsense”. The prime minister also told the liaison committee, made up of MPs who chair select committees, that the government needs to do “more of everything” to deal with the flooding that has repeatedly hit the UK in recent years. Cameron, who pledged in 2010 to lead the “greenest government ever”, has faced concerted criticism over a series of reversals to green policies, including cuts to renewable energy subsidies and energy efficiency programmes. In November, the government cancelled its £1bn competition for carbon capture and storage (CCS) technology, despite the project being in the Conservative party’s election manifesto.  Cameron said that spending on low-carbon energy was set to double to £11bn in this parliament and that there had been an “absolute revolution in renewable energy” during his premiership, with 98% of solar energy installed since 2010. Subsidies for solar power will be slashed this week, but Cameron said: “You do have to think as prime minister that every penny you put in is a penny on energy bills.” The SNP’s Angus MacNeil, chair of the energy and climate committee, challenged this, saying onshore wind was the cheapest clean energy, but was being drastically restricted by the government.  Cameron told the liaison committee in December 2014 that CCS, which traps CO2 from coal and gas power plants and buries it, was “absolutely crucial if we are going to decarbonise effectively”. But he defended the scrapping of the £1bn policy, which was designed to help develop commercial-scale CCS, saying, “The economics are not working at the moment.” This was contradicted by US energy secretary Ernest Moniz, on 7 January, who tweeted: “Carbon capture is critical for solving climate change. And it’s working.” The prime minister highlighted the UK’s pioneering Climate Change Act and the carbon budgets it sets for the nation, and said: “We are more than meeting the targets.” However, a leaked letter in November revealed that the UK was not on track to meet an EU target for green energy in 2020. Furthermore, experts have argued, the government’s renewed dash for gas, including fracking, without CCS will make meeting future carbon targets extremely difficult. Tidal power has been promoted by chancellor George Osborne, who signalled support for a project in Swansea Bay. But Cameron poured cold water on the technology, saying that the current proposals were too expensive: “We have not seen any proposals coming forward that would would beat the [subsidy] strike price.” Friends of the Earth chief executive Craig Bennett said: “If dismantling a dozen green policies and putting 19,000 solar workers on notice isn’t ‘backsliding on green commitments’, I don’t know what is.” Cameron was challenged on flooding by Huw Irranca-Davies, chair of the environment audit committee, who quoted one expert stating that the UK’s “current approach to flooding was not only inadequate, but has no likelihood of ever being adequate”. Cameron cut flood defence spending in 2010, only raising it after floods hit later, and has been repeatedly warned of the UK’s rising risk of floods. “On flooding, there is no doubt we need to do more,” Cameron said. “We’ve seen what are called one-in-100-year events, or one-in-200-year events, and they happened in 2007, 2013, 2015, and the country wants us to do more, and we will do more.” The controversial issue of river dredging was raised by Neil Parish, chair of the environment, food and rural affairs committee, who praised Cameron for restarting dredging on the Somerset Levels.  The government is going to allow farmers to dredge ditches without securing permission from the Environment Agency, but experts have warned of the risk of faster-flowing rivers rising more quickly and increasing the risk of flood to towns and villages downstream. Mark Lloyd, chief executive of the Angling Trust, said recently: “It is scandalous that the government has hidden from public view the advice of its own experts on the dangers of unregulated dredging and ignored the findings of the study into the pilot dredging projects. The evidence shows that the best way to reduce the risk of flooding is to manage land upstream to reduce the flow of water and soil off fields.” Cameron said a suggestion from Parish that farmers were given more incentive to store water on their land during periods of high rainfall made “very good sense”. The prime minister recounted an anecdote from the village of Kelmscott in his constituency when he visited a site where farmers were being sued by the EA for dredging without permission. Cameron said the EA was worried that some of the habitat of the water vole might have been destroyed. “At that moment, two water voles appeared on the river bank, almost in conversation, and in my mind, at that moment, the argument was settled,” he said."
"Europe is calling for a considerably less ambitious carbon emissions standard for airplanes than the US in a new global push to reduce aviation’s contribution to climate change, the Guardian has learned. The standard would mark a turning point for efforts to regulate fast-growing emissions from airplanes, which are not covered by December’s much-hailed Paris climate agreement.  The milestone would apply to new models and existing aircraft put into production after 2020, but the EU’s preferred version would be less stringent than alternative US proposals, which the Guardian has also seen. Both blueprints have been filed with the UN’s civil aviation agency, Icao, ahead of talks in Montreal next month. “The US proposal is definitely more ambitious,” said Joris Melkert, a former flight test engineer and senior aerospace lecturer at Delft University in the Netherlands. “It would save more emissions, and the difference is quite considerable.” The gap between the two proposals is greater than the annual emissions of most medium-sized European countries, and privately confirmed by EU officials.  Aviation is responsible for around 5% of the world’s global warming at present and the industry is growing so fast that, on current trends, it could make up 22% of global emissions by 2050, according to a recent European Parliament study. The Icao talks are pursuing a twin track approach of making airlines pay a cost for their CO2 output under a market-based scheme, and greening aircraft with a new fuel efficiency standard.  The debate on the standard began in 2007 and proposals agreed in Montreal will be sent on to an Icao council for approval next year. “After many years, decision time has finally come,” one EU official said. “I believe that we are going to have an ambitious standard and I hope we can secure it next month.” Airplanes emit CO2 in the process of burning engine fuel to provide a lift force that can overcome the aerodynamic drag created by wind resistance. For this reason, the Icao proposals focus on measures to improve planes’ aerodynamics, lightness and engines. Under the technical proposals, a stringency option of ‘9’ suggested by the US would reduce overall aircraft emissions by 37.5%, while the ‘7’ setting favoured by the EU would imply a 33% cut. The 4.5% gap is equal to 350m tonnes of CO2, or slightly more than Spain emits every year. EU officials privately concede that their proposal is “the second most ambitious of the positions put on the table”. But they insist that it is still “quite close to the US one” and that the agreement’s small print on cargo aircraft and categorisations should not be overlooked.  Environmentalists argue that the involvement of the Environmental Protection Agency and an unshackled president Obama in the US has contributed to the relative weakness of the EU’s position. But insiders in Brussels say that the sheer variety of complex issues still to be agreed – and the amount of aircraft manufacturing countries involved, from Brazil and Ukraine to India and China – make like-for-like comparisons unwise, and stringency factors of ‘10’ impossible. “There are so many parameters to be decided that it creates a lot of pieces you can move around on a chessboard,” one EU source told the Guardian. Europe has proposed a 60 tonne threshold for classifying aircraft, as this could cover 90% of emissions and apply to aircraft of the size of a Boeing 737 or Airbus 320 and above. But the classification would be further sub-divided between new model types and those in production; jets ferrying 19 people or less, and planes carrying freight instead of passengers. Alternate starting dates of 2020 and 2023 for the benchmark are other options under discussion. An EU source said: “We need a standard that reflects the state of art of the technology, that is as close as possible to what engineers are capable of doing, without going so high that a number of 60-tonne aircraft types would be put out of the market as that would be environmentally unhelpful, economically detrimental and also quite unfair, as lead-in times for aircraft take about 10 years.”"
"Susanlyn Singroy thinks the candidates for US president should be debating science. The eighth-grader argues that the candidates are talking about money, religion and immigration, but rarely mentioning the science challenges impacting her future. Singroy says, If they talk about the big science issues, maybe they’ll actually do something about them.  Her point is well taken. The Republican and Democratic candidates for president both held debates just days after the Paris climate summit, yet the debate moderators didn’t ask a single question about climate science—remarkable considering that climate change has emerged as a major global science, economic, environmental, tech, civil infrastructure, and foreign policy challenge. US journalists have similarly avoided asking the candidates about other major science, health, tech, and environmental issues. So Susan, who wants to be a scientist, decided to volunteer with other kids to create what may be the most memorable political ad you’ll see all year: I’m chair of sciencedebate.org, the volunteer-run nonprofit that produced the ad. We’re working with Susanlyn and other kids elevate these issues in the US political dialogue, because they disproportionately affect the next generation.  Candidates for president attend debates dedicated to economics and foreign policy, but science issues now have an equal or greater impact. Voters—and their kids—deserve a nationally televised discussion dedicated to science, health, tech and the environment. The public seems to agree. ScienceDebate.org and Research!America, a nonprofit that advocates for medical research, recently commissioned a national poll. We found that 87% of likely voters think the candidates for president ought to be well versed on science issues. 91% of Democrats, 88% of Republicans and 78% of Independents also said the presidential candidates should participate in a debate to discuss key science-based challenges facing the US.  What would such a debate look like? The possibilities for questions are fascinating, and could fill hours of discussion. Here’s a small sample: Americans deserve answers to these questions, and thinking about them now will make the candidates better qualified for the job they seek in November. Shawn Otto is a science writer and chair of ScienceDebate.org"
nan
nan
nan
"  Countries can deliver on the promises of the historic Paris climate change agreement by rapid scaling up wind and solar power to 36% of the global energy mix by 2030, an international energy gathering will be told on Saturday.  The International Renewable Energy Agency (Irena) meeting in Abu Dhabi – the first major global gathering since Paris – is seen as an important test of countries’ readiness to put those plans into action. Nearly 200 countries agreed to keep warming below 2C, and work towards a 1.5C limit, during the Paris climate negotiations last month. Some 187 put forward plans to cut greenhouse gas emissions. Now comes the hard part, government officials admit: making good on those promises by translating emissions cutting targets into policies, and expanding access to clean energy technologies. Irena said those goals were within reach – if countries move fast. Scaling up renewable energy to 36% of the global energy mix by 2030 would provide about half of the emissions reductions needed to hold warming to 2C. Energy efficiency could make up the rest.  “The Paris agreement set a long-term vision for the deep reduction of global emissions and the need to decarbonise the energy sector,” Adnan Amin, Irena’s director general said in a prepared statement. “The Irena assembly must now take the next steps and establish a blueprint for action to meet our climate goals and set the world on a path to a sustainable energy future.” In an effort to spur countries to action, an Irena report released on Saturday found doubling the share of renewables by 2030 would increase global GDP by up to 1.1% or about $1.3tn, and provide jobs for more than 24 million in the renewable sector. The United Nations climate chief, Christiana Figueres, has said repeatedly she was looking to the Paris agreement to send a clear signal to the business community of a shift away from a fossil-fuel driven economy. Some of those changes are already underway. Global clean energy investment attracted a record $329bn last year, according to a report released on Thursday by Bloomberg New Energy Finance.  The report noted the rise in clean energy investment came despite the drop in oil prices. Irena officials said they hoped that the Paris climate accord would add momentum to the shift. “We are not seeing climate change action as a cost, but starting to see it in terms of opportunities,” said Angela Kallhauge, Irena’s climate change officer. "
