"Individual cities, regions and businesses across the globe are banding together determinedly to confront climate change - but their emissions reductions are relatively small and don’t fully compensate for a recalcitrant US under the Trump administration, a new study has found. A cavalcade of city mayors, regional government representatives and business executives from around the world will convene in San Francisco next month for a major summit touting the role of action beyond national governments to stave off the worst impacts of climate change.  But the greenhouse gas cuts offered up by these entities are relatively modest, according to new research, placing the onus on nations to raise their ambitions even as the US, the world’s second largest emitter, looks to exit the landmark Paris climate agreement. An evaluation of climate change pledges by nearly 6,000 cities, states and regions, representing 7% of the global population, and more than 2,000 companies that have a combined revenue comparable to the size of the US economy, found a total projected reduction of between 1.5bn to 2.2bn tons of greenhouse gases by 2030. In some places this action will be significant, such as in the US, where shifts to cleaner energy and energy efficiency by cities and states are on track to contribute half of the emissions reductions promised by the country in the Paris agreement. But globally these emissions cuts fall short of enabling countries to avoid breaching agreed thresholds for dangerous warming that will trigger increased heatwaves, mightier storms, rising seas and displacement of people. “When we look at the individual pledges [by cities, regions and businesses] the impact isn’t that large so we absolutely need national governments to pull through and do a lot of the heavy lifting,” said Dr Angel Hsu, the director of Data-Driven Yale, which led the study. “The actions of cities, companies and states aren’t insignificant but they can’t do it by themselves. This shows everyone can be doing more. The current reductions are woefully inadequate and hopefully the actions of other entities will give national governments the confidence to be more ambitious.” The analyzed reductions, taken from nine high-emitting countries such as the US, China, India and Brazil, as well as the European Union, overlap with some national efforts that increase the total contribution of emissions cuts. But this action isn’t sufficient to bridge a gap between the Paris agreement’s goal to avoid 2C (3.6F) of global warming, with an aspiration of avoiding a 1.5C increase, and the insufficient emissions reductions put forward by the deal’s nearly 200 national signatories. The agenda of the Trump administration risks making this goal even more challenging. Trump has promised to withdraw the US from the Paris agreement and has unveiled a plan to weaken vehicle emissions standards that could result in more than 1bn tons of extra carbon dioxide over the next 15 years. Last week, Trump’s Environmental Protection Agency announced a watered-down climate policy for the energy sector that might even result in emissions rising from coal plants. Even if every Paris commitment is fully implemented, the world is on track to warm by around 3.3C by the end of the century. Pledges by the likes of Berlin, the Coca-Cola company or even an economic powerhouse like California “while welcome, are not sufficient”, said John Sterman, the director of the MIT system dynamics group. “The world is in a desperate race between accelerating climate change and the innovation needed to cut emissions before it’s too late,” said Sterman. “Cities, states, and business are in the lead, but they face stiff headwinds from weak national policies and the continued efforts of fossil fuel interests to undermine the innovation we need.” Global greenhouse gas emissions rose slightly last year, after a short period of stasis, highlighting the looming scenario whereby as-yet unproven technology will be need to be deployed at a mass scale to suck CO2 directly from the air or capture and bury it after burning vegetation, known as biomass, for energy. “We are already in an overshoot situation and it’s likely we are already going to have to need to remove carbon from the air,” said Klaus Lackner, the director of center for negative carbon emissions at Arizona State University. “The idea we just tighten our belt a bit isn’t going to solve the problem. We need to stop using the atmosphere as a dumping ground, abandon fossil fuels, find other sources of energy and deal with the carbon debt we already have. “Cities getting involved is good and important but we haven’t really acknowledged how big and serious the challenge is. We are whistling in the dark.”"
"Australia’s regional authority and influence is being eroded by its refusal to address the threat climate change poses to many of its Pacific neighbours, according to a pre-eminent climate scientist. As part of the Pacific Islands Forum, Australia was a signatory to the Boe declaration in Nauru on Wednesday which said climate change represented “the single greatest threat to the livelihoods, security and wellbeing of the peoples of the Pacific”.  But Australia attempted to water down the language of the declaration, other Pacific countries have said, resisting language around urgent action to cut emissions, and issued qualifications to part of the Pacific Islands Forum communique over the Paris climate agreement. The prime minister of Tuvalu, Enele Sopoaga, said the name of the country seeking qualifications “[started] with capital A”. Australia is the only country in the PIF beginning with A. Several sources from the PIF forum have corroborated Australia’s efforts to weaken the Boe Declaration. Vanuatu’s minister for foreign affairs Ralph Regenvanu said: “I was there, and can confirm this is true. And unfortunate.” Asked specifically by Guardian Australia whether Australia had sought to weaken the language of the declaration, Australia’s foreign minister Marise Payne neither rejected nor confirmed the allegation. “The communique is an agreed document of the Leaders’ Retreat. It is not appropriate to discuss the internal talks of the private Leaders’ Retreat. Pacific Island Forum leaders’ discussions are typically robust and frank and canvas a broad range of issues, including regional security, economic growth, climate change, fisheries and disaster response.” Payne said Australia understood the centrality of the climate threat to many Pacific Islands, and “the importance that Pacific countries place on effective global action to combat climate change”. Australia has pledged $300 million for climate change action in the Pacific between 2016 and 2020, and has also contributed $200 million to the Green Climate Fund. Dr Bill Hare, managing director of Climate Analytics and a lead author on the IPCC fourth assessment report, told Guardian Australia that Pacific leaders were growing increasingly disenchanted with Australia’s refusal to commit to cutting carbon emissions, even as their nations faced massive economic, physical and social disruption, even existential threat. “The leaders are not fools, and they are increasingly confronted by the problems of climate change, in all its different dimensions,” Hare said. “The problem for Australia is it doesn’t have credibility on climate. Australia is an important player for many of the Pacific Island countries, well-respected and well-liked by the populations and the political leaders, but on climate change there is a chasm opening up. “I hear it from Pacific leaders all the time: they are fighting to save their countries and their people and they cannot understand why the Australian government leadership can’t see the problems they’ve got.” Hare said while the language in the Boe declaration was strong, the real test for Australia would be in its actions to address its own emissions, and in helping the Pacific with adaptation. “The actions will not match the gravity of the declaration or the gravity of the need. There is a credibility gap: Australia is not acting on reducing its own emissions. All the leaders know that whenever the prime minister or energy minister says Australia will meet its Paris targets ‘in a canter’, that that it is wrong, it is factually incorrect – it is bullshit. “They know Australia is working to slow down action on meeting Paris targets, they know Australia is promoting coal, and they know it’s going to cause a climate catastrophe. Australia has dedicated and able diplomats across the region, but the political leadership of the government is so far removed from reality, it opens up major problems for the country.” Pacific leaders were confronting losing large proportions of their territory, and the forcible displacement of their populations, Hare said. He said leaders did not want their next generations to grow up dislocated, living in foreign cities like Sydney and Auckland, with the attendant loss of identity, culture and self-esteem. Support for Australia could ebb away, with Pacific Islands looking to other benefactors – in particular China – which has made massive in its aid spending and diplomatic engagement in the region. China is set to overtake Australia as the largest donor to the Pacific, after pledging US$4bn in aid to the region last year. But climate action is acutely politically sensitive for the Australian government, having just abandoned the National Energy Guarantee - which would have mandated emissions cuts - and new prime minister Scott Morrison facing pressure from some members within his own party to abandon Australia’s Paris agreement targets. Morrison said specific emissions reductions targets were not necessary to meet Australia’s Paris goals: “the business-as-usual model gets us there in a canter”. That directly contradicts advice from the government’s own Energy Security Board that says business as usual will mean the electricity sector will “fall short of the emissions reduction target of 26% below 2005 levels”. The Australian Conservation Foundation chief executive officer, Kelly O’Shanassy, said Australia’s Boe declaration commitment was welcomed but must be matched by domestic action. “It’s not surprising that Pacific leaders have been unhappy with Australia on climate change with the Morrison government turning up at the Pacific Islands Forum with no real plan to cut our domestic pollution and without a clear indication that it intends to develop one.” Ahead of the Pacific Islands Forum, Xavier Matsutaro, the national climate change coordinator for Palau, said Australia’s relationship with the Pacific was “dysfunctional” and akin to an abusive spouse, saying Australia was also responsible for diluting the strength of previous regional declarations on climate change. “Australia is a bit of an anomaly, because on the floor [of climate summits] they’re basically sometimes as far right as Trump in some of their views on climate change … but then on a regional basis they’ve actually given a lot of support to our region.” Hare said Matsutaro spoke the “real and growing truth” about Pacific sentiment towards Australia. “It reflects a major political and diplomatic crisis in the Pacific. If Pacific leaders lose faith in Australia, then they will turn to others, and this is already becoming a major source of discussion. Pacific leaders are not naive about the strings that will come with development from China, but they are beginning to feel abandoned.”"
"Tens of thousands of people around the world will mobilise over the weekend of 8-9 September under the banner of Rise for Climate, a grassroots movement seeking a fossil fuel free world.  More than 600 events are planned in at least 80 countries, with one of the key aims to challenge the decision-makers attending the Global Climate Summit in California on 12 September to escalate decarbonisation efforts and targets.  As well as a flagship event in San Fransisco which the organisers say will be the largest climate march the US west coast has ever seen, community groups are finding innovative ways to urge a future in which all energy sources are 100% renewable, including an initiative asking participants to share artworks related to the movement. We would like to hear from you if you are taking part in any of the events or involved in organising where you live, and will highlight some of your contributions in our coverage. You can also share pictures and stories from the events you attend. Rise For Climate’s website has an interactive map can search for events near you. Tell us what you are doing on or around the weekend of 8-9 September and why you are getting involved in the movement using the form below. What moved you to take part? How do you hope to make a difference? How many people are taking part where you live and what is the mood among participants? If you’re having trouble using the form, click here. Read terms of service here."
"A European parliament report that blames climate change on cosmic ray fluctuations, sunspots and planetary gravitational pulls, is so hackneyed and ill-informed it would “make the dinosaurs blush,” climate scientists say. The non-binding opinion written by Ukip MEP, John Stuart Agnew, has shocked EU lawmakers for its dismissal of climate science – and the support he received to write it from mainstream rightwing and liberal political blocs.  Green MEP Molly Scott Cato said their choice of Agnew, a Norfolk farmer, as parliamentary rapporteur by the agriculture committee, was a “truly scandalous” fiasco that illustrated a growing populist threat. A rapporteur is elected to shepherd EU proposals through the European parliament and, after negotiations with the European commission and EU states, into law. The Agnew report calls for a €5.45bn green fund called Life to be used to prepare “for an impending Maunder Minimum” – or a period of low sunspot activity. It deletes the European commission’s proposals for funds to be spent on clean energy infrastructure, references to climate mitigation and obligations under the Paris agreement. Agnew claimed that his ideas represented scientific “fact”. He said: “I’m doing this to ensure that somewhere in the files and annals of the European parliament there was somebody who said: ‘The king isn’t wearing an invisible suit! The king is naked!’” Rather than human activity, the Agnew report attributes climate change to cosmic ray fluctuations and gravitational pulls from elsewhere in the galaxy, sunspot activity, ocean currents and greenhouse gas water vapour, in the form of cloud cover. “The other greenhouse gases, CO2, methane and nitrous oxide have a negligible effect on our climate,” Agnew’s paper claims. “The only potential risk of a major CO2 event in Europe is an erupting volcano.” Dave Reay, professor of carbon management at Edinburgh University told the Guardian, after looking at the paper: “It is fitting that this laughable document misuses palaeoclimate information in its case against human-induced climate change – the hackneyed, pseudo-scientific arguments here would make the dinosaurs blush.” Agnew’s paper has no legal weight and will almost certainly be dismissed by the environment committee when the issue is debated on 30 August. In part, it reflects a turf war between the agriculture and environment panels over responsibility for separate proposals on greening obligations under the next CAP. But with fears of an influx of far-right MEPs in parliamentary elections next year growing, Agnew’s success has also set alarm bells ringing. Scott Cato told the Guardian it was “shocking” to think that someone with his climate views could influence funding disbursements. “It’s truly scandalous that a proud climate denier has got control of such an important file,” she said. “This fiasco shows the damage that can be done by electing populists who really have no understanding of their brief and are not competent to undertake the highly influential and detailed work that is required of elected politicians.” Agnew has long campaigned against what he terms “the global warming scam”. He has also drawn attention for claiming thousands of pounds in CAP payments for his Norfolk farm every month, according to his members’ declaration. He told the Guardian that “I threw my hat in the ring to do this [report] fully expecting to be thrown out of court,” but that he then received wide support, “to my genuine astonishment”. A spokesman for the European People’s Party said their backing for Agnew was due to bidding procedures and not an endorsement of his climate politics. Agnew was also supported by the European Conservatives and Reformists bloc of mostly Conservative MEPs and far-right Europe of Nations and Freedom faction. The Socialists opposed Agnew and the Greens stood against him, but they were hampered by the abstention of the far left GUE group and support for Agnew from the ALDE bloc of Liberals. Two ALDE MEP’s contacted by the Guardian declined to comment."
"The existential threat of climate change is being spelled out to New Yorkers via a selection of flashing highway signs that have been placed around the city. The 10 large solar-powered signs have been placed in locations in each of New York’s five boroughs, including areas deemed particularly vulnerable to the sea level rise and powerful storms associated with climate change, including the Rockaways in Queens and the west side of Manhattan.  Messages such as “Climate change at work” and “Climate denial kills” will be displayed in English, as well as in languages commonly spoken in the areas they will be deployed, such as Spanish, Russian and French. The signs are part of a project by the Climate Museum and a host of partners, including the New York City’s mayor’s office. The installation, called Climate Signals, has been done by Justin Brice Guariglia, an artist who regularly focuses on environmental themes in his work. “These signs sound a warning about the climate crisis and they call us to think and act on the issue,” said Miranda Massie, director of the Climate Museum. “When you see a flashing traffic signal your initial response is that there are uncertain conditions ahead, and that is exactly what climate change is. This is the perfect medium for bringing up this alert.” Some of the sites will include elements such as voter registration and appearances by climate scientists. Massie said the work is not overtly activist in nature, despite the unfolding agenda of Donald Trump, a native of Queens, to dismiss the science of climate change and dismantle policies that reduce greenhouse gas emissions. “Anyone who is aware of the climate crisis is appalled and alarmed by the disgraceful assault by the administration on climate progress,” she said. “But this project isn’t political in a narrow sense, it’s about social and cultural action. We need a social shift to deal with climate change. It shouldn’t be a political lightning rod.” Daniel Zarrilli, New York City’s chief resilience officer, said: “Climate change is one of New York City’s greatest challenges and requires creative approaches to educate and engage all of us about its risks and solutions. Art can play a valuable role in this effort.” Climate Signals will be visible across New York City until 6 November"
"Australia attempted to water down a resolution on climate change agreed by country representatives at the Pacific Islands Forum, a leader attending the event has claimed.Pacific leaders issued the Boe declaration on Wednesday night, calling climate change “the single greatest threat to the livelihoods, security and wellbeing of the peoples of the Pacific” at the conclusion of the Pacific Islands Forum, which has been held in Nauru this week. However the forum communique – which focused heavily on climate change and the need for emissions reductions – was endorsed by leaders “with qualification”.  When asked at a press conference if those qualifications came from a country “beginning with A”, Enele Sopoaga, the prime minister of Tuvalu, confirmed that “the name of the qualifier, seeking qualifications [started] with capital A”. Australia is the only nation in the Pacific to fit this description.It appears Australia also did not support a section of agreement calling on the United States to return to the Paris agreement on climate change. The communique made it clear that it was only “leaders of forum island countries” – a term that a forum spokesperson confirmed denoted all forum member countries other than Australia and New Zealand – who called on the US to return to the Paris agreement on climate change. A spokesperson from the New Zealand Ministry of Foreign Affairs and Trade said: “I can confirm that NZ absolutely supports the reference in the communique calling for the US to return to the Paris agreement.” Guardian Australia has sought comment from the Australian Department of Foreign Affairs and Trade.Sopoaga said it was essential the US return to the agreement and commit to reducing emissions.“We cannot have comprehensive robust emissions reductions unless the biggest emitter is there in the process, we cannot leave the US out, they are responsible for 25% of global emissions,” he said. The Boe declaration committed all forum countries to meeting their Paris agreement targets – a question of fierce domestic political debate in Australia. “Leaders reaffirmed the importance of immediate urgent action to combat climate change and … called on countries, particularly large emitters, to fully implement their … mitigation targets,” the declaration said. The president of host nation Nauru, Baron Waqa, said despite the fact the declaration included a qualification from Australia “that doesn’t make it any weaker”. But the Australian government’s apparent ambivalence towards a low-emissions climate policy has disquieted its Pacific neighbours. Low-lying island Pacific countries including Kiribati are forecast to be among the first on the planet to disappear underwater if rising sea levels are not arrested.Australia’s attempts to resist the strong language in the Boe declaration fits with its past behaviour at international meetings, according to a Pacific climate change representative who has represented his nation at COP summits for the last five years.Speaking to Guardian Australia ahead of the Pacific Islands Forum, Xavier Matsutaro, the national climate change coordinator for Palau, in the north-west Pacific, said Australia was “responsible for making our declarations weaker sometimes in the region”.“So there’s been forums that were formulated so [Australia] won’t be involved in it, they’re not members, so that whatever language that really reflects our views and our circumstances is actually reflected in the declaration,” he said. He also likened Australia to an ""abusive spouse"", saying Australia provided aid to the region to deal with the effects of global warming but undermining attempts to halt its progress. Additional reporting by Charles Anderson"
