"Students at Oxford and Cambridge are taught about the dangers of economic inequality, climate change, and the limits of burnable carbon. But the Paradise Papers have revealed that behind the scenes, the universities are investing tens of millions in projects that systematically exacerbate inequality and climate disaster.  The scandal is not simply tax avoidance. It is the hypocrisy of universities that espouse their commitment to sustainability while financing environmental destruction offshore.  A 2016 Cambridge report insisted that the university’s investments would reflect its underlying values, which include a commitment to environmental protection. Oxford’s vice-chancellor Louise Richardson declared in 2015 that the university must “recognise the need to work towards net-zero emissions in … all of the university’s activities, including the stewardship of our investment funds.” The Paradise Papers disclose a complex chain of investments that begins at Oxford and Cambridge, whose combined endowments exceed £11bn, and ends with the financing of Royal Dutch Shell initiatives to explore deeper into the ocean and identify more carbon to burn. These investments are not compatible with a carbon-neutral endowment, a stable climate, or a just future. Cambridge has defended its approach, pointing out that the charitable status of the universities means they do not normally have to pay tax on investments, while Oxford pointed out that offshore investments were commonly used and said it had “very low exposure to the broader energy sector”. The universities are, in fact, not totally exempt from taxes. Even charities must pay a special US tax on investments in hedge funds, but the Paradise Papers expose that Oxford and Cambridge use blocker corporations. Blocker corporations act as middlemen, converting the hedge fund income into dividends, which US law doesn’t tax. The schemes are legal, but the practice reveals two universities exploiting loopholes in pursuit of maximum return, generating profit at the expense of human communities near and far. It comes as no surprise that our universities are financing dirty oil. But the sheer scale of the investments and the disingenuous approach is breathtaking. It demonstrates a lack of transparency and a failure to take responsibility. What else are they hiding? Fossil fuel divestment is not just a prudent financial decision, it is a moral imperative. As we hurtle towards a dangerously warming world, it is essential that we stigmatise the industry most responsible for the climate crisis. Divestment has worked before – consider the cases of apartheid South Africa, or the tobacco industry. And it is working now, with a third of British universities already committed to fossil fuel divestment in some form. At Oxford and Cambridge alike, students have banded together in opposition to this immoral system, launching coordinated actions on both campuses under the banner of Oxbridge #ComeClean. Last Friday, Oxford students protested at the headquarters of the endowment management company; on Tuesday hundreds of students will march through the streets of Cambridge calling for justice and transparency. Our coalition has four demands: full disclosure of where the universities are investing their endowments; a complete withdrawal from all offshore funds and a public apology for such investment practices; full divestment from both direct and indirect investment in fossil fuels; and comprehensive student and faculty-led ethical investment policies. Both Cambridge and Oxford pride themselves on their contributions to society. Cambridge’s core values include “a concern for sustainability”, while Oxford seeks to “benefit society on a national and a global scale”. Our message is simple: they must start practising what they preach. Sustainability is not just a buzzword; it should be integral to everything the universities do. Greater profit margins are no excuse for dodging tax and profiting from climate breakdown. If they call themselves charities, they should start acting that way."
nan
"The US states, cities and businesses that have signed up to reduce greenhouse gas emissions despite president Donald Trump’s threats to withdraw from the Paris agreement would, if put together, have the clout of the world’s third biggest economy, after the US and China. To date, 20 US states and more than 50 of its largest cities, along with more than 60 of the biggest businesses in the US, have committed to emissions reduction goals.  Added together, they have an economic power of about $10tn, placing this group behind only the US as a whole ($18.6tn) and China ($11tn) in terms of GDP. On Saturday at the Bonn conference on climate change, these groups joined together to make “America’s pledge”, a commitment to combat global warming, in stark opposition to the Trump administration. “This is very powerful,” said Paul Bodnar, a former lead negotiator at the climate talks for the US under Barack Obama. “These states and cities would be larger than 195 out of the 197 countries signed up to the Paris agreement.”  Michael Bloomberg, the former mayor of New York, led the group in vowing to take measures, such as reducing coal-fired power and investing in renewable energy and efficiency, which would substantially reduce their carbon output. But some delegates want the companies and local governments involved to go further, by submitting reports on their progress towards their emissions-cutting goals to be subject to the kind of monitoring and accountability that is required from national governments under the UN process. They have put forward a draft text which, if accepted, would mean such voluntary commitments were made in line with UN standards, and could therefore be included in the national greenhouse gas inventories required from countries. Kevin Conrad, of Papua New Guinea, told the Guardian: “We welcome their contributions, but they should be accountable [on their progress in meeting their voluntary goals]. Will they be willing to be reviewed on their results, not just on the blather?” He said the draft text was aimed at giving these contributions “a legitimacy” under the UN’s rules. “They should be transparent,” he said. “We do not want to pre-judge America’s Pledge, we just want rigour on the results.” The group’s commitments fall outside the pledges under the landmark 2015 Paris agreement, and are likely to fall short of the requirements on carbon-cutting under the pact. Trump has vowed to withdraw the US from this agreement, the first to bind developed and developing countries to a specific temperature goal. At the Bonn COP23 talks, scheduled to continue to the end of the week, nations are discussing how to improve their pledges on cutting carbon in line with scientific advice. Under the Paris agreement, they must hold global temperature rises to no more than 2C, which scientists say is the limit of safety, beyond which climate change is likely to become catastrophic and irreversible. Current pledges under the Paris agreement are inadequate to reach this goal and it is estimated they would bring the world to 3C of warming, which would cause drastic changes in sea level rises, bring droughts and floods to many areas of the world, and make agriculture impossible in huge swaths of the globe. However, consensus on how to strengthen the pledges is proving elusive, and is unlikely to be finalised at these talks. Meanwhile, the Trump White House has indicated its priorities, to the consternation of many delegates, by scheduling a meeting at the talks focusing on the future of coal and how its use can be continued with new technologies. The America’s Pledge report will be released in the alternative US headquarters at the talks, the US Climate Action Center. The giant inflatable dome sits on the edge of the conference – which many of its supporters claim is a sign of its endorsement as a semi-official player. Despite the geographical proximity of the “America’s Pledge” delegation, there are limits to what non-state actors can do. They are excluded from many of the technical talks and cannot tap into federal funds that states use to finance commitments to slow climate change or reduce its impacts. More importantly, it is harder for them to set a course for the country. But while that is missing, Antha Williams, head of the Bloomberg Philanthropies environment team, said it was necessary to fill the void. “It would be better if we saw leadership from the White House, but the overarching point is that cities, states and companies that represent more than half of the US are showing their support for climate action.” Nick Nuttall, communications chief of UN Climate Change, said the organisers were willing to work constructively with non-state actors. “We are extremely supportive of the whole mass of cities, states and territories who have been aligning themselves with the Paris agreement,” he said. “American cities and states have been very active, which is welcome – and it mirrors what is happening elsewhere in the world.” His comments were echoed by several delegates. “We don’t turn a blind eye to anyone,” said Antonio Marcondes, the chief negotiator for Brazil. “We talk to the federal government and we have been approached by non-state bodies. Our policy is that we are willing to work with anyone who can move this process forward.” But some climate activists warned against expecting too much from the America’s Pledge team. Thanu Yakupitiyage, of the NGO 350.org said the climate pledges by many mayors and governors were a welcome step, but she urged still greater ambition and concrete policies to phase out fossil fuels. “America’s Pledge is a start and we’ll be holding our elected officials, including governor Jerry Brown, to his word. As we look towards the climate summit that the governor has announced for 2018, we want more than words; we want a tangible action plan and steps taken,” she said."
"“I was wondering if it was a dream,” said Walter Edwin, who sells honey from more than 50 beehives in Dennery on the Caribbean island of St Lucia. He had just received a phone call telling him to go to the bank for an automatic insurance payout following the major hurricane that struck in 2014.  “I used that very same money to get some syrup to look after my bees,” he said. Storms destroy the flowers the bees need for food, and falling branches damage the hives. Edwin is one of millions of people around the world vulnerable to the impacts of extreme weather already benefiting from low-cost insurance schemes. But on Tuesday, leaders at the UN climate change summit in Bonn, Germany, revealed a huge leap in ambition: to help protect 400 million poor and vulnerable people around the world by 2020. The project, called the InsuResilience Global Partnership, aims to provide insurance against the damage increasingly being caused by global warming. The issue of climate change impacts is perhaps the most sensitive among the 196 parties negotiating in Bonn, with the potential to explode into a row that derails other issues. Developing nations are adamant that rich nations, who they say caused climate change, should pay for the “loss and damage” that results. This year’s series of huge storms and floods across the world has intensified the debate. The InsuResilience scheme, started in 2015 by the G7, is one response. Patricia Espinosa, the UN’s climate chief, said: “People devastated by recent weather events and communities vulnerable to climatic impacts are looking to the nations meeting in Bonn for an answer. This new, higher ambition initiative represents one shining example of what can be delivered.” “Instead of only reacting to catastrophes we want to shift to planning, preparing and protecting,” said Thomas Silberhorn, a senior official in the German government, which on Monday announced an additional $125m of funding.  The UK donated £30m in July and so far the $550m raised means 160 million people could be covered by 2020. But the scheme, which has now expanded to involve more nations like Ethiopia and Madagascar, insurers including Allianz, Swiss Re and Munich Re and NGOs like Care International, expects to expand to reach the 400 million target. Aiyaz Sayed-Khaiyum, the economy minister of Fiji, which is running the climate summit, said: “When we had cyclone Winston in 2016, 40,000 houses and 225 schools were devastated. We need to be able to get people back quickly to day-to-day living after disaster strikes. But at the moment only 10% of homes in Fiji are insured.” Key to the scheme is slashing bureaucratic assessment and claims procedures. With some, like Edwin’s, , which was set up by the Munich Climate Insurance Initiative, the policy pays out simply when weather data passes trigger points. In September, $55m was paid to 10 Caribbean countries within 14 days of hurricanes Irma and Maria wreaking disaster on the islands. The scheme is also active in Zambia, Paraguay and elsewhere. However, the initiative has been met with suspicion by some delegates in Bonn. “It pushes the poor people of the poor countries to pay the insurance premiums from their limited resources,” an African diplomat told Climate Home. Julie-Anne Richards of the Climate Justice Program said: “The insurance mechanism is a clever initiative of developed countries to pushing the developing countries to pay for climate risk for which they are not responsible.” Gebru Jember Endalew, the Ethiopian chair of the 47-strong Least Developed Countries negotiating bloc at the climate talks, pointed out homes have to be resilient to be insurable at all. “When you go for health insurance, they ask you if you are already ill,” he said. “So first we need to address the vulnerability of infrastructure.” The disagreement about loss and damage could turn ugly, according to Prof John Schellnhuber, at the Potsdam Institute for Climate Impact Research in Germany and who has advised both Angela Merkel and the Pope. “Loss and damage could turn into a bombshell,” he said. But he is optimistic this can be avoided and said disputes over damages were moving into lawsuits in the courts. Silberhorn defended the insurance plan: “It is one tool among many others and it is a very effective tool. It is a different tool to loss and damage.” He said action on cutting emissions and funding adaption must also continue: “Insurance tools do not mean we do not have to change our behaviour.” Taking action like paying the $8 per month insurance premium has been very important to Edwin, who is in Bonn to tell his story: “If we just stay sitting there our bees are going to suffer. It is a very good thing.”"
"Five months ago, Trump quickly cemented his legacy as the country’s worst-ever president by inexplicably starting the process to withdraw from the Paris climate accords. With even war-torn Syria now signing the agreement, the leadership of every world country has announced its intent to tackle the existential threat posed by human-caused climate change, except the United States.  It's the US vs. the rest of the world, as Syria agrees to sign Paris climate accord https://t.co/Q1tkxuiHas pic.twitter.com/hnV2wHmLHL  While this decision may seem puzzling to the rest of the world, the explanation is simple - a study published two years ago found that the Republican Party is the only major political party in the world that rejects the need to tackle climate change, and we know that voters follow elite cues. In 2016, American voters made the terrible mistake of putting that party in charge of the entire federal government, including electing this man president: The concept of global warming was created by and for the Chinese in order to make U.S. manufacturing non-competitive. However, a year later, Americans are already recognizing this error. Trump’s approval rating is around 38%, and has not touched 40% in over six months. Meanwhile, congressional Democrats enjoy an 8–10% lead over their Republican opponents. Those polling results translated into a landslide Democratic victory in the 2017 elections last week. The clearest result came in Virginia’s gubernatorial election, in which Republican candidate Ed Gillespie ran a Trump-like culture war campaign. He also took the standard Trump administration line on climate change, acknowledging only that humans play some undetermined role while supporting America’s withdrawal from the Paris climate accords and opposing all policies to address the problem. Gillespie’s campaign was praised by Trump and Steve Bannon, until he lost the race by 9%.  Last week’s election results showed that Trump has strongly mobilized Democrats to vote, even in off-year elections. In Virginia state House of Delegates elections, Democratic candidates similarly beat their Republican opponents by more than 9% in total votes. However, due to gerrymandering and geographical disadvantages (Democrats tend to cluster in cities), unless recounts change the results of close races, Democrats will only hold 49% of the seats in the Virginia House. That structural disadvantage holds across the country. Estimates are that Democrats need to beat Republicans by 7–8% in overall congressional votes in order to win a bare majority of the seats. With a current lead of 8–10% in the generic congressional ballot, they have a chance to take the House in 2018, depending on what happens over the next year. We saw that same structural advantage hand Trump the presidency in 2016. While he lost the popular vote by over 2% (nearly 3 million votes), Trump won the Electoral College, as was the case in 2000 with Bush v. Gore (Gore won the popular vote by a half million votes). America has a bizarrely unbalanced election system in which people who live in sparsely populated areas (predominantly rural Republicans) are disproportionately represented in the government.  It will take a landslide election for Democrats to overcome that structural disadvantage, but last week’s results demonstrate that Trump and the Republican Party have become so unpopular, it very well might happen in the 2018 and 2020 elections. That would give Democrats the opportunity to undo Republican gerrymandering after the 2020 census. The Supreme Court is also currently considering a critical gerrymandering case. Regarding the presidency, betting markets currently give Trump approximately a 35–40% chance of winning a second term (which seems overly bullish), and Democrats a 55% chance of retaking the White House in 2020. If that happens, the next president can quickly begin reversing the damage the Trump administration has done to American climate policies and its standing in the world. At the UN climate talks in Bonn, the ‘We Are Still In’ coalition of US states, cities, tribes, and businesses has been given a US Climate Action Center. Meanwhile, the US government for the first time doesn’t have a pavilion, and the Trump administration perversely plans to promote fossil fuels and nuclear power in a presentation at the meeting. As Senator Brian Schatz (D-HI) noted, If you show up at a climate conference to talk about coal, you’re likely to be ignored. I think the We Are Still In delegation will get more attention than the executive branch. We’ve gone from the indispensable leader to being the only country not engaged in climate change. Many people in Congress are troubled not only from a climate standpoint but a geopolitical standpoint. China is happy to take that leadership from us. Indeed, China is stepping into the global leadership role that the United States has shrunk from under Trump’s “America First” platform. Chinese carbon pollution is approaching a peak 15–20 years ahead of schedule, and its leaders relish the opportunity to take America’s place as a global leader. Americans embrace the notion that their country is the greatest in the world. But what does it say that the United States is the nation that is responsible for the largest fraction of overall carbon pollution and global warming over the past 200 years, and is the only country in the world that refuses to take steps to address the existential threat we created? That lack of responsibility and willingness to protect the well-being of future generation is not the behavior of a great nation. However, that is almost exclusively a Republican Party position, and the party and its president are currently supported by fewer than 40% of Americans. Most of its leaders seem unwilling to reverse the party’s slide toward anti-climate culture wars-based isolationism, but with accelerating climate change and a growing population of non-whites, these are positions that will cost them elections. As we saw last week, the ‘Trump base’ is relatively small, and structural advantages won’t be enough to withstand landslide elections. America’s withdrawal from the Paris climate agreement won’t take effect until the day after the 2020 elections. The next president can quickly reverse that withdrawal, making America the last country to sign on, but resuming its global leadership role. While the Trump administration has exceeded everyone’s fears in its anti-environment, anti-climate actions, the damage is temporary. While the American majority fights to wrest control of its government away from the isolationist climate-denying minority, the rest of the world (literally) is moving forward to tackle this problem."
