"The National Aeronautics and Space Administration’s mission to land on an asteroid and its Earth science division both drew angry criticism from lawmakers on Thursday, as administrator Charles Bolden defended the agency on Capitol Hill. At a House hearing on Nasa’s 2016 budget, space subcommittee chairman Lamar Smith criticized what he called “the disproportionate increase” in funding for Earth science research, saying that over eight years almost $2bn had been added to its budget. Smith and other Republicans argued that Nasa should not devote so many resources to studying the climate when it could work on space.  “There are 13 other agencies involved in climate-change research, but only one that is responsible for space exploration,” Smith said. “The administration continues to starve Nasa’s exploration programs to fund a partisan environmental agenda. Nasa simply deserves better.” Bolden, a retired marine corps general and former astronaut, defended the division, saying: “Nasa since its inception has responsibility for exploring the universe and also taking care of Earth, my favorite planet.”  When representative Mo Brooks asked whether Bolden would support moving Earth science research under the purview of the Environmental Protection Agency (EPA), saying “Nasa is ‘aeronautics and space’, not ‘Earth science’,” Bolden balked.  “There’s no ‘s’ in Nasa for ‘science’ and some think we shouldn’t do science, but that’s absurd,” Bolden said. The administrator bluntly denied that increased funding for Earth sciences came at the expense of other divisions. “We do not divert money from human exploration and science,” he said. Republicans have made a concerted effort to drain funding from government research into climate change, directing most of their wrath toward the EPA, which they argue handcuffs business. While most Republicans support Nasa generally, they have recently taken aim at its Earth science program, which studies rising ocean temperatures, pollution and levels of carbon dioxide in the atmosphere, among other areas. In March, Ted Cruz, chair of the Senate committee that oversees Nasa, sparred with Bolden over the program, saying: “I am concerned that Nasa in the current environment has lost its full focus on that core mission.” Bolden replied: “It is absolutely critical that we understand Earth’s environment, because this is the only place we have to live.”  Bolden also testifed to the same Senate committee on Thursday. He was grilled by senators incensed about whether bases in their states might lose funding in the coming year.  Democrat Barbara Mikulski became particularly curt, pressing Bolden to keep Goddard Space Flight Center – in her state, Maryland – in business. “Satellites are on my mind,” Mikulski said, alluding to Goddard’s satellite servicing program, “and I would like that in the budget.” Bolden caught himself in the middle of an exasperated protest.  “I was about to get cute,” he said.  “Don’t,” Mikulski shot back. Eventually, Bolden accepted the senators’ complaints. “I don’t want you to think that I’m satisfied because I’m not,” he said. The first objective of Nasa’s charter, as laid out by Congress, is “the expansion of human knowledge of the Earth and of phenomena in the atmosphere and space”. House Republicans also criticized Nasa for its “asteroid redirect mission” (ARM), which has the objective of eventually tearing a boulder off an asteroid and placing it in orbit around the moon, where it could then be studied. Smith called the mission “uninspiring”. Representative Steven Palazzo said Nasa had failed to explain a cost, timeline, plan or even justification for the mission. Bolden defended the asteroid mission by saying it was both a step on the path to Mars and an opportunity to “inform our ability to deflect asteroids”. Asked why he had ignored recommendations about the program, he said: “I believe in constancy of purpose.” He was then forced to defend Nasa’s inchoate plans for a manned mission to Mars and did not satisfy the lawmaker’s demands for a “roadmap” for that mission or ARM.  A final point of tension was US reliance on Russian space shuttles to send astronauts to the International Space Station (ISS). Brooks said that since the American shuttle program was cancelled – omitting that it was president George W Bush who scheduled its end – “the US hitches rides from Russia, we are no longer preeminent space program”. Bolden argued that so long as Congress provides funding, the missions will launch from US soil again in 2017, and Nasa will “stop writing checks to the Russian space agency”. Pressed for a backup plan should Russia stop allowing Americans to join its launches, Bolden was stymied – although he did point out that Russia does not want to bar Americans from the ISS and had shown no sign it would do so. The lawmakers however harped on a joke tweeted by the Russian deputy prime minister Dmitry Rogozin last year, about American astronauts reaching the ISS “using a trampoline”. Representative Dana Rohrabacher, who has elsewhere argued in defense of Russia, suggested the US should outsource a mission to Mars to a private contractor, like SpaceX.  Bolden countered that “no commercial company is going to independently go to Mars without support of government”, and said that relying on a private company would slow the mission."
"It’s known as “single study syndrome”. When a new scientific paper is published suggesting that the climate is relatively insensitive to the increased greenhouse effect, potentially modestly downgrading the associated climate change threats, that sort of paper will generally receive disproportionate media attention. Because of that media attention, people will tend to remember the results of that single paper, and neglect the many recent studies that have arrived at very different conclusions.  For example, there have been several recent studies finding that the global climate models that most accurately simulate observed changes in clouds and humidity over the past 10–15 years also happen to be the ones that are the most sensitive to the increased greenhouse effect. For example, a 2012 paper by Kevin Trenberth and John Fasullo concluded, These results suggest a systematic deficiency in the drying effect of either subsident circulations or spurious mixing of moister air into the region in low-sensitivity models that directly relate to their projected changes in cloud amount and albedo … the results strongly suggest that the more sensitive models perform better, and indeed the less sensitive models are not adequate in replicating vital aspects of today’s climate. A 2014 paper led by Steven Sherwood took a similar approach with similar results. The paper concluded,  The mixing inferred from observations appears to be sufficiently strong to imply a climate sensitivity of more than 3 degrees for a doubling of carbon dioxide. This is significantly higher than the currently accepted lower bound of 1.5 degrees, thereby constraining model projections towards relatively severe future warming. Another 2014 paper published by scientists from CalTech and UCLA arrived at a similar conclusion, as lead author Hui Su explains, This study used an index that represents how models capture the observed spatial structure of the Hadley Circulation and associated humidity and cloud distributions. We showed that the inter-model spread in climate sensitivity and cloud feedback is closely related to models’ Hadley Circulation change and present-day circulation strength varies systematically with models’ climate sensitivity (Figure 9). The stronger Hadley Circulation in the models, the higher climate sensitivity the models have (Figure 10). The observed circulation strength is on the high end of the modeled ones. Clouds are a key to determining the Earth’s climate sensitivity. We know that by itself, a doubling of the amount of carbon dioxide in the atmosphere will cause about 1.2°C global warming. A warmer atmosphere will hold more water vapor, and as another greenhouse gas, we know that increase in water vapor will roughly double that carbon-caused warming (a “positive feedback”). We also know of some other significant positive feedbacks, like melting ice decreasing the reflectivity of the Earth’s surface, causing it to absorb more energy from the sun. Those who argue that the Earth’s climate is relatively insensitive to the increased greenhouse effect need a big negative feedback to offset those factors we know amplify global warming. Clouds represent the only such plausible mechanism, because we don’t have a very good grasp on how different types of clouds will change in a hotter world. For example, climate scientist contrarian Richard Lindzen came up with what’s known as the “iris hypothesis” in 2001, suggesting that in a warmer world, high cirrus clouds will contract like the iris on an eye to allow more heat to escape. That hypothesis has not withstood the test of time, however, with four studies published within a year of Lindzen’s paper effectively refuting the hypothesis. One recent paper found that even if the iris effect is real, it would reduce the Earth’s climate sensitivity by no more than 20%, still well within the range of possible values outlined by the IPCC. Not only have the aforementioned studies found that changes in humidity and clouds are consistent with simulations from more sensitive climate models, but previous research led by Andrew Dessler and more recently by Kevin Trenberth and colleagues has shown that observed changes in water vapor amplifying global warming as expected, and that clouds are thus far acting to weakly amplify global warming. These observations are inconsistent with the strong cloud dampening effect contrarians need to justify arguments for low climate sensitivity. There have been a few recent studies using what’s called an “energy balance model” approach, combining simple climate models with recent observational data, concluding that climate sensitivity is on the low end of IPCC estimates. However, subsequent research has identified some potentially serious flaws in this approach. These types of studies have nevertheless been the focus of disproportionate attention. For example, in recent testimony before the US House of Representatives Committee on Science, Space and Technology, contrarian climate scientist Judith Curry said, Recent data and research supports the importance of natural climate variability and calls into question the conclusion that humans are the dominant cause of recent climate change: … Reduced estimates of the sensitivity of climate to carbon dioxide Curry referenced just one paper (using the energy balance model approach) to support that argument – the very definition of single study syndrome – plus an interpretation of a second paper whose author objected, saying,  others have used my findings to suggest that Earth’s surface temperatures are rather insensitive to the concentration of atmospheric CO2. I do not believe that my work supports these suggestions, or inferences. As fond as I am of my own ideas, one should resist concluding too much, too soon, from a single study. True skepticism requires considering all available evidence. While some studies suggest that climate sensitivity is on the low end of the estimated range, other studies suggest it’s on the high end. As Andrew Dessler told me, There certainly is some evidence that climate sensitivity may be below 2°C. But if you look at all of the evidence, it’s hard to reconcile with such a low climate sensitivity. I think our best estimate is still around 3°C for doubled CO2. Ultimately when we consider all the available scientific evidence and risk management principles, there’s no case to be made for delaying action to curb global warming. Update: yet another paper has just been published finding that the models that most accurately simulate the observed changes in the Earth’s atmosphere are the ones that are most sensitive to the increasing greenhouse effect. "
"Marion Coutts, winner of the Wellcome book prize, has given her full support to the Guardian’s climate change campaign asking the Wellcome Trust health charity to sell off its large investments in fossil fuels. “I support your campaign in every way,” she told the Guardian, after Wednesday evening’s prize ceremony. “We need to think very carefully about how we live and about how we manage our resources. We are clearly not doing things very well at the moment.” More than a dozen other writers and judges honoured by the Wellcome Book prize since 2009 have also backed the campaign, including the chair of the 2014 judges, Sir Andrew Motion. “The Wellcome Trust does magnificent work in all sorts of ways, but its investment in fossil fuels contradicts many of its own policies. By divesting from fossil fuels it would show leadership in keeping with its reputation and ideals,” said Motion. The Wellcome prize, worth £30,000, is for fiction or non-fiction books with a medical or health theme and was awarded to a “delighted” Coutts for her memoir on art, work, death and language, The Iceberg. The book is “wise, moving and beautifully constructed,” said Bill Bryson, the chair of the 2015 judges. At the ceremony in London, Bryson referred to the fossil fuel divestment campaign with a joke, asking just before announcing the winner: “I know there is just one thing you want to hear from me: ‘Am I heavily invested in fossil fuels?’” A series of analyses have shown that existing fossil fuel reserves are several times greater than can be burned if the world’s governments are to fulfil their pledge to keep global warming below the danger limit of 2C. But coal, oil and gas companies continue to spend billions on finding new reserves. A fast-growing divestment movement, supported by the UN and Nobel prize winners, argues that fossil fuel investments are a threat to both the climate and health and also to investors, as action to combat climate change could render the fuel reserves worthless. In 2009, University College London and the Lancet published a report concluding that global warming is the biggest threat to global health in the 21st century. The Wellcome Trust, which considers “climate change to be one of the greatest contemporary challenges to global health”, is the world’s second largest non-governmental funder of medical research, dispensing £727m in grants in 2014. It was a co-founder of the Human Genome Project; it has funded pioneering work on cancer and malaria; and it has been at the forefront of the fight against Ebola. The Guardian campaign calls on Wellcome and the world’s biggest health charity, the Bill and Melinda Gates Foundation, to join over 180 institutions that have already divested from fossil fuels. The Guardian Media Group announced earlier in April that it will divest its £800m fund, the largest to date to sell off all fossil fuels. A Wellcome Trust spokesperson said: “Reducing carbon emissions is of crucial importance, but there are differing views as to how this is best achieved. The network of people with whom the Wellcome Trust enjoys relationships is broad and it would be surprising if this community did not contain a diversity of opinion about fossil fuel investments. We believe engagement rather than divestment gives us the best opportunity for change.” Coutts said: “It has always been a thing that people say – ‘it is better to be inside the camp than outside it’ – but that is not necessarily effective. People can put their money into projects which reflect the current [climate] crisis: humans are eternally inventive.” In 2014, the Wellcome Trust’s £18bn endowment included over £450m invested in the fossil fuel majors Shell, BP, Rio Tinto and BHP Billiton alone."
"It is popularly viewed as one of the greatest environmental success stories of modern times. Exactly 30 years ago, UK scientists announced they had discovered a hole in the ozone layer in the atmosphere above Antarctica. The hole threatened to spread, allowing increased levels of cancer-causing radiation from the sun to reach the ground. Within a few years of the discovery it was agreed to set up the Montreal Protocol, which banned the manmade chemicals responsible for depleting ozone in the upper atmosphere.  But last week, one of the three UK scientists who discovered the hole in 1985 warned that the real lessons of the story had still not been learned. “Yes, an international treaty was established fairly quickly to deal with the ozone hole, but really the main point about its discovery was that it shows how incredibly rapidly we can produce major changes to our atmosphere and how long it takes for nature to recover from them,” said Jon Shanklin of the British Antarctic Survey. “Clearly, we still do not understand the full consequences of what we did then because we are still inflicting major changes on the atmosphere. Then it was chlorofluorocarbons; today it is greenhouse gases.” In 1985, Shanklin was working – “as a general dogsbody” as he put it at the British Antarctic Survey, along with colleagues Brian Gardiner and the late Joe Farman. At the time, there was some speculation that spray cans and supersonic jets such as Concorde might be damaging the upper atmosphere’s ozone layer that protects us from the sun’s ultra-violet radiation. Using a device developed in the 20s, the Dobson Ozone Spectrophotometer, the three analysed amounts of ozone in the atmosphere over the Antarctic. “I was the backroom boy who calibrated the Dobson and fed results from it into our very primitive computer,” said Shanklin. The results revealed major changes in ozone levels over the Antarctic at certain times of the year, but at first the team could see no pattern. “We thought it might just be random fluctuations. Then I did a really careful calibration and found a pattern: every spring a major hole appeared in the ozone layer over the Antarctic, one that was getting bigger and bigger each year. It was Joe [Farman] who worked out that the hole was being created by chemicals called chlorofluorocarbons that were reacting with the ozone.” The team published their results in Nature in May 1985 and their research was later backed by Nasa who used their satellites to confirm the ozone hole’s existence. Other researchers later confirmed that CFCs were the likely culprits and within a couple of years the Montreal agreement led to the banning of the production of CFCs, an example of exceptional international co-operation according to former UN secretary-general Kofi Annan, who has since described it “as the single most successful international agreement to date”. But it was relatively easy to find a substitute for the CFCs – then widely used for refrigeration – that were causing ozone depletion, Shanklin pointed out, and that in turn made it fairly straightforward to establish the Montreal protocol. “We forget that 25 years later there is, in strict scientific terms, no statistically significant recovery in ozone over Antarctica, although there a few signs of improvement,” said Shanklin, who is now 61. “The CFCs we put up there will take a long time to dissipate and it will probably take us well into the second half of the century before the ozone layer recovers fully.” Thus a relatively easily cured atmospheric affliction will still take decades to be corrected. By contrast, the greenhouse gases we are now putting into the atmosphere have no substitutes that have broad political acceptance at present. For good measure, we are also pumping them out on a far greater scale. “The ozone hole story tells us that it is very easy to cause major changes to the atmosphere – it only took about 10 years to develop – but it is very difficult to restore equilibrium,” said Shanklin. “Unfortunately, we don’t seem to have learned that lesson. We are burying our heads in the sand about the changes we’re bringing about. On the other hand, carbon emissions are now on the political agenda, so there is some hope.”"
"The Abbott government approached the University of Western Australia to establish a policy centre headed by Danish climate contrarian Bjørn Lomborg, a spokesman for the university has said, contradicting claims by the federal education minister, Christopher Pyne. A spokesman for UWA told Guardian Australia that the government suggested the Australian Consensus Centre in the second half of last year.  “I can confirm that the university was approached by the federal government,” he said.  That contradicts an earlier claim made by a spokesman for Pyne, who said last week that the proposal for an Australian Consensus Centre was put forward by the “university and Dr Lomborg’s organisation”. The genesis of the centre is not the only area of disagreement between Pyne’s office and the university. A spokesman for Pyne told Guardian Australia on Friday that the $4m funding the federal government would provide was “around a third of the total cost” of running the centre, and that the university would also provide support.  But in a statement posted on its website on Monday, UWA said it would only be providing in-kind support and that financial support would be drawn from corporate sponsors, which the centre would seek to attract, and government grants. “UWA is not providing cash support for the ACC (Australian Consensus Centre) or its projects,” the statement said. “The ACC will always operate within its means and will only undertake additional work beyond the Australia Consensus program funded by the Australian government if external funding is forthcoming.” UWA said the funding target, including its in-kind support, was $13m. If it receives additional funding, the centre will “undertake a broader program of activities” to be determined by its financial partners and approved by the board. The centre is modelled on Lomborg’s Copenhagen Consensus Centre, which was defunded by the Danish government in 2012 and is now based in the US and reliant on private funding. Lomborg, who accepts that climate change is manmade but is famous for saying the challenge it poses has been overstated, told the Freakonomics podcast last year that the centre’s position on climate change was one of the reasons it lost its funding, and it was looking for a “long-term solution”. “One of the things that the Danish government did not like was that we said, ‘Yes, global warming is real, it is a challenge, but the typical way that we solve it turns out to be a pretty poor investment of resources,’” he said. “When there was a change of governments here, we went from a centre-right to a centre-left government, they actually cut off our funding.” UWA’s description of the centre does not specifically mention climate change. It says the centre will apply “an economic lens to proposals to achieve good for Australia, the region and the world, prioritising those initiatives which produce the most social value per dollar spent”. Students at UWA have called on the vice-chancellor not to accept federal government funding for the centre, saying it is “politically motivated.”  Fairfax Media reports that UWA’s academics are also “disgruntled” at the decision to fund the centre amid other cuts, and says leaked talking points circulated to academics by the university’s administrative wing state that the university didn’t plan to spend any money on the centre. The Australian Consensus Centre was announced just a few weeks after UWA confirmed it had defunded its award-winning centre for water research, claiming it was “unsustainable”. The West Australian reports that the centre’s founder, Prof Jörg Imberger, had been stood down pending a misconduct investigation since November and was told this month that he had been demoted."
nan
