url,title,author,date,tags,text
https://www.breitbart.com/middle-east/2019/08/12/in-wake-of-f-35-snub-turkey-mulls-purchase-of-russian-su-35-report/,Report: Turkey Mulls Purchase of Russian Su-35 after U.S. Nixes F-25 Deal,Deborah Danan,2019-08-12,defense,"

 **TEL AVIV – After the U.S. announced last month that it wouldnot sell Turkey F-35s due to Ankara’s procurement of the Russian-made S-400 missile defense system, Turkish authorities are now considering buying Russian Su-35 fighter jets, a Turkish daily reported Sunday.**



According to _Yeni Safak_ , the country’s Presidency of Defense Industries (SSB), Turkish Air Force Command and other relevant authorities have been asked to investigate the possibility of purchasing the Russian jets.



Turkish officials have yet to comment on the report.



According to Russian news site Sputnik, Russia’s state-controlled arms agency Rosoboronexport offered to sell Su-35 fighters to Ankara.



The U.S. stopped Turkey’s F-35 program due to the belief that the country’s purchase of the Russian missile defense system risks the security of NATO members and constitutes a clear violation of a 2017 law threatening sanctions for any purchase of sophisticated Russian technology — the Countering Russian Influence in Europe and Eurasia Act of 2017.



The White House at the time said, “The F-35 cannot coexist with a Russian intelligence collection platform that will be used to learn about its advanced capabilities.”



Russia’s S-400 is considered one of the most advanced air-defense systems in the world.



At the time of the purchase, President Donald Trump blamed the Obama administration for never reaching a deal to sell a comparable American missile defense system to Turkey.



“Because they have a system of missiles that’s made in Russia, they’re now prohibited from buying over 100 planes,” Trump said of Turkey during a Cabinet meeting. “I would say that (F-35 manufacturer) Lockheed isn’t exactly happy. That’s a lot of jobs. And frankly I’ve always had a very good relationship” with Turkish President Recep Tayyip Erdoğan.



Trump said the decision to ban F-35 sales was one he was making reluctantly, as the F-35 is the world’s largest defense program and has already generated $12.9 billion worth of orders.



“We are now telling Turkey that because you have really been forced to buy another missile system, we’re not going to sell you the F-35 fighter jets,” the president said. “It’s a very tough situation that they’re in and it’s a very tough situation that we’ve been placed in, the United States. With all of that being said, we’re working through it, we’ll see what happens. But it’s not really fair.”



“Because of the fact he bought a Russian missile, we’re not allowed to sell him billions of dollars worth of aircraft. It’s not a fair situation,” Trump added.



Speaking to Turkish ambassadors in Ankara last week, Erdogan slammed the U.S.’s accusation that the purchase of the S-400s put Turkey’s commitment to NATO into question.



“There is no concrete evidence showing the S-400s will harm the F-35s or NATO, nobody should deceive each other. Many NATO member states have purchased from Russia. We don’t see this being turned into a crisis,” Erdogan said, according to Reuters.
"
https://www.breitbart.com/politics/2019/07/02/james-clapper-previously-conceded-obama-admin-hardened-north-koreas-nuclear-positions/,James Clapper Previously Conceded Obama Admin Hardened North Korea’s Nuclear Positions,Aaron Klein,2019-07-02,defense,"

NEW YORK — James Clapper, who served as director of national intelligence for Barack Obama, has been making the rounds in the news media downplaying the prospect of President Donald Trump achieving a breakthrough in nuclear talks with North Korea.



Clapper left out how in his own recently published book, he admitted the Obama administration’s military campaign that brought about the downfall of Libya’s Muammar Gaddafi likely served as a lesson for Iran and North Korea not to give up their own nuclear programs. Gaddafi in 2003 voluntarily agreed to give up his decades-old nuclear weapons program and opened the country to nuclear inspectors.



“I personally don’t believe the North Koreans have long term any intent to denuclearize,” Clapper said on CNN when asked about Trump’s meeting with Kim Jong-un. “Why should they? It’s their ticket to survival, and they’re just not going to do that.”



Clapper made similar remarks to NPR, lecturing: “Demanding that the North Koreans give up what they consider is fundamental to their national survival has not proven real profitable, if you will, for this administration or previous administrations. So perhaps another approach might be in order.”



In his book, _Facts and Fears: Hard Truths from a Life in Intelligence_ , Clapper explains the Obama administration’s actions to depose Gaddafi as part of the so-called Arab Spring and despite the Libyan strongman’s disarmament may have hardened the positions of Iran and North Korea, making those countries less likely to agree to nuclear disarmament.



Clapper wrote (emphasis added):



As someone whose fingerprints were on the faulty National Intelligence Estimate that led the United States to invade Iraq, I certainly knew we were fallible, and as someone who’d helped fight the forces of chaos unleashed after we’d removed Saddam Hussein and Muammar Gaddafi from power, I was well aware that the actions we took from initial good intentions could have horrific unintended consequences.



…



Nine days after the hearing, with a UN resolution in hand, the US military began taking out Libyan air defenses, first with cruise missiles, and then with escorted bombing runs. With help from the British, French, and Canadian air forces, and drawing on targets identified by multinational intelligence efforts, the US military established a safe no-fly zone in four days and turned the mission over to NATO control. Gaddafi pleaded for the United States and then NATO to stop the attacks, citing his cooperation with weapons inspectors, his voluntary disarmament of his nuclear program, and his restraint from using chemical weapons in his current civil struggle. It was far too late, and no one in the West paid attention. **However, I believe North Korea and Iran took careful note of what happens when you give up your nuclear program, and Bashar al-Assad in Syria saw what happens to dictators who show restraint.**



 ** _Aaron Klein is Breitbart’s Jerusalem bureau chief and senior investigative reporter. He is a New York Times bestselling author and hosts the popular weekend talk radio program, “Aaron Klein Investigative Radio.” Follow him on Twitter @AaronKleinShow. Follow him on Facebook._**



 ** _Joshua Klein contributed research to this article._**
"
https://www.breitbart.com/middle-east/2019/07/01/15-said-killed-during-israeli-airstrikes-on-iranian-sites-in-syria/,Reports: 16 Killed as Israeli Strikes Hit Iranian Targets in Syria,Deborah Danan,2019-07-01,defense,"

 **TEL AVIV – At least 16 people were killed, including six civilians — one of whom was an infant — and 21 others wounded during an alleged Israeli airstrike on Iranian targets in Syria, Syrian sources reported on Monday.**



It was not immediately clear if they were killed by the strikes themselves or by Syrian anti-aircraft fire, war monitor the Syrian Observatory for Human Rights (SOHR) said. It added that several Hezbollah fighters and other Iranian-backed foreign forces were also killed in the strikes, which occurred near Homs and Damascus.



Among the targets were a headquarters for Iran’s Islamic Revolutionary Guard Corps forces, a research center near Homs, an airbase, a Hezbollah arms depot near the border with Lebanon, and a scientific research center in Jamraya that doubled as a weapons warehouse.



It was the third time Israeli airstrikes reportedly hit the facility, with strikes reported in 2013 and most recently in February 2018.



“A military source said that the army air defenses confronted hostile missiles launched by Israeli warplanes at midnight from Lebanese airspace towards some of our military sites in Homs and the surroundings of Damascus,” the state-run SANA news agency reported.



The report said Syria’s air defense had intercepted several missiles.



In keeping with its policy of silence surrounding strikes in Syria, Israel did not comment on the attacks, which were said to be the most widespread yet.



The al-Mezzeh airbase, which houses the air force intelligence service and its prison, was also targeted in the strikes, local media reported.



A Syrian anti-aircraft missile also crashed north of Nicosia in northern Cyprus, causing a large fire.



The strikes came hours after an Israeli satellite company released images it said showed that Syria’s S-300 air defense system was fully operational.



ISI #satellite image from #today shows: the fourth S-300 launcher in #Masyaf, #Syria, erected.#IMINT #VISINT #intelligence #satellite #s300 #Turkey #Russia #ISI #snaptasking pic.twitter.com/ciZeTBwWyr



— ImageSat Intl. (@ImageSatIntl) June 30, 2019



The strikes have raised doubts as to the effectiveness of the Russian-made S-300.



Israel has in the past warned that it would destroy the S-300 system if it is used against its warplanes.


"
https://www.breitbart.com/middle-east/2019/06/30/syria-at-four-killed-as-israeli-jets-strike-near-damascus/,Syria: At Least Four Killed as Israeli Jets Strike near Damascus,Breitbart Jerusalem,2019-06-30,defense,"

(Reuters) – Israeli warplanes fired missiles targeting Syrian military positions in Homs and the Damascus outskirts in an attack that killed at least four civilians and wounded another 21, Syrian state media said.



The Syrian military said Syrian air defences had confronted the attack, which was launched from Lebanese airspace.



An Israeli military spokeswoman, asked about the report, said: “We don’t comment on such reports.”



…



State news agency SANA said an additional 21 people had been wounded. SANA also reported that Syrian air defences had brought down a number of the missiles.



Read the full report here.
"
https://www.breitbart.com/middle-east/2019/06/16/golan-heights-town-named-trump-heights-in-honor-of-presidential-order-recognizing-israeli-sovereignty/,Netanyahu Inaugurates ‘Trump Heights’ Honoring President’s Recognition of Golan,Deborah Danan,2019-06-16,defense,"

 **TEL AVIV – Prime Minister Benjamin Netanyahu on Sunday inaugurated a new town in the Golan Heights named after President Donald Trump in recognition of his formal recognition of Israel’s sovereignty over the strategic plateau.**



The town, which has yet to be built, was named Ramat Trump, Hebrew for Trump Heights.



“This is a historic day,” Netanyahu said. “We are about to approve construction of a new town in the Golan, something that hasn’t happened in quite a long time … and we’ll be honoring a great friend of Israel, President Donald Trump, who recently recognized Israeli sovereignty over the Golan, the first foreign leader to do so.”



Earlier on Sunday, the cabinet held its weekly meeting in the Golan town of Kela Alon to formally approve the new community named for Trump.



Joining Netanyahu at the cabinet meeting and the subsequent naming ceremony, U.S. Ambassador to Israel David Friedman thanked Netanyahu for the “extraordinary gesture.”



“It is well-deserved, but much appreciated. We look forward to working with you and with the Government of Israel to continue to strengthen the unbreakable alliance between the United States and Israel.”



Later, Friedman lauded Trump as an Israeli hero.



“We all checked the history book … it almost never happens anywhere in the world that an entire community is dedicated in the name of a sitting president,” he said.



“President Trump will be honored to be in that small cadre of Israeli heroes,” he added.



“My only regret is that neither the president nor I are in the real estate business any more, because if we were, I’m sure this would be high on our list for places that we would think about developing.”



Trump’s March decision to recognize Israeli sovereignty over the Golan Heights came in the wake of what he said were “aggressive acts by Iran and terrorist groups, including Hezbollah, in southern Syria [that made] the Golan Heights a potential launching ground for attacks on Israel.”



In April, Netanyahu vowed to name a community in his honor.



“All Israelis were deeply moved when President Trump made his historic decision to recognize Israel’s sovereignty over the Golan Heights,” Netanyahu said at the time.



“I intend to bring to the government a resolution calling for a new community on the Golan Heights named after President Donald J. Trump.”



However, Sunday’s inauguration was slammed by critics as little more than a publicity stunt.



“What does a successful PR campaign look like? Exactly like this,” Blue and White MK Zvi Hauser said.



“Anyone who reads the fine print in this ‘historic decision’ will understand that it is nothing more than a non-binding fake policy. There is no budgeting, no planning, no location for settlement, and there is not really a binding decision to implement the project. But the main thing was that they insisted on deciding on a name for the dummy community,” he added.




"
https://www.breitbart.com/politics/2019/06/13/mccabe-confirms-some-fbi-employees-frustrated-no-charges-brought-against-hillary-clinton/,McCabe Confirms Some FBI Employees ‘Frustrated’ No Charges Brought Against Hillary Clinton,Aaron Klein,2019-06-13,defense,"

NEW YORK — Former acting FBI director Andrew McCabe lent some credibility to a previous White House claim that some FBI personnel were upset over the agency’s decision, under the leadership of disgraced ex-FBI Director James Comey, not to charge Hillary Clinton in the criminal probe of her private email server use.



The claim that some FBI rank-and-file workers lost confidence in Comey following his infamous press conference announcing that no charges would be brought has been in dispute.



Yet in largely unreported testimony before the House Judiciary Committee on December 21, 2017, McCabe confirmed that some FBI personnel were “surprised” and “frustrated” with the result of the Clinton email case as announced by Comey. A transcript of McCabe’s testimony was released three weeks ago by House Judiciary Committee Ranking Member Doug Collins, R-Ga.



On July 5, 2016, at the height of the presidential campaign, Comey held a notorious press conference during which he bypassed Justice Department tradition by unilaterally declaring that “no charges are appropriate” in the case of Clinton’s private email server. It is not the role of the FBI to make such pronouncements.



In his testimony, McCabe clarified that he was “not aware” of sentiments expressing disappointment or surprise from within the small unit that specifically investigated Clinton’s email case. But he stated several times that there was negative sentiment about Comey’s decision within the larger FBI.



“I am not aware of those sentiments within the team,” MCcCabe said. “But I am aware that the outcome of the case was surprising, and maybe frustrating to many people, including some of the people who work for the FBI.”



Asked what those FBI employees were surprised about, McCabe replied, “I think, like many people around the country, they were surprised by the result in the case and the fact that we were not recommending pursuing charges.”



“When I say surprise,” he added, “I’m talking about people who heard the Director’s statement on July 5 and were frustrated with that result, not people who were engaged in the investigation or the prosecutors across the street at the Department of Justice.”



McCabe was asked to respond to a November 2016 statement from Trump confidante Rudy Giuliani that he had heard from other former FBI agents “there’s a revolution going on” inside the agency over the decision not to charge Clinton.



“I am not aware of a revolution,” McCabe replied before going on to once again concede that some FBI agents were indeed surprised and possibly frustrated.



“As I said, there was certainly FBI personnel who were surprised and maybe frustrated by that result,” McCabe continued. “Director Comey spent a lot of time, in the months following his announcement, you know, in visits to field offices and interactions with retired agents’ groups, and things like that, answering a lot of questions about why we had done what we had done.”



The White House official who took the most flack for saying that FBI agents were upset over the case was undoubtedly White House press secretary Sarah Huckabee Sanders, who made a statement to that effect to reporters on May 10, 2017.



“Most importantly, the rank-and-file of the FBI had lost confidence in Comey,” she said, discussing Comey’s loss of credibility. “We’ve heard from countless members of the FBI that say very different things.”



According to the final report from Special Counsel Robert Mueller’s office, Sanders walked back some of those statements.



Reads the report: “Sanders told this Office that her reference to hearing from ‘countless members of the FBI’ was a ‘slip of the tongue.’”



“She also recalled that her statement in a separate press interview that rank-and-file FBI agents had lost confidence in Comey was a comment she made ‘in the heat of the moment’ that was not founded on anything,” the report continued.



After the release of Mueller’s report, Sanders went on Fox News where she maintained that the claim about disgruntled FBI agents over the Clinton email case was “not untrue.”



“I acknowledge that I had a slip of the tongue when I used the word ‘countless,’ but it’s not untrue,” she said, explaining that she meant to convey that “a number of both current and former FBI agents agreed with the president. James Comey was a disgraced leaker who tried to politicize and undermine the very agency he was supposed to run.”



In the wake of the Mueller report’s release, CNN political analyst April Ryan went so far as to call for Sanders to be fired over her statements about FBI agents.



“Not only does she not have any credibility left, she lied,” Ryan claimed. “She outright lied and the people, the American people, can’t trust her. They can’t trust what’s said from the president’s mouthpiece, spokesperson, from the people’s house.”



“Therefore, she should be let go; she should be fired; end of story,” Ryan stated. “When there is a lack of credibility there, you have to start … lopping the heads off. It’s ‘Fire me Thursday’ or ‘Fire me, Good Friday.’ She needs to go.”



In October 2016, the Daily Caller reported that some FBI agents were frustrated with Comey’s leadership following the Clinton email probe conclusion.



“This is a textbook case where a grand jury should have convened but was not. That is appalling,” one FBI special agent who has worked public corruption and criminal cases was quoted as saying in a transcript obtained by the Daily Caller. “We talk about it in the office and don’t know how Comey can keep going.”



 ** _Aaron Klein is Breitbart’s Jerusalem bureau chief and senior investigative reporter. He is a New York Times bestselling author and hosts the popular weekend talk radio program, “Aaron Klein Investigative Radio.” Follow him on Twitter @AaronKleinShow. Follow him on _****_Facebook._**



 ** _Joshua Klein contributed research to this article._**
"
https://www.breitbart.com/politics/2019/06/12/watch-live-president-trump-and-polish-president-hold-press-conference/,Watch Live: President Trump and Polish President Hold Press Conference,Michelle Moons,2019-06-12,defense,"

President Donald Trump and Polish President Andrzej Duda are holding a joint press conference in the White House Rose Garden Wednesday.



The two leaders held a midday bilateral meeting before an expanded working lunch and a joint signing ceremony. The two are then schedule for a joint press conference at 2:15pm.



A senior administration official previewed the visit on Tuesday with word that discussions will involve a high-level delegation and center primarily around matters of security. The goal is to deepen security partnership between the two nations in line with NATO goals and planning. The official emphasized that this falls in line with a pattern of meetings at a high-level with Central European leaders.



Poland was identified in Tuesday’s briefing as key as the nation has demonstrated a commitment to bearing the burden of their own security in the region, particularly meeting their two percent NATO defense spending goal.



The senior official described the meeting as historic, 80 years after the beginning of WWII, 30 years after communist rule in Poland, and 20 years since the nation joined NATO.



Another senior administration official added that the meetings will also highlight expanded trade relationships, energy partnerships, people-to-people contacts, and cultural relations.



Acting Secretary of Defense Patrick Shanahan hosted his counterpart from Poland Tuesday at the Pentagon, according to one of the officials.



 _Michelle Moons is a White House Correspondent for Breitbart News — follow on Twitter_ _@MichelleDiana_ _and_ _Facebook_
"
https://www.breitbart.com/middle-east/2019/05/18/syrian-tv-claims-israeli-missiles-targeted-sites-near-damascus/,Syrian TV Claims Israeli Missiles Targeted Sites near Damascus,Breitbart Jerusalem,2019-05-18,defense,"

The Times of Israel reports: Syrian state media on Friday evening said that Israel launched a strike against targets near Damascus and claimed the country’s air defenses downed a number of missiles.



“Aerial defenses detected hostile targets coming from the direction of Quneitra and dealt with them,” the official SANA news agency quoted a military source saying, referring to a Syrian town in the Golan Heights bordering Israel.



תיעוד מתוך שידורי הטלוויזיה הסורית של ה""גופים הזוהרים"" שלטענתם הגיעו מכיוון ישראל @Generalzini pic.twitter.com/l5teJD95os



— החדשות 13 (@newsisrael13) May 17, 2019



Reports in Syria said there were loud explosions south of Damascus, the capital.



Read the full story here.
"
