url,title,author,date,tags,text
https://www.breitbart.com/politics/2019/03/04/media-echo-michael-cohen-conspiracy-trump-will-start-civil-war-if-voted-out/,Media Echo Michael Cohen Conspiracy: Trump Will Start Civil War if Voted Out,Aaron Klein,2019-03-04,defense,"

Since last week, the news media has been busy churning out content echoing a talking point propagated during Congressional testimony by President Trump’s disgraced and disbarred attorney Michael Cohen claiming that Trump will not allow a peaceful transition if he loses the 2020 election.



Journalists and pundits utilized Cohen’s remarks to warn about such outlandish post-election scenarios as Trump using the U.S. military to cling to power, raising a private army of mercenaries or deliberately igniting a civil war.



Cohen is a convict who pled guilty to, among other things, lying to Congress in two separate prosecutions. The prison-bound Cohen also pled guilty to violating campaign finance laws and financial crimes, including tax evasion and bank fraud.



In his closing remarks before the House Committee on Oversight and Reform, Cohen stated:



Given my experience working for Mr. Trump, I fear that if he loses the election in 2020, there will never be a peaceful transition of power.



After the credibility-challenged Cohen’s internationally televised testimony, John Dean, President Richard Nixon’s former White House counsel, wrote an op-ed for the _New York Times_ in which he drew parallels with his own defining testimony against Nixon.



Dean used the column to say that he shares Cohen’s fears. Dean opined that Cohen’s warning about a violent transition “was the most troubling — actually, chilling — thing he said in his five hours before the committee.”



He further wrote:



Since Mr. Cohen’s warning came in his closing words, there was no opportunity for committee members to ask follow-up questions. So I double-checked with his lawyer, Lanny Davis, if I had understood Mr. Cohen’s testimony correctly. Mr. Davis responded, “He was referring to Trump’s authoritarian mind-set, and lack of respect for democracy and democratic institutions.”



Indeed, what is most similar about my and Mr. Cohen’s testimony is that we both challenged authoritarian presidents of the United States by revealing their lies and abuses of power. Mr. Trump is the first authoritarian president since Mr. Nixon, and neither he nor his supporters will play fair. Mr. Cohen will be dealing with these people the rest of his life.



In fact, all Americans are affected by the growing authoritarianism that made Mr. Trump president. These people who facilitated his rise will remain long after Mr. Trump is gone. We need to pay more attention.



In a piece published in the _Miami Herald_ and other publications, syndicated columnist Leonard Pitts Jr. warned, “Should Trump lose in 2020, a smooth transition is not guaranteed.”



Pitts cited Cohen’s remarks and inquired: “Let that marinate a moment. And ask yourself: What happens if this guy whose self-definition, whose entire psychological structure, is founded upon a self-image as a man who always wins, loses? Can you see him quietly accepting it with dignity and grace? One can more readily imagine Mitch McConnell twerking in Times Square.”



Pitts claimed that Trump’s supporters could turn violent if he loses the 2020 election:



And if Trump does refuse to accept the verdict of the electorate, what do the people who have followed him slavishly, renouncing common sense, simple decency and the evidence of their own eyes, do then? Will they reject the legitimacy of the new president? Will violence follow?



You may think the entire scenario far-fetched. But in the Trump age, that term hardly has meaning anymore. Indeed, it is a measure of how extraordinary this era is that this fear, expressed by a man who knows Trump better than almost anyone, was not the top takeaway from the hearing.



Following the standard anti-Trump playbook of comparing the president to Nixon and Watergate, Pitts cited Dean to smear Trump’s entire presidency as a “cancer.”



“John Dean, you will recall, famously warned Richard Nixon of a ‘cancer’ on the presidency,” Pitts recalled. “But in 2019, the cancer is the presidency. So there is a need for us to be clear-eyed and sober about what we face. I don’t know that we’re there yet.”



In a stroke of originality, Moveon.org activist Robert Reich, Bill Clinton’s former Secretary of Labor, wrote a piece for the _Guardian_ titled, “If Trump loses, we know what to expect: anger, fear and disruption.”



Reich utilized Cohen’s warning to exclaim, “The United States is now headed by someone pathologically incapable of admitting defeat. This doesn’t bode well for the 2020 presidential election.”



The alarmist Reich implies that a Trump loss in 2020 could prompt a civil war:



For Trump, losing is the deepest form of humiliation, and humiliation is intolerable.



…



Imagine it’s November 2020 and Trump has lost the election. He charges voter fraud, claiming that the “deep state” organized tens of millions of illegal immigrants to vote against him, and says he has an obligation not to step down.



Only this time he’s already president, with all the powers a president commands.



In years past, Americans have trusted our system of government enough that we abide by its outcomes even though we may disagree with them. Only once in our history — in 1861 — did enough of us distrust the system so much we succumbed to civil war.



Showing no concern for Cohen’s track record of deceit, Reich declared: “We should take seriously Michael Cohen’s admonition that if Trump is defeated in 2020, he will not leave office peacefully.”



Over at MSNBC, “Morning Joe” regular Donny Deutsch cited Cohen’s comments to suggest, like the others, that Trump could ignite a civil war. “If impeachment starts to happen, even if he loses an election, whatever inner move you think this guy is capable of doing to create a civil war, he will [do]. … I’m not speaking hyperbole.”



At Truthout.com following Cohen’s warning, a column by William Rivers Pitt was titled, “Trump May Want to Be President Forever. Take the Threat Seriously.”



Pitt wildly suggests a “private army” could be called upon to wreak havoc if Trump loses:



It may also be worth noting that Erik Prince, brother of the sitting Education Secretary and a Trump devotee, used to have his own large, battle-tested private army. I’m sure he still has their phone numbers.



There is a legitimate concern that even discussing the idea of Trump seeking to be president past his term actually empowers him and his followers. Raising the specter, goes the argument, gives them a club to wield, a weapon of intimidation to add to their already formidable arsenal. This dilemma is real, but outweighed in the end by the dangers implicit in not sounding the alarm. Awareness of what he is capable of is the first requirement for any effective resistance. Trump is fully capable of doing this, and the people must be warned.



…



Donald Trump might be the most dangerous man ever to hold the office of the presidency, and only a fool would believe he will go quietly into that good night.



Echoing the others, Pitt warns of a civil war scenario. “Some will tell you the Civil War never ended, and a lot of those folks voted for Donald Trump,” he writes. “If he calls, they will come.”



The talking point that Trump would not bow out peacefully following any election defeat was circulating even before Cohen’s testimony. Two weeks ago, CNN.com ran a piece by law professor Joshua A. Geltzer headlined, “What if Trump refuses to accept defeat in 2020?”



“In light of these overreaching assertions of his own authority, it’s at least plausible that Trump might attempt to cling to power in ways previously unimaginable by an American president,” Geltzer surmised.



Geltzer theorized Trump could potentially use the U.S. military to hold onto power after a defeat at the ballot box. “He’s the commander in chief of the most powerful military on Earth. If he even hints at contesting the election result in 2020, as he suggested he might in 2016, he’d be doing so not as an outsider but as a leader with the vast resources of the US government potentially at his disposal.”



Geltzer takes his outlandish theory so seriously he recommends that Congress ask military leaders to declare on record they will not allow Trump to use the military to stay in office following any election defeat:



Our civilian and uniformed Defense Department leaders have a role to play. The health of our democracy rests, in part, on not involving the military in transfers of power. And that should continue. But imagine the most extreme scenario, with Congress certifying Trump’s defeat but Trump refusing to leave office. In those circumstances, the military would no longer owe its loyalty to Donald Trump as of noon on January 20, 2021. And it’s worth asking the Secretary of Defense and Chairman of the Joint Chiefs of Staff, as they testify before Congress in coming months, to affirm that they understand that and would act consistently with it.



 ** _Aaron Klein is Breitbart’s Jerusalem bureau chief and senior investigative reporter. He is a New York Times bestselling author and hosts the popular weekend talk radio program, “Aaron Klein Investigative Radio.” Follow him on Twitter @AaronKleinShow. Follow him on _****_Facebook._**



 ** _Joshua Klein contributed research to this article._**
"
https://www.breitbart.com/politics/2019/02/14/exclusive-joe-arpaio-trump-has-guts-wont-surrender-on-wall/,"Exclusive — Joe Arpaio: Trump Has Guts, Won’t Surrender on Wall",Aaron Klein,2019-02-14,defense,"

Joe Arpaio, the former Sheriff of Maricopa County, Arizona, lauded President Trump for persisting with the drive to build a border barrier while slamming the Democratic Party and some Republican opponents of the proposed wall as “trying to hurt our country because they may not like our president.”



“He’s got guts to continue this,” Arpaio told Breitbart News. “And he is not going to surrender. Other presidents or politicians would surrender, play the Mickey Mouse games. You do this or you do that. No. He is sticking with the border issue. He is sticking with the wall. And he will come up with the money one way or another.”



Arpaio said that politicians opposed to Trump’s proposed barrier are risking U.S. national security because they “hate” Trump and are seeking to embarrass the president.



“I am talking about the Democrats and the few Republicans trying to hurt our country because they may not like our president,” Arpaio clarified.



“What’s the big deal to spend $5 billion when Congress in the past already said it was okay to build a wall? Now we have got this going on because they hate Trump? It’s all got to do with Trump. Nothing else. Trump. They hate him. They want to embarrass him. And that is what it is all about. And they don’t care about the security of this country. The murders that occur.



“I said four years ago that heroin is coming back. No one would listen. Now we are being flooded with heroin. And the president is trying to do something about it. You can’t just do it with boots on the ground. You’ve got to do something unusual. And that is building a wall.”



Arpaio spoke as the White House confirmed on Thursday that Trump will sign a bipartisan bill to avert a potential government shutdown that contains a fraction of the $5 million the president has been seeking to build a barrier along the porous U.S.-Mexico border.



Press Secretary Sarah Sanders told reporters that Trump would also take “other executive action — including a national emergency” as he tries to fulfill the border wall pledge.



 ** _Aaron Klein is Breitbart’s Jerusalem bureau chief and senior investigative reporter. He is a New York Times bestselling author and hosts the popular weekend talk radio program, “Aaron Klein Investigative Radio.” Follow him on Twitter @AaronKleinShow. Follow him on Facebook._**
"
https://www.breitbart.com/middle-east/2019/02/13/netanyahu-israel-arab-nations-share-common-interest-of-war-with-iran/,"Netanyahu: Israel, Arab Nations Share ‘Common Interest of War with Iran’",Breitbart Jerusalem,2019-02-13,defense,"

The Jerusalem Post reports: Arab countries and Israel are talking about war with Iran, Prime Minister Benjamin Netanyahu said in Warsaw, as he filmed a shot near a skating rink for his Facebook page.



“From here I am going to a meeting with 60 foreign ministers and envoys of countries from around the world against Iran,” Netanyahu said.



“What is important about this meeting – and this meeting is not in secret, because there are many of those – is that this is an open meeting with representatives of leading Arab countries, that are sitting down together with Israel in order to advance the common interest of war with Iran.” Netanyahu said.



Read the full story.
"
https://www.breitbart.com/politics/2019/02/04/klein-trump-respects-independence-of-intel-agencies-while-obama-politicized-them/,Klein: Trump Respects Independence of Intel Agencies While Obama Politicized Them,Aaron Klein,2019-02-04,defense,"

NEW YORK — Amid the flurry of news media coverage surrounding President Donald Trump’s criticism of the U.S. intelligence community, it may be instructive to recall the Obama administration was repeatedly accused of politicizing the country’s intelligence agencies to advance its own foreign policy agenda.



This while Trump has said that while he may disagree with some of the Intel community’s assessments, he respects the independence of those same agencies.



The uproar began last week, when Trump pushed back after U.S. agencies issued an annual report on global threats claiming Iran is not taking measures to produce a nuclear weapon and that North Korea was unlikely to give up its arsenal.



Trump initially responded on Twitter, calling the Intel community “extremely passive and naïve when it comes to the dangers of Iran.”



The Intelligence people seem to be extremely passive and naive when it comes to the dangers of Iran. They are wrong! When I became President Iran was making trouble all over the Middle East, and beyond. Since ending the terrible Iran Nuclear Deal, they are MUCH different, but….



— Donald J. Trump (@realDonaldTrump) January 30, 2019



….a source of potential danger and conflict. They are testing Rockets (last week) and more, and are coming very close to the edge. There economy is now crashing, which is the only thing holding them back. Be careful of Iran. Perhaps Intelligence should go back to school!



— Donald J. Trump (@realDonaldTrump) January 30, 2019



Trump then announced that he held a meeting with the leaders of the U.S. intelligence community and said their views had been “mischaracterized” by the news media.



Just concluded a great meeting with my Intel team in the Oval Office who told me that what they said on Tuesday at the Senate Hearing was mischaracterized by the media – and we are very much in agreement on Iran, ISIS, North Korea, etc. Their testimony was distorted press…. pic.twitter.com/Zl5aqBmpjF



— Donald J. Trump (@realDonaldTrump) January 31, 2019



In public remarks on the matter, Trump affirmed that he wants U.S. intelligence agencies to have their own opinions and explained that he takes their analysis into account when taking foreign policy decisions.



“I am going to trust the intelligence that I’m putting there,” Trump told CBS News’ “Face the Nation.”



“But I will say this: My intelligence people, if they said, in fact, that Iran is a wonderful kindergarten, I disagree with them 100 percent,” he continued. “I have intel people, but that doesn’t mean I have to agree,” Trump added, upholding the independence of the U.S. intelligence community.



The Obama administration, by contrast, was repeatedly accused of politicizing the U.S. intelligence community.



One damning investigation by House Republicans released in August 2016 found that under the Obama administration, the intelligence arm of the U.S. Military’s Central Command (CENTCOM) routinely produced intelligence that “distorted, suppressed, or substantially altered” the results of the campaign against the Islamic State.



The probe found that top CENTCOM leaders modified intelligence assessments to present an “unduly positive” assessment of combating the Islamic State and training the Iraqi Security Forces (ISF).



Far from respecting the independence of the military’s intelligence arm, analysts whose views conflicted with senior intelligence leaders were kept out of CENTCOM’s intelligence fusion center and restrictions were implemented for analysts whose views dissented, according to the investigation.



One common them that House Republicans found was that some Obama-era CENTCOM analysts declined to be interviewed, possibly out of fear of reprisals from CENTCOM leadership, while the interviews that did take place were under the watchful eyes of Obama’s DOD officials.



One year prior to the House probe, The Daily Beast broke the story that over 50 CENTCOM intelligence analysts formally complained that senior officials inappropriately altered their reports on IS and al-Qaeda’s Syria branch.



Writing at _National Review_ in September 2015, former national security employee Fred Fleitz documented other instances of the Obama administration allegedly politicizing intelligence:



Director of National Intelligence James Clapper, for instance, was accused of politicizing intelligence analysis in February 2011 when he said, during a congressional hearing: “The term ‘Muslim Brotherhood’ is an umbrella term for a variety of movements — in the case of Egypt, a very heterogeneous group, largely secular, which has eschewed violence and has decried al-Qaeda as a perversion of Islam.”



Many members of Congress were outraged by this statement, which Clapper later had to walk back. But Clapper was speaking from prepared remarks that conveyed the consensus views of the U.S. intelligence community. Why did no intelligence analysts come forward to allege that the intelligence community was playing down the threat from the Muslim Brotherhood.



…



I can cite many other examples of politicized intelligence analysis during the Obama administration, including the intelligence community’s altering of terrorism terminology to conform with the Obama administration’s agenda. **Analysts must now use the term “home-grown violent extremists,” for example, instead of “home-grown terrorists.” Intelligence agencies never use the terms “radical Islam” or “Islamist.” **When referring to ISIS terrorists in Syria, the intelligence community’s 2015 worldwide threat report repeatedly refers to them as “Sunni violent extremists.”



 ** _Aaron Klein is Breitbart’s Jerusalem bureau chief and senior investigative reporter. He is a New York Times bestselling author and hosts the popular weekend talk radio program, “Aaron Klein Investigative Radio.” Follow him on Twitter @AaronKleinShow. Follow him on Facebook._**



 ** _Written with research by Joshua Klein._**
"
